[I 2024-09-17 17:40:52,561] Trial 419 finished with values: [0.6234138306810525, 15319640.0] and parameters: {'bottleneck_dim': 5, 'aggregator_type': 1, 'phi_len': 2, 'phi_MLP_width_0': 4, 'phi_MLP_acts_0': 0, 'phi_MLP_norms_0': 'layer', 'phi_MLP_norms_1': 'batch', 'rho_len': 1, 'rho_MLP_norms_0': None}. 
Test Accuracy: 0.6234
Accuracy:  0.6234138306810525 , Inference time:  0.02885127067565918 , Validation Loss:  0.9894448944500515 , Param Count:  4869
Conv bp:  tensor(1244692.)
DeepSetsArchitecture(
  (phi): ConvPhi(
    (layers): Sequential(
      (0): Conv1d(3, 16, kernel_size=(1,), stride=(1,))
      (1): ReLU()
      (2): Conv1d(16, 16, kernel_size=(1,), stride=(1,))
      (3): BatchNorm1d(16, eps=1e-05, momentum=0.1, affine=True, track_running_stats=True)
      (4): ReLU()
      (5): Conv1d(16, 8, kernel_size=(1,), stride=(1,))
      (6): ReLU()
      (7): Conv1d(8, 4, kernel_size=(1,), stride=(1,))
    )
  )
  (rho): Rho(
    (layers): Sequential(
      (0): Linear(in_features=4, out_features=16, bias=True)
      (1): ReLU()
      (2): Linear(in_features=16, out_features=5, bias=True)
    )
  )
)
BOPs: tensor(1269012.)
Trial  420  begins evaluation...
[I 2024-09-17 17:46:12,691] Trial 420 finished with values: [0.5935430201895001, 1269012.0] and parameters: {'bottleneck_dim': 2, 'aggregator_type': 1, 'phi_len': 4, 'phi_MLP_width_0': 1, 'phi_MLP_width_1': 1, 'phi_MLP_width_2': 0, 'phi_MLP_acts_0': 0, 'phi_MLP_acts_1': 0, 'phi_MLP_acts_2': 0, 'phi_MLP_norms_0': 'layer', 'phi_MLP_norms_1': 'batch', 'phi_MLP_norms_2': 'layer', 'phi_MLP_norms_3': 'layer', 'rho_len': 2, 'rho_MLP_width_0': 1, 'rho_MLP_acts_0': 0, 'rho_MLP_norms_0': None, 'rho_MLP_norms_1': 'layer'}. 
Test Accuracy: 0.5935
Accuracy:  0.5935430201895001 , Inference time:  0.0480806827545166 , Validation Loss:  1.060346433905517 , Param Count:  705
Conv bp:  tensor(1855779.)
DeepSetsArchitecture(
  (phi): ConvPhi(
    (layers): Sequential(
      (0): Conv1d(3, 16, kernel_size=(1,), stride=(1,))
      (1): LeakyReLU(negative_slope=0.0078125)
      (2): Conv1d(16, 32, kernel_size=(1,), stride=(1,))
    )
  )
  (rho): Rho(
    (layers): Sequential(
      (0): Linear(in_features=32, out_features=32, bias=True)
      (1): ReLU()
      (2): Linear(in_features=32, out_features=32, bias=True)
      (3): BatchNorm1d(32, eps=1e-05, momentum=0.1, affine=True, track_running_stats=True)
      (4): LeakyReLU(negative_slope=0.0078125)
      (5): Linear(in_features=32, out_features=5, bias=True)
      (6): BatchNorm1d(5, eps=1e-05, momentum=0.1, affine=True, track_running_stats=True)
    )
  )
)
BOPs: tensor(2234979.)
Trial  421  begins evaluation...
[I 2024-09-17 17:51:37,845] Trial 421 finished with values: [0.6434452753907712, 2234979.0] and parameters: {'bottleneck_dim': 5, 'aggregator_type': 1, 'phi_len': 2, 'phi_MLP_width_0': 1, 'phi_MLP_acts_0': 1, 'phi_MLP_norms_0': 'layer', 'phi_MLP_norms_1': None, 'rho_len': 3, 'rho_MLP_width_0': 2, 'rho_MLP_width_1': 2, 'rho_MLP_acts_0': 0, 'rho_MLP_acts_1': 1, 'rho_MLP_norms_0': 'layer', 'rho_MLP_norms_1': 'batch', 'rho_MLP_norms_2': 'batch'}. 
Test Accuracy: 0.6434
Accuracy:  0.6434452753907712 , Inference time:  0.03878211975097656 , Validation Loss:  0.9327497912102005 , Param Count:  2959
Conv bp:  tensor(1039380.)
DeepSetsArchitecture(
  (phi): ConvPhi(
    (layers): Sequential(
      (0): Conv1d(3, 64, kernel_size=(1,), stride=(1,))
    )
  )
  (rho): Rho(
    (layers): Sequential(
      (0): Linear(in_features=64, out_features=16, bias=True)
      (1): ReLU()
      (2): Linear(in_features=16, out_features=5, bias=True)
      (3): BatchNorm1d(5, eps=1e-05, momentum=0.1, affine=True, track_running_stats=True)
    )
  )
)
BOPs: tensor(1237140.)
Trial  422  begins evaluation...
[I 2024-09-17 17:57:03,247] Trial 422 finished with values: [0.5539160309788622, 1237140.0] and parameters: {'bottleneck_dim': 6, 'aggregator_type': 1, 'phi_len': 1, 'phi_MLP_norms_0': 'layer', 'rho_len': 2, 'rho_MLP_width_0': 1, 'rho_MLP_acts_0': 0, 'rho_MLP_norms_0': 'layer', 'rho_MLP_norms_1': 'batch'}. 
Test Accuracy: 0.5539
Accuracy:  0.5539160309788622 , Inference time:  0.023194074630737305 , Validation Loss:  1.133202357357051 , Param Count:  1391
Conv bp:  tensor(1855779.)
DeepSetsArchitecture(
  (phi): ConvPhi(
    (layers): Sequential(
      (0): Conv1d(3, 64, kernel_size=(1,), stride=(1,))
      (1): LeakyReLU(negative_slope=0.0078125)
      (2): Conv1d(64, 4, kernel_size=(1,), stride=(1,))
    )
  )
  (rho): Rho(
    (layers): Sequential(
      (0): Linear(in_features=4, out_features=32, bias=True)
      (1): LeakyReLU(negative_slope=0.0078125)
      (2): Linear(in_features=32, out_features=16, bias=True)
      (3): ReLU()
      (4): Linear(in_features=16, out_features=5, bias=True)
      (5): BatchNorm1d(5, eps=1e-05, momentum=0.1, affine=True, track_running_stats=True)
    )
  )
)
BOPs: tensor(1977635.)
Trial  423  begins evaluation...
[I 2024-09-17 18:02:27,875] Trial 423 finished with values: [0.602998061741438, 1977635.0] and parameters: {'bottleneck_dim': 2, 'aggregator_type': 1, 'phi_len': 2, 'phi_MLP_width_0': 3, 'phi_MLP_acts_0': 1, 'phi_MLP_norms_0': 'layer', 'phi_MLP_norms_1': None, 'rho_len': 3, 'rho_MLP_width_0': 2, 'rho_MLP_width_1': 1, 'rho_MLP_acts_0': 1, 'rho_MLP_acts_1': 0, 'rho_MLP_norms_0': None, 'rho_MLP_norms_1': 'layer', 'rho_MLP_norms_2': 'batch'}. 
Test Accuracy: 0.6030
Accuracy:  0.602998061741438 , Inference time:  0.03524971008300781 , Validation Loss:  1.0349492819941775 , Param Count:  1299
Conv bp:  tensor(64961.2500)
DeepSetsArchitecture(
  (phi): ConvPhi(
    (layers): Sequential(
      (0): Conv1d(3, 4, kernel_size=(1,), stride=(1,))
    )
  )
  (rho): Rho(
    (layers): Sequential(
      (0): Linear(in_features=4, out_features=64, bias=True)
      (1): LeakyReLU(negative_slope=0.0078125)
      (2): Linear(in_features=64, out_features=5, bias=True)
    )
  )
)
BOPs: tensor(162369.2500)
Trial  424  begins evaluation...
[I 2024-09-17 18:07:50,857] Trial 424 finished with values: [0.49079535150693365, 162369.25] and parameters: {'bottleneck_dim': 2, 'aggregator_type': 1, 'phi_len': 1, 'phi_MLP_norms_0': 'layer', 'rho_len': 2, 'rho_MLP_width_0': 3, 'rho_MLP_acts_0': 1, 'rho_MLP_norms_0': None, 'rho_MLP_norms_1': 'layer'}. 
Test Accuracy: 0.4908
Accuracy:  0.49079535150693365 , Inference time:  0.017641305923461914 , Validation Loss:  1.2203466490823396 , Param Count:  661
Conv bp:  tensor(64961.2500)
DeepSetsArchitecture(
  (phi): ConvPhi(
    (layers): Sequential(
      (0): Conv1d(3, 4, kernel_size=(1,), stride=(1,))
      (1): BatchNorm1d(4, eps=1e-05, momentum=0.1, affine=True, track_running_stats=True)
    )
  )
  (rho): Rho(
    (layers): Sequential(
      (0): Linear(in_features=4, out_features=64, bias=True)
      (1): BatchNorm1d(64, eps=1e-05, momentum=0.1, affine=True, track_running_stats=True)
      (2): ReLU()
      (3): Linear(in_features=64, out_features=128, bias=True)
      (4): LeakyReLU(negative_slope=0.0078125)
      (5): Linear(in_features=128, out_features=5, bias=True)
    )
  )
)
BOPs: tensor(1627713.2500)
Trial  425  begins evaluation...
[I 2024-09-17 18:13:15,745] Trial 425 finished with values: [0.5614910449126952, 1627713.25] and parameters: {'bottleneck_dim': 2, 'aggregator_type': 1, 'phi_len': 1, 'phi_MLP_norms_0': 'batch', 'rho_len': 3, 'rho_MLP_width_0': 3, 'rho_MLP_width_1': 4, 'rho_MLP_acts_0': 0, 'rho_MLP_acts_1': 1, 'rho_MLP_norms_0': 'batch', 'rho_MLP_norms_1': 'layer', 'rho_MLP_norms_2': None}. 
Test Accuracy: 0.5615
Accuracy:  0.5614910449126952 , Inference time:  0.03126955032348633 , Validation Loss:  1.1171006592763524 , Param Count:  9437
Conv bp:  tensor(16240.3125)
DeepSetsArchitecture(
  (phi): ConvPhi(
    (layers): Sequential(
      (0): Conv1d(3, 1, kernel_size=(1,), stride=(1,))
    )
  )
  (rho): Rho(
    (layers): Sequential(
      (0): Linear(in_features=1, out_features=8, bias=True)
      (1): ReLU()
      (2): Linear(in_features=8, out_features=5, bias=True)
      (3): BatchNorm1d(5, eps=1e-05, momentum=0.1, affine=True, track_running_stats=True)
    )
  )
)
BOPs: tensor(24240.3125)
Trial  426  begins evaluation...
[I 2024-09-17 18:18:39,717] Trial 426 finished with values: [0.3599371105805625, 24240.3125] and parameters: {'bottleneck_dim': 0, 'aggregator_type': 1, 'phi_len': 1, 'phi_MLP_norms_0': 'layer', 'rho_len': 2, 'rho_MLP_width_0': 0, 'rho_MLP_acts_0': 0, 'rho_MLP_norms_0': None, 'rho_MLP_norms_1': 'batch'}. 
Test Accuracy: 0.3599
Accuracy:  0.3599371105805625 , Inference time:  0.02163219451904297 , Validation Loss:  1.4618495232393953 , Param Count:  75
Conv bp:  tensor(5317652.)
DeepSetsArchitecture(
  (phi): ConvPhi(
    (layers): Sequential(
      (0): Conv1d(3, 16, kernel_size=(1,), stride=(1,))
      (1): BatchNorm1d(16, eps=1e-05, momentum=0.1, affine=True, track_running_stats=True)
      (2): LeakyReLU(negative_slope=0.0078125)
      (3): Conv1d(16, 16, kernel_size=(1,), stride=(1,))
      (4): LeakyReLU(negative_slope=0.0078125)
      (5): Conv1d(16, 128, kernel_size=(1,), stride=(1,))
      (6): ReLU()
      (7): Conv1d(128, 32, kernel_size=(1,), stride=(1,))
    )
  )
  (rho): Rho(
    (layers): Sequential(
      (0): Linear(in_features=32, out_features=8, bias=True)
      (1): BatchNorm1d(8, eps=1e-05, momentum=0.1, affine=True, track_running_stats=True)
      (2): ReLU()
      (3): Linear(in_features=8, out_features=64, bias=True)
      (4): BatchNorm1d(64, eps=1e-05, momentum=0.1, affine=True, track_running_stats=True)
      (5): LeakyReLU(negative_slope=0.0078125)
      (6): Linear(in_features=64, out_features=5, bias=True)
    )
  )
)
BOPs: tensor(5505044.)
Trial  427  begins evaluation...
[I 2024-09-17 18:24:19,543] Trial 427 finished with values: [0.6466945620617082, 5505044.0] and parameters: {'bottleneck_dim': 5, 'aggregator_type': 1, 'phi_len': 4, 'phi_MLP_width_0': 1, 'phi_MLP_width_1': 1, 'phi_MLP_width_2': 4, 'phi_MLP_acts_0': 1, 'phi_MLP_acts_1': 1, 'phi_MLP_acts_2': 0, 'phi_MLP_norms_0': 'batch', 'phi_MLP_norms_1': None, 'phi_MLP_norms_2': 'layer', 'phi_MLP_norms_3': 'layer', 'rho_len': 3, 'rho_MLP_width_0': 0, 'rho_MLP_width_1': 3, 'rho_MLP_acts_0': 0, 'rho_MLP_acts_1': 1, 'rho_MLP_norms_0': 'batch', 'rho_MLP_norms_1': 'batch', 'rho_MLP_norms_2': None}. 
Test Accuracy: 0.6467
Accuracy:  0.6466945620617082 , Inference time:  0.0632014274597168 , Validation Loss:  0.9278326857657659 , Param Count:  7981
Conv bp:  tensor(16240.3125)
DeepSetsArchitecture(
  (phi): ConvPhi(
    (layers): Sequential(
      (0): Conv1d(3, 1, kernel_size=(1,), stride=(1,))
    )
  )
  (rho): Rho(
    (layers): Sequential(
      (0): Linear(in_features=1, out_features=128, bias=True)
      (1): ReLU()
      (2): Linear(in_features=128, out_features=16, bias=True)
      (3): ReLU()
      (4): Linear(in_features=16, out_features=5, bias=True)
    )
  )
)
BOPs: tensor(406592.3125)
Trial  428  begins evaluation...
[I 2024-09-17 18:29:53,963] Trial 428 finished with values: [0.3610568084451506, 406592.3125] and parameters: {'bottleneck_dim': 0, 'aggregator_type': 1, 'phi_len': 1, 'phi_MLP_norms_0': 'layer', 'rho_len': 3, 'rho_MLP_width_0': 4, 'rho_MLP_width_1': 1, 'rho_MLP_acts_0': 0, 'rho_MLP_acts_1': 0, 'rho_MLP_norms_0': None, 'rho_MLP_norms_1': None, 'rho_MLP_norms_2': 'layer'}. 
Test Accuracy: 0.3611
Accuracy:  0.3610568084451506 , Inference time:  0.02257370948791504 , Validation Loss:  1.4571835305415044 , Param Count:  2409
Conv bp:  tensor(64961.2500)
DeepSetsArchitecture(
  (phi): ConvPhi(
    (layers): Sequential(
      (0): Conv1d(3, 4, kernel_size=(1,), stride=(1,))
      (1): BatchNorm1d(4, eps=1e-05, momentum=0.1, affine=True, track_running_stats=True)
    )
  )
  (rho): Rho(
    (layers): Sequential(
      (0): Linear(in_features=4, out_features=16, bias=True)
      (1): ReLU()
      (2): Linear(in_features=16, out_features=5, bias=True)
      (3): BatchNorm1d(5, eps=1e-05, momentum=0.1, affine=True, track_running_stats=True)
    )
  )
)
BOPs: tensor(89281.2500)
Trial  429  begins evaluation...
[I 2024-09-17 18:35:34,427] Trial 429 finished with values: [0.5411268519519844, 89281.25] and parameters: {'bottleneck_dim': 2, 'aggregator_type': 1, 'phi_len': 1, 'phi_MLP_norms_0': 'batch', 'rho_len': 2, 'rho_MLP_width_0': 1, 'rho_MLP_acts_0': 0, 'rho_MLP_norms_0': None, 'rho_MLP_norms_1': 'batch'}. 
Test Accuracy: 0.5411
Accuracy:  0.5411268519519844 , Inference time:  0.02624964714050293 , Validation Loss:  1.1492675214397663 , Param Count:  199
Conv bp:  tensor(129922.5000)
DeepSetsArchitecture(
  (phi): ConvPhi(
    (layers): Sequential(
      (0): Conv1d(3, 8, kernel_size=(1,), stride=(1,))
      (1): BatchNorm1d(8, eps=1e-05, momentum=0.1, affine=True, track_running_stats=True)
    )
  )
  (rho): Rho(
    (layers): Sequential(
      (0): Linear(in_features=8, out_features=32, bias=True)
      (1): ReLU()
      (2): Linear(in_features=32, out_features=128, bias=True)
      (3): BatchNorm1d(128, eps=1e-05, momentum=0.1, affine=True, track_running_stats=True)
      (4): ReLU()
      (5): Linear(in_features=128, out_features=8, bias=True)
      (6): LeakyReLU(negative_slope=0.0078125)
      (7): Linear(in_features=8, out_features=5, bias=True)
    )
  )
)
BOPs: tensor(1054386.5000)
Trial  430  begins evaluation...
[I 2024-09-17 18:41:11,011] Trial 430 finished with values: [0.6161832111869961, 1054386.5] and parameters: {'bottleneck_dim': 3, 'aggregator_type': 1, 'phi_len': 1, 'phi_MLP_norms_0': 'batch', 'rho_len': 4, 'rho_MLP_width_0': 2, 'rho_MLP_width_1': 4, 'rho_MLP_width_2': 0, 'rho_MLP_acts_0': 0, 'rho_MLP_acts_1': 0, 'rho_MLP_acts_2': 1, 'rho_MLP_norms_0': None, 'rho_MLP_norms_1': 'batch', 'rho_MLP_norms_2': 'layer', 'rho_MLP_norms_3': None}. 
Test Accuracy: 0.6162
Accuracy:  0.6161832111869961 , Inference time:  0.03463459014892578 , Validation Loss:  1.001325791384898 , Param Count:  5893
Conv bp:  tensor(3892244.)
DeepSetsArchitecture(
  (phi): ConvPhi(
    (layers): Sequential(
      (0): Conv1d(3, 16, kernel_size=(1,), stride=(1,))
      (1): LeakyReLU(negative_slope=0.0078125)
      (2): Conv1d(16, 16, kernel_size=(1,), stride=(1,))
      (3): BatchNorm1d(16, eps=1e-05, momentum=0.1, affine=True, track_running_stats=True)
      (4): LeakyReLU(negative_slope=0.0078125)
      (5): Conv1d(16, 64, kernel_size=(1,), stride=(1,))
      (6): LeakyReLU(negative_slope=0.0078125)
      (7): Conv1d(64, 64, kernel_size=(1,), stride=(1,))
      (8): BatchNorm1d(64, eps=1e-05, momentum=0.1, affine=True, track_running_stats=True)
    )
  )
  (rho): Rho(
    (layers): Sequential(
      (0): Linear(in_features=64, out_features=8, bias=True)
      (1): LeakyReLU(negative_slope=0.0078125)
      (2): Linear(in_features=8, out_features=5, bias=True)
      (3): BatchNorm1d(5, eps=1e-05, momentum=0.1, affine=True, track_running_stats=True)
    )
  )
)
BOPs: tensor(3995140.)
Trial  431  begins evaluation...
[I 2024-09-17 18:46:50,804] Trial 431 finished with values: [0.6423255775261831, 3995140.0] and parameters: {'bottleneck_dim': 6, 'aggregator_type': 1, 'phi_len': 4, 'phi_MLP_width_0': 1, 'phi_MLP_width_1': 1, 'phi_MLP_width_2': 3, 'phi_MLP_acts_0': 1, 'phi_MLP_acts_1': 1, 'phi_MLP_acts_2': 1, 'phi_MLP_norms_0': 'layer', 'phi_MLP_norms_1': 'batch', 'phi_MLP_norms_2': 'layer', 'phi_MLP_norms_3': 'batch', 'rho_len': 2, 'rho_MLP_width_0': 0, 'rho_MLP_acts_0': 1, 'rho_MLP_norms_0': 'layer', 'rho_MLP_norms_1': 'batch'}. 
Test Accuracy: 0.6423
Accuracy:  0.6423255775261831 , Inference time:  0.052886247634887695 , Validation Loss:  0.9367098650153802 , Param Count:  6319
Conv bp:  tensor(7570572.)
DeepSetsArchitecture(
  (phi): ConvPhi(
    (layers): Sequential(
      (0): Conv1d(3, 64, kernel_size=(1,), stride=(1,))
      (1): LeakyReLU(negative_slope=0.0078125)
      (2): Conv1d(64, 32, kernel_size=(1,), stride=(1,))
    )
  )
  (rho): Rho(
    (layers): Sequential(
      (0): Linear(in_features=32, out_features=16, bias=True)
      (1): LeakyReLU(negative_slope=0.0078125)
      (2): Linear(in_features=16, out_features=64, bias=True)
      (3): ReLU()
      (4): Linear(in_features=64, out_features=5, bias=True)
      (5): BatchNorm1d(5, eps=1e-05, momentum=0.1, affine=True, track_running_stats=True)
    )
  )
)
BOPs: tensor(7888908.)
Trial  432  begins evaluation...
KUBERNETES_SERVICE_PORT_HTTPS=443
NVIDIA_VISIBLE_DEVICES=GPU-17033bcf-6ebd-45df-b529-141462a446f1
GGEXPOSE_SERVICE_HOST=10.103.93.169
SPATOPEXPOSE_SERVICE_HOST=10.98.174.135
SSL_JET_V2_EXPOSE_PORT=tcp://10.98.170.207:80
KUBERNETES_SERVICE_PORT=443
SSL_JET_V3_EXPOSE_PORT_80_TCP_ADDR=10.99.91.182
HOSTNAME=dd-global-c-par-1
PFEXPOSEEAST_PORT_80_TCP_ADDR=10.106.41.90
XILINXD_SERVICE_HOST=10.111.109.177
ABCDNNEXPOSE_PORT_80_TCP_PROTO=tcp
PFEXPOSE_PORT_80_TCP_PROTO=tcp
L1ANOMALYEXPOSE_PORT_80_TCP_PORT=80
HHBBVVEXPOSE_PORT_80_TCP_PROTO=tcp
SSL_JET_V3_EXPOSE_PORT=tcp://10.99.91.182:80
SPATOPEXPOSE_PORT_8800_TCP_ADDR=10.98.174.135
J_JEPA_VOL_EXPOSE_PORT=tcp://10.98.255.12:80
BUMPHUNTEXPOSE_SERVICE_PORT=80
HHBBVVEXPOSE_PORT_80_TCP_PORT=80
J_JEPA_VOL_EXPOSE_SERVICE_HOST=10.98.255.12
PFEXPOSE_PORT_80_TCP=tcp://10.97.167.151:80
BUMPHUNTEXPOSE_SERVICE_HOST=10.96.169.13
PFEXPOSE_SERVICE_PORT=80
PWD=/morph-nas-central/Morph
PFEXPOSE_PORT_80_TCP_ADDR=10.97.167.151
PFEXPOSEEAST_SERVICE_PORT=80
JOB_COMPLETION_INDEX=1
PFEXPOSEEAST_SERVICE_HOST=10.106.41.90
J_JEPA_VOL_EXPOSE_PORT_80_TCP_ADDR=10.98.255.12
NVIDIA_DRIVER_CAPABILITIES=compute,utility
PFEXPOSECENTRAL_SERVICE_HOST=10.101.81.212
BUMPHUNTEXPOSE_PORT_80_TCP_PROTO=tcp
SSL_JET_V3_EXPOSE_SERVICE_HOST=10.99.91.182
ABCDNNEXPOSE_SERVICE_PORT=80
SPATOPEXPOSE_PORT_8800_TCP_PROTO=tcp
SSL_JET_V3_EXPOSE_SERVICE_PORT=80
XILINXD_SERVICE_PORT_XILINXD=2100
ABCDNNEXPOSE_PORT_80_TCP_ADDR=10.108.83.250
MODEL_INDEX=1
PFEXPOSECENTRAL_PORT_80_TCP=tcp://10.101.81.212:80
HOME=/root
KUBERNETES_PORT_443_TCP=tcp://10.96.0.1:443
PFEXPOSECENTRAL_PORT_80_TCP_ADDR=10.101.81.212
J_JEPA_VOL_EXPOSE_PORT_80_TCP=tcp://10.98.255.12:80
XILINXD_PORT_2100_TCP_PORT=2100
SPATOPEXPOSE_PORT=tcp://10.98.174.135:8800
L1ANOMALYEXPOSE_PORT_80_TCP_PROTO=tcp
PYTORCH_VERSION=2.2.1
L1ANOMALYEXPOSE_SERVICE_PORT=80
XILINXD_SERVICE_PORT=2100
HHBBVVEXPOSE_PORT_80_TCP_ADDR=10.102.7.121
PFEXPOSEEAST_PORT_80_TCP_PORT=80
SPATOPEXPOSE_PORT_8800_TCP_PORT=8800
PFEXPOSE_SERVICE_HOST=10.97.167.151
PFEXPOSECENTRAL_PORT=tcp://10.101.81.212:80
PFEXPOSE_PORT=tcp://10.97.167.151:80
SPATOPEXPOSE_PORT_8800_TCP=tcp://10.98.174.135:8800
HHBBVVEXPOSE_PORT=tcp://10.102.7.121:80
ABCDNNEXPOSE_PORT_80_TCP_PORT=80
PFEXPOSEEAST_PORT=tcp://10.106.41.90:80
PFEXPOSECENTRAL_SERVICE_PORT=80
XILINXD_PORT_2100_TCP=tcp://10.111.109.177:2100
PFEXPOSEEAST_PORT_80_TCP=tcp://10.106.41.90:80
BUMPHUNTEXPOSE_PORT=tcp://10.96.169.13:80
SSL_JET_V3_EXPOSE_PORT_80_TCP_PROTO=tcp
PFEXPOSEEAST_PORT_80_TCP_PROTO=tcp
GGEXPOSE_SERVICE_PORT=80
PFEXPOSE_PORT_80_TCP_PORT=80
J_JEPA_VOL_EXPOSE_PORT_80_TCP_PORT=80
GGEXPOSE_PORT_80_TCP_PROTO=tcp
L1ANOMALYEXPOSE_PORT=tcp://10.101.29.4:80
SPATOPEXPOSE_SERVICE_PORT=8800
SSL_JET_V3_EXPOSE_PORT_80_TCP_PORT=80
HHBBVVEXPOSE_SERVICE_HOST=10.102.7.121
L1ANOMALYEXPOSE_SERVICE_HOST=10.101.29.4
XILINXD_PORT=tcp://10.111.109.177:2100
SSL_JET_V2_EXPOSE_PORT_80_TCP_ADDR=10.98.170.207
SHLVL=1
BUMPHUNTEXPOSE_PORT_80_TCP_ADDR=10.96.169.13
GGEXPOSE_PORT_80_TCP_ADDR=10.103.93.169
GGEXPOSE_PORT=tcp://10.103.93.169:80
PFEXPOSECENTRAL_PORT_80_TCP_PROTO=tcp
KUBERNETES_PORT_443_TCP_PROTO=tcp
SSL_JET_V2_EXPOSE_SERVICE_PORT=80
KUBERNETES_PORT_443_TCP_ADDR=10.96.0.1
SSL_JET_V3_EXPOSE_PORT_80_TCP=tcp://10.99.91.182:80
L1ANOMALYEXPOSE_PORT_80_TCP_ADDR=10.101.29.4
LD_LIBRARY_PATH=/usr/local/nvidia/lib:/usr/local/nvidia/lib64
SSL_JET_V2_EXPOSE_PORT_80_TCP_PORT=80
BUMPHUNTEXPOSE_PORT_80_TCP_PORT=80
XILINXD_PORT_2100_TCP_ADDR=10.111.109.177
GGEXPOSE_PORT_80_TCP_PORT=80
SSL_JET_V2_EXPOSE_PORT_80_TCP_PROTO=tcp
XILINXD_PORT_2100_TCP_PROTO=tcp
SSL_JET_V2_EXPOSE_SERVICE_HOST=10.98.170.207
KUBERNETES_SERVICE_HOST=10.96.0.1
ABCDNNEXPOSE_PORT_80_TCP=tcp://10.108.83.250:80
KUBERNETES_PORT=tcp://10.96.0.1:443
KUBERNETES_PORT_443_TCP_PORT=443
PATH=/opt/conda/bin:/usr/local/sbin:/usr/local/bin:/usr/sbin:/usr/bin:/sbin:/bin
HHBBVVEXPOSE_PORT_80_TCP=tcp://10.102.7.121:80
HHBBVVEXPOSE_SERVICE_PORT=80
BUMPHUNTEXPOSE_PORT_80_TCP=tcp://10.96.169.13:80
L1ANOMALYEXPOSE_PORT_80_TCP=tcp://10.101.29.4:80
GGEXPOSE_PORT_80_TCP=tcp://10.103.93.169:80
ABCDNNEXPOSE_SERVICE_HOST=10.108.83.250
ABCDNNEXPOSE_PORT=tcp://10.108.83.250:80
J_JEPA_VOL_EXPOSE_PORT_80_TCP_PROTO=tcp
J_JEPA_VOL_EXPOSE_SERVICE_PORT=80
SSL_JET_V2_EXPOSE_PORT_80_TCP=tcp://10.98.170.207:80
PFEXPOSECENTRAL_PORT_80_TCP_PORT=80
OLDPWD=/app
_=/usr/bin/env
MODEL_INDEX from terminal: 1
All command-line arguments: ['global_search_parallel2.py', '1']
model index:  1
Processing large model with index 1
Loaded 1 files for train set
Loaded 1 files for validation set
Loaded 2 files for test set
Loaded Dataset...
[I 2024-09-16 04:56:58,952] A new study created in memory with name: no-name-ffce258e-dc59-49fc-a438-c00055211433
input shape:  torch.Size([4096, 3, 8])
Conv bp:  tensor(7570572.)
DeepSetsArchitecture(
  (phi): ConvPhi(
    (layers): Sequential(
      (0): Conv1d(3, 64, kernel_size=(1,), stride=(1,))
      (1): BatchNorm1d(64, eps=1e-05, momentum=0.1, affine=True, track_running_stats=True)
      (2): ReLU()
      (3): Conv1d(64, 32, kernel_size=(1,), stride=(1,))
      (4): BatchNorm1d(32, eps=1e-05, momentum=0.1, affine=True, track_running_stats=True)
    )
  )
  (rho): Rho(
    (layers): Sequential(
      (0): Linear(in_features=32, out_features=64, bias=True)
      (1): BatchNorm1d(64, eps=1e-05, momentum=0.1, affine=True, track_running_stats=True)
      (2): ReLU()
      (3): Linear(in_features=64, out_features=128, bias=True)
      (4): ReLU()
      (5): Linear(in_features=128, out_features=5, bias=True)
      (6): BatchNorm1d(5, eps=1e-05, momentum=0.1, affine=True, track_running_stats=True)
    )
  )
)
BOPs: tensor(9443340.)
Trial  0  begins evaluation...
