[I 2024-09-17 14:40:49,150] Trial 386 finished with values: [0.6445499995840647, 5144288.5] and parameters: {'bottleneck_dim': 5, 'aggregator_type': 1, 'phi_len': 3, 'phi_MLP_width_0': 0, 'phi_MLP_width_1': 3, 'phi_MLP_acts_0': 1, 'phi_MLP_acts_1': 0, 'phi_MLP_norms_0': 'layer', 'phi_MLP_norms_1': None, 'phi_MLP_norms_2': 'layer', 'rho_len': 4, 'rho_MLP_width_0': 2, 'rho_MLP_width_1': 2, 'rho_MLP_width_2': 2, 'rho_MLP_acts_0': 0, 'rho_MLP_acts_1': 1, 'rho_MLP_acts_2': 0, 'rho_MLP_norms_0': None, 'rho_MLP_norms_1': 'layer', 'rho_MLP_norms_2': 'layer', 'rho_MLP_norms_3': None}. 
Test Accuracy: 0.6445
Accuracy:  0.6445499995840647 , Inference time:  0.043299198150634766 , Validation Loss:  0.9297898338765515 , Param Count:  6021
Conv bp:  tensor(7835688.)
DeepSetsArchitecture(
  (phi): ConvPhi(
    (layers): Sequential(
      (0): Conv1d(3, 32, kernel_size=(1,), stride=(1,))
      (1): LeakyReLU(negative_slope=0.0078125)
      (2): Conv1d(32, 16, kernel_size=(1,), stride=(1,))
      (3): ReLU()
      (4): Conv1d(16, 128, kernel_size=(1,), stride=(1,))
      (5): ReLU()
      (6): Conv1d(128, 64, kernel_size=(1,), stride=(1,))
    )
  )
  (rho): Rho(
    (layers): Sequential(
      (0): Linear(in_features=64, out_features=64, bias=True)
      (1): LeakyReLU(negative_slope=0.0078125)
      (2): Linear(in_features=64, out_features=5, bias=True)
    )
  )
)
BOPs: tensor(8604072.)
Trial  387  begins evaluation...
[I 2024-09-17 14:46:13,576] Trial 387 finished with values: [0.6474166257663608, 8604072.0] and parameters: {'bottleneck_dim': 6, 'aggregator_type': 0, 'phi_len': 4, 'phi_MLP_width_0': 2, 'phi_MLP_width_1': 1, 'phi_MLP_width_2': 4, 'phi_MLP_acts_0': 1, 'phi_MLP_acts_1': 0, 'phi_MLP_acts_2': 0, 'phi_MLP_norms_0': 'layer', 'phi_MLP_norms_1': None, 'phi_MLP_norms_2': None, 'phi_MLP_norms_3': None, 'rho_len': 2, 'rho_MLP_width_0': 3, 'rho_MLP_acts_0': 1, 'rho_MLP_norms_0': 'layer', 'rho_MLP_norms_1': None}. 
Test Accuracy: 0.6474
Accuracy:  0.6474166257663608 , Inference time:  0.0460052490234375 , Validation Loss:  0.9286483096427658 , Param Count:  15573
Conv bp:  tensor(7570572.)
DeepSetsArchitecture(
  (phi): ConvPhi(
    (layers): Sequential(
      (0): Conv1d(3, 64, kernel_size=(1,), stride=(1,))
      (1): BatchNorm1d(64, eps=1e-05, momentum=0.1, affine=True, track_running_stats=True)
      (2): LeakyReLU(negative_slope=0.0078125)
      (3): Conv1d(64, 32, kernel_size=(1,), stride=(1,))
    )
  )
  (rho): Rho(
    (layers): Sequential(
      (0): Linear(in_features=32, out_features=128, bias=True)
      (1): BatchNorm1d(128, eps=1e-05, momentum=0.1, affine=True, track_running_stats=True)
      (2): LeakyReLU(negative_slope=0.0078125)
      (3): Linear(in_features=128, out_features=64, bias=True)
      (4): BatchNorm1d(64, eps=1e-05, momentum=0.1, affine=True, track_running_stats=True)
      (5): LeakyReLU(negative_slope=0.0078125)
      (6): Linear(in_features=64, out_features=5, bias=True)
    )
  )
)
BOPs: tensor(9751180.)
Trial  388  begins evaluation...
[I 2024-09-17 14:51:35,781] Trial 388 finished with values: [0.6611757659448803, 9751180.0] and parameters: {'bottleneck_dim': 5, 'aggregator_type': 1, 'phi_len': 2, 'phi_MLP_width_0': 3, 'phi_MLP_acts_0': 1, 'phi_MLP_norms_0': 'batch', 'phi_MLP_norms_1': 'layer', 'rho_len': 3, 'rho_MLP_width_0': 4, 'rho_MLP_width_1': 3, 'rho_MLP_acts_0': 1, 'rho_MLP_acts_1': 1, 'rho_MLP_norms_0': 'batch', 'rho_MLP_norms_1': 'batch', 'rho_MLP_norms_2': None}. 
Test Accuracy: 0.6612
Accuracy:  0.6611757659448803 , Inference time:  0.04465651512145996 , Validation Loss:  0.889954285962241 , Param Count:  15653
Conv bp:  tensor(259845.)
DeepSetsArchitecture(
  (phi): ConvPhi(
    (layers): Sequential(
      (0): Conv1d(3, 16, kernel_size=(1,), stride=(1,))
      (1): BatchNorm1d(16, eps=1e-05, momentum=0.1, affine=True, track_running_stats=True)
    )
  )
  (rho): Rho(
    (layers): Sequential(
      (0): Linear(in_features=16, out_features=16, bias=True)
      (1): ReLU()
      (2): Linear(in_features=16, out_features=5, bias=True)
    )
  )
)
BOPs: tensor(318085.)
Trial  389  begins evaluation...
[I 2024-09-17 14:56:59,569] Trial 389 finished with values: [0.5696516957682741, 318085.0] and parameters: {'bottleneck_dim': 4, 'aggregator_type': 1, 'phi_len': 1, 'phi_MLP_norms_0': 'batch', 'rho_len': 2, 'rho_MLP_width_0': 1, 'rho_MLP_acts_0': 0, 'rho_MLP_norms_0': None, 'rho_MLP_norms_1': None}. 
Test Accuracy: 0.5697
Accuracy:  0.5696516957682741 , Inference time:  0.022225618362426758 , Validation Loss:  1.0994108047615103 , Param Count:  453
Conv bp:  tensor(1522713.)
DeepSetsArchitecture(
  (phi): ConvPhi(
    (layers): Sequential(
      (0): Conv1d(3, 32, kernel_size=(1,), stride=(1,))
      (1): BatchNorm1d(32, eps=1e-05, momentum=0.1, affine=True, track_running_stats=True)
      (2): LeakyReLU(negative_slope=0.0078125)
      (3): Conv1d(32, 8, kernel_size=(1,), stride=(1,))
      (4): BatchNorm1d(8, eps=1e-05, momentum=0.1, affine=True, track_running_stats=True)
      (5): LeakyReLU(negative_slope=0.0078125)
      (6): Conv1d(8, 16, kernel_size=(1,), stride=(1,))
      (7): BatchNorm1d(16, eps=1e-05, momentum=0.1, affine=True, track_running_stats=True)
      (8): LeakyReLU(negative_slope=0.0078125)
      (9): Conv1d(16, 4, kernel_size=(1,), stride=(1,))
      (10): BatchNorm1d(4, eps=1e-05, momentum=0.1, affine=True, track_running_stats=True)
    )
  )
  (rho): Rho(
    (layers): Sequential(
      (0): Linear(in_features=4, out_features=32, bias=True)
      (1): LeakyReLU(negative_slope=0.0078125)
      (2): Linear(in_features=32, out_features=5, bias=True)
    )
  )
)
BOPs: tensor(1571289.)
Trial  390  begins evaluation...
[I 2024-09-17 15:02:26,318] Trial 390 finished with values: [0.6036469208308723, 1571289.0] and parameters: {'bottleneck_dim': 2, 'aggregator_type': 1, 'phi_len': 4, 'phi_MLP_width_0': 2, 'phi_MLP_width_1': 0, 'phi_MLP_width_2': 1, 'phi_MLP_acts_0': 1, 'phi_MLP_acts_1': 1, 'phi_MLP_acts_2': 1, 'phi_MLP_norms_0': 'batch', 'phi_MLP_norms_1': 'batch', 'phi_MLP_norms_2': 'batch', 'phi_MLP_norms_3': 'batch', 'rho_len': 2, 'rho_MLP_width_0': 2, 'rho_MLP_acts_0': 1, 'rho_MLP_norms_0': None, 'rho_MLP_norms_1': None}. 
Test Accuracy: 0.6036
Accuracy:  0.6036469208308723 , Inference time:  0.05514192581176758 , Validation Loss:  1.0385100115724162 , Param Count:  1049
Conv bp:  tensor(7570572.)
DeepSetsArchitecture(
  (phi): ConvPhi(
    (layers): Sequential(
      (0): Conv1d(3, 64, kernel_size=(1,), stride=(1,))
      (1): ReLU()
      (2): Conv1d(64, 32, kernel_size=(1,), stride=(1,))
    )
  )
  (rho): Rho(
    (layers): Sequential(
      (0): Linear(in_features=32, out_features=8, bias=True)
      (1): ReLU()
      (2): Linear(in_features=8, out_features=128, bias=True)
      (3): LeakyReLU(negative_slope=0.0078125)
      (4): Linear(in_features=128, out_features=64, bias=True)
      (5): ReLU()
      (6): Linear(in_features=64, out_features=5, bias=True)
    )
  )
)
BOPs: tensor(9268364.)
Trial  391  begins evaluation...
[I 2024-09-17 15:07:52,621] Trial 391 finished with values: [0.640873131410603, 9268364.0] and parameters: {'bottleneck_dim': 5, 'aggregator_type': 1, 'phi_len': 2, 'phi_MLP_width_0': 3, 'phi_MLP_acts_0': 0, 'phi_MLP_norms_0': 'layer', 'phi_MLP_norms_1': None, 'rho_len': 4, 'rho_MLP_width_0': 0, 'rho_MLP_width_1': 4, 'rho_MLP_width_2': 3, 'rho_MLP_acts_0': 0, 'rho_MLP_acts_1': 1, 'rho_MLP_acts_2': 0, 'rho_MLP_norms_0': None, 'rho_MLP_norms_1': None, 'rho_MLP_norms_2': 'layer', 'rho_MLP_norms_3': None}. 
Test Accuracy: 0.6409
Accuracy:  0.640873131410603 , Inference time:  0.0353398323059082 , Validation Loss:  0.9372092870627942 , Param Count:  12333
Conv bp:  tensor(6621510.)
DeepSetsArchitecture(
  (phi): ConvPhi(
    (layers): Sequential(
      (0): Conv1d(3, 32, kernel_size=(1,), stride=(1,))
      (1): ReLU()
      (2): Conv1d(32, 32, kernel_size=(1,), stride=(1,))
      (3): LeakyReLU(negative_slope=0.0078125)
      (4): Conv1d(32, 64, kernel_size=(1,), stride=(1,))
      (5): BatchNorm1d(64, eps=1e-05, momentum=0.1, affine=True, track_running_stats=True)
      (6): ReLU()
      (7): Conv1d(64, 1, kernel_size=(1,), stride=(1,))
    )
  )
  (rho): Rho(
    (layers): Sequential(
      (0): Linear(in_features=1, out_features=128, bias=True)
      (1): LeakyReLU(negative_slope=0.0078125)
      (2): Linear(in_features=128, out_features=16, bias=True)
      (3): LeakyReLU(negative_slope=0.0078125)
      (4): Linear(in_features=16, out_features=5, bias=True)
    )
  )
)
BOPs: tensor(7011862.)
Trial  392  begins evaluation...
[I 2024-09-17 15:13:24,472] Trial 392 finished with values: [0.44429378343080084, 7011862.0] and parameters: {'bottleneck_dim': 0, 'aggregator_type': 1, 'phi_len': 4, 'phi_MLP_width_0': 2, 'phi_MLP_width_1': 2, 'phi_MLP_width_2': 3, 'phi_MLP_acts_0': 0, 'phi_MLP_acts_1': 1, 'phi_MLP_acts_2': 0, 'phi_MLP_norms_0': 'layer', 'phi_MLP_norms_1': None, 'phi_MLP_norms_2': 'batch', 'phi_MLP_norms_3': None, 'rho_len': 3, 'rho_MLP_width_0': 4, 'rho_MLP_width_1': 1, 'rho_MLP_acts_0': 1, 'rho_MLP_acts_1': 1, 'rho_MLP_norms_0': 'layer', 'rho_MLP_norms_1': 'layer', 'rho_MLP_norms_2': None}. 
Test Accuracy: 0.4443
Accuracy:  0.44429378343080084 , Inference time:  0.054646968841552734 , Validation Loss:  1.286361763266479 , Param Count:  5894
Conv bp:  tensor(702348.5000)
DeepSetsArchitecture(
  (phi): ConvPhi(
    (layers): Sequential(
      (0): Conv1d(3, 16, kernel_size=(1,), stride=(1,))
      (1): ReLU()
      (2): Conv1d(16, 8, kernel_size=(1,), stride=(1,))
      (3): BatchNorm1d(8, eps=1e-05, momentum=0.1, affine=True, track_running_stats=True)
      (4): ReLU()
      (5): Conv1d(8, 4, kernel_size=(1,), stride=(1,))
    )
  )
  (rho): Rho(
    (layers): Sequential(
      (0): Linear(in_features=4, out_features=16, bias=True)
      (1): LeakyReLU(negative_slope=0.0078125)
      (2): Linear(in_features=16, out_features=5, bias=True)
    )
  )
)
BOPs: tensor(726668.5000)
Trial  393  begins evaluation...
[I 2024-09-17 15:18:53,941] Trial 393 finished with values: [0.5511392468243339, 726668.5] and parameters: {'bottleneck_dim': 2, 'aggregator_type': 1, 'phi_len': 3, 'phi_MLP_width_0': 1, 'phi_MLP_width_1': 0, 'phi_MLP_acts_0': 0, 'phi_MLP_acts_1': 0, 'phi_MLP_norms_0': 'layer', 'phi_MLP_norms_1': 'batch', 'phi_MLP_norms_2': 'layer', 'rho_len': 2, 'rho_MLP_width_0': 1, 'rho_MLP_acts_0': 1, 'rho_MLP_norms_0': None, 'rho_MLP_norms_1': None}. 
Test Accuracy: 0.5511
Accuracy:  0.5511392468243339 , Inference time:  0.03849911689758301 , Validation Loss:  1.1342639663592489 , Param Count:  417
Conv bp:  tensor(8683680.)
DeepSetsArchitecture(
  (phi): ConvPhi(
    (layers): Sequential(
      (0): Conv1d(3, 128, kernel_size=(1,), stride=(1,))
      (1): BatchNorm1d(128, eps=1e-05, momentum=0.1, affine=True, track_running_stats=True)
      (2): LeakyReLU(negative_slope=0.0078125)
      (3): Conv1d(128, 16, kernel_size=(1,), stride=(1,))
    )
  )
  (rho): Rho(
    (layers): Sequential(
      (0): Linear(in_features=16, out_features=128, bias=True)
      (1): LeakyReLU(negative_slope=0.0078125)
      (2): Linear(in_features=128, out_features=128, bias=True)
      (3): LeakyReLU(negative_slope=0.0078125)
      (4): Linear(in_features=128, out_features=5, bias=True)
      (5): BatchNorm1d(5, eps=1e-05, momentum=0.1, affine=True, track_running_stats=True)
    )
  )
)
BOPs: tensor(11991712.)
Trial  394  begins evaluation...
[I 2024-09-17 15:24:27,156] Trial 394 finished with values: [0.6549533736513298, 11991712.0] and parameters: {'bottleneck_dim': 4, 'aggregator_type': 1, 'phi_len': 2, 'phi_MLP_width_0': 4, 'phi_MLP_acts_0': 1, 'phi_MLP_norms_0': 'batch', 'phi_MLP_norms_1': None, 'rho_len': 3, 'rho_MLP_width_0': 4, 'rho_MLP_width_1': 4, 'rho_MLP_acts_0': 1, 'rho_MLP_acts_1': 1, 'rho_MLP_norms_0': None, 'rho_MLP_norms_1': None, 'rho_MLP_norms_2': 'batch'}. 
Test Accuracy: 0.6550
Accuracy:  0.6549533736513298 , Inference time:  0.03846621513366699 , Validation Loss:  0.9023550274420757 , Param Count:  22175
Conv bp:  tensor(5381220.)
DeepSetsArchitecture(
  (phi): ConvPhi(
    (layers): Sequential(
      (0): Conv1d(3, 128, kernel_size=(1,), stride=(1,))
      (1): BatchNorm1d(128, eps=1e-05, momentum=0.1, affine=True, track_running_stats=True)
      (2): LeakyReLU(negative_slope=0.0078125)
      (3): Conv1d(128, 8, kernel_size=(1,), stride=(1,))
    )
  )
  (rho): Rho(
    (layers): Sequential(
      (0): Linear(in_features=8, out_features=128, bias=True)
      (1): LeakyReLU(negative_slope=0.0078125)
      (2): Linear(in_features=128, out_features=128, bias=True)
      (3): ReLU()
      (4): Linear(in_features=128, out_features=32, bias=True)
      (5): ReLU()
      (6): Linear(in_features=32, out_features=5, bias=True)
    )
  )
)
BOPs: tensor(9142756.)
Trial  395  begins evaluation...
[I 2024-09-17 15:30:04,736] Trial 395 finished with values: [0.6369051085175234, 9142756.0] and parameters: {'bottleneck_dim': 3, 'aggregator_type': 1, 'phi_len': 2, 'phi_MLP_width_0': 4, 'phi_MLP_acts_0': 1, 'phi_MLP_norms_0': 'batch', 'phi_MLP_norms_1': 'layer', 'rho_len': 4, 'rho_MLP_width_0': 4, 'rho_MLP_width_1': 4, 'rho_MLP_width_2': 2, 'rho_MLP_acts_0': 1, 'rho_MLP_acts_1': 0, 'rho_MLP_acts_2': 0, 'rho_MLP_norms_0': None, 'rho_MLP_norms_1': None, 'rho_MLP_norms_2': 'layer', 'rho_MLP_norms_3': 'layer'}. 
Test Accuracy: 0.6369
Accuracy:  0.6369051085175234 , Inference time:  0.03772258758544922 , Validation Loss:  0.9523379287752164 , Param Count:  23757
Conv bp:  tensor(2491567.5000)
DeepSetsArchitecture(
  (phi): ConvPhi(
    (layers): Sequential(
      (0): Conv1d(3, 128, kernel_size=(1,), stride=(1,))
      (1): ReLU()
      (2): Conv1d(128, 1, kernel_size=(1,), stride=(1,))
      (3): BatchNorm1d(1, eps=1e-05, momentum=0.1, affine=True, track_running_stats=True)
    )
  )
  (rho): Rho(
    (layers): Sequential(
      (0): Linear(in_features=1, out_features=64, bias=True)
      (1): ReLU()
      (2): Linear(in_features=64, out_features=16, bias=True)
      (3): LeakyReLU(negative_slope=0.0078125)
      (4): Linear(in_features=16, out_features=16, bias=True)
      (5): LeakyReLU(negative_slope=0.0078125)
      (6): Linear(in_features=16, out_features=5, bias=True)
      (7): BatchNorm1d(5, eps=1e-05, momentum=0.1, affine=True, track_running_stats=True)
    )
  )
)
BOPs: tensor(2734463.5000)
Trial  396  begins evaluation...
[I 2024-09-17 15:35:42,382] Trial 396 finished with values: [0.4782024939481412, 2734463.5] and parameters: {'bottleneck_dim': 0, 'aggregator_type': 1, 'phi_len': 2, 'phi_MLP_width_0': 4, 'phi_MLP_acts_0': 0, 'phi_MLP_norms_0': 'layer', 'phi_MLP_norms_1': 'batch', 'rho_len': 4, 'rho_MLP_width_0': 3, 'rho_MLP_width_1': 1, 'rho_MLP_width_2': 1, 'rho_MLP_acts_0': 0, 'rho_MLP_acts_1': 1, 'rho_MLP_acts_2': 1, 'rho_MLP_norms_0': 'layer', 'rho_MLP_norms_1': 'layer', 'rho_MLP_norms_2': 'layer', 'rho_MLP_norms_3': 'batch'}. 
Test Accuracy: 0.4782
Accuracy:  0.4782024939481412 , Inference time:  0.042517662048339844 , Validation Loss:  1.254465794076725 , Param Count:  2178
Conv bp:  tensor(25100026.)
DeepSetsArchitecture(
  (phi): ConvPhi(
    (layers): Sequential(
      (0): Conv1d(3, 32, kernel_size=(1,), stride=(1,))
      (1): BatchNorm1d(32, eps=1e-05, momentum=0.1, affine=True, track_running_stats=True)
      (2): ReLU()
      (3): Conv1d(32, 128, kernel_size=(1,), stride=(1,))
      (4): LeakyReLU(negative_slope=0.0078125)
      (5): Conv1d(128, 64, kernel_size=(1,), stride=(1,))
    )
  )
  (rho): Rho(
    (layers): Sequential(
      (0): Linear(in_features=64, out_features=16, bias=True)
      (1): ReLU()
      (2): Linear(in_features=16, out_features=32, bias=True)
      (3): LeakyReLU(negative_slope=0.0078125)
      (4): Linear(in_features=32, out_features=5, bias=True)
    )
  )
)
BOPs: tensor(25397562.)
Trial  397  begins evaluation...
[I 2024-09-17 15:41:20,062] Trial 397 finished with values: [0.6490138173711224, 25397562.0] and parameters: {'bottleneck_dim': 6, 'aggregator_type': 1, 'phi_len': 3, 'phi_MLP_width_0': 2, 'phi_MLP_width_1': 4, 'phi_MLP_acts_0': 0, 'phi_MLP_acts_1': 1, 'phi_MLP_norms_0': 'batch', 'phi_MLP_norms_1': 'layer', 'phi_MLP_norms_2': 'layer', 'rho_len': 3, 'rho_MLP_width_0': 1, 'rho_MLP_width_1': 2, 'rho_MLP_acts_0': 0, 'rho_MLP_acts_1': 1, 'rho_MLP_norms_0': None, 'rho_MLP_norms_1': None, 'rho_MLP_norms_2': None}. 
Test Accuracy: 0.6490
Accuracy:  0.6490138173711224 , Inference time:  0.04658842086791992 , Validation Loss:  0.9200431680192753 , Param Count:  14421
Conv bp:  tensor(918673.5000)
DeepSetsArchitecture(
  (phi): ConvPhi(
    (layers): Sequential(
      (0): Conv1d(3, 8, kernel_size=(1,), stride=(1,))
      (1): ReLU()
      (2): Conv1d(8, 32, kernel_size=(1,), stride=(1,))
    )
  )
  (rho): Rho(
    (layers): Sequential(
      (0): Linear(in_features=32, out_features=8, bias=True)
      (1): BatchNorm1d(8, eps=1e-05, momentum=0.1, affine=True, track_running_stats=True)
      (2): LeakyReLU(negative_slope=0.0078125)
      (3): Linear(in_features=8, out_features=64, bias=True)
      (4): ReLU()
      (5): Linear(in_features=64, out_features=64, bias=True)
      (6): LeakyReLU(negative_slope=0.0078125)
      (7): Linear(in_features=64, out_features=5, bias=True)
      (8): BatchNorm1d(5, eps=1e-05, momentum=0.1, affine=True, track_running_stats=True)
    )
  )
)
BOPs: tensor(1810577.5000)
Trial  398  begins evaluation...
[I 2024-09-17 15:46:43,091] Trial 398 finished with values: [0.6341649266706042, 1810577.5] and parameters: {'bottleneck_dim': 5, 'aggregator_type': 1, 'phi_len': 2, 'phi_MLP_width_0': 0, 'phi_MLP_acts_0': 0, 'phi_MLP_norms_0': 'layer', 'phi_MLP_norms_1': None, 'rho_len': 4, 'rho_MLP_width_0': 0, 'rho_MLP_width_1': 3, 'rho_MLP_width_2': 3, 'rho_MLP_acts_0': 1, 'rho_MLP_acts_1': 0, 'rho_MLP_acts_2': 1, 'rho_MLP_norms_0': 'batch', 'rho_MLP_norms_1': None, 'rho_MLP_norms_2': None, 'rho_MLP_norms_3': 'batch'}. 
Test Accuracy: 0.6342
Accuracy:  0.6341649266706042 , Inference time:  0.044252634048461914 , Validation Loss:  0.9528839263786264 , Param Count:  5671
Conv bp:  tensor(16240.3125)
DeepSetsArchitecture(
  (phi): ConvPhi(
    (layers): Sequential(
      (0): Conv1d(3, 1, kernel_size=(1,), stride=(1,))
      (1): BatchNorm1d(1, eps=1e-05, momentum=0.1, affine=True, track_running_stats=True)
    )
  )
  (rho): Rho(
    (layers): Sequential(
      (0): Linear(in_features=1, out_features=5, bias=True)
    )
  )
)
BOPs: tensor(17120.3125)
Trial  399  begins evaluation...
[I 2024-09-17 15:52:00,989] Trial 399 finished with values: [0.33440367354069095, 17120.3125] and parameters: {'bottleneck_dim': 0, 'aggregator_type': 1, 'phi_len': 1, 'phi_MLP_norms_0': 'batch', 'rho_len': 1, 'rho_MLP_norms_0': None}. 
Test Accuracy: 0.3344
Accuracy:  0.33440367354069095 , Inference time:  0.016647815704345703 , Validation Loss:  1.5117947860639922 , Param Count:  16
Conv bp:  tensor(9734013.)
DeepSetsArchitecture(
  (phi): ConvPhi(
    (layers): Sequential(
      (0): Conv1d(3, 16, kernel_size=(1,), stride=(1,))
      (1): LeakyReLU(negative_slope=0.0078125)
      (2): Conv1d(16, 128, kernel_size=(1,), stride=(1,))
      (3): LeakyReLU(negative_slope=0.0078125)
      (4): Conv1d(128, 16, kernel_size=(1,), stride=(1,))
      (5): ReLU()
      (6): Conv1d(16, 32, kernel_size=(1,), stride=(1,))
    )
  )
  (rho): Rho(
    (layers): Sequential(
      (0): Linear(in_features=32, out_features=64, bias=True)
      (1): ReLU()
      (2): Linear(in_features=64, out_features=5, bias=True)
      (3): BatchNorm1d(5, eps=1e-05, momentum=0.1, affine=True, track_running_stats=True)
    )
  )
)
BOPs: tensor(10141053.)
Trial  400  begins evaluation...
[I 2024-09-17 15:57:22,671] Trial 400 finished with values: [0.6308574090557436, 10141053.0] and parameters: {'bottleneck_dim': 5, 'aggregator_type': 1, 'phi_len': 4, 'phi_MLP_width_0': 1, 'phi_MLP_width_1': 4, 'phi_MLP_width_2': 1, 'phi_MLP_acts_0': 1, 'phi_MLP_acts_1': 1, 'phi_MLP_acts_2': 0, 'phi_MLP_norms_0': 'layer', 'phi_MLP_norms_1': 'layer', 'phi_MLP_norms_2': 'layer', 'phi_MLP_norms_3': None, 'rho_len': 2, 'rho_MLP_width_0': 3, 'rho_MLP_acts_0': 0, 'rho_MLP_norms_0': 'layer', 'rho_MLP_norms_1': 'batch'}. 
Test Accuracy: 0.6309
Accuracy:  0.6308574090557436 , Inference time:  0.0507502555847168 , Validation Loss:  0.9649424861077549 , Param Count:  7295
Conv bp:  tensor(259845.)
DeepSetsArchitecture(
  (phi): ConvPhi(
    (layers): Sequential(
      (0): Conv1d(3, 16, kernel_size=(1,), stride=(1,))
      (1): BatchNorm1d(16, eps=1e-05, momentum=0.1, affine=True, track_running_stats=True)
    )
  )
  (rho): Rho(
    (layers): Sequential(
      (0): Linear(in_features=16, out_features=32, bias=True)
      (1): ReLU()
      (2): Linear(in_features=32, out_features=5, bias=True)
      (3): BatchNorm1d(5, eps=1e-05, momentum=0.1, affine=True, track_running_stats=True)
    )
  )
)
BOPs: tensor(375109.)
Trial  401  begins evaluation...
[I 2024-09-17 16:02:38,134] Trial 401 finished with values: [0.3989218956667859, 375109.0] and parameters: {'bottleneck_dim': 4, 'aggregator_type': 0, 'phi_len': 1, 'phi_MLP_norms_0': 'batch', 'rho_len': 2, 'rho_MLP_width_0': 2, 'rho_MLP_acts_0': 0, 'rho_MLP_norms_0': None, 'rho_MLP_norms_1': 'batch'}. 
Test Accuracy: 0.3989
Accuracy:  0.3989218956667859 , Inference time:  0.026156902313232422 , Validation Loss:  1.381590925106386 , Param Count:  815
Conv bp:  tensor(15288600.)
DeepSetsArchitecture(
  (phi): ConvPhi(
    (layers): Sequential(
      (0): Conv1d(3, 128, kernel_size=(1,), stride=(1,))
      (1): LeakyReLU(negative_slope=0.0078125)
      (2): Conv1d(128, 32, kernel_size=(1,), stride=(1,))
    )
  )
  (rho): Rho(
    (layers): Sequential(
      (0): Linear(in_features=32, out_features=5, bias=True)
    )
  )
)
BOPs: tensor(15319640.)
Trial  402  begins evaluation...
