[I 2024-09-16 19:45:47,570] Trial 168 finished with values: [0.40020131269185016, 4182410.0] and parameters: {'bottleneck_dim': 5, 'aggregator_type': 0, 'phi_len': 1, 'phi_MLP_norms_0': 'layer', 'rho_len': 3, 'rho_MLP_width_0': 4, 'rho_MLP_width_1': 4, 'rho_MLP_acts_0': 1, 'rho_MLP_acts_1': 1, 'rho_MLP_norms_0': 'layer', 'rho_MLP_norms_1': 'batch', 'rho_MLP_norms_2': 'layer'}. 
Test Accuracy: 0.4002
Accuracy:  0.40020131269185016 , Inference time:  0.026569128036499023 , Validation Loss:  1.3775398869092772 , Param Count:  21765
Conv bp:  tensor(918673.5000)
DeepSetsArchitecture(
  (phi): ConvPhi(
    (layers): Sequential(
      (0): Conv1d(3, 8, kernel_size=(1,), stride=(1,))
      (1): BatchNorm1d(8, eps=1e-05, momentum=0.1, affine=True, track_running_stats=True)
      (2): LeakyReLU(negative_slope=0.0078125)
      (3): Conv1d(8, 32, kernel_size=(1,), stride=(1,))
    )
  )
  (rho): Rho(
    (layers): Sequential(
      (0): Linear(in_features=32, out_features=5, bias=True)
    )
  )
)
BOPs: tensor(949713.5000)
Trial  169  begins evaluation...
[I 2024-09-16 19:50:47,622] Trial 169 finished with values: [0.5657884885742569, 949713.5] and parameters: {'bottleneck_dim': 5, 'aggregator_type': 1, 'phi_len': 2, 'phi_MLP_width_0': 0, 'phi_MLP_acts_0': 1, 'phi_MLP_norms_0': 'batch', 'phi_MLP_norms_1': None, 'rho_len': 1, 'rho_MLP_norms_0': None}. 
Test Accuracy: 0.5658
Accuracy:  0.5657884885742569 , Inference time:  0.025722265243530273 , Validation Loss:  1.1101894086720991 , Param Count:  501
Conv bp:  tensor(702348.5000)
DeepSetsArchitecture(
  (phi): ConvPhi(
    (layers): Sequential(
      (0): Conv1d(3, 16, kernel_size=(1,), stride=(1,))
      (1): LeakyReLU(negative_slope=0.0078125)
      (2): Conv1d(16, 8, kernel_size=(1,), stride=(1,))
      (3): BatchNorm1d(8, eps=1e-05, momentum=0.1, affine=True, track_running_stats=True)
      (4): LeakyReLU(negative_slope=0.0078125)
      (5): Conv1d(8, 4, kernel_size=(1,), stride=(1,))
    )
  )
  (rho): Rho(
    (layers): Sequential(
      (0): Linear(in_features=4, out_features=16, bias=True)
      (1): BatchNorm1d(16, eps=1e-05, momentum=0.1, affine=True, track_running_stats=True)
      (2): LeakyReLU(negative_slope=0.0078125)
      (3): Linear(in_features=16, out_features=5, bias=True)
    )
  )
)
BOPs: tensor(726828.5000)
Trial  170  begins evaluation...
[I 2024-09-16 19:55:57,074] Trial 170 finished with values: [0.6105830581228008, 726828.5] and parameters: {'bottleneck_dim': 2, 'aggregator_type': 0, 'phi_len': 3, 'phi_MLP_width_0': 1, 'phi_MLP_width_1': 0, 'phi_MLP_acts_0': 1, 'phi_MLP_acts_1': 1, 'phi_MLP_norms_0': 'layer', 'phi_MLP_norms_1': 'batch', 'phi_MLP_norms_2': None, 'rho_len': 2, 'rho_MLP_width_0': 1, 'rho_MLP_acts_0': 1, 'rho_MLP_norms_0': 'batch', 'rho_MLP_norms_1': 'layer'}. 
Test Accuracy: 0.6106
Accuracy:  0.6105830581228008 , Inference time:  0.04074287414550781 , Validation Loss:  1.0215512331651182 , Param Count:  449
Conv bp:  tensor(2916643.)
DeepSetsArchitecture(
  (phi): ConvPhi(
    (layers): Sequential(
      (0): Conv1d(3, 16, kernel_size=(1,), stride=(1,))
      (1): LeakyReLU(negative_slope=0.0078125)
      (2): Conv1d(16, 32, kernel_size=(1,), stride=(1,))
      (3): LeakyReLU(negative_slope=0.0078125)
      (4): Conv1d(32, 16, kernel_size=(1,), stride=(1,))
      (5): BatchNorm1d(16, eps=1e-05, momentum=0.1, affine=True, track_running_stats=True)
      (6): ReLU()
      (7): Conv1d(16, 64, kernel_size=(1,), stride=(1,))
      (8): BatchNorm1d(64, eps=1e-05, momentum=0.1, affine=True, track_running_stats=True)
    )
  )
  (rho): Rho(
    (layers): Sequential(
      (0): Linear(in_features=64, out_features=128, bias=True)
      (1): LeakyReLU(negative_slope=0.0078125)
      (2): Linear(in_features=128, out_features=16, bias=True)
      (3): ReLU()
      (4): Linear(in_features=16, out_features=5, bias=True)
      (5): BatchNorm1d(5, eps=1e-05, momentum=0.1, affine=True, track_running_stats=True)
    )
  )
)
BOPs: tensor(4703651.)
Trial  171  begins evaluation...
[I 2024-09-16 20:01:08,484] Trial 171 finished with values: [0.6551164202943158, 4703651.0] and parameters: {'bottleneck_dim': 6, 'aggregator_type': 1, 'phi_len': 4, 'phi_MLP_width_0': 1, 'phi_MLP_width_1': 2, 'phi_MLP_width_2': 1, 'phi_MLP_acts_0': 1, 'phi_MLP_acts_1': 1, 'phi_MLP_acts_2': 0, 'phi_MLP_norms_0': 'layer', 'phi_MLP_norms_1': None, 'phi_MLP_norms_2': 'batch', 'phi_MLP_norms_3': 'batch', 'rho_len': 3, 'rho_MLP_width_0': 4, 'rho_MLP_width_1': 1, 'rho_MLP_acts_0': 1, 'rho_MLP_acts_1': 0, 'rho_MLP_norms_0': 'layer', 'rho_MLP_norms_1': None, 'rho_MLP_norms_2': 'batch'}. 
Test Accuracy: 0.6551
Accuracy:  0.6551164202943158 , Inference time:  0.057671308517456055 , Validation Loss:  0.9049681562955688 , Param Count:  12863
Conv bp:  tensor(14101764.)
DeepSetsArchitecture(
  (phi): ConvPhi(
    (layers): Sequential(
      (0): Conv1d(3, 64, kernel_size=(1,), stride=(1,))
      (1): LeakyReLU(negative_slope=0.0078125)
      (2): Conv1d(64, 64, kernel_size=(1,), stride=(1,))
    )
  )
  (rho): Rho(
    (layers): Sequential(
      (0): Linear(in_features=64, out_features=64, bias=True)
      (1): LeakyReLU(negative_slope=0.0078125)
      (2): Linear(in_features=64, out_features=8, bias=True)
      (3): BatchNorm1d(8, eps=1e-05, momentum=0.1, affine=True, track_running_stats=True)
      (4): ReLU()
      (5): Linear(in_features=8, out_features=5, bias=True)
    )
  )
)
BOPs: tensor(14909172.)
Trial  172  begins evaluation...
[I 2024-09-16 20:06:19,952] Trial 172 finished with values: [0.6546206254003377, 14909172.0] and parameters: {'bottleneck_dim': 6, 'aggregator_type': 1, 'phi_len': 2, 'phi_MLP_width_0': 3, 'phi_MLP_acts_0': 1, 'phi_MLP_norms_0': None, 'phi_MLP_norms_1': None, 'rho_len': 3, 'rho_MLP_width_0': 3, 'rho_MLP_width_1': 0, 'rho_MLP_acts_0': 1, 'rho_MLP_acts_1': 0, 'rho_MLP_norms_0': None, 'rho_MLP_norms_1': 'batch', 'rho_MLP_norms_2': None}. 
Test Accuracy: 0.6546
Accuracy:  0.6546206254003377 , Inference time:  0.03516960144042969 , Validation Loss:  0.9062924093129684 , Param Count:  9157
Conv bp:  tensor(1447579.5000)
DeepSetsArchitecture(
  (phi): ConvPhi(
    (layers): Sequential(
      (0): Conv1d(3, 64, kernel_size=(1,), stride=(1,))
      (1): BatchNorm1d(64, eps=1e-05, momentum=0.1, affine=True, track_running_stats=True)
      (2): LeakyReLU(negative_slope=0.0078125)
      (3): Conv1d(64, 2, kernel_size=(1,), stride=(1,))
      (4): BatchNorm1d(2, eps=1e-05, momentum=0.1, affine=True, track_running_stats=True)
    )
  )
  (rho): Rho(
    (layers): Sequential(
      (0): Linear(in_features=2, out_features=8, bias=True)
      (1): ReLU()
      (2): Linear(in_features=8, out_features=16, bias=True)
      (3): LeakyReLU(negative_slope=0.0078125)
      (4): Linear(in_features=16, out_features=5, bias=True)
    )
  )
)
BOPs: tensor(1485035.5000)
Trial  173  begins evaluation...
[I 2024-09-16 20:11:32,921] Trial 173 finished with values: [0.5716199016728918, 1485035.5] and parameters: {'bottleneck_dim': 1, 'aggregator_type': 1, 'phi_len': 2, 'phi_MLP_width_0': 3, 'phi_MLP_acts_0': 1, 'phi_MLP_norms_0': 'batch', 'phi_MLP_norms_1': 'batch', 'rho_len': 3, 'rho_MLP_width_0': 0, 'rho_MLP_width_1': 1, 'rho_MLP_acts_0': 0, 'rho_MLP_acts_1': 1, 'rho_MLP_norms_0': 'layer', 'rho_MLP_norms_1': 'layer', 'rho_MLP_norms_2': None}. 
Test Accuracy: 0.5716
Accuracy:  0.5716199016728918 , Inference time:  0.035158395767211914 , Validation Loss:  1.1157683746344378 , Param Count:  771
Conv bp:  tensor(7570572.)
DeepSetsArchitecture(
  (phi): ConvPhi(
    (layers): Sequential(
      (0): Conv1d(3, 64, kernel_size=(1,), stride=(1,))
      (1): LeakyReLU(negative_slope=0.0078125)
      (2): Conv1d(64, 32, kernel_size=(1,), stride=(1,))
    )
  )
  (rho): Rho(
    (layers): Sequential(
      (0): Linear(in_features=32, out_features=32, bias=True)
      (1): ReLU()
      (2): Linear(in_features=32, out_features=128, bias=True)
      (3): ReLU()
      (4): Linear(in_features=128, out_features=8, bias=True)
      (5): LeakyReLU(negative_slope=0.0078125)
      (6): Linear(in_features=8, out_features=5, bias=True)
    )
  )
)
BOPs: tensor(8629628.)
Trial  174  begins evaluation...
[I 2024-09-16 20:16:40,408] Trial 174 finished with values: [0.6522331566994701, 8629628.0] and parameters: {'bottleneck_dim': 5, 'aggregator_type': 1, 'phi_len': 2, 'phi_MLP_width_0': 3, 'phi_MLP_acts_0': 1, 'phi_MLP_norms_0': None, 'phi_MLP_norms_1': 'layer', 'rho_len': 4, 'rho_MLP_width_0': 2, 'rho_MLP_width_1': 4, 'rho_MLP_width_2': 0, 'rho_MLP_acts_0': 0, 'rho_MLP_acts_1': 0, 'rho_MLP_acts_2': 1, 'rho_MLP_norms_0': None, 'rho_MLP_norms_1': None, 'rho_MLP_norms_2': None, 'rho_MLP_norms_3': None}. 
Test Accuracy: 0.6522
Accuracy:  0.6522331566994701 , Inference time:  0.03450322151184082 , Validation Loss:  0.912180913954365 , Param Count:  8693
Conv bp:  tensor(32480.6250)
DeepSetsArchitecture(
  (phi): ConvPhi(
    (layers): Sequential(
      (0): Conv1d(3, 2, kernel_size=(1,), stride=(1,))
    )
  )
  (rho): Rho(
    (layers): Sequential(
      (0): Linear(in_features=2, out_features=5, bias=True)
    )
  )
)
BOPs: tensor(34276.6250)
Trial  175  begins evaluation...
[I 2024-09-16 20:21:36,092] Trial 175 finished with values: [0.29205646737819335, 34276.625] and parameters: {'bottleneck_dim': 1, 'aggregator_type': 1, 'phi_len': 1, 'phi_MLP_norms_0': 'layer', 'rho_len': 1, 'rho_MLP_norms_0': None}. 
Test Accuracy: 0.2921
Accuracy:  0.29205646737819335 , Inference time:  0.0146026611328125 , Validation Loss:  1.5366397114838062 , Param Count:  23
Conv bp:  tensor(16240.3125)
DeepSetsArchitecture(
  (phi): ConvPhi(
    (layers): Sequential(
      (0): Conv1d(3, 1, kernel_size=(1,), stride=(1,))
    )
  )
  (rho): Rho(
    (layers): Sequential(
      (0): Linear(in_features=1, out_features=16, bias=True)
      (1): LeakyReLU(negative_slope=0.0078125)
      (2): Linear(in_features=16, out_features=5, bias=True)
    )
  )
)
BOPs: tensor(32320.3125)
Trial  176  begins evaluation...
[I 2024-09-16 20:26:32,450] Trial 176 finished with values: [0.3599620666993869, 32320.3125] and parameters: {'bottleneck_dim': 0, 'aggregator_type': 1, 'phi_len': 1, 'phi_MLP_norms_0': 'layer', 'rho_len': 2, 'rho_MLP_width_0': 1, 'rho_MLP_acts_0': 1, 'rho_MLP_norms_0': None, 'rho_MLP_norms_1': None}. 
Test Accuracy: 0.3600
Accuracy:  0.3599620666993869 , Inference time:  0.016504287719726562 , Validation Loss:  1.457753492861378 , Param Count:  121
Conv bp:  tensor(3048593.5000)
DeepSetsArchitecture(
  (phi): ConvPhi(
    (layers): Sequential(
      (0): Conv1d(3, 8, kernel_size=(1,), stride=(1,))
      (1): BatchNorm1d(8, eps=1e-05, momentum=0.1, affine=True, track_running_stats=True)
      (2): ReLU()
      (3): Conv1d(8, 32, kernel_size=(1,), stride=(1,))
      (4): ReLU()
      (5): Conv1d(32, 32, kernel_size=(1,), stride=(1,))
      (6): ReLU()
      (7): Conv1d(32, 64, kernel_size=(1,), stride=(1,))
    )
  )
  (rho): Rho(
    (layers): Sequential(
      (0): Linear(in_features=64, out_features=16, bias=True)
      (1): ReLU()
      (2): Linear(in_features=16, out_features=128, bias=True)
      (3): LeakyReLU(negative_slope=0.0078125)
      (4): Linear(in_features=128, out_features=5, bias=True)
    )
  )
)
BOPs: tensor(3688337.5000)
Trial  177  begins evaluation...
[I 2024-09-16 20:31:32,449] Trial 177 finished with values: [0.6494330801673723, 3688337.5] and parameters: {'bottleneck_dim': 6, 'aggregator_type': 1, 'phi_len': 4, 'phi_MLP_width_0': 0, 'phi_MLP_width_1': 2, 'phi_MLP_width_2': 2, 'phi_MLP_acts_0': 0, 'phi_MLP_acts_1': 0, 'phi_MLP_acts_2': 0, 'phi_MLP_norms_0': 'batch', 'phi_MLP_norms_1': 'layer', 'phi_MLP_norms_2': None, 'phi_MLP_norms_3': None, 'rho_len': 3, 'rho_MLP_width_0': 1, 'rho_MLP_width_1': 4, 'rho_MLP_acts_0': 0, 'rho_MLP_acts_1': 1, 'rho_MLP_norms_0': 'layer', 'rho_MLP_norms_1': None, 'rho_MLP_norms_2': None}. 
Test Accuracy: 0.6494
Accuracy:  0.6494330801673723 , Inference time:  0.05289483070373535 , Validation Loss:  0.9174692586165707 , Param Count:  7365
Conv bp:  tensor(7570572.)
DeepSetsArchitecture(
  (phi): ConvPhi(
    (layers): Sequential(
      (0): Conv1d(3, 64, kernel_size=(1,), stride=(1,))
      (1): BatchNorm1d(64, eps=1e-05, momentum=0.1, affine=True, track_running_stats=True)
      (2): LeakyReLU(negative_slope=0.0078125)
      (3): Conv1d(64, 32, kernel_size=(1,), stride=(1,))
    )
  )
  (rho): Rho(
    (layers): Sequential(
      (0): Linear(in_features=32, out_features=5, bias=True)
    )
  )
)
BOPs: tensor(7601612.)
Trial  178  begins evaluation...
[I 2024-09-16 20:36:26,795] Trial 178 finished with values: [0.6118491652178253, 7601612.0] and parameters: {'bottleneck_dim': 5, 'aggregator_type': 1, 'phi_len': 2, 'phi_MLP_width_0': 3, 'phi_MLP_acts_0': 1, 'phi_MLP_norms_0': 'batch', 'phi_MLP_norms_1': 'layer', 'rho_len': 1, 'rho_MLP_norms_0': None}. 
Test Accuracy: 0.6118
Accuracy:  0.6118491652178253 , Inference time:  0.0272066593170166 , Validation Loss:  1.0226268918335844 , Param Count:  2629
Conv bp:  tensor(37125880.)
DeepSetsArchitecture(
  (phi): ConvPhi(
    (layers): Sequential(
      (0): Conv1d(3, 32, kernel_size=(1,), stride=(1,))
      (1): ReLU()
      (2): Conv1d(32, 128, kernel_size=(1,), stride=(1,))
      (3): BatchNorm1d(128, eps=1e-05, momentum=0.1, affine=True, track_running_stats=True)
      (4): ReLU()
      (5): Conv1d(128, 128, kernel_size=(1,), stride=(1,))
      (6): LeakyReLU(negative_slope=0.0078125)
      (7): Conv1d(128, 8, kernel_size=(1,), stride=(1,))
    )
  )
  (rho): Rho(
    (layers): Sequential(
      (0): Linear(in_features=8, out_features=16, bias=True)
      (1): ReLU()
      (2): Linear(in_features=16, out_features=64, bias=True)
      (3): BatchNorm1d(64, eps=1e-05, momentum=0.1, affine=True, track_running_stats=True)
      (4): LeakyReLU(negative_slope=0.0078125)
      (5): Linear(in_features=64, out_features=128, bias=True)
      (6): BatchNorm1d(128, eps=1e-05, momentum=0.1, affine=True, track_running_stats=True)
      (7): LeakyReLU(negative_slope=0.0078125)
      (8): Linear(in_features=128, out_features=5, bias=True)
    )
  )
)
BOPs: tensor(38840376.)
Trial  179  begins evaluation...
[I 2024-09-16 20:41:30,482] Trial 179 finished with values: [0.6316626598231443, 38840376.0] and parameters: {'bottleneck_dim': 3, 'aggregator_type': 1, 'phi_len': 4, 'phi_MLP_width_0': 2, 'phi_MLP_width_1': 4, 'phi_MLP_width_2': 4, 'phi_MLP_acts_0': 0, 'phi_MLP_acts_1': 0, 'phi_MLP_acts_2': 1, 'phi_MLP_norms_0': 'layer', 'phi_MLP_norms_1': 'batch', 'phi_MLP_norms_2': 'layer', 'phi_MLP_norms_3': None, 'rho_len': 4, 'rho_MLP_width_0': 1, 'rho_MLP_width_1': 3, 'rho_MLP_width_2': 4, 'rho_MLP_acts_0': 0, 'rho_MLP_acts_1': 1, 'rho_MLP_acts_2': 1, 'rho_MLP_norms_0': None, 'rho_MLP_norms_1': 'batch', 'rho_MLP_norms_2': 'batch', 'rho_MLP_norms_3': 'layer'}. 
Test Accuracy: 0.6317
Accuracy:  0.6316626598231443 , Inference time:  0.06498575210571289 , Validation Loss:  0.965520132966593 , Param Count:  32733
Conv bp:  tensor(7570572.)
DeepSetsArchitecture(
  (phi): ConvPhi(
    (layers): Sequential(
      (0): Conv1d(3, 64, kernel_size=(1,), stride=(1,))
      (1): BatchNorm1d(64, eps=1e-05, momentum=0.1, affine=True, track_running_stats=True)
      (2): LeakyReLU(negative_slope=0.0078125)
      (3): Conv1d(64, 32, kernel_size=(1,), stride=(1,))
    )
  )
  (rho): Rho(
    (layers): Sequential(
      (0): Linear(in_features=32, out_features=32, bias=True)
      (1): BatchNorm1d(32, eps=1e-05, momentum=0.1, affine=True, track_running_stats=True)
      (2): ReLU()
      (3): Linear(in_features=32, out_features=64, bias=True)
      (4): BatchNorm1d(64, eps=1e-05, momentum=0.1, affine=True, track_running_stats=True)
      (5): LeakyReLU(negative_slope=0.0078125)
      (6): Linear(in_features=64, out_features=5, bias=True)
    )
  )
)
BOPs: tensor(8151692.)
Trial  180  begins evaluation...
[I 2024-09-16 20:46:40,141] Trial 180 finished with values: [0.6547054762043407, 8151692.0] and parameters: {'bottleneck_dim': 5, 'aggregator_type': 1, 'phi_len': 2, 'phi_MLP_width_0': 3, 'phi_MLP_acts_0': 1, 'phi_MLP_norms_0': 'batch', 'phi_MLP_norms_1': None, 'rho_len': 3, 'rho_MLP_width_0': 2, 'rho_MLP_width_1': 3, 'rho_MLP_acts_0': 0, 'rho_MLP_acts_1': 1, 'rho_MLP_norms_0': 'batch', 'rho_MLP_norms_1': 'batch', 'rho_MLP_norms_2': 'layer'}. 
Test Accuracy: 0.6547
Accuracy:  0.6547054762043407 , Inference time:  0.04371142387390137 , Validation Loss:  0.9066864069627256 , Param Count:  6149
Conv bp:  tensor(5381220.)
DeepSetsArchitecture(
  (phi): ConvPhi(
    (layers): Sequential(
      (0): Conv1d(3, 128, kernel_size=(1,), stride=(1,))
      (1): ReLU()
      (2): Conv1d(128, 8, kernel_size=(1,), stride=(1,))
    )
  )
  (rho): Rho(
    (layers): Sequential(
      (0): Linear(in_features=8, out_features=8, bias=True)
      (1): LeakyReLU(negative_slope=0.0078125)
      (2): Linear(in_features=8, out_features=5, bias=True)
    )
  )
)
BOPs: tensor(5399316.)
Trial  181  begins evaluation...
[I 2024-09-16 20:51:42,771] Trial 181 finished with values: [0.6090174776018834, 5399316.0] and parameters: {'bottleneck_dim': 3, 'aggregator_type': 1, 'phi_len': 2, 'phi_MLP_width_0': 4, 'phi_MLP_acts_0': 0, 'phi_MLP_norms_0': 'layer', 'phi_MLP_norms_1': None, 'rho_len': 2, 'rho_MLP_width_0': 0, 'rho_MLP_acts_0': 1, 'rho_MLP_norms_0': None, 'rho_MLP_norms_1': 'layer'}. 
Test Accuracy: 0.6090
Accuracy:  0.6090174776018834 , Inference time:  0.026886940002441406 , Validation Loss:  1.0223582966798017 , Param Count:  1661
Conv bp:  tensor(21294340.)
DeepSetsArchitecture(
  (phi): ConvPhi(
    (layers): Sequential(
      (0): Conv1d(3, 64, kernel_size=(1,), stride=(1,))
      (1): LeakyReLU(negative_slope=0.0078125)
      (2): Conv1d(64, 64, kernel_size=(1,), stride=(1,))
      (3): BatchNorm1d(64, eps=1e-05, momentum=0.1, affine=True, track_running_stats=True)
      (4): LeakyReLU(negative_slope=0.0078125)
      (5): Conv1d(64, 64, kernel_size=(1,), stride=(1,))
      (6): LeakyReLU(negative_slope=0.0078125)
      (7): Conv1d(64, 64, kernel_size=(1,), stride=(1,))
      (8): BatchNorm1d(64, eps=1e-05, momentum=0.1, affine=True, track_running_stats=True)
    )
  )
  (rho): Rho(
    (layers): Sequential(
      (0): Linear(in_features=64, out_features=128, bias=True)
      (1): LeakyReLU(negative_slope=0.0078125)
      (2): Linear(in_features=128, out_features=5, bias=True)
      (3): BatchNorm1d(5, eps=1e-05, momentum=0.1, affine=True, track_running_stats=True)
    )
  )
)
BOPs: tensor(22822916.)
Trial  182  begins evaluation...
[I 2024-09-16 20:56:57,276] Trial 182 finished with values: [0.6599512523812296, 22822916.0] and parameters: {'bottleneck_dim': 6, 'aggregator_type': 1, 'phi_len': 4, 'phi_MLP_width_0': 3, 'phi_MLP_width_1': 3, 'phi_MLP_width_2': 3, 'phi_MLP_acts_0': 1, 'phi_MLP_acts_1': 1, 'phi_MLP_acts_2': 1, 'phi_MLP_norms_0': 'layer', 'phi_MLP_norms_1': 'batch', 'phi_MLP_norms_2': None, 'phi_MLP_norms_3': 'batch', 'rho_len': 2, 'rho_MLP_width_0': 4, 'rho_MLP_acts_0': 1, 'rho_MLP_norms_0': 'layer', 'rho_MLP_norms_1': 'batch'}. 
Test Accuracy: 0.6600
Accuracy:  0.6599512523812296 , Inference time:  0.05663943290710449 , Validation Loss:  0.8937929568647527 , Param Count:  21967
Conv bp:  tensor(4056084.)
DeepSetsArchitecture(
  (phi): ConvPhi(
    (layers): Sequential(
      (0): Conv1d(3, 16, kernel_size=(1,), stride=(1,))
      (1): LeakyReLU(negative_slope=0.0078125)
      (2): Conv1d(16, 16, kernel_size=(1,), stride=(1,))
      (3): BatchNorm1d(16, eps=1e-05, momentum=0.1, affine=True, track_running_stats=True)
      (4): ReLU()
      (5): Conv1d(16, 128, kernel_size=(1,), stride=(1,))
      (6): ReLU()
      (7): Conv1d(128, 4, kernel_size=(1,), stride=(1,))
      (8): BatchNorm1d(4, eps=1e-05, momentum=0.1, affine=True, track_running_stats=True)
    )
  )
  (rho): Rho(
    (layers): Sequential(
      (0): Linear(in_features=4, out_features=32, bias=True)
      (1): LeakyReLU(negative_slope=0.0078125)
      (2): Linear(in_features=32, out_features=5, bias=True)
    )
  )
)
BOPs: tensor(4104660.)
Trial  183  begins evaluation...
[I 2024-09-16 21:01:56,636] Trial 183 finished with values: [0.6043972681368593, 4104660.0] and parameters: {'bottleneck_dim': 2, 'aggregator_type': 1, 'phi_len': 4, 'phi_MLP_width_0': 1, 'phi_MLP_width_1': 1, 'phi_MLP_width_2': 4, 'phi_MLP_acts_0': 1, 'phi_MLP_acts_1': 0, 'phi_MLP_acts_2': 0, 'phi_MLP_norms_0': 'layer', 'phi_MLP_norms_1': 'batch', 'phi_MLP_norms_2': 'layer', 'phi_MLP_norms_3': 'batch', 'rho_len': 2, 'rho_MLP_width_0': 2, 'rho_MLP_acts_0': 1, 'rho_MLP_norms_0': None, 'rho_MLP_norms_1': None}. 
Test Accuracy: 0.6044
Accuracy:  0.6043972681368593 , Inference time:  0.050000905990600586 , Validation Loss:  1.0291860448259886 , Param Count:  3393
Conv bp:  tensor(658828.5000)
DeepSetsArchitecture(
  (phi): ConvPhi(
    (layers): Sequential(
      (0): Conv1d(3, 16, kernel_size=(1,), stride=(1,))
      (1): BatchNorm1d(16, eps=1e-05, momentum=0.1, affine=True, track_running_stats=True)
      (2): LeakyReLU(negative_slope=0.0078125)
      (3): Conv1d(16, 8, kernel_size=(1,), stride=(1,))
    )
  )
  (rho): Rho(
    (layers): Sequential(
      (0): Linear(in_features=8, out_features=16, bias=True)
      (1): LeakyReLU(negative_slope=0.0078125)
      (2): Linear(in_features=16, out_features=32, bias=True)
      (3): BatchNorm1d(32, eps=1e-05, momentum=0.1, affine=True, track_running_stats=True)
      (4): ReLU()
      (5): Linear(in_features=32, out_features=5, bias=True)
      (6): BatchNorm1d(5, eps=1e-05, momentum=0.1, affine=True, track_running_stats=True)
    )
  )
)
BOPs: tensor(794124.5000)
Trial  184  begins evaluation...
