KUBERNETES_SERVICE_PORT_HTTPS=443
NVIDIA_VISIBLE_DEVICES=GPU-be418b81-858f-7382-3ad9-2edef376f4a3
GGEXPOSE_SERVICE_HOST=10.103.93.169
SPATOPEXPOSE_SERVICE_HOST=10.98.174.135
SSL_JET_V2_EXPOSE_PORT=tcp://10.98.170.207:80
KUBERNETES_SERVICE_PORT=443
SSL_JET_V3_EXPOSE_PORT_80_TCP_ADDR=10.99.91.182
HOSTNAME=dd-global-c-par-0
PFEXPOSEEAST_PORT_80_TCP_ADDR=10.106.41.90
XILINXD_SERVICE_HOST=10.111.109.177
ABCDNNEXPOSE_PORT_80_TCP_PROTO=tcp
PFEXPOSE_PORT_80_TCP_PROTO=tcp
L1ANOMALYEXPOSE_PORT_80_TCP_PORT=80
HHBBVVEXPOSE_PORT_80_TCP_PROTO=tcp
SSL_JET_V3_EXPOSE_PORT=tcp://10.99.91.182:80
J_JEPA_VOL_EXPOSE_PORT=tcp://10.98.255.12:80
SPATOPEXPOSE_PORT_8800_TCP_ADDR=10.98.174.135
BUMPHUNTEXPOSE_SERVICE_PORT=80
HHBBVVEXPOSE_PORT_80_TCP_PORT=80
J_JEPA_VOL_EXPOSE_SERVICE_HOST=10.98.255.12
PFEXPOSE_PORT_80_TCP=tcp://10.97.167.151:80
BUMPHUNTEXPOSE_SERVICE_HOST=10.96.169.13
PFEXPOSE_SERVICE_PORT=80
PWD=/morph-nas-central/Morph
PFEXPOSE_PORT_80_TCP_ADDR=10.97.167.151
PFEXPOSEEAST_SERVICE_PORT=80
JOB_COMPLETION_INDEX=0
PFEXPOSEEAST_SERVICE_HOST=10.106.41.90
J_JEPA_VOL_EXPOSE_PORT_80_TCP_ADDR=10.98.255.12
NVIDIA_DRIVER_CAPABILITIES=compute,utility
PFEXPOSECENTRAL_SERVICE_HOST=10.101.81.212
BUMPHUNTEXPOSE_PORT_80_TCP_PROTO=tcp
SSL_JET_V3_EXPOSE_SERVICE_HOST=10.99.91.182
ABCDNNEXPOSE_SERVICE_PORT=80
SPATOPEXPOSE_PORT_8800_TCP_PROTO=tcp
SSL_JET_V3_EXPOSE_SERVICE_PORT=80
XILINXD_SERVICE_PORT_XILINXD=2100
ABCDNNEXPOSE_PORT_80_TCP_ADDR=10.108.83.250
MODEL_INDEX=0
PFEXPOSECENTRAL_PORT_80_TCP=tcp://10.101.81.212:80
HOME=/root
KUBERNETES_PORT_443_TCP=tcp://10.96.0.1:443
PFEXPOSECENTRAL_PORT_80_TCP_ADDR=10.101.81.212
J_JEPA_VOL_EXPOSE_PORT_80_TCP=tcp://10.98.255.12:80
XILINXD_PORT_2100_TCP_PORT=2100
SPATOPEXPOSE_PORT=tcp://10.98.174.135:8800
L1ANOMALYEXPOSE_PORT_80_TCP_PROTO=tcp
PYTORCH_VERSION=2.2.1
L1ANOMALYEXPOSE_SERVICE_PORT=80
XILINXD_SERVICE_PORT=2100
HHBBVVEXPOSE_PORT_80_TCP_ADDR=10.102.7.121
PFEXPOSEEAST_PORT_80_TCP_PORT=80
SPATOPEXPOSE_PORT_8800_TCP_PORT=8800
PFEXPOSE_SERVICE_HOST=10.97.167.151
PFEXPOSECENTRAL_PORT=tcp://10.101.81.212:80
PFEXPOSE_PORT=tcp://10.97.167.151:80
SPATOPEXPOSE_PORT_8800_TCP=tcp://10.98.174.135:8800
HHBBVVEXPOSE_PORT=tcp://10.102.7.121:80
ABCDNNEXPOSE_PORT_80_TCP_PORT=80
PFEXPOSEEAST_PORT=tcp://10.106.41.90:80
PFEXPOSECENTRAL_SERVICE_PORT=80
XILINXD_PORT_2100_TCP=tcp://10.111.109.177:2100
PFEXPOSEEAST_PORT_80_TCP=tcp://10.106.41.90:80
BUMPHUNTEXPOSE_PORT=tcp://10.96.169.13:80
SSL_JET_V3_EXPOSE_PORT_80_TCP_PROTO=tcp
PFEXPOSEEAST_PORT_80_TCP_PROTO=tcp
GGEXPOSE_SERVICE_PORT=80
PFEXPOSE_PORT_80_TCP_PORT=80
J_JEPA_VOL_EXPOSE_PORT_80_TCP_PORT=80
GGEXPOSE_PORT_80_TCP_PROTO=tcp
L1ANOMALYEXPOSE_PORT=tcp://10.101.29.4:80
SPATOPEXPOSE_SERVICE_PORT=8800
SSL_JET_V3_EXPOSE_PORT_80_TCP_PORT=80
HHBBVVEXPOSE_SERVICE_HOST=10.102.7.121
L1ANOMALYEXPOSE_SERVICE_HOST=10.101.29.4
XILINXD_PORT=tcp://10.111.109.177:2100
SSL_JET_V2_EXPOSE_PORT_80_TCP_ADDR=10.98.170.207
SHLVL=1
BUMPHUNTEXPOSE_PORT_80_TCP_ADDR=10.96.169.13
GGEXPOSE_PORT_80_TCP_ADDR=10.103.93.169
GGEXPOSE_PORT=tcp://10.103.93.169:80
PFEXPOSECENTRAL_PORT_80_TCP_PROTO=tcp
KUBERNETES_PORT_443_TCP_PROTO=tcp
SSL_JET_V2_EXPOSE_SERVICE_PORT=80
KUBERNETES_PORT_443_TCP_ADDR=10.96.0.1
SSL_JET_V3_EXPOSE_PORT_80_TCP=tcp://10.99.91.182:80
L1ANOMALYEXPOSE_PORT_80_TCP_ADDR=10.101.29.4
LD_LIBRARY_PATH=/usr/local/nvidia/lib:/usr/local/nvidia/lib64
SSL_JET_V2_EXPOSE_PORT_80_TCP_PORT=80
BUMPHUNTEXPOSE_PORT_80_TCP_PORT=80
XILINXD_PORT_2100_TCP_ADDR=10.111.109.177
GGEXPOSE_PORT_80_TCP_PORT=80
SSL_JET_V2_EXPOSE_PORT_80_TCP_PROTO=tcp
SSL_JET_V2_EXPOSE_SERVICE_HOST=10.98.170.207
XILINXD_PORT_2100_TCP_PROTO=tcp
KUBERNETES_SERVICE_HOST=10.96.0.1
ABCDNNEXPOSE_PORT_80_TCP=tcp://10.108.83.250:80
KUBERNETES_PORT=tcp://10.96.0.1:443
KUBERNETES_PORT_443_TCP_PORT=443
PATH=/opt/conda/bin:/usr/local/sbin:/usr/local/bin:/usr/sbin:/usr/bin:/sbin:/bin
HHBBVVEXPOSE_PORT_80_TCP=tcp://10.102.7.121:80
HHBBVVEXPOSE_SERVICE_PORT=80
BUMPHUNTEXPOSE_PORT_80_TCP=tcp://10.96.169.13:80
L1ANOMALYEXPOSE_PORT_80_TCP=tcp://10.101.29.4:80
GGEXPOSE_PORT_80_TCP=tcp://10.103.93.169:80
ABCDNNEXPOSE_SERVICE_HOST=10.108.83.250
ABCDNNEXPOSE_PORT=tcp://10.108.83.250:80
J_JEPA_VOL_EXPOSE_PORT_80_TCP_PROTO=tcp
J_JEPA_VOL_EXPOSE_SERVICE_PORT=80
SSL_JET_V2_EXPOSE_PORT_80_TCP=tcp://10.98.170.207:80
PFEXPOSECENTRAL_PORT_80_TCP_PORT=80
OLDPWD=/app
_=/usr/bin/env
MODEL_INDEX from terminal: 0
All command-line arguments: ['global_search_parallel2.py', '0']
model index:  0
Processing Deepsets model with index 0
Loaded 1 files for train set
Loaded 1 files for validation set
Loaded 2 files for test set
Loaded Dataset...
[I 2024-09-16 04:56:55,214] A new study created in memory with name: no-name-2e336f43-e21b-46df-b8a0-89afeda6a0d1
input shape:  torch.Size([4096, 3, 8])
Conv bp:  tensor(16985348.)
DeepSetsArchitecture(
  (phi): ConvPhi(
    (layers): Sequential(
      (0): Conv1d(3, 64, kernel_size=(1,), stride=(1,))
      (1): ReLU()
      (2): Conv1d(64, 64, kernel_size=(1,), stride=(1,))
      (3): ReLU()
      (4): Conv1d(64, 32, kernel_size=(1,), stride=(1,))
    )
  )
  (rho): Rho(
    (layers): Sequential(
      (0): Linear(in_features=32, out_features=32, bias=True)
      (1): ReLU()
      (2): Linear(in_features=32, out_features=5, bias=True)
    )
  )
)
BOPs: tensor(17190852.)
Trial  0  begins evaluation...
[I 2024-09-16 05:01:36,410] Trial 0 finished with values: [0.6240477160991923, 17190852.0] and parameters: {'bottleneck_dim': 5, 'aggregator_type': 0, 'phi_len': 3, 'phi_MLP_width_0': 3, 'phi_MLP_width_1': 3, 'phi_MLP_acts_0': 0, 'phi_MLP_acts_1': 0, 'phi_MLP_norms_0': None, 'phi_MLP_norms_1': None, 'phi_MLP_norms_2': None, 'rho_len': 2, 'rho_MLP_width_0': 2, 'rho_MLP_acts_0': 0, 'rho_MLP_norms_0': None, 'rho_MLP_norms_1': None}. 
Test Accuracy: 0.6240
Accuracy:  0.6240477160991923 , Inference time:  0.03697824478149414 , Validation Loss:  0.9831548596725983 , Param Count:  7717
Conv bp:  tensor(259845.)
DeepSetsArchitecture(
  (phi): ConvPhi(
    (layers): Sequential(
      (0): Conv1d(3, 16, kernel_size=(1,), stride=(1,))
    )
  )
  (rho): Rho(
    (layers): Sequential(
      (0): Linear(in_features=16, out_features=64, bias=True)
      (1): ReLU()
      (2): Linear(in_features=64, out_features=128, bias=True)
      (3): BatchNorm1d(128, eps=1e-05, momentum=0.1, affine=True, track_running_stats=True)
      (4): ReLU()
      (5): Linear(in_features=128, out_features=32, bias=True)
      (6): LeakyReLU(negative_slope=0.0078125)
      (7): Linear(in_features=32, out_features=5, bias=True)
    )
  )
)
BOPs: tensor(2582853.)
Trial  1  begins evaluation...
[I 2024-09-16 05:06:22,360] Trial 1 finished with values: [0.4002246050694196, 2582853.0] and parameters: {'bottleneck_dim': 4, 'aggregator_type': 0, 'phi_len': 1, 'phi_MLP_norms_0': 'layer', 'rho_len': 4, 'rho_MLP_width_0': 3, 'rho_MLP_width_1': 4, 'rho_MLP_width_2': 2, 'rho_MLP_acts_0': 0, 'rho_MLP_acts_1': 0, 'rho_MLP_acts_2': 1, 'rho_MLP_norms_0': None, 'rho_MLP_norms_1': 'batch', 'rho_MLP_norms_2': None, 'rho_MLP_norms_3': 'layer'}. 
Test Accuracy: 0.4002
Accuracy:  0.4002246050694196 , Inference time:  0.030687570571899414 , Validation Loss:  1.377495728382448 , Param Count:  14021
Conv bp:  tensor(2134056.)
DeepSetsArchitecture(
  (phi): ConvPhi(
    (layers): Sequential(
      (0): Conv1d(3, 32, kernel_size=(1,), stride=(1,))
      (1): LeakyReLU(negative_slope=0.0078125)
      (2): Conv1d(32, 16, kernel_size=(1,), stride=(1,))
    )
  )
  (rho): Rho(
    (layers): Sequential(
      (0): Linear(in_features=16, out_features=64, bias=True)
      (1): ReLU()
      (2): Linear(in_features=64, out_features=5, bias=True)
    )
  )
)
BOPs: tensor(2363176.)
Trial  2  begins evaluation...
[I 2024-09-16 05:11:18,937] Trial 2 finished with values: [0.6294565389190673, 2363176.0] and parameters: {'bottleneck_dim': 4, 'aggregator_type': 0, 'phi_len': 2, 'phi_MLP_width_0': 2, 'phi_MLP_acts_0': 1, 'phi_MLP_norms_0': None, 'phi_MLP_norms_1': None, 'rho_len': 2, 'rho_MLP_width_0': 3, 'rho_MLP_acts_0': 0, 'rho_MLP_norms_0': None, 'rho_MLP_norms_1': None}. 
Test Accuracy: 0.6295
Accuracy:  0.6294565389190673 , Inference time:  0.02602100372314453 , Validation Loss:  0.9670651384762355 , Param Count:  2069
Conv bp:  tensor(64961.2500)
DeepSetsArchitecture(
  (phi): ConvPhi(
    (layers): Sequential(
      (0): Conv1d(3, 4, kernel_size=(1,), stride=(1,))
    )
  )
  (rho): Rho(
    (layers): Sequential(
      (0): Linear(in_features=4, out_features=64, bias=True)
      (1): ReLU()
      (2): Linear(in_features=64, out_features=8, bias=True)
      (3): LeakyReLU(negative_slope=0.0078125)
      (4): Linear(in_features=8, out_features=5, bias=True)
    )
  )
)
BOPs: tensor(202033.2500)
Trial  3  begins evaluation...
[I 2024-09-16 05:16:37,811] Trial 3 finished with values: [0.5548493898228948, 202033.25] and parameters: {'bottleneck_dim': 2, 'aggregator_type': 1, 'phi_len': 1, 'phi_MLP_norms_0': 'layer', 'rho_len': 3, 'rho_MLP_width_0': 3, 'rho_MLP_width_1': 0, 'rho_MLP_acts_0': 0, 'rho_MLP_acts_1': 1, 'rho_MLP_norms_0': None, 'rho_MLP_norms_1': None, 'rho_MLP_norms_2': None}. 
Test Accuracy: 0.5548
Accuracy:  0.5548493898228948 , Inference time:  0.02293848991394043 , Validation Loss:  1.1305255585787248 , Param Count:  901
Conv bp:  tensor(7168080.)
DeepSetsArchitecture(
  (phi): ConvPhi(
    (layers): Sequential(
      (0): Conv1d(3, 64, kernel_size=(1,), stride=(1,))
      (1): ReLU()
      (2): Conv1d(64, 16, kernel_size=(1,), stride=(1,))
      (3): BatchNorm1d(16, eps=1e-05, momentum=0.1, affine=True, track_running_stats=True)
      (4): LeakyReLU(negative_slope=0.0078125)
      (5): Conv1d(16, 128, kernel_size=(1,), stride=(1,))
      (6): ReLU()
      (7): Conv1d(128, 1, kernel_size=(1,), stride=(1,))
    )
  )
  (rho): Rho(
    (layers): Sequential(
      (0): Linear(in_features=1, out_features=16, bias=True)
      (1): LeakyReLU(negative_slope=0.0078125)
      (2): Linear(in_features=16, out_features=8, bias=True)
      (3): ReLU()
      (4): Linear(in_features=8, out_features=8, bias=True)
      (5): ReLU()
      (6): Linear(in_features=8, out_features=5, bias=True)
    )
  )
)
BOPs: tensor(7209624.)
Trial  4  begins evaluation...
[I 2024-09-16 05:21:44,750] Trial 4 finished with values: [0.5668932127675503, 7209624.0] and parameters: {'bottleneck_dim': 0, 'aggregator_type': 0, 'phi_len': 4, 'phi_MLP_width_0': 3, 'phi_MLP_width_1': 1, 'phi_MLP_width_2': 4, 'phi_MLP_acts_0': 0, 'phi_MLP_acts_1': 1, 'phi_MLP_acts_2': 0, 'phi_MLP_norms_0': 'layer', 'phi_MLP_norms_1': 'batch', 'phi_MLP_norms_2': 'layer', 'phi_MLP_norms_3': None, 'rho_len': 4, 'rho_MLP_width_0': 1, 'rho_MLP_width_1': 0, 'rho_MLP_width_2': 0, 'rho_MLP_acts_0': 1, 'rho_MLP_acts_1': 0, 'rho_MLP_acts_2': 0, 'rho_MLP_norms_0': None, 'rho_MLP_norms_1': None, 'rho_MLP_norms_2': None, 'rho_MLP_norms_3': 'layer'}. 
Test Accuracy: 0.5669
Accuracy:  0.5668932127675503 , Inference time:  0.05573844909667969 , Validation Loss:  1.112104052994527 , Param Count:  3918
Conv bp:  tensor(6081636.)
DeepSetsArchitecture(
  (phi): ConvPhi(
    (layers): Sequential(
      (0): Conv1d(3, 128, kernel_size=(1,), stride=(1,))
      (1): LeakyReLU(negative_slope=0.0078125)
      (2): Conv1d(128, 8, kernel_size=(1,), stride=(1,))
      (3): BatchNorm1d(8, eps=1e-05, momentum=0.1, affine=True, track_running_stats=True)
      (4): LeakyReLU(negative_slope=0.0078125)
      (5): Conv1d(8, 32, kernel_size=(1,), stride=(1,))
      (6): LeakyReLU(negative_slope=0.0078125)
      (7): Conv1d(32, 32, kernel_size=(1,), stride=(1,))
    )
  )
  (rho): Rho(
    (layers): Sequential(
      (0): Linear(in_features=32, out_features=5, bias=True)
    )
  )
)
BOPs: tensor(6113060.)
Trial  5  begins evaluation...
[I 2024-09-16 05:26:48,768] Trial 5 finished with values: [0.5567443911122942, 6113060.0] and parameters: {'bottleneck_dim': 5, 'aggregator_type': 0, 'phi_len': 4, 'phi_MLP_width_0': 4, 'phi_MLP_width_1': 0, 'phi_MLP_width_2': 2, 'phi_MLP_acts_0': 1, 'phi_MLP_acts_1': 1, 'phi_MLP_acts_2': 1, 'phi_MLP_norms_0': 'layer', 'phi_MLP_norms_1': 'batch', 'phi_MLP_norms_2': None, 'phi_MLP_norms_3': None, 'rho_len': 1, 'rho_MLP_norms_0': 'layer'}. 
Test Accuracy: 0.5567
Accuracy:  0.5567443911122942 , Inference time:  0.04323434829711914 , Validation Loss:  1.151600435072062 , Param Count:  3069
Conv bp:  tensor(15288600.)
DeepSetsArchitecture(
  (phi): ConvPhi(
    (layers): Sequential(
      (0): Conv1d(3, 128, kernel_size=(1,), stride=(1,))
      (1): LeakyReLU(negative_slope=0.0078125)
      (2): Conv1d(128, 32, kernel_size=(1,), stride=(1,))
    )
  )
  (rho): Rho(
    (layers): Sequential(
      (0): Linear(in_features=32, out_features=5, bias=True)
    )
  )
)
BOPs: tensor(15319640.)
Trial  6  begins evaluation...
[I 2024-09-16 05:31:51,752] Trial 6 finished with values: [0.6148871567493823, 15319640.0] and parameters: {'bottleneck_dim': 5, 'aggregator_type': 1, 'phi_len': 2, 'phi_MLP_width_0': 4, 'phi_MLP_acts_0': 1, 'phi_MLP_norms_0': 'layer', 'phi_MLP_norms_1': 'layer', 'rho_len': 1, 'rho_MLP_norms_0': 'layer'}. 
Test Accuracy: 0.6149
Accuracy:  0.6148871567493823 , Inference time:  0.024752378463745117 , Validation Loss:  1.005282081308819 , Param Count:  4805
Conv bp:  tensor(2838568.)
DeepSetsArchitecture(
  (phi): ConvPhi(
    (layers): Sequential(
      (0): Conv1d(3, 32, kernel_size=(1,), stride=(1,))
      (1): ReLU()
      (2): Conv1d(32, 16, kernel_size=(1,), stride=(1,))
      (3): BatchNorm1d(16, eps=1e-05, momentum=0.1, affine=True, track_running_stats=True)
      (4): LeakyReLU(negative_slope=0.0078125)
      (5): Conv1d(16, 32, kernel_size=(1,), stride=(1,))
    )
  )
  (rho): Rho(
    (layers): Sequential(
      (0): Linear(in_features=32, out_features=64, bias=True)
      (1): BatchNorm1d(64, eps=1e-05, momentum=0.1, affine=True, track_running_stats=True)
      (2): LeakyReLU(negative_slope=0.0078125)
      (3): Linear(in_features=64, out_features=5, bias=True)
    )
  )
)
BOPs: tensor(3245608.)
Trial  7  begins evaluation...
[I 2024-09-16 05:36:56,725] Trial 7 finished with values: [0.6483516483516484, 3245608.0] and parameters: {'bottleneck_dim': 5, 'aggregator_type': 1, 'phi_len': 3, 'phi_MLP_width_0': 2, 'phi_MLP_width_1': 1, 'phi_MLP_acts_0': 0, 'phi_MLP_acts_1': 1, 'phi_MLP_norms_0': 'layer', 'phi_MLP_norms_1': 'batch', 'phi_MLP_norms_2': None, 'rho_len': 2, 'rho_MLP_width_0': 3, 'rho_MLP_acts_0': 1, 'rho_MLP_norms_0': 'batch', 'rho_MLP_norms_1': None}. 
Test Accuracy: 0.6484
Accuracy:  0.6483516483516484 , Inference time:  0.04389238357543945 , Validation Loss:  0.9248885078495052 , Param Count:  3797
Conv bp:  tensor(2466836.)
DeepSetsArchitecture(
  (phi): ConvPhi(
    (layers): Sequential(
      (0): Conv1d(3, 16, kernel_size=(1,), stride=(1,))
      (1): BatchNorm1d(16, eps=1e-05, momentum=0.1, affine=True, track_running_stats=True)
      (2): LeakyReLU(negative_slope=0.0078125)
      (3): Conv1d(16, 16, kernel_size=(1,), stride=(1,))
      (4): BatchNorm1d(16, eps=1e-05, momentum=0.1, affine=True, track_running_stats=True)
      (5): LeakyReLU(negative_slope=0.0078125)
      (6): Conv1d(16, 64, kernel_size=(1,), stride=(1,))
      (7): BatchNorm1d(64, eps=1e-05, momentum=0.1, affine=True, track_running_stats=True)
    )
  )
  (rho): Rho(
    (layers): Sequential(
      (0): Linear(in_features=64, out_features=5, bias=True)
    )
  )
)
BOPs: tensor(2530708.)
Trial  8  begins evaluation...
[I 2024-09-16 05:42:03,134] Trial 8 finished with values: [0.5497899526665613, 2530708.0] and parameters: {'bottleneck_dim': 6, 'aggregator_type': 0, 'phi_len': 3, 'phi_MLP_width_0': 1, 'phi_MLP_width_1': 1, 'phi_MLP_acts_0': 1, 'phi_MLP_acts_1': 1, 'phi_MLP_norms_0': 'batch', 'phi_MLP_norms_1': 'batch', 'phi_MLP_norms_2': 'batch', 'rho_len': 1, 'rho_MLP_norms_0': None}. 
Test Accuracy: 0.5498
Accuracy:  0.5497899526665613 , Inference time:  0.03983449935913086 , Validation Loss:  1.1624454726167277 , Param Count:  1941
Conv bp:  tensor(658828.5000)
DeepSetsArchitecture(
  (phi): ConvPhi(
    (layers): Sequential(
      (0): Conv1d(3, 16, kernel_size=(1,), stride=(1,))
      (1): ReLU()
      (2): Conv1d(16, 8, kernel_size=(1,), stride=(1,))
    )
  )
  (rho): Rho(
    (layers): Sequential(
      (0): Linear(in_features=8, out_features=5, bias=True)
    )
  )
)
BOPs: tensor(666492.5000)
Trial  9  begins evaluation...
[I 2024-09-16 05:47:07,013] Trial 9 finished with values: [0.5293076340767484, 666492.5] and parameters: {'bottleneck_dim': 3, 'aggregator_type': 0, 'phi_len': 2, 'phi_MLP_width_0': 1, 'phi_MLP_acts_0': 0, 'phi_MLP_norms_0': None, 'phi_MLP_norms_1': None, 'rho_len': 1, 'rho_MLP_norms_0': None}. 
Test Accuracy: 0.5293
Accuracy:  0.5293076340767484 , Inference time:  0.02300095558166504 , Validation Loss:  1.201210373923892 , Param Count:  245
Conv bp:  tensor(675270.2500)
DeepSetsArchitecture(
  (phi): ConvPhi(
    (layers): Sequential(
      (0): Conv1d(3, 8, kernel_size=(1,), stride=(1,))
      (1): BatchNorm1d(8, eps=1e-05, momentum=0.1, affine=True, track_running_stats=True)
      (2): LeakyReLU(negative_slope=0.0078125)
      (3): Conv1d(8, 8, kernel_size=(1,), stride=(1,))
      (4): ReLU()
      (5): Conv1d(8, 16, kernel_size=(1,), stride=(1,))
      (6): ReLU()
      (7): Conv1d(16, 32, kernel_size=(1,), stride=(1,))
      (8): BatchNorm1d(32, eps=1e-05, momentum=0.1, affine=True, track_running_stats=True)
    )
  )
  (rho): Rho(
    (layers): Sequential(
      (0): Linear(in_features=32, out_features=5, bias=True)
    )
  )
)
BOPs: tensor(706310.2500)
Trial  10  begins evaluation...
[I 2024-09-16 05:52:19,485] Trial 10 finished with values: [0.6117010922461339, 706310.25] and parameters: {'bottleneck_dim': 5, 'aggregator_type': 1, 'phi_len': 4, 'phi_MLP_width_0': 0, 'phi_MLP_width_1': 0, 'phi_MLP_width_2': 1, 'phi_MLP_acts_0': 1, 'phi_MLP_acts_1': 0, 'phi_MLP_acts_2': 0, 'phi_MLP_norms_0': 'batch', 'phi_MLP_norms_1': None, 'phi_MLP_norms_2': 'layer', 'phi_MLP_norms_3': 'batch', 'rho_len': 1, 'rho_MLP_norms_0': None}. 
Test Accuracy: 0.6117
Accuracy:  0.6117010922461339 , Inference time:  0.04662823677062988 , Validation Loss:  1.0146748614149028 , Param Count:  1037
Conv bp:  tensor(568330.)
DeepSetsArchitecture(
  (phi): ConvPhi(
    (layers): Sequential(
      (0): Conv1d(3, 8, kernel_size=(1,), stride=(1,))
      (1): ReLU()
      (2): Conv1d(8, 16, kernel_size=(1,), stride=(1,))
      (3): ReLU()
      (4): Conv1d(16, 2, kernel_size=(1,), stride=(1,))
      (5): BatchNorm1d(2, eps=1e-05, momentum=0.1, affine=True, track_running_stats=True)
    )
  )
  (rho): Rho(
    (layers): Sequential(
      (0): Linear(in_features=2, out_features=32, bias=True)
      (1): ReLU()
      (2): Linear(in_features=32, out_features=128, bias=True)
      (3): BatchNorm1d(128, eps=1e-05, momentum=0.1, affine=True, track_running_stats=True)
      (4): ReLU()
      (5): Linear(in_features=128, out_features=64, bias=True)
      (6): BatchNorm1d(64, eps=1e-05, momentum=0.1, affine=True, track_running_stats=True)
      (7): LeakyReLU(negative_slope=0.0078125)
      (8): Linear(in_features=64, out_features=5, bias=True)
    )
  )
)
BOPs: tensor(2755786.)
Trial  11  begins evaluation...
[I 2024-09-16 05:57:34,028] Trial 11 finished with values: [0.5828518188851269, 2755786.0] and parameters: {'bottleneck_dim': 1, 'aggregator_type': 0, 'phi_len': 3, 'phi_MLP_width_0': 0, 'phi_MLP_width_1': 1, 'phi_MLP_acts_0': 0, 'phi_MLP_acts_1': 0, 'phi_MLP_norms_0': 'layer', 'phi_MLP_norms_1': None, 'phi_MLP_norms_2': 'batch', 'rho_len': 4, 'rho_MLP_width_0': 2, 'rho_MLP_width_1': 4, 'rho_MLP_width_2': 3, 'rho_MLP_acts_0': 0, 'rho_MLP_acts_1': 0, 'rho_MLP_acts_2': 1, 'rho_MLP_norms_0': 'layer', 'rho_MLP_norms_1': 'batch', 'rho_MLP_norms_2': 'batch', 'rho_MLP_norms_3': None}. 
Test Accuracy: 0.5829
Accuracy:  0.5828518188851269 , Inference time:  0.0545806884765625 , Validation Loss:  1.0596679615325668 , Param Count:  13499
Conv bp:  tensor(705802.)
DeepSetsArchitecture(
  (phi): ConvPhi(
    (layers): Sequential(
      (0): Conv1d(3, 8, kernel_size=(1,), stride=(1,))
      (1): ReLU()
      (2): Conv1d(8, 16, kernel_size=(1,), stride=(1,))
      (3): BatchNorm1d(16, eps=1e-05, momentum=0.1, affine=True, track_running_stats=True)
      (4): ReLU()
      (5): Conv1d(16, 8, kernel_size=(1,), stride=(1,))
      (6): ReLU()
      (7): Conv1d(8, 2, kernel_size=(1,), stride=(1,))
    )
  )
  (rho): Rho(
    (layers): Sequential(
      (0): Linear(in_features=2, out_features=5, bias=True)
    )
  )
)
BOPs: tensor(707598.)
Trial  12  begins evaluation...
[I 2024-09-16 06:03:02,506] Trial 12 finished with values: [0.4657277620184509, 707598.0] and parameters: {'bottleneck_dim': 1, 'aggregator_type': 1, 'phi_len': 4, 'phi_MLP_width_0': 0, 'phi_MLP_width_1': 1, 'phi_MLP_width_2': 0, 'phi_MLP_acts_0': 0, 'phi_MLP_acts_1': 0, 'phi_MLP_acts_2': 0, 'phi_MLP_norms_0': None, 'phi_MLP_norms_1': 'batch', 'phi_MLP_norms_2': None, 'phi_MLP_norms_3': 'layer', 'rho_len': 1, 'rho_MLP_norms_0': 'layer'}. 
Test Accuracy: 0.4657
Accuracy:  0.4657277620184509 , Inference time:  0.04132223129272461 , Validation Loss:  1.2631761573609852 , Param Count:  377
Conv bp:  tensor(1039380.)
DeepSetsArchitecture(
  (phi): ConvPhi(
    (layers): Sequential(
      (0): Conv1d(3, 64, kernel_size=(1,), stride=(1,))
    )
  )
  (rho): Rho(
    (layers): Sequential(
      (0): Linear(in_features=64, out_features=16, bias=True)
      (1): ReLU()
      (2): Linear(in_features=16, out_features=5, bias=True)
    )
  )
)
BOPs: tensor(1237780.)
Trial  13  begins evaluation...
