[I 2024-09-16 06:42:53,222] Trial 16 finished with values: [0.53548344161516, 753532.5] and parameters: {'bottleneck_dim': 3, 'aggregator_type': 0, 'phi_len': 3, 'phi_MLP_width_0': 1, 'phi_MLP_width_1': 0, 'phi_MLP_acts_0': 0, 'phi_MLP_acts_1': 1, 'phi_MLP_norms_0': 'layer', 'phi_MLP_norms_1': 'layer', 'phi_MLP_norms_2': 'batch', 'rho_len': 1, 'rho_MLP_norms_0': 'batch'}. 
Test Accuracy: 0.5355
Accuracy:  0.53548344161516 , Inference time:  0.04265594482421875 , Validation Loss:  1.1759498938411272 , Param Count:  343
Conv bp:  tensor(8683680.)
DeepSetsArchitecture(
  (phi): ConvPhi(
    (layers): Sequential(
      (0): Conv1d(3, 128, kernel_size=(1,), stride=(1,))
      (1): LeakyReLU(negative_slope=0.0078125)
      (2): Conv1d(128, 16, kernel_size=(1,), stride=(1,))
    )
  )
  (rho): Rho(
    (layers): Sequential(
      (0): Linear(in_features=16, out_features=32, bias=True)
      (1): ReLU()
      (2): Linear(in_features=32, out_features=5, bias=True)
      (3): BatchNorm1d(5, eps=1e-05, momentum=0.1, affine=True, track_running_stats=True)
    )
  )
)
BOPs: tensor(8798688.)
Trial  17  begins evaluation...
[I 2024-09-16 06:48:59,822] Trial 17 finished with values: [0.6365557228539818, 8798688.0] and parameters: {'bottleneck_dim': 4, 'aggregator_type': 1, 'phi_len': 2, 'phi_MLP_width_0': 4, 'phi_MLP_acts_0': 1, 'phi_MLP_norms_0': None, 'phi_MLP_norms_1': 'layer', 'rho_len': 2, 'rho_MLP_width_0': 2, 'rho_MLP_acts_0': 0, 'rho_MLP_norms_0': 'layer', 'rho_MLP_norms_1': 'batch'}. 
Test Accuracy: 0.6366
Accuracy:  0.6365557228539818 , Inference time:  0.04210305213928223 , Validation Loss:  0.9511470271616566 , Param Count:  3295
Conv bp:  tensor(5555300.)
DeepSetsArchitecture(
  (phi): ConvPhi(
    (layers): Sequential(
      (0): Conv1d(3, 128, kernel_size=(1,), stride=(1,))
      (1): ReLU()
      (2): Conv1d(128, 8, kernel_size=(1,), stride=(1,))
      (3): ReLU()
      (4): Conv1d(8, 16, kernel_size=(1,), stride=(1,))
    )
  )
  (rho): Rho(
    (layers): Sequential(
      (0): Linear(in_features=16, out_features=64, bias=True)
      (1): BatchNorm1d(64, eps=1e-05, momentum=0.1, affine=True, track_running_stats=True)
      (2): LeakyReLU(negative_slope=0.0078125)
      (3): Linear(in_features=64, out_features=16, bias=True)
      (4): LeakyReLU(negative_slope=0.0078125)
      (5): Linear(in_features=16, out_features=5, bias=True)
    )
  )
)
BOPs: tensor(5918692.)
Trial  18  begins evaluation...
[I 2024-09-16 06:55:10,286] Trial 18 finished with values: [0.643994310004908, 5918692.0] and parameters: {'bottleneck_dim': 4, 'aggregator_type': 1, 'phi_len': 3, 'phi_MLP_width_0': 4, 'phi_MLP_width_1': 0, 'phi_MLP_acts_0': 0, 'phi_MLP_acts_1': 0, 'phi_MLP_norms_0': 'layer', 'phi_MLP_norms_1': 'layer', 'phi_MLP_norms_2': 'layer', 'rho_len': 3, 'rho_MLP_width_0': 3, 'rho_MLP_width_1': 1, 'rho_MLP_acts_0': 1, 'rho_MLP_acts_1': 1, 'rho_MLP_norms_0': 'batch', 'rho_MLP_norms_1': 'layer', 'rho_MLP_norms_2': None}. 
Test Accuracy: 0.6440
Accuracy:  0.643994310004908 , Inference time:  0.04953598976135254 , Validation Loss:  0.9346336462870747 , Param Count:  4029
Conv bp:  tensor(32480.6250)
DeepSetsArchitecture(
  (phi): ConvPhi(
    (layers): Sequential(
      (0): Conv1d(3, 2, kernel_size=(1,), stride=(1,))
      (1): BatchNorm1d(2, eps=1e-05, momentum=0.1, affine=True, track_running_stats=True)
    )
  )
  (rho): Rho(
    (layers): Sequential(
      (0): Linear(in_features=2, out_features=16, bias=True)
      (1): BatchNorm1d(16, eps=1e-05, momentum=0.1, affine=True, track_running_stats=True)
      (2): LeakyReLU(negative_slope=0.0078125)
      (3): Linear(in_features=16, out_features=64, bias=True)
      (4): LeakyReLU(negative_slope=0.0078125)
      (5): Linear(in_features=64, out_features=16, bias=True)
      (6): LeakyReLU(negative_slope=0.0078125)
      (7): Linear(in_features=16, out_features=5, bias=True)
    )
  )
)
BOPs: tensor(399584.6250)
Trial  19  begins evaluation...
[I 2024-09-16 07:01:19,594] Trial 19 finished with values: [0.37555132225836235, 399584.625] and parameters: {'bottleneck_dim': 1, 'aggregator_type': 0, 'phi_len': 1, 'phi_MLP_norms_0': 'batch', 'rho_len': 4, 'rho_MLP_width_0': 1, 'rho_MLP_width_1': 3, 'rho_MLP_width_2': 1, 'rho_MLP_acts_0': 1, 'rho_MLP_acts_1': 1, 'rho_MLP_acts_2': 1, 'rho_MLP_norms_0': 'batch', 'rho_MLP_norms_1': 'layer', 'rho_MLP_norms_2': 'layer', 'rho_MLP_norms_3': 'layer'}. 
Test Accuracy: 0.3756
Accuracy:  0.37555132225836235 , Inference time:  0.0364534854888916 , Validation Loss:  1.4124621590789483 , Param Count:  2305
Conv bp:  tensor(546314.)
DeepSetsArchitecture(
  (phi): ConvPhi(
    (layers): Sequential(
      (0): Conv1d(3, 8, kernel_size=(1,), stride=(1,))
      (1): ReLU()
      (2): Conv1d(8, 16, kernel_size=(1,), stride=(1,))
      (3): ReLU()
      (4): Conv1d(16, 1, kernel_size=(1,), stride=(1,))
    )
  )
  (rho): Rho(
    (layers): Sequential(
      (0): Linear(in_features=1, out_features=16, bias=True)
      (1): BatchNorm1d(16, eps=1e-05, momentum=0.1, affine=True, track_running_stats=True)
      (2): LeakyReLU(negative_slope=0.0078125)
      (3): Linear(in_features=16, out_features=16, bias=True)
      (4): BatchNorm1d(16, eps=1e-05, momentum=0.1, affine=True, track_running_stats=True)
      (5): LeakyReLU(negative_slope=0.0078125)
      (6): Linear(in_features=16, out_features=64, bias=True)
      (7): ReLU()
      (8): Linear(in_features=64, out_features=5, bias=True)
      (9): BatchNorm1d(5, eps=1e-05, momentum=0.1, affine=True, track_running_stats=True)
    )
  )
)
BOPs: tensor(819170.)
Trial  20  begins evaluation...
[I 2024-09-16 07:07:36,626] Trial 20 finished with values: [0.5577775744316243, 819170.0] and parameters: {'bottleneck_dim': 0, 'aggregator_type': 0, 'phi_len': 3, 'phi_MLP_width_0': 0, 'phi_MLP_width_1': 1, 'phi_MLP_acts_0': 0, 'phi_MLP_acts_1': 0, 'phi_MLP_norms_0': 'layer', 'phi_MLP_norms_1': None, 'phi_MLP_norms_2': None, 'rho_len': 4, 'rho_MLP_width_0': 1, 'rho_MLP_width_1': 1, 'rho_MLP_width_2': 3, 'rho_MLP_acts_0': 1, 'rho_MLP_acts_1': 1, 'rho_MLP_acts_2': 0, 'rho_MLP_norms_0': 'batch', 'rho_MLP_norms_1': 'batch', 'rho_MLP_norms_2': 'layer', 'rho_MLP_norms_3': 'batch'}. 
Test Accuracy: 0.5578
Accuracy:  0.5577775744316243 , Inference time:  0.06239199638366699 , Validation Loss:  1.1308908048941164 , Param Count:  1984
Conv bp:  tensor(16240.3125)
DeepSetsArchitecture(
  (phi): ConvPhi(
    (layers): Sequential(
      (0): Conv1d(3, 1, kernel_size=(1,), stride=(1,))
      (1): BatchNorm1d(1, eps=1e-05, momentum=0.1, affine=True, track_running_stats=True)
    )
  )
  (rho): Rho(
    (layers): Sequential(
      (0): Linear(in_features=1, out_features=8, bias=True)
      (1): LeakyReLU(negative_slope=0.0078125)
      (2): Linear(in_features=8, out_features=16, bias=True)
      (3): LeakyReLU(negative_slope=0.0078125)
      (4): Linear(in_features=16, out_features=128, bias=True)
      (5): BatchNorm1d(128, eps=1e-05, momentum=0.1, affine=True, track_running_stats=True)
      (6): LeakyReLU(negative_slope=0.0078125)
      (7): Linear(in_features=128, out_features=5, bias=True)
    )
  )
)
BOPs: tensor(494408.3125)
Trial  21  begins evaluation...
[I 2024-09-16 07:13:47,733] Trial 21 finished with values: [0.3396993619552287, 494408.3125] and parameters: {'bottleneck_dim': 0, 'aggregator_type': 0, 'phi_len': 1, 'phi_MLP_norms_0': 'batch', 'rho_len': 4, 'rho_MLP_width_0': 0, 'rho_MLP_width_1': 1, 'rho_MLP_width_2': 4, 'rho_MLP_acts_0': 1, 'rho_MLP_acts_1': 1, 'rho_MLP_acts_2': 1, 'rho_MLP_norms_0': None, 'rho_MLP_norms_1': 'layer', 'rho_MLP_norms_2': 'batch', 'rho_MLP_norms_3': None}. 
Test Accuracy: 0.3397
Accuracy:  0.3396993619552287 , Inference time:  0.03704333305358887 , Validation Loss:  1.4663065209680675 , Param Count:  3243
Conv bp:  tensor(7067266.)
DeepSetsArchitecture(
  (phi): ConvPhi(
    (layers): Sequential(
      (0): Conv1d(3, 32, kernel_size=(1,), stride=(1,))
      (1): LeakyReLU(negative_slope=0.0078125)
      (2): Conv1d(32, 64, kernel_size=(1,), stride=(1,))
      (3): LeakyReLU(negative_slope=0.0078125)
      (4): Conv1d(64, 1, kernel_size=(1,), stride=(1,))
    )
  )
  (rho): Rho(
    (layers): Sequential(
      (0): Linear(in_features=1, out_features=8, bias=True)
      (1): ReLU()
      (2): Linear(in_features=8, out_features=128, bias=True)
      (3): LeakyReLU(negative_slope=0.0078125)
      (4): Linear(in_features=128, out_features=32, bias=True)
      (5): ReLU()
      (6): Linear(in_features=32, out_features=5, bias=True)
    )
  )
)
BOPs: tensor(7978650.)
Trial  22  begins evaluation...
[I 2024-09-16 07:19:58,873] Trial 22 finished with values: [0.5655622197635823, 7978650.0] and parameters: {'bottleneck_dim': 0, 'aggregator_type': 0, 'phi_len': 3, 'phi_MLP_width_0': 2, 'phi_MLP_width_1': 3, 'phi_MLP_acts_0': 1, 'phi_MLP_acts_1': 1, 'phi_MLP_norms_0': 'layer', 'phi_MLP_norms_1': None, 'phi_MLP_norms_2': 'layer', 'rho_len': 4, 'rho_MLP_width_0': 0, 'rho_MLP_width_1': 4, 'rho_MLP_width_2': 2, 'rho_MLP_acts_0': 0, 'rho_MLP_acts_1': 1, 'rho_MLP_acts_2': 0, 'rho_MLP_norms_0': 'layer', 'rho_MLP_norms_1': None, 'rho_MLP_norms_2': 'layer', 'rho_MLP_norms_3': 'layer'}. 
Test Accuracy: 0.5656
Accuracy:  0.5655622197635823 , Inference time:  0.05976128578186035 , Validation Loss:  1.1126975133305503 , Param Count:  7766
Conv bp:  tensor(8418946.)
DeepSetsArchitecture(
  (phi): ConvPhi(
    (layers): Sequential(
      (0): Conv1d(3, 32, kernel_size=(1,), stride=(1,))
      (1): ReLU()
      (2): Conv1d(32, 64, kernel_size=(1,), stride=(1,))
      (3): LeakyReLU(negative_slope=0.0078125)
      (4): Conv1d(64, 16, kernel_size=(1,), stride=(1,))
    )
  )
  (rho): Rho(
    (layers): Sequential(
      (0): Linear(in_features=16, out_features=64, bias=True)
      (1): BatchNorm1d(64, eps=1e-05, momentum=0.1, affine=True, track_running_stats=True)
      (2): LeakyReLU(negative_slope=0.0078125)
      (3): Linear(in_features=64, out_features=8, bias=True)
      (4): BatchNorm1d(8, eps=1e-05, momentum=0.1, affine=True, track_running_stats=True)
      (5): LeakyReLU(negative_slope=0.0078125)
      (6): Linear(in_features=8, out_features=5, bias=True)
    )
  )
)
BOPs: tensor(8687474.)
Trial  23  begins evaluation...
[I 2024-09-16 07:26:08,897] Trial 23 finished with values: [0.6462769630067132, 8687474.0] and parameters: {'bottleneck_dim': 4, 'aggregator_type': 1, 'phi_len': 3, 'phi_MLP_width_0': 2, 'phi_MLP_width_1': 3, 'phi_MLP_acts_0': 0, 'phi_MLP_acts_1': 1, 'phi_MLP_norms_0': None, 'phi_MLP_norms_1': 'layer', 'phi_MLP_norms_2': 'layer', 'rho_len': 3, 'rho_MLP_width_0': 3, 'rho_MLP_width_1': 0, 'rho_MLP_acts_0': 1, 'rho_MLP_acts_1': 1, 'rho_MLP_norms_0': 'batch', 'rho_MLP_norms_1': 'batch', 'rho_MLP_norms_2': 'layer'}. 
Test Accuracy: 0.6463
Accuracy:  0.6462769630067132 , Inference time:  0.05385994911193848 , Validation Loss:  0.9283788451532118 , Param Count:  5077
Conv bp:  tensor(519690.)
DeepSetsArchitecture(
  (phi): ConvPhi(
    (layers): Sequential(
      (0): Conv1d(3, 32, kernel_size=(1,), stride=(1,))
    )
  )
  (rho): Rho(
    (layers): Sequential(
      (0): Linear(in_features=32, out_features=32, bias=True)
      (1): BatchNorm1d(32, eps=1e-05, momentum=0.1, affine=True, track_running_stats=True)
      (2): LeakyReLU(negative_slope=0.0078125)
      (3): Linear(in_features=32, out_features=64, bias=True)
      (4): ReLU()
      (5): Linear(in_features=64, out_features=64, bias=True)
      (6): LeakyReLU(negative_slope=0.0078125)
      (7): Linear(in_features=64, out_features=5, bias=True)
    )
  )
)
BOPs: tensor(1805322.)
Trial  24  begins evaluation...
[I 2024-09-16 07:32:15,043] Trial 24 finished with values: [0.6317292094733427, 1805322.0] and parameters: {'bottleneck_dim': 5, 'aggregator_type': 1, 'phi_len': 1, 'phi_MLP_norms_0': None, 'rho_len': 4, 'rho_MLP_width_0': 2, 'rho_MLP_width_1': 3, 'rho_MLP_width_2': 3, 'rho_MLP_acts_0': 1, 'rho_MLP_acts_1': 0, 'rho_MLP_acts_2': 1, 'rho_MLP_norms_0': 'batch', 'rho_MLP_norms_1': None, 'rho_MLP_norms_2': None, 'rho_MLP_norms_3': 'layer'}. 
Test Accuracy: 0.6317
Accuracy:  0.6317292094733427 , Inference time:  0.04495549201965332 , Validation Loss:  0.9597311705148139 , Param Count:  7845
Conv bp:  tensor(64961.2500)
DeepSetsArchitecture(
  (phi): ConvPhi(
    (layers): Sequential(
      (0): Conv1d(3, 4, kernel_size=(1,), stride=(1,))
    )
  )
  (rho): Rho(
    (layers): Sequential(
      (0): Linear(in_features=4, out_features=5, bias=True)
    )
  )
)
BOPs: tensor(68625.2500)
Trial  25  begins evaluation...
[I 2024-09-16 07:38:24,830] Trial 25 finished with values: [0.48036036635582435, 68625.25] and parameters: {'bottleneck_dim': 2, 'aggregator_type': 1, 'phi_len': 1, 'phi_MLP_norms_0': None, 'rho_len': 1, 'rho_MLP_norms_0': 'layer'}. 
Test Accuracy: 0.4804
Accuracy:  0.48036036635582435 , Inference time:  0.013796091079711914 , Validation Loss:  1.3411908806586752 , Param Count:  41
Conv bp:  tensor(259845.)
DeepSetsArchitecture(
  (phi): ConvPhi(
    (layers): Sequential(
      (0): Conv1d(3, 16, kernel_size=(1,), stride=(1,))
    )
  )
  (rho): Rho(
    (layers): Sequential(
      (0): Linear(in_features=16, out_features=5, bias=True)
    )
  )
)
BOPs: tensor(275333.)
Trial  26  begins evaluation...
[I 2024-09-16 07:44:31,063] Trial 26 finished with values: [0.32135162339552953, 275333.0] and parameters: {'bottleneck_dim': 4, 'aggregator_type': 0, 'phi_len': 1, 'phi_MLP_norms_0': 'layer', 'rho_len': 1, 'rho_MLP_norms_0': 'layer'}. 
Test Accuracy: 0.3214
Accuracy:  0.32135162339552953 , Inference time:  0.013466119766235352 , Validation Loss:  1.5010169493097838 , Param Count:  149
Conv bp:  tensor(2715698.)
DeepSetsArchitecture(
  (phi): ConvPhi(
    (layers): Sequential(
      (0): Conv1d(3, 64, kernel_size=(1,), stride=(1,))
      (1): BatchNorm1d(64, eps=1e-05, momentum=0.1, affine=True, track_running_stats=True)
      (2): LeakyReLU(negative_slope=0.0078125)
      (3): Conv1d(64, 8, kernel_size=(1,), stride=(1,))
      (4): LeakyReLU(negative_slope=0.0078125)
      (5): Conv1d(8, 4, kernel_size=(1,), stride=(1,))
    )
  )
  (rho): Rho(
    (layers): Sequential(
      (0): Linear(in_features=4, out_features=8, bias=True)
      (1): BatchNorm1d(8, eps=1e-05, momentum=0.1, affine=True, track_running_stats=True)
      (2): LeakyReLU(negative_slope=0.0078125)
      (3): Linear(in_features=8, out_features=5, bias=True)
    )
  )
)
BOPs: tensor(2727970.)
Trial  27  begins evaluation...
[I 2024-09-16 07:50:45,220] Trial 27 finished with values: [0.5947658700118957, 2727970.0] and parameters: {'bottleneck_dim': 2, 'aggregator_type': 1, 'phi_len': 3, 'phi_MLP_width_0': 3, 'phi_MLP_width_1': 0, 'phi_MLP_acts_0': 1, 'phi_MLP_acts_1': 1, 'phi_MLP_norms_0': 'batch', 'phi_MLP_norms_1': None, 'phi_MLP_norms_2': 'layer', 'rho_len': 2, 'rho_MLP_width_0': 0, 'rho_MLP_acts_0': 1, 'rho_MLP_norms_0': 'batch', 'rho_MLP_norms_1': None}. 
Test Accuracy: 0.5948
Accuracy:  0.5947658700118957 , Inference time:  0.04912137985229492 , Validation Loss:  1.0570290737411603 , Param Count:  1041
Conv bp:  tensor(1326873.)
DeepSetsArchitecture(
  (phi): ConvPhi(
    (layers): Sequential(
      (0): Conv1d(3, 32, kernel_size=(1,), stride=(1,))
      (1): ReLU()
      (2): Conv1d(32, 8, kernel_size=(1,), stride=(1,))
      (3): BatchNorm1d(8, eps=1e-05, momentum=0.1, affine=True, track_running_stats=True)
    )
  )
  (rho): Rho(
    (layers): Sequential(
      (0): Linear(in_features=8, out_features=16, bias=True)
      (1): BatchNorm1d(16, eps=1e-05, momentum=0.1, affine=True, track_running_stats=True)
      (2): LeakyReLU(negative_slope=0.0078125)
      (3): Linear(in_features=16, out_features=5, bias=True)
    )
  )
)
BOPs: tensor(1362393.)
Trial  28  begins evaluation...
[I 2024-09-16 07:57:03,965] Trial 28 finished with values: [0.6205172571561671, 1362393.0] and parameters: {'bottleneck_dim': 3, 'aggregator_type': 1, 'phi_len': 2, 'phi_MLP_width_0': 2, 'phi_MLP_acts_0': 0, 'phi_MLP_norms_0': 'layer', 'phi_MLP_norms_1': 'batch', 'rho_len': 2, 'rho_MLP_width_0': 1, 'rho_MLP_acts_0': 1, 'rho_MLP_norms_0': 'batch', 'rho_MLP_norms_1': None}. 
Test Accuracy: 0.6205
Accuracy:  0.6205172571561671 , Inference time:  0.040160179138183594 , Validation Loss:  0.9968550841824538 , Param Count:  669
Conv bp:  tensor(129922.5000)
DeepSetsArchitecture(
  (phi): ConvPhi(
    (layers): Sequential(
      (0): Conv1d(3, 8, kernel_size=(1,), stride=(1,))
    )
  )
  (rho): Rho(
    (layers): Sequential(
      (0): Linear(in_features=8, out_features=8, bias=True)
      (1): BatchNorm1d(8, eps=1e-05, momentum=0.1, affine=True, track_running_stats=True)
      (2): LeakyReLU(negative_slope=0.0078125)
      (3): Linear(in_features=8, out_features=64, bias=True)
      (4): ReLU()
      (5): Linear(in_features=64, out_features=16, bias=True)
      (6): ReLU()
      (7): Linear(in_features=16, out_features=5, bias=True)
    )
  )
)
BOPs: tensor(416130.5000)
Trial  29  begins evaluation...
[I 2024-09-16 08:03:19,358] Trial 29 finished with values: [0.39982530716822917, 416130.5] and parameters: {'bottleneck_dim': 3, 'aggregator_type': 0, 'phi_len': 1, 'phi_MLP_norms_0': 'layer', 'rho_len': 4, 'rho_MLP_width_0': 0, 'rho_MLP_width_1': 3, 'rho_MLP_width_2': 1, 'rho_MLP_acts_0': 1, 'rho_MLP_acts_1': 0, 'rho_MLP_acts_2': 0, 'rho_MLP_norms_0': 'batch', 'rho_MLP_norms_1': None, 'rho_MLP_norms_2': 'layer', 'rho_MLP_norms_3': None}. 
Test Accuracy: 0.3998
Accuracy:  0.39982530716822917 , Inference time:  0.035257577896118164 , Validation Loss:  1.3786287210425552 , Param Count:  1821
Conv bp:  tensor(519690.)
DeepSetsArchitecture(
  (phi): ConvPhi(
    (layers): Sequential(
      (0): Conv1d(3, 32, kernel_size=(1,), stride=(1,))
    )
  )
  (rho): Rho(
    (layers): Sequential(
      (0): Linear(in_features=32, out_features=5, bias=True)
      (1): BatchNorm1d(5, eps=1e-05, momentum=0.1, affine=True, track_running_stats=True)
    )
  )
)
BOPs: tensor(551114.)
Trial  30  begins evaluation...
[I 2024-09-16 08:09:33,537] Trial 30 finished with values: [0.3215862109124789, 551114.0] and parameters: {'bottleneck_dim': 5, 'aggregator_type': 0, 'phi_len': 1, 'phi_MLP_norms_0': 'layer', 'rho_len': 1, 'rho_MLP_norms_0': 'batch'}. 
Test Accuracy: 0.3216
Accuracy:  0.3215862109124789 , Inference time:  0.019703388214111328 , Validation Loss:  1.5010169476878887 , Param Count:  303
Conv bp:  tensor(2672178.)
DeepSetsArchitecture(
  (phi): ConvPhi(
    (layers): Sequential(
      (0): Conv1d(3, 64, kernel_size=(1,), stride=(1,))
      (1): ReLU()
      (2): Conv1d(64, 8, kernel_size=(1,), stride=(1,))
      (3): BatchNorm1d(8, eps=1e-05, momentum=0.1, affine=True, track_running_stats=True)
    )
  )
  (rho): Rho(
    (layers): Sequential(
      (0): Linear(in_features=8, out_features=32, bias=True)
      (1): ReLU()
      (2): Linear(in_features=32, out_features=32, bias=True)
      (3): BatchNorm1d(32, eps=1e-05, momentum=0.1, affine=True, track_running_stats=True)
      (4): LeakyReLU(negative_slope=0.0078125)
      (5): Linear(in_features=32, out_features=5, bias=True)
      (6): BatchNorm1d(5, eps=1e-05, momentum=0.1, affine=True, track_running_stats=True)
    )
  )
)
BOPs: tensor(2916786.)
Trial  31  begins evaluation...
[I 2024-09-16 08:15:56,330] Trial 31 finished with values: [0.6246932477061168, 2916786.0] and parameters: {'bottleneck_dim': 3, 'aggregator_type': 1, 'phi_len': 2, 'phi_MLP_width_0': 3, 'phi_MLP_acts_0': 0, 'phi_MLP_norms_0': 'layer', 'phi_MLP_norms_1': 'batch', 'rho_len': 3, 'rho_MLP_width_0': 2, 'rho_MLP_width_1': 2, 'rho_MLP_acts_0': 0, 'rho_MLP_acts_1': 1, 'rho_MLP_norms_0': None, 'rho_MLP_norms_1': 'batch', 'rho_MLP_norms_2': 'batch'}. 
Test Accuracy: 0.6247
Accuracy:  0.6246932477061168 , Inference time:  0.05220746994018555 , Validation Loss:  0.9798803451109905 , Param Count:  2375
Conv bp:  tensor(12922498.)
DeepSetsArchitecture(
  (phi): ConvPhi(
    (layers): Sequential(
      (0): Conv1d(3, 32, kernel_size=(1,), stride=(1,))
      (1): BatchNorm1d(32, eps=1e-05, momentum=0.1, affine=True, track_running_stats=True)
      (2): ReLU()
      (3): Conv1d(32, 64, kernel_size=(1,), stride=(1,))
      (4): BatchNorm1d(64, eps=1e-05, momentum=0.1, affine=True, track_running_stats=True)
      (5): LeakyReLU(negative_slope=0.0078125)
      (6): Conv1d(64, 64, kernel_size=(1,), stride=(1,))
      (7): LeakyReLU(negative_slope=0.0078125)
      (8): Conv1d(64, 8, kernel_size=(1,), stride=(1,))
    )
  )
  (rho): Rho(
    (layers): Sequential(
      (0): Linear(in_features=8, out_features=128, bias=True)
      (1): ReLU()
      (2): Linear(in_features=128, out_features=8, bias=True)
      (3): LeakyReLU(negative_slope=0.0078125)
      (4): Linear(in_features=8, out_features=16, bias=True)
      (5): BatchNorm1d(16, eps=1e-05, momentum=0.1, affine=True, track_running_stats=True)
      (6): ReLU()
      (7): Linear(in_features=16, out_features=5, bias=True)
    )
  )
)
BOPs: tensor(13306178.)
Trial  32  begins evaluation...
