[I 2024-09-17 02:47:20,926] Trial 251 finished with values: [0.5563118183860046, 289781.0] and parameters: {'bottleneck_dim': 4, 'aggregator_type': 1, 'phi_len': 1, 'phi_MLP_norms_0': 'layer', 'rho_len': 2, 'rho_MLP_width_0': 0, 'rho_MLP_acts_0': 1, 'rho_MLP_norms_0': None, 'rho_MLP_norms_1': 'layer'}. 
Test Accuracy: 0.5563
Accuracy:  0.5563118183860046 , Inference time:  0.019528627395629883 , Validation Loss:  1.134354211035229 , Param Count:  245
Conv bp:  tensor(1039380.)
DeepSetsArchitecture(
  (phi): ConvPhi(
    (layers): Sequential(
      (0): Conv1d(3, 64, kernel_size=(1,), stride=(1,))
      (1): BatchNorm1d(64, eps=1e-05, momentum=0.1, affine=True, track_running_stats=True)
    )
  )
  (rho): Rho(
    (layers): Sequential(
      (0): Linear(in_features=64, out_features=128, bias=True)
      (1): LeakyReLU(negative_slope=0.0078125)
      (2): Linear(in_features=128, out_features=64, bias=True)
      (3): LeakyReLU(negative_slope=0.0078125)
      (4): Linear(in_features=64, out_features=64, bias=True)
      (5): LeakyReLU(negative_slope=0.0078125)
      (6): Linear(in_features=64, out_features=5, bias=True)
    )
  )
)
BOPs: tensor(4641556.)
Trial  252  begins evaluation...
[I 2024-09-17 02:52:37,582] Trial 252 finished with values: [0.6371846170483566, 4641556.0] and parameters: {'bottleneck_dim': 6, 'aggregator_type': 1, 'phi_len': 1, 'phi_MLP_norms_0': 'batch', 'rho_len': 4, 'rho_MLP_width_0': 4, 'rho_MLP_width_1': 3, 'rho_MLP_width_2': 3, 'rho_MLP_acts_0': 1, 'rho_MLP_acts_1': 1, 'rho_MLP_acts_2': 1, 'rho_MLP_norms_0': 'layer', 'rho_MLP_norms_1': None, 'rho_MLP_norms_2': None, 'rho_MLP_norms_3': None}. 
Test Accuracy: 0.6372
Accuracy:  0.6371846170483566 , Inference time:  0.02921581268310547 , Validation Loss:  0.9468484196533151 , Param Count:  21445
Conv bp:  tensor(327110.2500)
DeepSetsArchitecture(
  (phi): ConvPhi(
    (layers): Sequential(
      (0): Conv1d(3, 8, kernel_size=(1,), stride=(1,))
      (1): ReLU()
      (2): Conv1d(8, 8, kernel_size=(1,), stride=(1,))
      (3): BatchNorm1d(8, eps=1e-05, momentum=0.1, affine=True, track_running_stats=True)
    )
  )
  (rho): Rho(
    (layers): Sequential(
      (0): Linear(in_features=8, out_features=16, bias=True)
      (1): LeakyReLU(negative_slope=0.0078125)
      (2): Linear(in_features=16, out_features=5, bias=True)
      (3): BatchNorm1d(5, eps=1e-05, momentum=0.1, affine=True, track_running_stats=True)
    )
  )
)
BOPs: tensor(362630.2500)
Trial  253  begins evaluation...
[I 2024-09-17 02:57:56,231] Trial 253 finished with values: [0.6052607498481836, 362630.25] and parameters: {'bottleneck_dim': 3, 'aggregator_type': 1, 'phi_len': 2, 'phi_MLP_width_0': 0, 'phi_MLP_acts_0': 0, 'phi_MLP_norms_0': None, 'phi_MLP_norms_1': 'batch', 'rho_len': 2, 'rho_MLP_width_0': 1, 'rho_MLP_acts_0': 1, 'rho_MLP_norms_0': None, 'rho_MLP_norms_1': 'batch'}. 
Test Accuracy: 0.6053
Accuracy:  0.6052607498481836 , Inference time:  0.035388946533203125 , Validation Loss:  1.0300637244367274 , Param Count:  359
Conv bp:  tensor(64961.2500)
DeepSetsArchitecture(
  (phi): ConvPhi(
    (layers): Sequential(
      (0): Conv1d(3, 4, kernel_size=(1,), stride=(1,))
      (1): BatchNorm1d(4, eps=1e-05, momentum=0.1, affine=True, track_running_stats=True)
    )
  )
  (rho): Rho(
    (layers): Sequential(
      (0): Linear(in_features=4, out_features=32, bias=True)
      (1): ReLU()
      (2): Linear(in_features=32, out_features=32, bias=True)
      (3): ReLU()
      (4): Linear(in_features=32, out_features=8, bias=True)
      (5): LeakyReLU(negative_slope=0.0078125)
      (6): Linear(in_features=8, out_features=5, bias=True)
    )
  )
)
BOPs: tensor(310577.2500)
Trial  254  begins evaluation...
[I 2024-09-17 03:03:17,060] Trial 254 finished with values: [0.5714202527222966, 310577.25] and parameters: {'bottleneck_dim': 2, 'aggregator_type': 1, 'phi_len': 1, 'phi_MLP_norms_0': 'batch', 'rho_len': 4, 'rho_MLP_width_0': 2, 'rho_MLP_width_1': 2, 'rho_MLP_width_2': 0, 'rho_MLP_acts_0': 0, 'rho_MLP_acts_1': 0, 'rho_MLP_acts_2': 1, 'rho_MLP_norms_0': None, 'rho_MLP_norms_1': None, 'rho_MLP_norms_2': None, 'rho_MLP_norms_3': None}. 
Test Accuracy: 0.5714
Accuracy:  0.5714202527222966 , Inference time:  0.027873992919921875 , Validation Loss:  1.1010411689881565 , Param Count:  1549
Conv bp:  tensor(129922.5000)
DeepSetsArchitecture(
  (phi): ConvPhi(
    (layers): Sequential(
      (0): Conv1d(3, 8, kernel_size=(1,), stride=(1,))
      (1): BatchNorm1d(8, eps=1e-05, momentum=0.1, affine=True, track_running_stats=True)
    )
  )
  (rho): Rho(
    (layers): Sequential(
      (0): Linear(in_features=8, out_features=8, bias=True)
      (1): LeakyReLU(negative_slope=0.0078125)
      (2): Linear(in_features=8, out_features=32, bias=True)
      (3): BatchNorm1d(32, eps=1e-05, momentum=0.1, affine=True, track_running_stats=True)
      (4): ReLU()
      (5): Linear(in_features=32, out_features=8, bias=True)
      (6): LeakyReLU(negative_slope=0.0078125)
      (7): Linear(in_features=8, out_features=5, bias=True)
    )
  )
)
BOPs: tensor(234034.5000)
Trial  255  begins evaluation...
[I 2024-09-17 03:08:35,764] Trial 255 finished with values: [0.6033158363211354, 234034.5] and parameters: {'bottleneck_dim': 3, 'aggregator_type': 1, 'phi_len': 1, 'phi_MLP_norms_0': 'batch', 'rho_len': 4, 'rho_MLP_width_0': 0, 'rho_MLP_width_1': 2, 'rho_MLP_width_2': 0, 'rho_MLP_acts_0': 1, 'rho_MLP_acts_1': 0, 'rho_MLP_acts_2': 1, 'rho_MLP_norms_0': None, 'rho_MLP_norms_1': 'batch', 'rho_MLP_norms_2': None, 'rho_MLP_norms_3': 'layer'}. 
Test Accuracy: 0.6033
Accuracy:  0.6033158363211354 , Inference time:  0.0332491397857666 , Validation Loss:  1.0334046410054576 , Param Count:  781
Conv bp:  tensor(64961.2500)
DeepSetsArchitecture(
  (phi): ConvPhi(
    (layers): Sequential(
      (0): Conv1d(3, 4, kernel_size=(1,), stride=(1,))
    )
  )
  (rho): Rho(
    (layers): Sequential(
      (0): Linear(in_features=4, out_features=128, bias=True)
      (1): LeakyReLU(negative_slope=0.0078125)
      (2): Linear(in_features=128, out_features=128, bias=True)
      (3): ReLU()
      (4): Linear(in_features=128, out_features=5, bias=True)
      (5): BatchNorm1d(5, eps=1e-05, momentum=0.1, affine=True, track_running_stats=True)
    )
  )
)
BOPs: tensor(3111489.2500)
Trial  256  begins evaluation...
[I 2024-09-17 03:13:59,140] Trial 256 finished with values: [0.5746179634143298, 3111489.25] and parameters: {'bottleneck_dim': 2, 'aggregator_type': 1, 'phi_len': 1, 'phi_MLP_norms_0': 'layer', 'rho_len': 3, 'rho_MLP_width_0': 4, 'rho_MLP_width_1': 4, 'rho_MLP_acts_0': 1, 'rho_MLP_acts_1': 0, 'rho_MLP_norms_0': None, 'rho_MLP_norms_1': 'layer', 'rho_MLP_norms_2': 'batch'}. 
Test Accuracy: 0.5746
Accuracy:  0.5746179634143298 , Inference time:  0.027873992919921875 , Validation Loss:  1.0908056108319029 , Param Count:  17823
Conv bp:  tensor(1707424.5000)
DeepSetsArchitecture(
  (phi): ConvPhi(
    (layers): Sequential(
      (0): Conv1d(3, 8, kernel_size=(1,), stride=(1,))
      (1): BatchNorm1d(8, eps=1e-05, momentum=0.1, affine=True, track_running_stats=True)
      (2): LeakyReLU(negative_slope=0.0078125)
      (3): Conv1d(8, 64, kernel_size=(1,), stride=(1,))
      (4): BatchNorm1d(64, eps=1e-05, momentum=0.1, affine=True, track_running_stats=True)
    )
  )
  (rho): Rho(
    (layers): Sequential(
      (0): Linear(in_features=64, out_features=16, bias=True)
      (1): LeakyReLU(negative_slope=0.0078125)
      (2): Linear(in_features=16, out_features=8, bias=True)
      (3): LeakyReLU(negative_slope=0.0078125)
      (4): Linear(in_features=8, out_features=5, bias=True)
    )
  )
)
BOPs: tensor(1919888.5000)
Trial  257  begins evaluation...
[I 2024-09-17 03:19:23,322] Trial 257 finished with values: [0.6294199366114582, 1919888.5] and parameters: {'bottleneck_dim': 6, 'aggregator_type': 1, 'phi_len': 2, 'phi_MLP_width_0': 0, 'phi_MLP_acts_0': 1, 'phi_MLP_norms_0': 'batch', 'phi_MLP_norms_1': 'batch', 'rho_len': 3, 'rho_MLP_width_0': 1, 'rho_MLP_width_1': 0, 'rho_MLP_acts_0': 1, 'rho_MLP_acts_1': 1, 'rho_MLP_norms_0': 'layer', 'rho_MLP_norms_1': None, 'rho_MLP_norms_2': None}. 
Test Accuracy: 0.6294
Accuracy:  0.6294199366114582 , Inference time:  0.03622078895568848 , Validation Loss:  0.968733590476367 , Param Count:  1973
Conv bp:  tensor(15288600.)
DeepSetsArchitecture(
  (phi): ConvPhi(
    (layers): Sequential(
      (0): Conv1d(3, 128, kernel_size=(1,), stride=(1,))
      (1): ReLU()
      (2): Conv1d(128, 32, kernel_size=(1,), stride=(1,))
    )
  )
  (rho): Rho(
    (layers): Sequential(
      (0): Linear(in_features=32, out_features=16, bias=True)
      (1): BatchNorm1d(16, eps=1e-05, momentum=0.1, affine=True, track_running_stats=True)
      (2): ReLU()
      (3): Linear(in_features=16, out_features=5, bias=True)
    )
  )
)
BOPs: tensor(15393304.)
Trial  258  begins evaluation...
[I 2024-09-17 03:24:35,704] Trial 258 finished with values: [0.634128324362995, 15393304.0] and parameters: {'bottleneck_dim': 5, 'aggregator_type': 0, 'phi_len': 2, 'phi_MLP_width_0': 4, 'phi_MLP_acts_0': 0, 'phi_MLP_norms_0': None, 'phi_MLP_norms_1': None, 'rho_len': 2, 'rho_MLP_width_0': 1, 'rho_MLP_acts_0': 0, 'rho_MLP_norms_0': 'batch', 'rho_MLP_norms_1': 'layer'}. 
Test Accuracy: 0.6341
Accuracy:  0.634128324362995 , Inference time:  0.03325676918029785 , Validation Loss:  0.9707198763380245 , Param Count:  5285
Conv bp:  tensor(179219.4375)
DeepSetsArchitecture(
  (phi): ConvPhi(
    (layers): Sequential(
      (0): Conv1d(3, 8, kernel_size=(1,), stride=(1,))
      (1): LeakyReLU(negative_slope=0.0078125)
      (2): Conv1d(8, 2, kernel_size=(1,), stride=(1,))
      (3): BatchNorm1d(2, eps=1e-05, momentum=0.1, affine=True, track_running_stats=True)
    )
  )
  (rho): Rho(
    (layers): Sequential(
      (0): Linear(in_features=2, out_features=8, bias=True)
      (1): ReLU()
      (2): Linear(in_features=8, out_features=32, bias=True)
      (3): LeakyReLU(negative_slope=0.0078125)
      (4): Linear(in_features=32, out_features=5, bias=True)
    )
  )
)
BOPs: tensor(251683.4375)
Trial  259  begins evaluation...
[I 2024-09-17 03:29:51,886] Trial 259 finished with values: [0.5700443387044447, 251683.4375] and parameters: {'bottleneck_dim': 1, 'aggregator_type': 1, 'phi_len': 2, 'phi_MLP_width_0': 0, 'phi_MLP_acts_0': 1, 'phi_MLP_norms_0': 'layer', 'phi_MLP_norms_1': 'batch', 'rho_len': 3, 'rho_MLP_width_0': 0, 'rho_MLP_width_1': 2, 'rho_MLP_acts_0': 0, 'rho_MLP_acts_1': 1, 'rho_MLP_norms_0': 'layer', 'rho_MLP_norms_1': 'layer', 'rho_MLP_norms_2': None}. 
Test Accuracy: 0.5700
Accuracy:  0.5700443387044447 , Inference time:  0.03284621238708496 , Validation Loss:  1.114417400489859 , Param Count:  531
Conv bp:  tensor(12788866.)
DeepSetsArchitecture(
  (phi): ConvPhi(
    (layers): Sequential(
      (0): Conv1d(3, 32, kernel_size=(1,), stride=(1,))
      (1): BatchNorm1d(32, eps=1e-05, momentum=0.1, affine=True, track_running_stats=True)
      (2): LeakyReLU(negative_slope=0.0078125)
      (3): Conv1d(32, 64, kernel_size=(1,), stride=(1,))
      (4): BatchNorm1d(64, eps=1e-05, momentum=0.1, affine=True, track_running_stats=True)
      (5): ReLU()
      (6): Conv1d(64, 64, kernel_size=(1,), stride=(1,))
      (7): LeakyReLU(negative_slope=0.0078125)
      (8): Conv1d(64, 2, kernel_size=(1,), stride=(1,))
    )
  )
  (rho): Rho(
    (layers): Sequential(
      (0): Linear(in_features=2, out_features=5, bias=True)
    )
  )
)
BOPs: tensor(12790662.)
Trial  260  begins evaluation...
[I 2024-09-17 03:35:04,063] Trial 260 finished with values: [0.47849198492650424, 12790662.0] and parameters: {'bottleneck_dim': 1, 'aggregator_type': 1, 'phi_len': 4, 'phi_MLP_width_0': 2, 'phi_MLP_width_1': 3, 'phi_MLP_width_2': 3, 'phi_MLP_acts_0': 1, 'phi_MLP_acts_1': 0, 'phi_MLP_acts_2': 1, 'phi_MLP_norms_0': 'batch', 'phi_MLP_norms_1': 'batch', 'phi_MLP_norms_2': 'layer', 'phi_MLP_norms_3': 'layer', 'rho_len': 1, 'rho_MLP_norms_0': 'layer'}. 
Test Accuracy: 0.4785
Accuracy:  0.47849198492650424 , Inference time:  0.047631263732910156 , Validation Loss:  1.252725906112567 , Param Count:  6737
Conv bp:  tensor(15288600.)
DeepSetsArchitecture(
  (phi): ConvPhi(
    (layers): Sequential(
      (0): Conv1d(3, 128, kernel_size=(1,), stride=(1,))
      (1): LeakyReLU(negative_slope=0.0078125)
      (2): Conv1d(128, 32, kernel_size=(1,), stride=(1,))
      (3): BatchNorm1d(32, eps=1e-05, momentum=0.1, affine=True, track_running_stats=True)
    )
  )
  (rho): Rho(
    (layers): Sequential(
      (0): Linear(in_features=32, out_features=128, bias=True)
      (1): LeakyReLU(negative_slope=0.0078125)
      (2): Linear(in_features=128, out_features=5, bias=True)
    )
  )
)
BOPs: tensor(16100120.)
Trial  261  begins evaluation...
[I 2024-09-17 03:40:16,423] Trial 261 finished with values: [0.6526341183419154, 16100120.0] and parameters: {'bottleneck_dim': 5, 'aggregator_type': 1, 'phi_len': 2, 'phi_MLP_width_0': 4, 'phi_MLP_acts_0': 1, 'phi_MLP_norms_0': None, 'phi_MLP_norms_1': 'batch', 'rho_len': 2, 'rho_MLP_width_0': 4, 'rho_MLP_acts_0': 1, 'rho_MLP_norms_0': 'layer', 'rho_MLP_norms_1': 'layer'}. 
Test Accuracy: 0.6526
Accuracy:  0.6526341183419154 , Inference time:  0.03398704528808594 , Validation Loss:  0.9121091244172077 , Param Count:  9573
Conv bp:  tensor(259845.)
DeepSetsArchitecture(
  (phi): ConvPhi(
    (layers): Sequential(
      (0): Conv1d(3, 16, kernel_size=(1,), stride=(1,))
    )
  )
  (rho): Rho(
    (layers): Sequential(
      (0): Linear(in_features=16, out_features=8, bias=True)
      (1): ReLU()
      (2): Linear(in_features=8, out_features=5, bias=True)
      (3): BatchNorm1d(5, eps=1e-05, momentum=0.1, affine=True, track_running_stats=True)
    )
  )
)
BOPs: tensor(289781.)
Trial  262  begins evaluation...
[I 2024-09-17 03:45:26,403] Trial 262 finished with values: [0.5488399564099791, 289781.0] and parameters: {'bottleneck_dim': 4, 'aggregator_type': 1, 'phi_len': 1, 'phi_MLP_norms_0': None, 'rho_len': 2, 'rho_MLP_width_0': 0, 'rho_MLP_acts_0': 0, 'rho_MLP_norms_0': None, 'rho_MLP_norms_1': 'batch'}. 
Test Accuracy: 0.5488
Accuracy:  0.5488399564099791 , Inference time:  0.02546095848083496 , Validation Loss:  1.1506949403659017 , Param Count:  255
Conv bp:  tensor(14101764.)
DeepSetsArchitecture(
  (phi): ConvPhi(
    (layers): Sequential(
      (0): Conv1d(3, 64, kernel_size=(1,), stride=(1,))
      (1): LeakyReLU(negative_slope=0.0078125)
      (2): Conv1d(64, 64, kernel_size=(1,), stride=(1,))
      (3): BatchNorm1d(64, eps=1e-05, momentum=0.1, affine=True, track_running_stats=True)
    )
  )
  (rho): Rho(
    (layers): Sequential(
      (0): Linear(in_features=64, out_features=8, bias=True)
      (1): ReLU()
      (2): Linear(in_features=8, out_features=8, bias=True)
      (3): BatchNorm1d(8, eps=1e-05, momentum=0.1, affine=True, track_running_stats=True)
      (4): LeakyReLU(negative_slope=0.0078125)
      (5): Linear(in_features=8, out_features=8, bias=True)
      (6): ReLU()
      (7): Linear(in_features=8, out_features=5, bias=True)
      (8): BatchNorm1d(5, eps=1e-05, momentum=0.1, affine=True, track_running_stats=True)
    )
  )
)
BOPs: tensor(14225908.)
Trial  263  begins evaluation...
[I 2024-09-17 03:50:39,948] Trial 263 finished with values: [0.644079160808911, 14225908.0] and parameters: {'bottleneck_dim': 6, 'aggregator_type': 1, 'phi_len': 2, 'phi_MLP_width_0': 3, 'phi_MLP_acts_0': 1, 'phi_MLP_norms_0': None, 'phi_MLP_norms_1': 'batch', 'rho_len': 4, 'rho_MLP_width_0': 0, 'rho_MLP_width_1': 0, 'rho_MLP_width_2': 0, 'rho_MLP_acts_0': 0, 'rho_MLP_acts_1': 1, 'rho_MLP_acts_2': 0, 'rho_MLP_norms_0': None, 'rho_MLP_norms_1': 'batch', 'rho_MLP_norms_2': None, 'rho_MLP_norms_3': 'batch'}. 
Test Accuracy: 0.6441
Accuracy:  0.644079160808911 , Inference time:  0.0462193489074707 , Validation Loss:  0.9357249700293249 , Param Count:  5279
Conv bp:  tensor(16240.3125)
DeepSetsArchitecture(
  (phi): ConvPhi(
    (layers): Sequential(
      (0): Conv1d(3, 1, kernel_size=(1,), stride=(1,))
    )
  )
  (rho): Rho(
    (layers): Sequential(
      (0): Linear(in_features=1, out_features=128, bias=True)
      (1): LeakyReLU(negative_slope=0.0078125)
      (2): Linear(in_features=128, out_features=128, bias=True)
      (3): ReLU()
      (4): Linear(in_features=128, out_features=5, bias=True)
    )
  )
)
BOPs: tensor(2998976.2500)
Trial  264  begins evaluation...
[I 2024-09-17 03:55:50,597] Trial 264 finished with values: [0.3607656537255326, 2998976.25] and parameters: {'bottleneck_dim': 0, 'aggregator_type': 1, 'phi_len': 1, 'phi_MLP_norms_0': 'layer', 'rho_len': 3, 'rho_MLP_width_0': 4, 'rho_MLP_width_1': 4, 'rho_MLP_acts_0': 1, 'rho_MLP_acts_1': 0, 'rho_MLP_norms_0': 'layer', 'rho_MLP_norms_1': 'layer', 'rho_MLP_norms_2': None}. 
Test Accuracy: 0.3608
Accuracy:  0.3607656537255326 , Inference time:  0.020731210708618164 , Validation Loss:  1.4563859441653402 , Param Count:  17417
Conv bp:  tensor(658828.5000)
DeepSetsArchitecture(
  (phi): ConvPhi(
    (layers): Sequential(
      (0): Conv1d(3, 16, kernel_size=(1,), stride=(1,))
      (1): BatchNorm1d(16, eps=1e-05, momentum=0.1, affine=True, track_running_stats=True)
      (2): LeakyReLU(negative_slope=0.0078125)
      (3): Conv1d(16, 8, kernel_size=(1,), stride=(1,))
    )
  )
  (rho): Rho(
    (layers): Sequential(
      (0): Linear(in_features=8, out_features=8, bias=True)
      (1): ReLU()
      (2): Linear(in_features=8, out_features=5, bias=True)
    )
  )
)
BOPs: tensor(676924.5000)
Trial  265  begins evaluation...
[I 2024-09-17 04:00:56,326] Trial 265 finished with values: [0.6026220562178171, 676924.5] and parameters: {'bottleneck_dim': 3, 'aggregator_type': 1, 'phi_len': 2, 'phi_MLP_width_0': 1, 'phi_MLP_acts_0': 1, 'phi_MLP_norms_0': 'batch', 'phi_MLP_norms_1': 'layer', 'rho_len': 2, 'rho_MLP_width_0': 0, 'rho_MLP_acts_0': 0, 'rho_MLP_norms_0': None, 'rho_MLP_norms_1': None}. 
Test Accuracy: 0.6026
Accuracy:  0.6026220562178171 , Inference time:  0.029567956924438477 , Validation Loss:  1.0285562759354 , Param Count:  349
Conv bp:  tensor(129922.5000)
DeepSetsArchitecture(
  (phi): ConvPhi(
    (layers): Sequential(
      (0): Conv1d(3, 8, kernel_size=(1,), stride=(1,))
      (1): BatchNorm1d(8, eps=1e-05, momentum=0.1, affine=True, track_running_stats=True)
    )
  )
  (rho): Rho(
    (layers): Sequential(
      (0): Linear(in_features=8, out_features=16, bias=True)
      (1): ReLU()
      (2): Linear(in_features=16, out_features=16, bias=True)
      (3): ReLU()
      (4): Linear(in_features=16, out_features=32, bias=True)
      (5): LeakyReLU(negative_slope=0.0078125)
      (6): Linear(in_features=32, out_features=5, bias=True)
    )
  )
)
BOPs: tensor(308226.5000)
Trial  266  begins evaluation...
[I 2024-09-17 04:06:07,342] Trial 266 finished with values: [0.5974960694112852, 308226.5] and parameters: {'bottleneck_dim': 3, 'aggregator_type': 1, 'phi_len': 1, 'phi_MLP_norms_0': 'batch', 'rho_len': 4, 'rho_MLP_width_0': 1, 'rho_MLP_width_1': 1, 'rho_MLP_width_2': 2, 'rho_MLP_acts_0': 0, 'rho_MLP_acts_1': 0, 'rho_MLP_acts_2': 1, 'rho_MLP_norms_0': 'layer', 'rho_MLP_norms_1': 'layer', 'rho_MLP_norms_2': 'layer', 'rho_MLP_norms_3': None}. 
Test Accuracy: 0.5975
Accuracy:  0.5974960694112852 , Inference time:  0.028517961502075195 , Validation Loss:  1.0412453388681218 , Param Count:  1173
Conv bp:  tensor(64961.2500)
DeepSetsArchitecture(
  (phi): ConvPhi(
    (layers): Sequential(
      (0): Conv1d(3, 4, kernel_size=(1,), stride=(1,))
      (1): BatchNorm1d(4, eps=1e-05, momentum=0.1, affine=True, track_running_stats=True)
    )
  )
  (rho): Rho(
    (layers): Sequential(
      (0): Linear(in_features=4, out_features=8, bias=True)
      (1): BatchNorm1d(8, eps=1e-05, momentum=0.1, affine=True, track_running_stats=True)
      (2): LeakyReLU(negative_slope=0.0078125)
      (3): Linear(in_features=8, out_features=32, bias=True)
      (4): LeakyReLU(negative_slope=0.0078125)
      (5): Linear(in_features=32, out_features=16, bias=True)
      (6): BatchNorm1d(16, eps=1e-05, momentum=0.1, affine=True, track_running_stats=True)
      (7): ReLU()
      (8): Linear(in_features=16, out_features=5, bias=True)
    )
  )
)
BOPs: tensor(213569.2500)
Trial  267  begins evaluation...
[I 2024-09-17 04:11:20,912] Trial 267 finished with values: [0.5576744224738168, 213569.25] and parameters: {'bottleneck_dim': 2, 'aggregator_type': 1, 'phi_len': 1, 'phi_MLP_norms_0': 'batch', 'rho_len': 4, 'rho_MLP_width_0': 0, 'rho_MLP_width_1': 2, 'rho_MLP_width_2': 1, 'rho_MLP_acts_0': 1, 'rho_MLP_acts_1': 1, 'rho_MLP_acts_2': 0, 'rho_MLP_norms_0': 'batch', 'rho_MLP_norms_1': 'layer', 'rho_MLP_norms_2': 'batch', 'rho_MLP_norms_3': 'layer'}. 
Test Accuracy: 0.5577
Accuracy:  0.5576744224738168 , Inference time:  0.037865638732910156 , Validation Loss:  1.1243406120611696 , Param Count:  1013
Conv bp:  tensor(1707424.5000)
DeepSetsArchitecture(
  (phi): ConvPhi(
    (layers): Sequential(
      (0): Conv1d(3, 8, kernel_size=(1,), stride=(1,))
      (1): BatchNorm1d(8, eps=1e-05, momentum=0.1, affine=True, track_running_stats=True)
      (2): ReLU()
      (3): Conv1d(8, 64, kernel_size=(1,), stride=(1,))
    )
  )
  (rho): Rho(
    (layers): Sequential(
      (0): Linear(in_features=64, out_features=16, bias=True)
      (1): LeakyReLU(negative_slope=0.0078125)
      (2): Linear(in_features=16, out_features=128, bias=True)
      (3): ReLU()
      (4): Linear(in_features=128, out_features=16, bias=True)
      (5): ReLU()
      (6): Linear(in_features=16, out_features=5, bias=True)
    )
  )
)
BOPs: tensor(2605600.5000)
Trial  268  begins evaluation...
