[I 2024-09-17 18:33:56,577] Trial 330 finished with values: [0.6502932343961867, 5238352.0] and parameters: {'bottleneck_dim': 4, 'aggregator_type': 1, 'phi_len': 2, 'phi_MLP_width_0': 3, 'phi_MLP_acts_0': 0, 'phi_MLP_norms_0': None, 'phi_MLP_norms_1': 'layer', 'rho_len': 3, 'rho_MLP_width_0': 3, 'rho_MLP_width_1': 3, 'rho_MLP_acts_0': 1, 'rho_MLP_acts_1': 1, 'rho_MLP_norms_0': 'batch', 'rho_MLP_norms_1': 'batch', 'rho_MLP_norms_2': None}. 
Test Accuracy: 0.6503
Accuracy:  0.6502932343961867 , Inference time:  0.056108713150024414 , Validation Loss:  0.9160651767334971 , Param Count:  7125
Conv bp:  tensor(1057812.)
DeepSetsArchitecture(
  (phi): ConvPhi(
    (layers): Sequential(
      (0): Conv1d(3, 16, kernel_size=(1,), stride=(1,))
      (1): BatchNorm1d(16, eps=1e-05, momentum=0.1, affine=True, track_running_stats=True)
      (2): LeakyReLU(negative_slope=0.0078125)
      (3): Conv1d(16, 16, kernel_size=(1,), stride=(1,))
    )
  )
  (rho): Rho(
    (layers): Sequential(
      (0): Linear(in_features=16, out_features=8, bias=True)
      (1): BatchNorm1d(8, eps=1e-05, momentum=0.1, affine=True, track_running_stats=True)
      (2): LeakyReLU(negative_slope=0.0078125)
      (3): Linear(in_features=8, out_features=8, bias=True)
      (4): ReLU()
      (5): Linear(in_features=8, out_features=5, bias=True)
      (6): BatchNorm1d(5, eps=1e-05, momentum=0.1, affine=True, track_running_stats=True)
    )
  )
)
BOPs: tensor(1098372.)
Trial  331  begins evaluation...
[I 2024-09-17 18:41:10,566] Trial 331 finished with values: [0.6234055119747777, 1098372.0] and parameters: {'bottleneck_dim': 4, 'aggregator_type': 1, 'phi_len': 2, 'phi_MLP_width_0': 1, 'phi_MLP_acts_0': 1, 'phi_MLP_norms_0': 'batch', 'phi_MLP_norms_1': None, 'rho_len': 3, 'rho_MLP_width_0': 0, 'rho_MLP_width_1': 0, 'rho_MLP_acts_0': 1, 'rho_MLP_acts_1': 0, 'rho_MLP_norms_0': 'batch', 'rho_MLP_norms_1': None, 'rho_MLP_norms_2': 'batch'}. 
Test Accuracy: 0.6234
Accuracy:  0.6234055119747777 , Inference time:  0.06208300590515137 , Validation Loss:  0.9842250918855473 , Param Count:  647
Conv bp:  tensor(34265608.)
DeepSetsArchitecture(
  (phi): ConvPhi(
    (layers): Sequential(
      (0): Conv1d(3, 128, kernel_size=(1,), stride=(1,))
      (1): ReLU()
      (2): Conv1d(128, 64, kernel_size=(1,), stride=(1,))
      (3): BatchNorm1d(64, eps=1e-05, momentum=0.1, affine=True, track_running_stats=True)
      (4): ReLU()
      (5): Conv1d(64, 64, kernel_size=(1,), stride=(1,))
    )
  )
  (rho): Rho(
    (layers): Sequential(
      (0): Linear(in_features=64, out_features=8, bias=True)
      (1): BatchNorm1d(8, eps=1e-05, momentum=0.1, affine=True, track_running_stats=True)
      (2): ReLU()
      (3): Linear(in_features=8, out_features=32, bias=True)
      (4): BatchNorm1d(32, eps=1e-05, momentum=0.1, affine=True, track_running_stats=True)
      (5): LeakyReLU(negative_slope=0.0078125)
      (6): Linear(in_features=32, out_features=5, bias=True)
    )
  )
)
BOPs: tensor(34431560.)
Trial  332  begins evaluation...
KUBERNETES_SERVICE_PORT_HTTPS=443
NVIDIA_VISIBLE_DEVICES=GPU-9ad0f941-f037-6ae1-e24b-cb9036781aba
GGEXPOSE_SERVICE_HOST=10.103.93.169
SPATOPEXPOSE_SERVICE_HOST=10.98.174.135
SSL_JET_V2_EXPOSE_PORT=tcp://10.98.170.207:80
KUBERNETES_SERVICE_PORT=443
SSL_JET_V3_EXPOSE_PORT_80_TCP_ADDR=10.99.91.182
HOSTNAME=dd-global-c-par-2
PFEXPOSEEAST_PORT_80_TCP_ADDR=10.106.41.90
XILINXD_SERVICE_HOST=10.111.109.177
ABCDNNEXPOSE_PORT_80_TCP_PROTO=tcp
PFEXPOSE_PORT_80_TCP_PROTO=tcp
L1ANOMALYEXPOSE_PORT_80_TCP_PORT=80
HHBBVVEXPOSE_PORT_80_TCP_PROTO=tcp
SSL_JET_V3_EXPOSE_PORT=tcp://10.99.91.182:80
SPATOPEXPOSE_PORT_8800_TCP_ADDR=10.98.174.135
J_JEPA_VOL_EXPOSE_PORT=tcp://10.98.255.12:80
BUMPHUNTEXPOSE_SERVICE_PORT=80
HHBBVVEXPOSE_PORT_80_TCP_PORT=80
J_JEPA_VOL_EXPOSE_SERVICE_HOST=10.98.255.12
PFEXPOSE_PORT_80_TCP=tcp://10.97.167.151:80
BUMPHUNTEXPOSE_SERVICE_HOST=10.96.169.13
PFEXPOSE_SERVICE_PORT=80
PWD=/morph-nas-central/Morph
PFEXPOSE_PORT_80_TCP_ADDR=10.97.167.151
PFEXPOSEEAST_SERVICE_PORT=80
JOB_COMPLETION_INDEX=2
PFEXPOSEEAST_SERVICE_HOST=10.106.41.90
J_JEPA_VOL_EXPOSE_PORT_80_TCP_ADDR=10.98.255.12
NVIDIA_DRIVER_CAPABILITIES=compute,utility
PFEXPOSECENTRAL_SERVICE_HOST=10.101.81.212
BUMPHUNTEXPOSE_PORT_80_TCP_PROTO=tcp
SSL_JET_V3_EXPOSE_SERVICE_HOST=10.99.91.182
ABCDNNEXPOSE_SERVICE_PORT=80
SPATOPEXPOSE_PORT_8800_TCP_PROTO=tcp
SSL_JET_V3_EXPOSE_SERVICE_PORT=80
ABCDNNEXPOSE_PORT_80_TCP_ADDR=10.108.83.250
XILINXD_SERVICE_PORT_XILINXD=2100
MODEL_INDEX=2
PFEXPOSECENTRAL_PORT_80_TCP=tcp://10.101.81.212:80
HOME=/root
KUBERNETES_PORT_443_TCP=tcp://10.96.0.1:443
PFEXPOSECENTRAL_PORT_80_TCP_ADDR=10.101.81.212
J_JEPA_VOL_EXPOSE_PORT_80_TCP=tcp://10.98.255.12:80
XILINXD_PORT_2100_TCP_PORT=2100
SPATOPEXPOSE_PORT=tcp://10.98.174.135:8800
L1ANOMALYEXPOSE_PORT_80_TCP_PROTO=tcp
PYTORCH_VERSION=2.2.1
L1ANOMALYEXPOSE_SERVICE_PORT=80
XILINXD_SERVICE_PORT=2100
HHBBVVEXPOSE_PORT_80_TCP_ADDR=10.102.7.121
PFEXPOSEEAST_PORT_80_TCP_PORT=80
SPATOPEXPOSE_PORT_8800_TCP_PORT=8800
PFEXPOSE_SERVICE_HOST=10.97.167.151
PFEXPOSECENTRAL_PORT=tcp://10.101.81.212:80
PFEXPOSE_PORT=tcp://10.97.167.151:80
SPATOPEXPOSE_PORT_8800_TCP=tcp://10.98.174.135:8800
HHBBVVEXPOSE_PORT=tcp://10.102.7.121:80
ABCDNNEXPOSE_PORT_80_TCP_PORT=80
PFEXPOSEEAST_PORT=tcp://10.106.41.90:80
PFEXPOSECENTRAL_SERVICE_PORT=80
XILINXD_PORT_2100_TCP=tcp://10.111.109.177:2100
PFEXPOSEEAST_PORT_80_TCP=tcp://10.106.41.90:80
BUMPHUNTEXPOSE_PORT=tcp://10.96.169.13:80
SSL_JET_V3_EXPOSE_PORT_80_TCP_PROTO=tcp
PFEXPOSEEAST_PORT_80_TCP_PROTO=tcp
GGEXPOSE_SERVICE_PORT=80
PFEXPOSE_PORT_80_TCP_PORT=80
J_JEPA_VOL_EXPOSE_PORT_80_TCP_PORT=80
GGEXPOSE_PORT_80_TCP_PROTO=tcp
L1ANOMALYEXPOSE_PORT=tcp://10.101.29.4:80
SPATOPEXPOSE_SERVICE_PORT=8800
SSL_JET_V3_EXPOSE_PORT_80_TCP_PORT=80
HHBBVVEXPOSE_SERVICE_HOST=10.102.7.121
L1ANOMALYEXPOSE_SERVICE_HOST=10.101.29.4
XILINXD_PORT=tcp://10.111.109.177:2100
SSL_JET_V2_EXPOSE_PORT_80_TCP_ADDR=10.98.170.207
SHLVL=1
BUMPHUNTEXPOSE_PORT_80_TCP_ADDR=10.96.169.13
GGEXPOSE_PORT_80_TCP_ADDR=10.103.93.169
GGEXPOSE_PORT=tcp://10.103.93.169:80
PFEXPOSECENTRAL_PORT_80_TCP_PROTO=tcp
KUBERNETES_PORT_443_TCP_PROTO=tcp
SSL_JET_V2_EXPOSE_SERVICE_PORT=80
KUBERNETES_PORT_443_TCP_ADDR=10.96.0.1
SSL_JET_V3_EXPOSE_PORT_80_TCP=tcp://10.99.91.182:80
L1ANOMALYEXPOSE_PORT_80_TCP_ADDR=10.101.29.4
LD_LIBRARY_PATH=/usr/local/nvidia/lib:/usr/local/nvidia/lib64
SSL_JET_V2_EXPOSE_PORT_80_TCP_PORT=80
BUMPHUNTEXPOSE_PORT_80_TCP_PORT=80
XILINXD_PORT_2100_TCP_ADDR=10.111.109.177
GGEXPOSE_PORT_80_TCP_PORT=80
SSL_JET_V2_EXPOSE_PORT_80_TCP_PROTO=tcp
XILINXD_PORT_2100_TCP_PROTO=tcp
SSL_JET_V2_EXPOSE_SERVICE_HOST=10.98.170.207
KUBERNETES_SERVICE_HOST=10.96.0.1
ABCDNNEXPOSE_PORT_80_TCP=tcp://10.108.83.250:80
KUBERNETES_PORT=tcp://10.96.0.1:443
KUBERNETES_PORT_443_TCP_PORT=443
PATH=/opt/conda/bin:/usr/local/sbin:/usr/local/bin:/usr/sbin:/usr/bin:/sbin:/bin
HHBBVVEXPOSE_PORT_80_TCP=tcp://10.102.7.121:80
HHBBVVEXPOSE_SERVICE_PORT=80
BUMPHUNTEXPOSE_PORT_80_TCP=tcp://10.96.169.13:80
L1ANOMALYEXPOSE_PORT_80_TCP=tcp://10.101.29.4:80
GGEXPOSE_PORT_80_TCP=tcp://10.103.93.169:80
ABCDNNEXPOSE_SERVICE_HOST=10.108.83.250
ABCDNNEXPOSE_PORT=tcp://10.108.83.250:80
J_JEPA_VOL_EXPOSE_PORT_80_TCP_PROTO=tcp
J_JEPA_VOL_EXPOSE_SERVICE_PORT=80
SSL_JET_V2_EXPOSE_PORT_80_TCP=tcp://10.98.170.207:80
PFEXPOSECENTRAL_PORT_80_TCP_PORT=80
OLDPWD=/app
_=/usr/bin/env
MODEL_INDEX from terminal: 2
All command-line arguments: ['global_search_parallel2.py', '2']
model index:  2
Processing medium model with index 2
Loaded 1 files for train set
Loaded 1 files for validation set
Loaded 2 files for test set
Loaded Dataset...
[I 2024-09-16 04:56:55,136] A new study created in memory with name: no-name-9d33b102-b8cc-4fc5-8c9c-ab03eabf8c15
input shape:  torch.Size([4096, 3, 8])
Conv bp:  tensor(4304976.)
DeepSetsArchitecture(
  (phi): ConvPhi(
    (layers): Sequential(
      (0): Conv1d(3, 64, kernel_size=(1,), stride=(1,))
      (1): BatchNorm1d(64, eps=1e-05, momentum=0.1, affine=True, track_running_stats=True)
      (2): ReLU()
      (3): Conv1d(64, 16, kernel_size=(1,), stride=(1,))
      (4): BatchNorm1d(16, eps=1e-05, momentum=0.1, affine=True, track_running_stats=True)
    )
  )
  (rho): Rho(
    (layers): Sequential(
      (0): Linear(in_features=16, out_features=128, bias=True)
      (1): BatchNorm1d(128, eps=1e-05, momentum=0.1, affine=True, track_running_stats=True)
      (2): ReLU()
      (3): Linear(in_features=128, out_features=16, bias=True)
      (4): BatchNorm1d(16, eps=1e-05, momentum=0.1, affine=True, track_running_stats=True)
      (5): LeakyReLU(negative_slope=0.0078125)
      (6): Linear(in_features=16, out_features=64, bias=True)
      (7): BatchNorm1d(64, eps=1e-05, momentum=0.1, affine=True, track_running_stats=True)
      (8): ReLU()
      (9): Linear(in_features=64, out_features=5, bias=True)
      (10): BatchNorm1d(5, eps=1e-05, momentum=0.1, affine=True, track_running_stats=True)
    )
  )
)
BOPs: tensor(5234512.)
Trial  0  begins evaluation...
[I 2024-09-16 05:01:39,814] Trial 0 finished with values: [0.6654798645714618, 5234512.0] and parameters: {'bottleneck_dim': 4, 'aggregator_type': 0, 'phi_len': 2, 'phi_MLP_width_0': 3, 'phi_MLP_acts_0': 0, 'phi_MLP_norms_0': 'batch', 'phi_MLP_norms_1': 'batch', 'rho_len': 4, 'rho_MLP_width_0': 4, 'rho_MLP_width_1': 1, 'rho_MLP_width_2': 3, 'rho_MLP_acts_0': 0, 'rho_MLP_acts_1': 1, 'rho_MLP_acts_2': 0, 'rho_MLP_norms_0': 'batch', 'rho_MLP_norms_1': 'batch', 'rho_MLP_norms_2': 'batch', 'rho_MLP_norms_3': 'batch'}. 
Test Accuracy: 0.6655
Accuracy:  0.6654798645714618 , Inference time:  0.058031558990478516 , Validation Loss:  0.8808052714179162 , Param Count:  7535
Conv bp:  tensor(5381220.)
DeepSetsArchitecture(
  (phi): ConvPhi(
    (layers): Sequential(
      (0): Conv1d(3, 128, kernel_size=(1,), stride=(1,))
      (1): LeakyReLU(negative_slope=0.0078125)
      (2): Conv1d(128, 8, kernel_size=(1,), stride=(1,))
    )
  )
  (rho): Rho(
    (layers): Sequential(
      (0): Linear(in_features=8, out_features=5, bias=True)
      (1): BatchNorm1d(5, eps=1e-05, momentum=0.1, affine=True, track_running_stats=True)
    )
  )
)
BOPs: tensor(5388692.)
Trial  1  begins evaluation...
[I 2024-09-16 05:06:10,434] Trial 1 finished with values: [0.5920872465914101, 5388692.0] and parameters: {'bottleneck_dim': 3, 'aggregator_type': 1, 'phi_len': 2, 'phi_MLP_width_0': 4, 'phi_MLP_acts_0': 1, 'phi_MLP_norms_0': None, 'phi_MLP_norms_1': None, 'rho_len': 1, 'rho_MLP_norms_0': 'batch'}. 
Test Accuracy: 0.5921
Accuracy:  0.5920872465914101 , Inference time:  0.02793145179748535 , Validation Loss:  1.067167919509265 , Param Count:  1599
Conv bp:  tensor(1039380.)
DeepSetsArchitecture(
  (phi): ConvPhi(
    (layers): Sequential(
      (0): Conv1d(3, 64, kernel_size=(1,), stride=(1,))
    )
  )
  (rho): Rho(
    (layers): Sequential(
      (0): Linear(in_features=64, out_features=16, bias=True)
      (1): ReLU()
      (2): Linear(in_features=16, out_features=5, bias=True)
    )
  )
)
BOPs: tensor(1237780.)
Trial  2  begins evaluation...
[I 2024-09-16 05:10:39,267] Trial 2 finished with values: [0.3963564066516375, 1237780.0] and parameters: {'bottleneck_dim': 6, 'aggregator_type': 0, 'phi_len': 1, 'phi_MLP_norms_0': 'layer', 'rho_len': 2, 'rho_MLP_width_0': 1, 'rho_MLP_acts_0': 0, 'rho_MLP_norms_0': 'layer', 'rho_MLP_norms_1': None}. 
Test Accuracy: 0.3964
Accuracy:  0.3963564066516375 , Inference time:  0.018149375915527344 , Validation Loss:  1.3891484153514007 , Param Count:  1381
Conv bp:  tensor(38207224.)
DeepSetsArchitecture(
  (phi): ConvPhi(
    (layers): Sequential(
      (0): Conv1d(3, 32, kernel_size=(1,), stride=(1,))
      (1): ReLU()
      (2): Conv1d(32, 128, kernel_size=(1,), stride=(1,))
      (3): BatchNorm1d(128, eps=1e-05, momentum=0.1, affine=True, track_running_stats=True)
      (4): ReLU()
      (5): Conv1d(128, 128, kernel_size=(1,), stride=(1,))
      (6): BatchNorm1d(128, eps=1e-05, momentum=0.1, affine=True, track_running_stats=True)
      (7): LeakyReLU(negative_slope=0.0078125)
      (8): Conv1d(128, 32, kernel_size=(1,), stride=(1,))
    )
  )
  (rho): Rho(
    (layers): Sequential(
      (0): Linear(in_features=32, out_features=64, bias=True)
      (1): ReLU()
      (2): Linear(in_features=64, out_features=8, bias=True)
      (3): BatchNorm1d(8, eps=1e-05, momentum=0.1, affine=True, track_running_stats=True)
      (4): ReLU()
      (5): Linear(in_features=8, out_features=128, bias=True)
      (6): ReLU()
      (7): Linear(in_features=128, out_features=5, bias=True)
    )
  )
)
BOPs: tensor(38929016.)
Trial  3  begins evaluation...
[I 2024-09-16 05:15:41,222] Trial 3 finished with values: [0.664102286812355, 38929016.0] and parameters: {'bottleneck_dim': 5, 'aggregator_type': 0, 'phi_len': 4, 'phi_MLP_width_0': 2, 'phi_MLP_width_1': 4, 'phi_MLP_width_2': 4, 'phi_MLP_acts_0': 0, 'phi_MLP_acts_1': 0, 'phi_MLP_acts_2': 1, 'phi_MLP_norms_0': None, 'phi_MLP_norms_1': 'batch', 'phi_MLP_norms_2': 'batch', 'phi_MLP_norms_3': 'layer', 'rho_len': 4, 'rho_MLP_width_0': 3, 'rho_MLP_width_1': 0, 'rho_MLP_width_2': 4, 'rho_MLP_acts_0': 0, 'rho_MLP_acts_1': 0, 'rho_MLP_acts_2': 0, 'rho_MLP_norms_0': None, 'rho_MLP_norms_1': 'batch', 'rho_MLP_norms_2': None, 'rho_MLP_norms_3': 'layer'}. 
Test Accuracy: 0.6641
Accuracy:  0.664102286812355 , Inference time:  0.06925725936889648 , Validation Loss:  0.8865967522673055 , Param Count:  29949
Conv bp:  tensor(6225930.)
DeepSetsArchitecture(
  (phi): ConvPhi(
    (layers): Sequential(
      (0): Conv1d(3, 8, kernel_size=(1,), stride=(1,))
      (1): BatchNorm1d(8, eps=1e-05, momentum=0.1, affine=True, track_running_stats=True)
      (2): LeakyReLU(negative_slope=0.0078125)
      (3): Conv1d(8, 16, kernel_size=(1,), stride=(1,))
      (4): ReLU()
      (5): Conv1d(16, 128, kernel_size=(1,), stride=(1,))
      (6): ReLU()
      (7): Conv1d(128, 64, kernel_size=(1,), stride=(1,))
    )
  )
  (rho): Rho(
    (layers): Sequential(
      (0): Linear(in_features=64, out_features=64, bias=True)
      (1): BatchNorm1d(64, eps=1e-05, momentum=0.1, affine=True, track_running_stats=True)
      (2): ReLU()
      (3): Linear(in_features=64, out_features=5, bias=True)
      (4): BatchNorm1d(5, eps=1e-05, momentum=0.1, affine=True, track_running_stats=True)
    )
  )
)
BOPs: tensor(6993674.)
Trial  4  begins evaluation...
[I 2024-09-16 05:20:33,676] Trial 4 finished with values: [0.6574223656736904, 6993674.0] and parameters: {'bottleneck_dim': 6, 'aggregator_type': 1, 'phi_len': 4, 'phi_MLP_width_0': 0, 'phi_MLP_width_1': 1, 'phi_MLP_width_2': 4, 'phi_MLP_acts_0': 1, 'phi_MLP_acts_1': 0, 'phi_MLP_acts_2': 0, 'phi_MLP_norms_0': 'batch', 'phi_MLP_norms_1': None, 'phi_MLP_norms_2': 'layer', 'phi_MLP_norms_3': None, 'rho_len': 2, 'rho_MLP_width_0': 3, 'rho_MLP_acts_0': 0, 'rho_MLP_norms_0': 'batch', 'rho_MLP_norms_1': 'batch'}. 
Test Accuracy: 0.6574
Accuracy:  0.6574223656736904 , Inference time:  0.06171107292175293 , Validation Loss:  0.9000547301201594 , Param Count:  15247
Conv bp:  tensor(259845.)
DeepSetsArchitecture(
  (phi): ConvPhi(
    (layers): Sequential(
      (0): Conv1d(3, 16, kernel_size=(1,), stride=(1,))
      (1): BatchNorm1d(16, eps=1e-05, momentum=0.1, affine=True, track_running_stats=True)
    )
  )
  (rho): Rho(
    (layers): Sequential(
      (0): Linear(in_features=16, out_features=64, bias=True)
      (1): ReLU()
      (2): Linear(in_features=64, out_features=8, bias=True)
      (3): BatchNorm1d(8, eps=1e-05, momentum=0.1, affine=True, track_running_stats=True)
      (4): ReLU()
      (5): Linear(in_features=8, out_features=5, bias=True)
      (6): BatchNorm1d(5, eps=1e-05, momentum=0.1, affine=True, track_running_stats=True)
    )
  )
)
BOPs: tensor(528629.)
Trial  5  begins evaluation...
[I 2024-09-16 05:25:23,112] Trial 5 finished with values: [0.3996622605252431, 528629.0] and parameters: {'bottleneck_dim': 4, 'aggregator_type': 0, 'phi_len': 1, 'phi_MLP_norms_0': 'batch', 'rho_len': 3, 'rho_MLP_width_0': 3, 'rho_MLP_width_1': 0, 'rho_MLP_acts_0': 0, 'rho_MLP_acts_1': 0, 'rho_MLP_norms_0': 'layer', 'rho_MLP_norms_1': 'batch', 'rho_MLP_norms_2': 'batch'}. 
Test Accuracy: 0.3997
Accuracy:  0.3996622605252431 , Inference time:  0.03406047821044922 , Validation Loss:  1.3786230444097194 , Param Count:  1775
Conv bp:  tensor(60761832.)
DeepSetsArchitecture(
  (phi): ConvPhi(
    (layers): Sequential(
      (0): Conv1d(3, 128, kernel_size=(1,), stride=(1,))
      (1): ReLU()
      (2): Conv1d(128, 128, kernel_size=(1,), stride=(1,))
      (3): BatchNorm1d(128, eps=1e-05, momentum=0.1, affine=True, track_running_stats=True)
      (4): ReLU()
      (5): Conv1d(128, 32, kernel_size=(1,), stride=(1,))
      (6): BatchNorm1d(32, eps=1e-05, momentum=0.1, affine=True, track_running_stats=True)
      (7): ReLU()
      (8): Conv1d(32, 1, kernel_size=(1,), stride=(1,))
    )
  )
  (rho): Rho(
    (layers): Sequential(
      (0): Linear(in_features=1, out_features=32, bias=True)
      (1): LeakyReLU(negative_slope=0.0078125)
      (2): Linear(in_features=32, out_features=64, bias=True)
      (3): BatchNorm1d(64, eps=1e-05, momentum=0.1, affine=True, track_running_stats=True)
      (4): ReLU()
      (5): Linear(in_features=64, out_features=8, bias=True)
      (6): LeakyReLU(negative_slope=0.0078125)
      (7): Linear(in_features=8, out_features=5, bias=True)
    )
  )
)
BOPs: tensor(61210032.)
Trial  6  begins evaluation...
[I 2024-09-16 05:30:23,473] Trial 6 finished with values: [0.5666519702855812, 61210032.0] and parameters: {'bottleneck_dim': 0, 'aggregator_type': 0, 'phi_len': 4, 'phi_MLP_width_0': 4, 'phi_MLP_width_1': 4, 'phi_MLP_width_2': 2, 'phi_MLP_acts_0': 0, 'phi_MLP_acts_1': 0, 'phi_MLP_acts_2': 0, 'phi_MLP_norms_0': None, 'phi_MLP_norms_1': 'batch', 'phi_MLP_norms_2': 'batch', 'phi_MLP_norms_3': 'layer', 'rho_len': 4, 'rho_MLP_width_0': 2, 'rho_MLP_width_1': 3, 'rho_MLP_width_2': 0, 'rho_MLP_acts_0': 1, 'rho_MLP_acts_1': 0, 'rho_MLP_acts_2': 1, 'rho_MLP_norms_0': None, 'rho_MLP_norms_1': 'batch', 'rho_MLP_norms_2': None, 'rho_MLP_norms_3': 'layer'}. 
Test Accuracy: 0.5667
Accuracy:  0.5666519702855812 , Inference time:  0.0683746337890625 , Validation Loss:  1.1104637429016788 , Param Count:  24374
Conv bp:  tensor(658828.5000)
DeepSetsArchitecture(
  (phi): ConvPhi(
    (layers): Sequential(
      (0): Conv1d(3, 16, kernel_size=(1,), stride=(1,))
      (1): LeakyReLU(negative_slope=0.0078125)
      (2): Conv1d(16, 8, kernel_size=(1,), stride=(1,))
    )
  )
  (rho): Rho(
    (layers): Sequential(
      (0): Linear(in_features=8, out_features=128, bias=True)
      (1): LeakyReLU(negative_slope=0.0078125)
      (2): Linear(in_features=128, out_features=128, bias=True)
      (3): ReLU()
      (4): Linear(in_features=128, out_features=64, bias=True)
      (5): ReLU()
      (6): Linear(in_features=64, out_features=5, bias=True)
      (7): BatchNorm1d(5, eps=1e-05, momentum=0.1, affine=True, track_running_stats=True)
    )
  )
)
BOPs: tensor(5161100.5000)
Trial  7  begins evaluation...
[I 2024-09-16 05:35:12,547] Trial 7 finished with values: [0.6105165084726023, 5161100.5] and parameters: {'bottleneck_dim': 3, 'aggregator_type': 0, 'phi_len': 2, 'phi_MLP_width_0': 1, 'phi_MLP_acts_0': 1, 'phi_MLP_norms_0': 'layer', 'phi_MLP_norms_1': 'layer', 'rho_len': 4, 'rho_MLP_width_0': 4, 'rho_MLP_width_1': 4, 'rho_MLP_width_2': 3, 'rho_MLP_acts_0': 1, 'rho_MLP_acts_1': 0, 'rho_MLP_acts_2': 0, 'rho_MLP_norms_0': None, 'rho_MLP_norms_1': 'layer', 'rho_MLP_norms_2': 'layer', 'rho_MLP_norms_3': 'batch'}. 
Test Accuracy: 0.6105
Accuracy:  0.6105165084726023 , Inference time:  0.03885364532470703 , Validation Loss:  1.0110915059946022 , Param Count:  26455
Conv bp:  tensor(1243479.7500)
DeepSetsArchitecture(
  (phi): ConvPhi(
    (layers): Sequential(
      (0): Conv1d(3, 64, kernel_size=(1,), stride=(1,))
      (1): BatchNorm1d(64, eps=1e-05, momentum=0.1, affine=True, track_running_stats=True)
      (2): LeakyReLU(negative_slope=0.0078125)
      (3): Conv1d(64, 1, kernel_size=(1,), stride=(1,))
      (4): BatchNorm1d(1, eps=1e-05, momentum=0.1, affine=True, track_running_stats=True)
    )
  )
  (rho): Rho(
    (layers): Sequential(
      (0): Linear(in_features=1, out_features=8, bias=True)
      (1): LeakyReLU(negative_slope=0.0078125)
      (2): Linear(in_features=8, out_features=8, bias=True)
      (3): ReLU()
      (4): Linear(in_features=8, out_features=5, bias=True)
    )
  )
)
BOPs: tensor(1262239.7500)
Trial  8  begins evaluation...
