[I 2024-09-17 02:43:31,264] Trial 192 finished with values: [0.6220545540757502, 750853.0] and parameters: {'bottleneck_dim': 4, 'aggregator_type': 1, 'phi_len': 1, 'phi_MLP_norms_0': 'batch', 'rho_len': 3, 'rho_MLP_width_0': 2, 'rho_MLP_width_1': 3, 'rho_MLP_acts_0': 0, 'rho_MLP_acts_1': 0, 'rho_MLP_norms_0': None, 'rho_MLP_norms_1': 'batch', 'rho_MLP_norms_2': None}. 
Test Accuracy: 0.6221
Accuracy:  0.6220545540757502 , Inference time:  0.04429483413696289 , Validation Loss:  0.9858358113133178 , Param Count:  3205
Conv bp:  tensor(21170456.)
DeepSetsArchitecture(
  (phi): ConvPhi(
    (layers): Sequential(
      (0): Conv1d(3, 128, kernel_size=(1,), stride=(1,))
      (1): ReLU()
      (2): Conv1d(128, 32, kernel_size=(1,), stride=(1,))
      (3): BatchNorm1d(32, eps=1e-05, momentum=0.1, affine=True, track_running_stats=True)
      (4): LeakyReLU(negative_slope=0.0078125)
      (5): Conv1d(32, 128, kernel_size=(1,), stride=(1,))
      (6): LeakyReLU(negative_slope=0.0078125)
      (7): Conv1d(128, 4, kernel_size=(1,), stride=(1,))
      (8): BatchNorm1d(4, eps=1e-05, momentum=0.1, affine=True, track_running_stats=True)
    )
  )
  (rho): Rho(
    (layers): Sequential(
      (0): Linear(in_features=4, out_features=8, bias=True)
      (1): BatchNorm1d(8, eps=1e-05, momentum=0.1, affine=True, track_running_stats=True)
      (2): ReLU()
      (3): Linear(in_features=8, out_features=5, bias=True)
    )
  )
)
BOPs: tensor(21182728.)
Trial  193  begins evaluation...
[I 2024-09-17 02:51:04,009] Trial 193 finished with values: [0.6014674197868748, 21182728.0] and parameters: {'bottleneck_dim': 2, 'aggregator_type': 1, 'phi_len': 4, 'phi_MLP_width_0': 4, 'phi_MLP_width_1': 2, 'phi_MLP_width_2': 4, 'phi_MLP_acts_0': 0, 'phi_MLP_acts_1': 1, 'phi_MLP_acts_2': 1, 'phi_MLP_norms_0': 'layer', 'phi_MLP_norms_1': 'batch', 'phi_MLP_norms_2': 'layer', 'phi_MLP_norms_3': 'batch', 'rho_len': 2, 'rho_MLP_width_0': 0, 'rho_MLP_acts_0': 0, 'rho_MLP_norms_0': 'batch', 'rho_MLP_norms_1': 'layer'}. 
Test Accuracy: 0.6015
Accuracy:  0.6014674197868748 , Inference time:  0.07159709930419922 , Validation Loss:  1.0450800916775553 , Param Count:  9553
Conv bp:  tensor(1285777.5000)
DeepSetsArchitecture(
  (phi): ConvPhi(
    (layers): Sequential(
      (0): Conv1d(3, 8, kernel_size=(1,), stride=(1,))
      (1): BatchNorm1d(8, eps=1e-05, momentum=0.1, affine=True, track_running_stats=True)
      (2): ReLU()
      (3): Conv1d(8, 32, kernel_size=(1,), stride=(1,))
      (4): BatchNorm1d(32, eps=1e-05, momentum=0.1, affine=True, track_running_stats=True)
      (5): ReLU()
      (6): Conv1d(32, 8, kernel_size=(1,), stride=(1,))
      (7): ReLU()
      (8): Conv1d(8, 4, kernel_size=(1,), stride=(1,))
    )
  )
  (rho): Rho(
    (layers): Sequential(
      (0): Linear(in_features=4, out_features=64, bias=True)
      (1): BatchNorm1d(64, eps=1e-05, momentum=0.1, affine=True, track_running_stats=True)
      (2): LeakyReLU(negative_slope=0.0078125)
      (3): Linear(in_features=64, out_features=32, bias=True)
      (4): LeakyReLU(negative_slope=0.0078125)
      (5): Linear(in_features=32, out_features=5, bias=True)
      (6): BatchNorm1d(5, eps=1e-05, momentum=0.1, affine=True, track_running_stats=True)
    )
  )
)
BOPs: tensor(1707761.5000)
Trial  194  begins evaluation...
[I 2024-09-17 02:58:51,138] Trial 194 finished with values: [0.6390696358902264, 1707761.5] and parameters: {'bottleneck_dim': 2, 'aggregator_type': 0, 'phi_len': 4, 'phi_MLP_width_0': 0, 'phi_MLP_width_1': 2, 'phi_MLP_width_2': 0, 'phi_MLP_acts_0': 0, 'phi_MLP_acts_1': 0, 'phi_MLP_acts_2': 0, 'phi_MLP_norms_0': 'batch', 'phi_MLP_norms_1': 'batch', 'phi_MLP_norms_2': 'layer', 'phi_MLP_norms_3': None, 'rho_len': 3, 'rho_MLP_width_0': 3, 'rho_MLP_width_1': 2, 'rho_MLP_acts_0': 1, 'rho_MLP_acts_1': 1, 'rho_MLP_norms_0': 'batch', 'rho_MLP_norms_1': 'layer', 'rho_MLP_norms_2': 'batch'}. 
Test Accuracy: 0.6391
Accuracy:  0.6390696358902264 , Inference time:  0.0803518295288086 , Validation Loss:  0.950574892313302 , Param Count:  3403
Conv bp:  tensor(519690.)
DeepSetsArchitecture(
  (phi): ConvPhi(
    (layers): Sequential(
      (0): Conv1d(3, 32, kernel_size=(1,), stride=(1,))
    )
  )
  (rho): Rho(
    (layers): Sequential(
      (0): Linear(in_features=32, out_features=64, bias=True)
      (1): BatchNorm1d(64, eps=1e-05, momentum=0.1, affine=True, track_running_stats=True)
      (2): LeakyReLU(negative_slope=0.0078125)
      (3): Linear(in_features=64, out_features=8, bias=True)
      (4): ReLU()
      (5): Linear(in_features=8, out_features=5, bias=True)
    )
  )
)
BOPs: tensor(966778.)
Trial  195  begins evaluation...
[I 2024-09-17 03:06:27,671] Trial 195 finished with values: [0.39968888038532246, 966778.0] and parameters: {'bottleneck_dim': 5, 'aggregator_type': 0, 'phi_len': 1, 'phi_MLP_norms_0': None, 'rho_len': 3, 'rho_MLP_width_0': 3, 'rho_MLP_width_1': 0, 'rho_MLP_acts_0': 1, 'rho_MLP_acts_1': 0, 'rho_MLP_norms_0': 'batch', 'rho_MLP_norms_1': 'layer', 'rho_MLP_norms_2': None}. 
Test Accuracy: 0.3997
Accuracy:  0.39968888038532246 , Inference time:  0.050318002700805664 , Validation Loss:  1.3790979661098144 , Param Count:  2933
Conv bp:  tensor(2178088.)
DeepSetsArchitecture(
  (phi): ConvPhi(
    (layers): Sequential(
      (0): Conv1d(3, 32, kernel_size=(1,), stride=(1,))
      (1): LeakyReLU(negative_slope=0.0078125)
      (2): Conv1d(32, 16, kernel_size=(1,), stride=(1,))
      (3): LeakyReLU(negative_slope=0.0078125)
      (4): Conv1d(16, 2, kernel_size=(1,), stride=(1,))
      (5): BatchNorm1d(2, eps=1e-05, momentum=0.1, affine=True, track_running_stats=True)
    )
  )
  (rho): Rho(
    (layers): Sequential(
      (0): Linear(in_features=2, out_features=16, bias=True)
      (1): ReLU()
      (2): Linear(in_features=16, out_features=64, bias=True)
      (3): BatchNorm1d(64, eps=1e-05, momentum=0.1, affine=True, track_running_stats=True)
      (4): LeakyReLU(negative_slope=0.0078125)
      (5): Linear(in_features=64, out_features=5, bias=True)
    )
  )
)
BOPs: tensor(2410520.)
Trial  196  begins evaluation...
[I 2024-09-17 03:14:14,298] Trial 196 finished with values: [0.5829216960178353, 2410520.0] and parameters: {'bottleneck_dim': 1, 'aggregator_type': 1, 'phi_len': 3, 'phi_MLP_width_0': 2, 'phi_MLP_width_1': 1, 'phi_MLP_acts_0': 1, 'phi_MLP_acts_1': 1, 'phi_MLP_norms_0': 'layer', 'phi_MLP_norms_1': 'layer', 'phi_MLP_norms_2': 'batch', 'rho_len': 3, 'rho_MLP_width_0': 1, 'rho_MLP_width_1': 3, 'rho_MLP_acts_0': 0, 'rho_MLP_acts_1': 1, 'rho_MLP_norms_0': 'layer', 'rho_MLP_norms_1': 'batch', 'rho_MLP_norms_2': None}. 
Test Accuracy: 0.5829
Accuracy:  0.5829216960178353 , Inference time:  0.05976414680480957 , Validation Loss:  1.0884002163296653 , Param Count:  2283
Conv bp:  tensor(3149216.5000)
DeepSetsArchitecture(
  (phi): ConvPhi(
    (layers): Sequential(
      (0): Conv1d(3, 8, kernel_size=(1,), stride=(1,))
      (1): LeakyReLU(negative_slope=0.0078125)
      (2): Conv1d(8, 64, kernel_size=(1,), stride=(1,))
      (3): BatchNorm1d(64, eps=1e-05, momentum=0.1, affine=True, track_running_stats=True)
      (4): ReLU()
      (5): Conv1d(64, 16, kernel_size=(1,), stride=(1,))
    )
  )
  (rho): Rho(
    (layers): Sequential(
      (0): Linear(in_features=16, out_features=128, bias=True)
      (1): BatchNorm1d(128, eps=1e-05, momentum=0.1, affine=True, track_running_stats=True)
      (2): LeakyReLU(negative_slope=0.0078125)
      (3): Linear(in_features=128, out_features=5, bias=True)
    )
  )
)
BOPs: tensor(3606688.5000)
Trial  197  begins evaluation...
[I 2024-09-17 03:22:03,325] Trial 197 finished with values: [0.6531066208583242, 3606688.5] and parameters: {'bottleneck_dim': 4, 'aggregator_type': 0, 'phi_len': 3, 'phi_MLP_width_0': 0, 'phi_MLP_width_1': 3, 'phi_MLP_acts_0': 1, 'phi_MLP_acts_1': 0, 'phi_MLP_norms_0': 'layer', 'phi_MLP_norms_1': 'batch', 'phi_MLP_norms_2': None, 'rho_len': 2, 'rho_MLP_width_0': 4, 'rho_MLP_acts_0': 1, 'rho_MLP_norms_0': 'batch', 'rho_MLP_norms_1': 'layer'}. 
Test Accuracy: 0.6531
Accuracy:  0.6531066208583242 , Inference time:  0.05107307434082031 , Validation Loss:  0.9168470801950312 , Param Count:  4853
Conv bp:  tensor(129922.5000)
DeepSetsArchitecture(
  (phi): ConvPhi(
    (layers): Sequential(
      (0): Conv1d(3, 8, kernel_size=(1,), stride=(1,))
    )
  )
  (rho): Rho(
    (layers): Sequential(
      (0): Linear(in_features=8, out_features=64, bias=True)
      (1): BatchNorm1d(64, eps=1e-05, momentum=0.1, affine=True, track_running_stats=True)
      (2): LeakyReLU(negative_slope=0.0078125)
      (3): Linear(in_features=64, out_features=5, bias=True)
      (4): BatchNorm1d(5, eps=1e-05, momentum=0.1, affine=True, track_running_stats=True)
    )
  )
)
BOPs: tensor(270978.5000)
Trial  198  begins evaluation...
[I 2024-09-17 03:29:42,260] Trial 198 finished with values: [0.399208059162639, 270978.5] and parameters: {'bottleneck_dim': 3, 'aggregator_type': 0, 'phi_len': 1, 'phi_MLP_norms_0': 'layer', 'rho_len': 2, 'rho_MLP_width_0': 3, 'rho_MLP_acts_0': 1, 'rho_MLP_norms_0': 'batch', 'rho_MLP_norms_1': 'batch'}. 
Test Accuracy: 0.3992
Accuracy:  0.399208059162639 , Inference time:  0.03973197937011719 , Validation Loss:  1.3810981422865471 , Param Count:  1071
Conv bp:  tensor(4767136.5000)
DeepSetsArchitecture(
  (phi): ConvPhi(
    (layers): Sequential(
      (0): Conv1d(3, 8, kernel_size=(1,), stride=(1,))
      (1): BatchNorm1d(8, eps=1e-05, momentum=0.1, affine=True, track_running_stats=True)
      (2): ReLU()
      (3): Conv1d(8, 64, kernel_size=(1,), stride=(1,))
      (4): BatchNorm1d(64, eps=1e-05, momentum=0.1, affine=True, track_running_stats=True)
      (5): LeakyReLU(negative_slope=0.0078125)
      (6): Conv1d(64, 32, kernel_size=(1,), stride=(1,))
      (7): LeakyReLU(negative_slope=0.0078125)
      (8): Conv1d(32, 16, kernel_size=(1,), stride=(1,))
      (9): BatchNorm1d(16, eps=1e-05, momentum=0.1, affine=True, track_running_stats=True)
    )
  )
  (rho): Rho(
    (layers): Sequential(
      (0): Linear(in_features=16, out_features=32, bias=True)
      (1): BatchNorm1d(32, eps=1e-05, momentum=0.1, affine=True, track_running_stats=True)
      (2): LeakyReLU(negative_slope=0.0078125)
      (3): Linear(in_features=32, out_features=8, bias=True)
      (4): ReLU()
      (5): Linear(in_features=8, out_features=5, bias=True)
    )
  )
)
BOPs: tensor(4905104.5000)
Trial  199  begins evaluation...
[I 2024-09-17 03:37:41,245] Trial 199 finished with values: [0.6413805724933659, 4905104.5] and parameters: {'bottleneck_dim': 4, 'aggregator_type': 1, 'phi_len': 4, 'phi_MLP_width_0': 0, 'phi_MLP_width_1': 3, 'phi_MLP_width_2': 2, 'phi_MLP_acts_0': 0, 'phi_MLP_acts_1': 1, 'phi_MLP_acts_2': 1, 'phi_MLP_norms_0': 'batch', 'phi_MLP_norms_1': 'batch', 'phi_MLP_norms_2': 'layer', 'phi_MLP_norms_3': 'batch', 'rho_len': 3, 'rho_MLP_width_0': 2, 'rho_MLP_width_1': 0, 'rho_MLP_acts_0': 1, 'rho_MLP_acts_1': 0, 'rho_MLP_norms_0': 'batch', 'rho_MLP_norms_1': 'layer', 'rho_MLP_norms_2': None}. 
Test Accuracy: 0.6414
Accuracy:  0.6413805724933659 , Inference time:  0.07177042961120605 , Validation Loss:  0.9397213973966586 , Param Count:  4309
Conv bp:  tensor(64961.2500)
DeepSetsArchitecture(
  (phi): ConvPhi(
    (layers): Sequential(
      (0): Conv1d(3, 4, kernel_size=(1,), stride=(1,))
      (1): BatchNorm1d(4, eps=1e-05, momentum=0.1, affine=True, track_running_stats=True)
    )
  )
  (rho): Rho(
    (layers): Sequential(
      (0): Linear(in_features=4, out_features=32, bias=True)
      (1): LeakyReLU(negative_slope=0.0078125)
      (2): Linear(in_features=32, out_features=5, bias=True)
    )
  )
)
BOPs: tensor(113537.2500)
Trial  200  begins evaluation...
[I 2024-09-17 03:45:21,591] Trial 200 finished with values: [0.5518812754240461, 113537.25] and parameters: {'bottleneck_dim': 2, 'aggregator_type': 1, 'phi_len': 1, 'phi_MLP_norms_0': 'batch', 'rho_len': 2, 'rho_MLP_width_0': 2, 'rho_MLP_acts_0': 1, 'rho_MLP_norms_0': None, 'rho_MLP_norms_1': None}. 
Test Accuracy: 0.5519
Accuracy:  0.5518812754240461 , Inference time:  0.023530244827270508 , Validation Loss:  1.137220055473094 , Param Count:  349
Conv bp:  tensor(64961.2500)
DeepSetsArchitecture(
  (phi): ConvPhi(
    (layers): Sequential(
      (0): Conv1d(3, 4, kernel_size=(1,), stride=(1,))
    )
  )
  (rho): Rho(
    (layers): Sequential(
      (0): Linear(in_features=4, out_features=64, bias=True)
      (1): ReLU()
      (2): Linear(in_features=64, out_features=32, bias=True)
      (3): ReLU()
      (4): Linear(in_features=32, out_features=5, bias=True)
    )
  )
)
BOPs: tensor(486785.2500)
Trial  201  begins evaluation...
[I 2024-09-17 03:53:06,039] Trial 201 finished with values: [0.5697615026911015, 486785.25] and parameters: {'bottleneck_dim': 2, 'aggregator_type': 1, 'phi_len': 1, 'phi_MLP_norms_0': None, 'rho_len': 3, 'rho_MLP_width_0': 3, 'rho_MLP_width_1': 2, 'rho_MLP_acts_0': 0, 'rho_MLP_acts_1': 0, 'rho_MLP_norms_0': 'layer', 'rho_MLP_norms_1': 'layer', 'rho_MLP_norms_2': None}. 
Test Accuracy: 0.5698
Accuracy:  0.5697615026911015 , Inference time:  0.040422916412353516 , Validation Loss:  1.1038357420843474 , Param Count:  2581
Conv bp:  tensor(129922.5000)
DeepSetsArchitecture(
  (phi): ConvPhi(
    (layers): Sequential(
      (0): Conv1d(3, 8, kernel_size=(1,), stride=(1,))
    )
  )
  (rho): Rho(
    (layers): Sequential(
      (0): Linear(in_features=8, out_features=32, bias=True)
      (1): BatchNorm1d(32, eps=1e-05, momentum=0.1, affine=True, track_running_stats=True)
      (2): LeakyReLU(negative_slope=0.0078125)
      (3): Linear(in_features=32, out_features=16, bias=True)
      (4): BatchNorm1d(16, eps=1e-05, momentum=0.1, affine=True, track_running_stats=True)
      (5): ReLU()
      (6): Linear(in_features=16, out_features=16, bias=True)
      (7): LeakyReLU(negative_slope=0.0078125)
      (8): Linear(in_features=16, out_features=5, bias=True)
    )
  )
)
BOPs: tensor(316738.5000)
Trial  202  begins evaluation...
[I 2024-09-17 04:00:42,388] Trial 202 finished with values: [0.6097511874953208, 316738.5] and parameters: {'bottleneck_dim': 3, 'aggregator_type': 1, 'phi_len': 1, 'phi_MLP_norms_0': None, 'rho_len': 4, 'rho_MLP_width_0': 2, 'rho_MLP_width_1': 1, 'rho_MLP_width_2': 1, 'rho_MLP_acts_0': 1, 'rho_MLP_acts_1': 0, 'rho_MLP_acts_2': 1, 'rho_MLP_norms_0': 'batch', 'rho_MLP_norms_1': 'batch', 'rho_MLP_norms_2': None, 'rho_MLP_norms_3': None}. 
Test Accuracy: 0.6098
Accuracy:  0.6097511874953208 , Inference time:  0.051900386810302734 , Validation Loss:  1.0167387715813254 , Param Count:  1301
Conv bp:  tensor(19868932.)
DeepSetsArchitecture(
  (phi): ConvPhi(
    (layers): Sequential(
      (0): Conv1d(3, 64, kernel_size=(1,), stride=(1,))
      (1): LeakyReLU(negative_slope=0.0078125)
      (2): Conv1d(64, 64, kernel_size=(1,), stride=(1,))
      (3): BatchNorm1d(64, eps=1e-05, momentum=0.1, affine=True, track_running_stats=True)
      (4): ReLU()
      (5): Conv1d(64, 64, kernel_size=(1,), stride=(1,))
    )
  )
  (rho): Rho(
    (layers): Sequential(
      (0): Linear(in_features=64, out_features=8, bias=True)
      (1): BatchNorm1d(8, eps=1e-05, momentum=0.1, affine=True, track_running_stats=True)
      (2): LeakyReLU(negative_slope=0.0078125)
      (3): Linear(in_features=8, out_features=128, bias=True)
      (4): BatchNorm1d(128, eps=1e-05, momentum=0.1, affine=True, track_running_stats=True)
      (5): LeakyReLU(negative_slope=0.0078125)
      (6): Linear(in_features=128, out_features=32, bias=True)
      (7): ReLU()
      (8): Linear(in_features=32, out_features=5, bias=True)
    )
  )
)
BOPs: tensor(20875716.)
Trial  203  begins evaluation...
[I 2024-09-17 04:08:24,581] Trial 203 finished with values: [0.6519586393924017, 20875716.0] and parameters: {'bottleneck_dim': 6, 'aggregator_type': 0, 'phi_len': 3, 'phi_MLP_width_0': 3, 'phi_MLP_width_1': 3, 'phi_MLP_acts_0': 1, 'phi_MLP_acts_1': 0, 'phi_MLP_norms_0': 'layer', 'phi_MLP_norms_1': 'batch', 'phi_MLP_norms_2': None, 'rho_len': 4, 'rho_MLP_width_0': 0, 'rho_MLP_width_1': 4, 'rho_MLP_width_2': 2, 'rho_MLP_acts_0': 1, 'rho_MLP_acts_1': 1, 'rho_MLP_acts_2': 0, 'rho_MLP_norms_0': 'batch', 'rho_MLP_norms_1': 'batch', 'rho_MLP_norms_2': 'layer', 'rho_MLP_norms_3': None}. 
Test Accuracy: 0.6520
Accuracy:  0.6519586393924017 , Inference time:  0.08136630058288574 , Validation Loss:  0.9182258138851244 , Param Count:  14941
Conv bp:  tensor(1096849.5000)
DeepSetsArchitecture(
  (phi): ConvPhi(
    (layers): Sequential(
      (0): Conv1d(3, 8, kernel_size=(1,), stride=(1,))
      (1): BatchNorm1d(8, eps=1e-05, momentum=0.1, affine=True, track_running_stats=True)
      (2): LeakyReLU(negative_slope=0.0078125)
      (3): Conv1d(8, 32, kernel_size=(1,), stride=(1,))
      (4): ReLU()
      (5): Conv1d(32, 4, kernel_size=(1,), stride=(1,))
    )
  )
  (rho): Rho(
    (layers): Sequential(
      (0): Linear(in_features=4, out_features=128, bias=True)
      (1): BatchNorm1d(128, eps=1e-05, momentum=0.1, affine=True, track_running_stats=True)
      (2): ReLU()
      (3): Linear(in_features=128, out_features=8, bias=True)
      (4): LeakyReLU(negative_slope=0.0078125)
      (5): Linear(in_features=8, out_features=16, bias=True)
      (6): LeakyReLU(negative_slope=0.0078125)
      (7): Linear(in_features=16, out_features=5, bias=True)
    )
  )
)
BOPs: tensor(1394225.5000)
Trial  204  begins evaluation...
[I 2024-09-17 04:16:03,046] Trial 204 finished with values: [0.6204124414571046, 1394225.5] and parameters: {'bottleneck_dim': 2, 'aggregator_type': 0, 'phi_len': 3, 'phi_MLP_width_0': 0, 'phi_MLP_width_1': 2, 'phi_MLP_acts_0': 1, 'phi_MLP_acts_1': 0, 'phi_MLP_norms_0': 'batch', 'phi_MLP_norms_1': 'layer', 'phi_MLP_norms_2': 'layer', 'rho_len': 4, 'rho_MLP_width_0': 4, 'rho_MLP_width_1': 0, 'rho_MLP_width_2': 1, 'rho_MLP_acts_0': 0, 'rho_MLP_acts_1': 1, 'rho_MLP_acts_2': 1, 'rho_MLP_norms_0': 'batch', 'rho_MLP_norms_1': None, 'rho_MLP_norms_2': None, 'rho_MLP_norms_3': None}. 
Test Accuracy: 0.6204
Accuracy:  0.6204124414571046 , Inference time:  0.06306982040405273 , Validation Loss:  0.986799144420494 , Param Count:  2625
Conv bp:  tensor(32480.6250)
DeepSetsArchitecture(
  (phi): ConvPhi(
    (layers): Sequential(
      (0): Conv1d(3, 2, kernel_size=(1,), stride=(1,))
    )
  )
  (rho): Rho(
    (layers): Sequential(
      (0): Linear(in_features=2, out_features=64, bias=True)
      (1): ReLU()
      (2): Linear(in_features=64, out_features=5, bias=True)
      (3): BatchNorm1d(5, eps=1e-05, momentum=0.1, affine=True, track_running_stats=True)
    )
  )
)
BOPs: tensor(108432.6250)
Trial  205  begins evaluation...
[I 2024-09-17 04:23:34,843] Trial 205 finished with values: [0.42239894851552684, 108432.625] and parameters: {'bottleneck_dim': 1, 'aggregator_type': 1, 'phi_len': 1, 'phi_MLP_norms_0': None, 'rho_len': 2, 'rho_MLP_width_0': 3, 'rho_MLP_acts_0': 0, 'rho_MLP_norms_0': 'layer', 'rho_MLP_norms_1': 'batch'}. 
Test Accuracy: 0.4224
Accuracy:  0.42239894851552684 , Inference time:  0.032096147537231445 , Validation Loss:  1.3620415642147972 , Param Count:  535
Conv bp:  tensor(1500953.)
DeepSetsArchitecture(
  (phi): ConvPhi(
    (layers): Sequential(
      (0): Conv1d(3, 32, kernel_size=(1,), stride=(1,))
      (1): ReLU()
      (2): Conv1d(32, 8, kernel_size=(1,), stride=(1,))
      (3): ReLU()
      (4): Conv1d(8, 16, kernel_size=(1,), stride=(1,))
    )
  )
  (rho): Rho(
    (layers): Sequential(
      (0): Linear(in_features=16, out_features=5, bias=True)
      (1): BatchNorm1d(5, eps=1e-05, momentum=0.1, affine=True, track_running_stats=True)
    )
  )
)
BOPs: tensor(1516441.)
Trial  206  begins evaluation...
[I 2024-09-17 04:31:07,651] Trial 206 finished with values: [0.5508580745522457, 1516441.0] and parameters: {'bottleneck_dim': 4, 'aggregator_type': 0, 'phi_len': 3, 'phi_MLP_width_0': 2, 'phi_MLP_width_1': 0, 'phi_MLP_acts_0': 0, 'phi_MLP_acts_1': 0, 'phi_MLP_norms_0': 'layer', 'phi_MLP_norms_1': None, 'phi_MLP_norms_2': None, 'rho_len': 1, 'rho_MLP_norms_0': 'batch'}. 
Test Accuracy: 0.5509
Accuracy:  0.5508580745522457 , Inference time:  0.04020214080810547 , Validation Loss:  1.1707447832133495 , Param Count:  631
Conv bp:  tensor(129922.5000)
DeepSetsArchitecture(
  (phi): ConvPhi(
    (layers): Sequential(
      (0): Conv1d(3, 8, kernel_size=(1,), stride=(1,))
    )
  )
  (rho): Rho(
    (layers): Sequential(
      (0): Linear(in_features=8, out_features=5, bias=True)
    )
  )
)
BOPs: tensor(137394.5000)
Trial  207  begins evaluation...
