[I 2024-09-16 09:24:31,839] Trial 42 finished with values: [0.6489971799585729, 8384224.5] and parameters: {'bottleneck_dim': 4, 'aggregator_type': 1, 'phi_len': 4, 'phi_MLP_width_0': 0, 'phi_MLP_width_1': 3, 'phi_MLP_width_2': 3, 'phi_MLP_acts_0': 0, 'phi_MLP_acts_1': 1, 'phi_MLP_acts_2': 0, 'phi_MLP_norms_0': None, 'phi_MLP_norms_1': 'layer', 'phi_MLP_norms_2': None, 'phi_MLP_norms_3': 'batch', 'rho_len': 3, 'rho_MLP_width_0': 3, 'rho_MLP_width_1': 2, 'rho_MLP_acts_0': 1, 'rho_MLP_acts_1': 1, 'rho_MLP_norms_0': None, 'rho_MLP_norms_1': 'batch', 'rho_MLP_norms_2': 'layer'}. 
Test Accuracy: 0.6490
Accuracy:  0.6489971799585729 , Inference time:  0.07553863525390625 , Validation Loss:  0.9201117514753018 , Param Count:  9237
Conv bp:  tensor(1500953.)
DeepSetsArchitecture(
  (phi): ConvPhi(
    (layers): Sequential(
      (0): Conv1d(3, 32, kernel_size=(1,), stride=(1,))
      (1): LeakyReLU(negative_slope=0.0078125)
      (2): Conv1d(32, 8, kernel_size=(1,), stride=(1,))
      (3): LeakyReLU(negative_slope=0.0078125)
      (4): Conv1d(8, 16, kernel_size=(1,), stride=(1,))
    )
  )
  (rho): Rho(
    (layers): Sequential(
      (0): Linear(in_features=16, out_features=16, bias=True)
      (1): BatchNorm1d(16, eps=1e-05, momentum=0.1, affine=True, track_running_stats=True)
      (2): ReLU()
      (3): Linear(in_features=16, out_features=128, bias=True)
      (4): BatchNorm1d(128, eps=1e-05, momentum=0.1, affine=True, track_running_stats=True)
      (5): LeakyReLU(negative_slope=0.0078125)
      (6): Linear(in_features=128, out_features=5, bias=True)
    )
  )
)
BOPs: tensor(2001433.)
Trial  43  begins evaluation...
[I 2024-09-16 09:30:48,903] Trial 43 finished with values: [0.6357820831704253, 2001433.0] and parameters: {'bottleneck_dim': 4, 'aggregator_type': 0, 'phi_len': 3, 'phi_MLP_width_0': 2, 'phi_MLP_width_1': 0, 'phi_MLP_acts_0': 1, 'phi_MLP_acts_1': 1, 'phi_MLP_norms_0': None, 'phi_MLP_norms_1': 'layer', 'phi_MLP_norms_2': None, 'rho_len': 3, 'rho_MLP_width_0': 1, 'rho_MLP_width_1': 4, 'rho_MLP_acts_0': 0, 'rho_MLP_acts_1': 1, 'rho_MLP_norms_0': 'batch', 'rho_MLP_norms_1': 'batch', 'rho_MLP_norms_2': 'layer'}. 
Test Accuracy: 0.6358
Accuracy:  0.6357820831704253 , Inference time:  0.05298113822937012 , Validation Loss:  0.9586609484387093 , Param Count:  3917
Conv bp:  tensor(414150.2500)
DeepSetsArchitecture(
  (phi): ConvPhi(
    (layers): Sequential(
      (0): Conv1d(3, 8, kernel_size=(1,), stride=(1,))
      (1): ReLU()
      (2): Conv1d(8, 8, kernel_size=(1,), stride=(1,))
      (3): ReLU()
      (4): Conv1d(8, 8, kernel_size=(1,), stride=(1,))
    )
  )
  (rho): Rho(
    (layers): Sequential(
      (0): Linear(in_features=8, out_features=5, bias=True)
      (1): BatchNorm1d(5, eps=1e-05, momentum=0.1, affine=True, track_running_stats=True)
    )
  )
)
BOPs: tensor(421622.2500)
Trial  44  begins evaluation...
[I 2024-09-16 09:37:07,214] Trial 44 finished with values: [0.548716839557112, 421622.25] and parameters: {'bottleneck_dim': 3, 'aggregator_type': 1, 'phi_len': 3, 'phi_MLP_width_0': 0, 'phi_MLP_width_1': 0, 'phi_MLP_acts_0': 0, 'phi_MLP_acts_1': 0, 'phi_MLP_norms_0': 'layer', 'phi_MLP_norms_1': None, 'phi_MLP_norms_2': None, 'rho_len': 1, 'rho_MLP_norms_0': 'batch'}. 
Test Accuracy: 0.5487
Accuracy:  0.548716839557112 , Inference time:  0.03864574432373047 , Validation Loss:  1.1357413266791778 , Param Count:  231
Conv bp:  tensor(16240.3125)
DeepSetsArchitecture(
  (phi): ConvPhi(
    (layers): Sequential(
      (0): Conv1d(3, 1, kernel_size=(1,), stride=(1,))
    )
  )
  (rho): Rho(
    (layers): Sequential(
      (0): Linear(in_features=1, out_features=64, bias=True)
      (1): ReLU()
      (2): Linear(in_features=64, out_features=128, bias=True)
      (3): LeakyReLU(negative_slope=0.0078125)
      (4): Linear(in_features=128, out_features=64, bias=True)
      (5): LeakyReLU(negative_slope=0.0078125)
      (6): Linear(in_features=64, out_features=5, bias=True)
    )
  )
)
BOPs: tensor(2916032.2500)
Trial  45  begins evaluation...
[I 2024-09-16 09:43:24,562] Trial 45 finished with values: [0.36105514470389566, 2916032.25] and parameters: {'bottleneck_dim': 0, 'aggregator_type': 1, 'phi_len': 1, 'phi_MLP_norms_0': 'layer', 'rho_len': 4, 'rho_MLP_width_0': 3, 'rho_MLP_width_1': 4, 'rho_MLP_width_2': 3, 'rho_MLP_acts_0': 0, 'rho_MLP_acts_1': 1, 'rho_MLP_acts_2': 1, 'rho_MLP_norms_0': 'layer', 'rho_MLP_norms_1': None, 'rho_MLP_norms_2': 'layer', 'rho_MLP_norms_3': 'layer'}. 
Test Accuracy: 0.3611
Accuracy:  0.36105514470389566 , Inference time:  0.035283803939819336 , Validation Loss:  1.4563205339470688 , Param Count:  17033
Conv bp:  tensor(16240.3125)
DeepSetsArchitecture(
  (phi): ConvPhi(
    (layers): Sequential(
      (0): Conv1d(3, 1, kernel_size=(1,), stride=(1,))
      (1): BatchNorm1d(1, eps=1e-05, momentum=0.1, affine=True, track_running_stats=True)
    )
  )
  (rho): Rho(
    (layers): Sequential(
      (0): Linear(in_features=1, out_features=32, bias=True)
      (1): BatchNorm1d(32, eps=1e-05, momentum=0.1, affine=True, track_running_stats=True)
      (2): LeakyReLU(negative_slope=0.0078125)
      (3): Linear(in_features=32, out_features=32, bias=True)
      (4): BatchNorm1d(32, eps=1e-05, momentum=0.1, affine=True, track_running_stats=True)
      (5): ReLU()
      (6): Linear(in_features=32, out_features=5, bias=True)
    )
  )
)
BOPs: tensor(222856.3125)
Trial  46  begins evaluation...
[I 2024-09-16 09:49:44,285] Trial 46 finished with values: [0.3397259818153081, 222856.3125] and parameters: {'bottleneck_dim': 0, 'aggregator_type': 0, 'phi_len': 1, 'phi_MLP_norms_0': 'batch', 'rho_len': 3, 'rho_MLP_width_0': 2, 'rho_MLP_width_1': 2, 'rho_MLP_acts_0': 1, 'rho_MLP_acts_1': 0, 'rho_MLP_norms_0': 'batch', 'rho_MLP_norms_1': 'batch', 'rho_MLP_norms_2': None}. 
Test Accuracy: 0.3397
Accuracy:  0.3397259818153081 , Inference time:  0.03855490684509277 , Validation Loss:  1.4667880372936224 , Param Count:  1419
Conv bp:  tensor(64961.2500)
DeepSetsArchitecture(
  (phi): ConvPhi(
    (layers): Sequential(
      (0): Conv1d(3, 4, kernel_size=(1,), stride=(1,))
    )
  )
  (rho): Rho(
    (layers): Sequential(
      (0): Linear(in_features=4, out_features=32, bias=True)
      (1): LeakyReLU(negative_slope=0.0078125)
      (2): Linear(in_features=32, out_features=5, bias=True)
    )
  )
)
BOPs: tensor(113537.2500)
Trial  47  begins evaluation...
[I 2024-09-16 09:56:03,188] Trial 47 finished with values: [0.559045345267904, 113537.25] and parameters: {'bottleneck_dim': 2, 'aggregator_type': 1, 'phi_len': 1, 'phi_MLP_norms_0': None, 'rho_len': 2, 'rho_MLP_width_0': 2, 'rho_MLP_acts_0': 1, 'rho_MLP_norms_0': 'layer', 'rho_MLP_norms_1': 'layer'}. 
Test Accuracy: 0.5590
Accuracy:  0.559045345267904 , Inference time:  0.01839733123779297 , Validation Loss:  1.1316993593358669 , Param Count:  341
Conv bp:  tensor(2672178.)
DeepSetsArchitecture(
  (phi): ConvPhi(
    (layers): Sequential(
      (0): Conv1d(3, 64, kernel_size=(1,), stride=(1,))
      (1): ReLU()
      (2): Conv1d(64, 8, kernel_size=(1,), stride=(1,))
    )
  )
  (rho): Rho(
    (layers): Sequential(
      (0): Linear(in_features=8, out_features=16, bias=True)
      (1): BatchNorm1d(16, eps=1e-05, momentum=0.1, affine=True, track_running_stats=True)
      (2): ReLU()
      (3): Linear(in_features=16, out_features=16, bias=True)
      (4): BatchNorm1d(16, eps=1e-05, momentum=0.1, affine=True, track_running_stats=True)
      (5): LeakyReLU(negative_slope=0.0078125)
      (6): Linear(in_features=16, out_features=16, bias=True)
      (7): BatchNorm1d(16, eps=1e-05, momentum=0.1, affine=True, track_running_stats=True)
      (8): LeakyReLU(negative_slope=0.0078125)
      (9): Linear(in_features=16, out_features=5, bias=True)
    )
  )
)
BOPs: tensor(2793906.)
Trial  48  begins evaluation...
[I 2024-09-16 10:02:30,984] Trial 48 finished with values: [0.6485895633511076, 2793906.0] and parameters: {'bottleneck_dim': 3, 'aggregator_type': 0, 'phi_len': 2, 'phi_MLP_width_0': 3, 'phi_MLP_acts_0': 0, 'phi_MLP_norms_0': None, 'phi_MLP_norms_1': None, 'rho_len': 4, 'rho_MLP_width_0': 1, 'rho_MLP_width_1': 1, 'rho_MLP_width_2': 1, 'rho_MLP_acts_0': 0, 'rho_MLP_acts_1': 1, 'rho_MLP_acts_2': 1, 'rho_MLP_norms_0': 'batch', 'rho_MLP_norms_1': 'batch', 'rho_MLP_norms_2': 'batch', 'rho_MLP_norms_3': None}. 
Test Accuracy: 0.6486
Accuracy:  0.6485895633511076 , Inference time:  0.05206441879272461 , Validation Loss:  0.9291048500002647 , Param Count:  1645
Conv bp:  tensor(2212131.)
DeepSetsArchitecture(
  (phi): ConvPhi(
    (layers): Sequential(
      (0): Conv1d(3, 16, kernel_size=(1,), stride=(1,))
      (1): LeakyReLU(negative_slope=0.0078125)
      (2): Conv1d(16, 32, kernel_size=(1,), stride=(1,))
      (3): ReLU()
      (4): Conv1d(32, 8, kernel_size=(1,), stride=(1,))
    )
  )
  (rho): Rho(
    (layers): Sequential(
      (0): Linear(in_features=8, out_features=64, bias=True)
      (1): BatchNorm1d(64, eps=1e-05, momentum=0.1, affine=True, track_running_stats=True)
      (2): ReLU()
      (3): Linear(in_features=64, out_features=32, bias=True)
      (4): BatchNorm1d(32, eps=1e-05, momentum=0.1, affine=True, track_running_stats=True)
      (5): ReLU()
      (6): Linear(in_features=32, out_features=5, bias=True)
    )
  )
)
BOPs: tensor(2677411.)
Trial  49  begins evaluation...
[I 2024-09-16 10:09:00,573] Trial 49 finished with values: [0.6278643385380706, 2677411.0] and parameters: {'bottleneck_dim': 3, 'aggregator_type': 1, 'phi_len': 3, 'phi_MLP_width_0': 1, 'phi_MLP_width_1': 2, 'phi_MLP_acts_0': 1, 'phi_MLP_acts_1': 0, 'phi_MLP_norms_0': 'layer', 'phi_MLP_norms_1': None, 'phi_MLP_norms_2': 'layer', 'rho_len': 3, 'rho_MLP_width_0': 3, 'rho_MLP_width_1': 2, 'rho_MLP_acts_0': 0, 'rho_MLP_acts_1': 0, 'rho_MLP_norms_0': 'batch', 'rho_MLP_norms_1': 'batch', 'rho_MLP_norms_2': 'layer'}. 
Test Accuracy: 0.6279
Accuracy:  0.6278643385380706 , Inference time:  0.06556057929992676 , Validation Loss:  0.9715421049773287 , Param Count:  3885
Conv bp:  tensor(129922.5000)
DeepSetsArchitecture(
  (phi): ConvPhi(
    (layers): Sequential(
      (0): Conv1d(3, 8, kernel_size=(1,), stride=(1,))
    )
  )
  (rho): Rho(
    (layers): Sequential(
      (0): Linear(in_features=8, out_features=16, bias=True)
      (1): BatchNorm1d(16, eps=1e-05, momentum=0.1, affine=True, track_running_stats=True)
      (2): ReLU()
      (3): Linear(in_features=16, out_features=5, bias=True)
    )
  )
)
BOPs: tensor(165442.5000)
Trial  50  begins evaluation...
[I 2024-09-16 10:15:15,057] Trial 50 finished with values: [0.5523670878704944, 165442.5] and parameters: {'bottleneck_dim': 3, 'aggregator_type': 1, 'phi_len': 1, 'phi_MLP_norms_0': None, 'rho_len': 2, 'rho_MLP_width_0': 1, 'rho_MLP_acts_0': 0, 'rho_MLP_norms_0': 'batch', 'rho_MLP_norms_1': None}. 
Test Accuracy: 0.5524
Accuracy:  0.5523670878704944 , Inference time:  0.025419950485229492 , Validation Loss:  1.142318037902417 , Param Count:  293
Conv bp:  tensor(129922.5000)
DeepSetsArchitecture(
  (phi): ConvPhi(
    (layers): Sequential(
      (0): Conv1d(3, 8, kernel_size=(1,), stride=(1,))
    )
  )
  (rho): Rho(
    (layers): Sequential(
      (0): Linear(in_features=8, out_features=32, bias=True)
      (1): BatchNorm1d(32, eps=1e-05, momentum=0.1, affine=True, track_running_stats=True)
      (2): ReLU()
      (3): Linear(in_features=32, out_features=5, bias=True)
    )
  )
)
BOPs: tensor(200450.5000)
Trial  51  begins evaluation...
[I 2024-09-16 10:21:24,368] Trial 51 finished with values: [0.5625192370082605, 200450.5] and parameters: {'bottleneck_dim': 3, 'aggregator_type': 1, 'phi_len': 1, 'phi_MLP_norms_0': None, 'rho_len': 2, 'rho_MLP_width_0': 2, 'rho_MLP_acts_0': 0, 'rho_MLP_norms_0': 'batch', 'rho_MLP_norms_1': None}. 
Test Accuracy: 0.5625
Accuracy:  0.5625192370082605 , Inference time:  0.024921178817749023 , Validation Loss:  1.1172918928723756 , Param Count:  549
Conv bp:  tensor(3792966.)
DeepSetsArchitecture(
  (phi): ConvPhi(
    (layers): Sequential(
      (0): Conv1d(3, 32, kernel_size=(1,), stride=(1,))
      (1): LeakyReLU(negative_slope=0.0078125)
      (2): Conv1d(32, 32, kernel_size=(1,), stride=(1,))
      (3): BatchNorm1d(32, eps=1e-05, momentum=0.1, affine=True, track_running_stats=True)
      (4): LeakyReLU(negative_slope=0.0078125)
      (5): Conv1d(32, 1, kernel_size=(1,), stride=(1,))
    )
  )
  (rho): Rho(
    (layers): Sequential(
      (0): Linear(in_features=1, out_features=64, bias=True)
      (1): BatchNorm1d(64, eps=1e-05, momentum=0.1, affine=True, track_running_stats=True)
      (2): ReLU()
      (3): Linear(in_features=64, out_features=128, bias=True)
      (4): BatchNorm1d(128, eps=1e-05, momentum=0.1, affine=True, track_running_stats=True)
      (5): ReLU()
      (6): Linear(in_features=128, out_features=5, bias=True)
      (7): BatchNorm1d(5, eps=1e-05, momentum=0.1, affine=True, track_running_stats=True)
    )
  )
)
BOPs: tensor(5323806.)
Trial  52  begins evaluation...
[I 2024-09-16 10:27:38,696] Trial 52 finished with values: [0.5660130936436766, 5323806.0] and parameters: {'bottleneck_dim': 0, 'aggregator_type': 0, 'phi_len': 3, 'phi_MLP_width_0': 2, 'phi_MLP_width_1': 2, 'phi_MLP_acts_0': 1, 'phi_MLP_acts_1': 1, 'phi_MLP_norms_0': None, 'phi_MLP_norms_1': 'batch', 'phi_MLP_norms_2': 'layer', 'rho_len': 3, 'rho_MLP_width_0': 3, 'rho_MLP_width_1': 4, 'rho_MLP_acts_0': 0, 'rho_MLP_acts_1': 0, 'rho_MLP_norms_0': 'batch', 'rho_MLP_norms_1': 'batch', 'rho_MLP_norms_2': 'batch'}. 
Test Accuracy: 0.5660
Accuracy:  0.5660130936436766 , Inference time:  0.07579708099365234 , Validation Loss:  1.1147418979073869 , Param Count:  10768
Conv bp:  tensor(16714008.)
DeepSetsArchitecture(
  (phi): ConvPhi(
    (layers): Sequential(
      (0): Conv1d(3, 128, kernel_size=(1,), stride=(1,))
      (1): ReLU()
      (2): Conv1d(128, 32, kernel_size=(1,), stride=(1,))
      (3): BatchNorm1d(32, eps=1e-05, momentum=0.1, affine=True, track_running_stats=True)
      (4): ReLU()
      (5): Conv1d(32, 32, kernel_size=(1,), stride=(1,))
    )
  )
  (rho): Rho(
    (layers): Sequential(
      (0): Linear(in_features=32, out_features=8, bias=True)
      (1): BatchNorm1d(8, eps=1e-05, momentum=0.1, affine=True, track_running_stats=True)
      (2): ReLU()
      (3): Linear(in_features=8, out_features=128, bias=True)
      (4): ReLU()
      (5): Linear(in_features=128, out_features=16, bias=True)
      (6): ReLU()
      (7): Linear(in_features=16, out_features=5, bias=True)
      (8): BatchNorm1d(5, eps=1e-05, momentum=0.1, affine=True, track_running_stats=True)
    )
  )
)
BOPs: tensor(17301528.)
Trial  53  begins evaluation...
[I 2024-09-16 10:33:56,749] Trial 53 finished with values: [0.6555057357479764, 17301528.0] and parameters: {'bottleneck_dim': 5, 'aggregator_type': 0, 'phi_len': 3, 'phi_MLP_width_0': 4, 'phi_MLP_width_1': 2, 'phi_MLP_acts_0': 0, 'phi_MLP_acts_1': 0, 'phi_MLP_norms_0': None, 'phi_MLP_norms_1': 'batch', 'phi_MLP_norms_2': 'layer', 'rho_len': 4, 'rho_MLP_width_0': 0, 'rho_MLP_width_1': 4, 'rho_MLP_width_2': 1, 'rho_MLP_acts_0': 0, 'rho_MLP_acts_1': 0, 'rho_MLP_acts_2': 0, 'rho_MLP_norms_0': 'batch', 'rho_MLP_norms_1': None, 'rho_MLP_norms_2': 'layer', 'rho_MLP_norms_3': 'batch'}. 
Test Accuracy: 0.6555
Accuracy:  0.6555057357479764 , Inference time:  0.07161450386047363 , Validation Loss:  0.9138423188203046 , Param Count:  9351
Conv bp:  tensor(64961.2500)
DeepSetsArchitecture(
  (phi): ConvPhi(
    (layers): Sequential(
      (0): Conv1d(3, 4, kernel_size=(1,), stride=(1,))
    )
  )
  (rho): Rho(
    (layers): Sequential(
      (0): Linear(in_features=4, out_features=32, bias=True)
      (1): BatchNorm1d(32, eps=1e-05, momentum=0.1, affine=True, track_running_stats=True)
      (2): ReLU()
      (3): Linear(in_features=32, out_features=5, bias=True)
    )
  )
)
BOPs: tensor(113537.2500)
Trial  54  begins evaluation...
[I 2024-09-16 10:40:08,210] Trial 54 finished with values: [0.5568874728602208, 113537.25] and parameters: {'bottleneck_dim': 2, 'aggregator_type': 1, 'phi_len': 1, 'phi_MLP_norms_0': None, 'rho_len': 2, 'rho_MLP_width_0': 2, 'rho_MLP_acts_0': 0, 'rho_MLP_norms_0': 'batch', 'rho_MLP_norms_1': 'layer'}. 
Test Accuracy: 0.5569
Accuracy:  0.5568874728602208 , Inference time:  0.025529861450195312 , Validation Loss:  1.1317805059913064 , Param Count:  405
Conv bp:  tensor(2379545.)
DeepSetsArchitecture(
  (phi): ConvPhi(
    (layers): Sequential(
      (0): Conv1d(3, 32, kernel_size=(1,), stride=(1,))
      (1): ReLU()
      (2): Conv1d(32, 8, kernel_size=(1,), stride=(1,))
      (3): ReLU()
      (4): Conv1d(8, 64, kernel_size=(1,), stride=(1,))
      (5): ReLU()
      (6): Conv1d(64, 16, kernel_size=(1,), stride=(1,))
      (7): BatchNorm1d(16, eps=1e-05, momentum=0.1, affine=True, track_running_stats=True)
    )
  )
  (rho): Rho(
    (layers): Sequential(
      (0): Linear(in_features=16, out_features=8, bias=True)
      (1): LeakyReLU(negative_slope=0.0078125)
      (2): Linear(in_features=8, out_features=5, bias=True)
    )
  )
)
BOPs: tensor(2409737.)
Trial  55  begins evaluation...
[I 2024-09-16 10:46:19,529] Trial 55 finished with values: [0.6151051068537821, 2409737.0] and parameters: {'bottleneck_dim': 4, 'aggregator_type': 0, 'phi_len': 4, 'phi_MLP_width_0': 2, 'phi_MLP_width_1': 0, 'phi_MLP_width_2': 3, 'phi_MLP_acts_0': 0, 'phi_MLP_acts_1': 0, 'phi_MLP_acts_2': 0, 'phi_MLP_norms_0': 'layer', 'phi_MLP_norms_1': 'layer', 'phi_MLP_norms_2': 'layer', 'phi_MLP_norms_3': 'batch', 'rho_len': 2, 'rho_MLP_width_0': 0, 'rho_MLP_acts_0': 1, 'rho_MLP_norms_0': None, 'rho_MLP_norms_1': 'layer'}. 
Test Accuracy: 0.6151
Accuracy:  0.6151051068537821 , Inference time:  0.0541691780090332 , Validation Loss:  1.005154551697426 , Param Count:  2221
Conv bp:  tensor(259845.)
DeepSetsArchitecture(
  (phi): ConvPhi(
    (layers): Sequential(
      (0): Conv1d(3, 16, kernel_size=(1,), stride=(1,))
    )
  )
  (rho): Rho(
    (layers): Sequential(
      (0): Linear(in_features=16, out_features=16, bias=True)
      (1): LeakyReLU(negative_slope=0.0078125)
      (2): Linear(in_features=16, out_features=5, bias=True)
    )
  )
)
BOPs: tensor(318085.)
Trial  56  begins evaluation...
[I 2024-09-16 10:52:29,074] Trial 56 finished with values: [0.5735598239761752, 318085.0] and parameters: {'bottleneck_dim': 4, 'aggregator_type': 1, 'phi_len': 1, 'phi_MLP_norms_0': None, 'rho_len': 2, 'rho_MLP_width_0': 1, 'rho_MLP_acts_0': 1, 'rho_MLP_norms_0': 'layer', 'rho_MLP_norms_1': 'layer'}. 
Test Accuracy: 0.5736
Accuracy:  0.5735598239761752 , Inference time:  0.019001483917236328 , Validation Loss:  1.092213091801624 , Param Count:  421
Conv bp:  tensor(4304976.)
DeepSetsArchitecture(
  (phi): ConvPhi(
    (layers): Sequential(
      (0): Conv1d(3, 64, kernel_size=(1,), stride=(1,))
      (1): ReLU()
      (2): Conv1d(64, 16, kernel_size=(1,), stride=(1,))
    )
  )
  (rho): Rho(
    (layers): Sequential(
      (0): Linear(in_features=16, out_features=32, bias=True)
      (1): LeakyReLU(negative_slope=0.0078125)
      (2): Linear(in_features=32, out_features=8, bias=True)
      (3): ReLU()
      (4): Linear(in_features=8, out_features=5, bias=True)
    )
  )
)
BOPs: tensor(4442944.)
Trial  57  begins evaluation...
[I 2024-09-16 10:58:41,865] Trial 57 finished with values: [0.6292286063671377, 4442944.0] and parameters: {'bottleneck_dim': 4, 'aggregator_type': 1, 'phi_len': 2, 'phi_MLP_width_0': 3, 'phi_MLP_acts_0': 0, 'phi_MLP_norms_0': None, 'phi_MLP_norms_1': None, 'rho_len': 3, 'rho_MLP_width_0': 2, 'rho_MLP_width_1': 0, 'rho_MLP_acts_0': 1, 'rho_MLP_acts_1': 0, 'rho_MLP_norms_0': 'layer', 'rho_MLP_norms_1': None, 'rho_MLP_norms_2': None}. 
Test Accuracy: 0.6292
Accuracy:  0.6292286063671377 , Inference time:  0.03304290771484375 , Validation Loss:  0.9655086580587893 , Param Count:  2149
Conv bp:  tensor(2491567.5000)
DeepSetsArchitecture(
  (phi): ConvPhi(
    (layers): Sequential(
      (0): Conv1d(3, 128, kernel_size=(1,), stride=(1,))
      (1): LeakyReLU(negative_slope=0.0078125)
      (2): Conv1d(128, 1, kernel_size=(1,), stride=(1,))
      (3): BatchNorm1d(1, eps=1e-05, momentum=0.1, affine=True, track_running_stats=True)
    )
  )
  (rho): Rho(
    (layers): Sequential(
      (0): Linear(in_features=1, out_features=64, bias=True)
      (1): ReLU()
      (2): Linear(in_features=64, out_features=128, bias=True)
      (3): BatchNorm1d(128, eps=1e-05, momentum=0.1, affine=True, track_running_stats=True)
      (4): LeakyReLU(negative_slope=0.0078125)
      (5): Linear(in_features=128, out_features=8, bias=True)
      (6): LeakyReLU(negative_slope=0.0078125)
      (7): Linear(in_features=8, out_features=5, bias=True)
      (8): BatchNorm1d(5, eps=1e-05, momentum=0.1, affine=True, track_running_stats=True)
    )
  )
)
BOPs: tensor(4095863.5000)
Trial  58  begins evaluation...
