[I 2024-09-17 14:28:57,164] Trial 292 finished with values: [0.42262188984369153, 2278288.5] and parameters: {'bottleneck_dim': 1, 'aggregator_type': 1, 'phi_len': 1, 'phi_MLP_norms_0': 'layer', 'rho_len': 4, 'rho_MLP_width_0': 3, 'rho_MLP_width_1': 3, 'rho_MLP_width_2': 4, 'rho_MLP_acts_0': 1, 'rho_MLP_acts_1': 0, 'rho_MLP_acts_2': 0, 'rho_MLP_norms_0': None, 'rho_MLP_norms_1': 'batch', 'rho_MLP_norms_2': 'batch', 'rho_MLP_norms_3': 'batch'}. 
Test Accuracy: 0.4226
Accuracy:  0.42262188984369153 , Inference time:  0.05550217628479004 , Validation Loss:  1.3602740918697953 , Param Count:  13719
Conv bp:  tensor(129922.5000)
DeepSetsArchitecture(
  (phi): ConvPhi(
    (layers): Sequential(
      (0): Conv1d(3, 8, kernel_size=(1,), stride=(1,))
      (1): BatchNorm1d(8, eps=1e-05, momentum=0.1, affine=True, track_running_stats=True)
    )
  )
  (rho): Rho(
    (layers): Sequential(
      (0): Linear(in_features=8, out_features=64, bias=True)
      (1): BatchNorm1d(64, eps=1e-05, momentum=0.1, affine=True, track_running_stats=True)
      (2): LeakyReLU(negative_slope=0.0078125)
      (3): Linear(in_features=64, out_features=5, bias=True)
    )
  )
)
BOPs: tensor(270978.5000)
Trial  293  begins evaluation...
[I 2024-09-17 14:35:11,027] Trial 293 finished with values: [0.39921637786891384, 270978.5] and parameters: {'bottleneck_dim': 3, 'aggregator_type': 0, 'phi_len': 1, 'phi_MLP_norms_0': 'batch', 'rho_len': 2, 'rho_MLP_width_0': 3, 'rho_MLP_acts_0': 1, 'rho_MLP_norms_0': 'batch', 'rho_MLP_norms_1': 'layer'}. 
Test Accuracy: 0.3992
Accuracy:  0.39921637786891384 , Inference time:  0.029270648956298828 , Validation Loss:  1.3811036510532404 , Param Count:  1077
Conv bp:  tensor(259845.)
DeepSetsArchitecture(
  (phi): ConvPhi(
    (layers): Sequential(
      (0): Conv1d(3, 16, kernel_size=(1,), stride=(1,))
    )
  )
  (rho): Rho(
    (layers): Sequential(
      (0): Linear(in_features=16, out_features=8, bias=True)
      (1): LeakyReLU(negative_slope=0.0078125)
      (2): Linear(in_features=8, out_features=64, bias=True)
      (3): ReLU()
      (4): Linear(in_features=64, out_features=5, bias=True)
      (5): BatchNorm1d(5, eps=1e-05, momentum=0.1, affine=True, track_running_stats=True)
    )
  )
)
BOPs: tensor(423429.)
Trial  294  begins evaluation...
[I 2024-09-17 14:41:19,586] Trial 294 finished with values: [0.3742303117019241, 423429.0] and parameters: {'bottleneck_dim': 4, 'aggregator_type': 0, 'phi_len': 1, 'phi_MLP_norms_0': None, 'rho_len': 3, 'rho_MLP_width_0': 0, 'rho_MLP_width_1': 3, 'rho_MLP_acts_0': 1, 'rho_MLP_acts_1': 0, 'rho_MLP_norms_0': 'layer', 'rho_MLP_norms_1': 'layer', 'rho_MLP_norms_2': 'batch'}. 
Test Accuracy: 0.3742
Accuracy:  0.3742303117019241 , Inference time:  0.03573417663574219 , Validation Loss:  1.4154341245184139 , Param Count:  1111
Conv bp:  tensor(5714000.)
DeepSetsArchitecture(
  (phi): ConvPhi(
    (layers): Sequential(
      (0): Conv1d(3, 64, kernel_size=(1,), stride=(1,))
      (1): ReLU()
      (2): Conv1d(64, 16, kernel_size=(1,), stride=(1,))
      (3): LeakyReLU(negative_slope=0.0078125)
      (4): Conv1d(16, 64, kernel_size=(1,), stride=(1,))
    )
  )
  (rho): Rho(
    (layers): Sequential(
      (0): Linear(in_features=64, out_features=32, bias=True)
      (1): BatchNorm1d(32, eps=1e-05, momentum=0.1, affine=True, track_running_stats=True)
      (2): LeakyReLU(negative_slope=0.0078125)
      (3): Linear(in_features=32, out_features=64, bias=True)
      (4): ReLU()
      (5): Linear(in_features=64, out_features=64, bias=True)
      (6): BatchNorm1d(64, eps=1e-05, momentum=0.1, affine=True, track_running_stats=True)
      (7): LeakyReLU(negative_slope=0.0078125)
      (8): Linear(in_features=64, out_features=5, bias=True)
    )
  )
)
BOPs: tensor(7182800.)
Trial  295  begins evaluation...
[I 2024-09-17 14:47:32,816] Trial 295 finished with values: [0.6604620209465024, 7182800.0] and parameters: {'bottleneck_dim': 6, 'aggregator_type': 0, 'phi_len': 3, 'phi_MLP_width_0': 3, 'phi_MLP_width_1': 1, 'phi_MLP_acts_0': 0, 'phi_MLP_acts_1': 1, 'phi_MLP_norms_0': None, 'phi_MLP_norms_1': None, 'phi_MLP_norms_2': 'layer', 'rho_len': 4, 'rho_MLP_width_0': 2, 'rho_MLP_width_1': 3, 'rho_MLP_width_2': 3, 'rho_MLP_acts_0': 1, 'rho_MLP_acts_1': 0, 'rho_MLP_acts_2': 1, 'rho_MLP_norms_0': 'batch', 'rho_MLP_norms_1': 'layer', 'rho_MLP_norms_2': 'batch', 'rho_MLP_norms_3': None}. 
Test Accuracy: 0.6605
Accuracy:  0.6604620209465024 , Inference time:  0.07544565200805664 , Validation Loss:  0.8931814805180037 , Param Count:  11253
Conv bp:  tensor(18308988.)
DeepSetsArchitecture(
  (phi): ConvPhi(
    (layers): Sequential(
      (0): Conv1d(3, 16, kernel_size=(1,), stride=(1,))
      (1): ReLU()
      (2): Conv1d(16, 128, kernel_size=(1,), stride=(1,))
      (3): BatchNorm1d(128, eps=1e-05, momentum=0.1, affine=True, track_running_stats=True)
      (4): LeakyReLU(negative_slope=0.0078125)
      (5): Conv1d(128, 64, kernel_size=(1,), stride=(1,))
      (6): BatchNorm1d(64, eps=1e-05, momentum=0.1, affine=True, track_running_stats=True)
    )
  )
  (rho): Rho(
    (layers): Sequential(
      (0): Linear(in_features=64, out_features=128, bias=True)
      (1): BatchNorm1d(128, eps=1e-05, momentum=0.1, affine=True, track_running_stats=True)
      (2): ReLU()
      (3): Linear(in_features=128, out_features=5, bias=True)
      (4): BatchNorm1d(5, eps=1e-05, momentum=0.1, affine=True, track_running_stats=True)
    )
  )
)
BOPs: tensor(19837564.)
Trial  296  begins evaluation...
[I 2024-09-17 14:53:50,583] Trial 296 finished with values: [0.6613022102802573, 19837564.0] and parameters: {'bottleneck_dim': 6, 'aggregator_type': 1, 'phi_len': 3, 'phi_MLP_width_0': 1, 'phi_MLP_width_1': 4, 'phi_MLP_acts_0': 0, 'phi_MLP_acts_1': 1, 'phi_MLP_norms_0': None, 'phi_MLP_norms_1': 'batch', 'phi_MLP_norms_2': 'batch', 'rho_len': 2, 'rho_MLP_width_0': 4, 'rho_MLP_acts_0': 0, 'rho_MLP_norms_0': 'batch', 'rho_MLP_norms_1': 'batch'}. 
Test Accuracy: 0.6613
Accuracy:  0.6613022102802573 , Inference time:  0.07144880294799805 , Validation Loss:  0.8903821946001377 , Param Count:  20111
Conv bp:  tensor(16240.3125)
DeepSetsArchitecture(
  (phi): ConvPhi(
    (layers): Sequential(
      (0): Conv1d(3, 1, kernel_size=(1,), stride=(1,))
      (1): BatchNorm1d(1, eps=1e-05, momentum=0.1, affine=True, track_running_stats=True)
    )
  )
  (rho): Rho(
    (layers): Sequential(
      (0): Linear(in_features=1, out_features=64, bias=True)
      (1): BatchNorm1d(64, eps=1e-05, momentum=0.1, affine=True, track_running_stats=True)
      (2): LeakyReLU(negative_slope=0.0078125)
      (3): Linear(in_features=64, out_features=32, bias=True)
      (4): ReLU()
      (5): Linear(in_features=32, out_features=16, bias=True)
      (6): LeakyReLU(negative_slope=0.0078125)
      (7): Linear(in_features=16, out_features=5, bias=True)
      (8): BatchNorm1d(5, eps=1e-05, momentum=0.1, affine=True, track_running_stats=True)
    )
  )
)
BOPs: tensor(479296.3125)
Trial  297  begins evaluation...
[I 2024-09-17 15:00:00,625] Trial 297 finished with values: [0.36000532397201584, 479296.3125] and parameters: {'bottleneck_dim': 0, 'aggregator_type': 1, 'phi_len': 1, 'phi_MLP_norms_0': 'batch', 'rho_len': 4, 'rho_MLP_width_0': 3, 'rho_MLP_width_1': 2, 'rho_MLP_width_2': 1, 'rho_MLP_acts_0': 1, 'rho_MLP_acts_1': 0, 'rho_MLP_acts_2': 1, 'rho_MLP_norms_0': 'batch', 'rho_MLP_norms_1': 'layer', 'rho_MLP_norms_2': None, 'rho_MLP_norms_3': 'batch'}. 
Test Accuracy: 0.3600
Accuracy:  0.36000532397201584 , Inference time:  0.05411815643310547 , Validation Loss:  1.457416750135876 , Param Count:  2965
Conv bp:  tensor(4304976.)
DeepSetsArchitecture(
  (phi): ConvPhi(
    (layers): Sequential(
      (0): Conv1d(3, 64, kernel_size=(1,), stride=(1,))
      (1): ReLU()
      (2): Conv1d(64, 16, kernel_size=(1,), stride=(1,))
    )
  )
  (rho): Rho(
    (layers): Sequential(
      (0): Linear(in_features=16, out_features=128, bias=True)
      (1): BatchNorm1d(128, eps=1e-05, momentum=0.1, affine=True, track_running_stats=True)
      (2): LeakyReLU(negative_slope=0.0078125)
      (3): Linear(in_features=128, out_features=128, bias=True)
      (4): BatchNorm1d(128, eps=1e-05, momentum=0.1, affine=True, track_running_stats=True)
      (5): ReLU()
      (6): Linear(in_features=128, out_features=32, bias=True)
      (7): LeakyReLU(negative_slope=0.0078125)
      (8): Linear(in_features=32, out_features=5, bias=True)
      (9): BatchNorm1d(5, eps=1e-05, momentum=0.1, affine=True, track_running_stats=True)
    )
  )
)
BOPs: tensor(8241808.)
Trial  298  begins evaluation...
[I 2024-09-17 15:06:17,560] Trial 298 finished with values: [0.6655048206902863, 8241808.0] and parameters: {'bottleneck_dim': 4, 'aggregator_type': 0, 'phi_len': 2, 'phi_MLP_width_0': 3, 'phi_MLP_acts_0': 0, 'phi_MLP_norms_0': 'layer', 'phi_MLP_norms_1': 'layer', 'rho_len': 4, 'rho_MLP_width_0': 4, 'rho_MLP_width_1': 4, 'rho_MLP_width_2': 2, 'rho_MLP_acts_0': 1, 'rho_MLP_acts_1': 0, 'rho_MLP_acts_2': 1, 'rho_MLP_norms_0': 'batch', 'rho_MLP_norms_1': 'batch', 'rho_MLP_norms_2': None, 'rho_MLP_norms_3': 'batch'}. 
Test Accuracy: 0.6655
Accuracy:  0.6655048206902863 , Inference time:  0.07193851470947266 , Validation Loss:  0.8787020894945884 , Param Count:  24799
Conv bp:  tensor(2849576.)
DeepSetsArchitecture(
  (phi): ConvPhi(
    (layers): Sequential(
      (0): Conv1d(3, 32, kernel_size=(1,), stride=(1,))
      (1): ReLU()
      (2): Conv1d(32, 16, kernel_size=(1,), stride=(1,))
      (3): ReLU()
      (4): Conv1d(16, 32, kernel_size=(1,), stride=(1,))
      (5): BatchNorm1d(32, eps=1e-05, momentum=0.1, affine=True, track_running_stats=True)
      (6): LeakyReLU(negative_slope=0.0078125)
      (7): Conv1d(32, 1, kernel_size=(1,), stride=(1,))
    )
  )
  (rho): Rho(
    (layers): Sequential(
      (0): Linear(in_features=1, out_features=128, bias=True)
      (1): ReLU()
      (2): Linear(in_features=128, out_features=128, bias=True)
      (3): BatchNorm1d(128, eps=1e-05, momentum=0.1, affine=True, track_running_stats=True)
      (4): LeakyReLU(negative_slope=0.0078125)
      (5): Linear(in_features=128, out_features=64, bias=True)
      (6): LeakyReLU(negative_slope=0.0078125)
      (7): Linear(in_features=64, out_features=5, bias=True)
    )
  )
)
BOPs: tensor(7201400.)
Trial  299  begins evaluation...
[I 2024-09-17 15:12:41,125] Trial 299 finished with values: [0.47809102328405884, 7201400.0] and parameters: {'bottleneck_dim': 0, 'aggregator_type': 1, 'phi_len': 4, 'phi_MLP_width_0': 2, 'phi_MLP_width_1': 1, 'phi_MLP_width_2': 2, 'phi_MLP_acts_0': 0, 'phi_MLP_acts_1': 0, 'phi_MLP_acts_2': 1, 'phi_MLP_norms_0': None, 'phi_MLP_norms_1': None, 'phi_MLP_norms_2': 'batch', 'phi_MLP_norms_3': None, 'rho_len': 4, 'rho_MLP_width_0': 4, 'rho_MLP_width_1': 4, 'rho_MLP_width_2': 3, 'rho_MLP_acts_0': 0, 'rho_MLP_acts_1': 1, 'rho_MLP_acts_2': 1, 'rho_MLP_norms_0': 'layer', 'rho_MLP_norms_1': 'batch', 'rho_MLP_norms_2': 'layer', 'rho_MLP_norms_3': 'layer'}. 
Test Accuracy: 0.4781
Accuracy:  0.47809102328405884 , Inference time:  0.08733439445495605 , Validation Loss:  1.253424680151907 , Param Count:  26902
Conv bp:  tensor(64961.2500)
DeepSetsArchitecture(
  (phi): ConvPhi(
    (layers): Sequential(
      (0): Conv1d(3, 4, kernel_size=(1,), stride=(1,))
    )
  )
  (rho): Rho(
    (layers): Sequential(
      (0): Linear(in_features=4, out_features=5, bias=True)
      (1): BatchNorm1d(5, eps=1e-05, momentum=0.1, affine=True, track_running_stats=True)
    )
  )
)
BOPs: tensor(68785.2500)
Trial  300  begins evaluation...
[I 2024-09-17 15:18:57,514] Trial 300 finished with values: [0.3212035504238381, 68785.25] and parameters: {'bottleneck_dim': 2, 'aggregator_type': 0, 'phi_len': 1, 'phi_MLP_norms_0': 'layer', 'rho_len': 1, 'rho_MLP_norms_0': 'batch'}. 
Test Accuracy: 0.3212
Accuracy:  0.3212035504238381 , Inference time:  0.019913196563720703 , Validation Loss:  1.5010203244734783 , Param Count:  51
Conv bp:  tensor(32480.6250)
DeepSetsArchitecture(
  (phi): ConvPhi(
    (layers): Sequential(
      (0): Conv1d(3, 2, kernel_size=(1,), stride=(1,))
    )
  )
  (rho): Rho(
    (layers): Sequential(
      (0): Linear(in_features=2, out_features=64, bias=True)
      (1): BatchNorm1d(64, eps=1e-05, momentum=0.1, affine=True, track_running_stats=True)
      (2): ReLU()
      (3): Linear(in_features=64, out_features=16, bias=True)
      (4): BatchNorm1d(16, eps=1e-05, momentum=0.1, affine=True, track_running_stats=True)
      (5): LeakyReLU(negative_slope=0.0078125)
      (6): Linear(in_features=16, out_features=5, bias=True)
    )
  )
)
BOPs: tensor(242960.6250)
Trial  301  begins evaluation...
[I 2024-09-17 15:25:22,291] Trial 301 finished with values: [0.42229080533395447, 242960.625] and parameters: {'bottleneck_dim': 1, 'aggregator_type': 1, 'phi_len': 1, 'phi_MLP_norms_0': None, 'rho_len': 3, 'rho_MLP_width_0': 3, 'rho_MLP_width_1': 1, 'rho_MLP_acts_0': 0, 'rho_MLP_acts_1': 1, 'rho_MLP_norms_0': 'batch', 'rho_MLP_norms_1': 'batch', 'rho_MLP_norms_2': None}. 
Test Accuracy: 0.4223
Accuracy:  0.42229080533395447 , Inference time:  0.034037113189697266 , Validation Loss:  1.3612517645569886 , Param Count:  1485
Conv bp:  tensor(64961.2500)
DeepSetsArchitecture(
  (phi): ConvPhi(
    (layers): Sequential(
      (0): Conv1d(3, 4, kernel_size=(1,), stride=(1,))
      (1): BatchNorm1d(4, eps=1e-05, momentum=0.1, affine=True, track_running_stats=True)
    )
  )
  (rho): Rho(
    (layers): Sequential(
      (0): Linear(in_features=4, out_features=32, bias=True)
      (1): BatchNorm1d(32, eps=1e-05, momentum=0.1, affine=True, track_running_stats=True)
      (2): LeakyReLU(negative_slope=0.0078125)
      (3): Linear(in_features=32, out_features=64, bias=True)
      (4): BatchNorm1d(64, eps=1e-05, momentum=0.1, affine=True, track_running_stats=True)
      (5): ReLU()
      (6): Linear(in_features=64, out_features=5, bias=True)
      (7): BatchNorm1d(5, eps=1e-05, momentum=0.1, affine=True, track_running_stats=True)
    )
  )
)
BOPs: tensor(489537.2500)
Trial  302  begins evaluation...
[I 2024-09-17 15:31:48,498] Trial 302 finished with values: [0.5749989601617157, 489537.25] and parameters: {'bottleneck_dim': 2, 'aggregator_type': 1, 'phi_len': 1, 'phi_MLP_norms_0': 'batch', 'rho_len': 3, 'rho_MLP_width_0': 2, 'rho_MLP_width_1': 3, 'rho_MLP_acts_0': 1, 'rho_MLP_acts_1': 0, 'rho_MLP_norms_0': 'batch', 'rho_MLP_norms_1': 'batch', 'rho_MLP_norms_2': 'batch'}. 
Test Accuracy: 0.5750
Accuracy:  0.5749989601617157 , Inference time:  0.055271148681640625 , Validation Loss:  1.0915335035648475 , Param Count:  2823
Conv bp:  tensor(1355148.5000)
DeepSetsArchitecture(
  (phi): ConvPhi(
    (layers): Sequential(
      (0): Conv1d(3, 16, kernel_size=(1,), stride=(1,))
      (1): BatchNorm1d(16, eps=1e-05, momentum=0.1, affine=True, track_running_stats=True)
      (2): LeakyReLU(negative_slope=0.0078125)
      (3): Conv1d(16, 8, kernel_size=(1,), stride=(1,))
      (4): BatchNorm1d(8, eps=1e-05, momentum=0.1, affine=True, track_running_stats=True)
      (5): ReLU()
      (6): Conv1d(8, 64, kernel_size=(1,), stride=(1,))
    )
  )
  (rho): Rho(
    (layers): Sequential(
      (0): Linear(in_features=64, out_features=16, bias=True)
      (1): BatchNorm1d(16, eps=1e-05, momentum=0.1, affine=True, track_running_stats=True)
      (2): LeakyReLU(negative_slope=0.0078125)
      (3): Linear(in_features=16, out_features=128, bias=True)
      (4): ReLU()
      (5): Linear(in_features=128, out_features=64, bias=True)
      (6): BatchNorm1d(64, eps=1e-05, momentum=0.1, affine=True, track_running_stats=True)
      (7): LeakyReLU(negative_slope=0.0078125)
      (8): Linear(in_features=64, out_features=5, bias=True)
      (9): BatchNorm1d(5, eps=1e-05, momentum=0.1, affine=True, track_running_stats=True)
    )
  )
)
BOPs: tensor(3363980.5000)
Trial  303  begins evaluation...
[I 2024-09-17 15:38:23,482] Trial 303 finished with values: [0.654529119631315, 3363980.5] and parameters: {'bottleneck_dim': 6, 'aggregator_type': 1, 'phi_len': 3, 'phi_MLP_width_0': 1, 'phi_MLP_width_1': 0, 'phi_MLP_acts_0': 1, 'phi_MLP_acts_1': 0, 'phi_MLP_norms_0': 'batch', 'phi_MLP_norms_1': 'batch', 'phi_MLP_norms_2': 'layer', 'rho_len': 4, 'rho_MLP_width_0': 1, 'rho_MLP_width_1': 4, 'rho_MLP_width_2': 3, 'rho_MLP_acts_0': 1, 'rho_MLP_acts_1': 0, 'rho_MLP_acts_2': 1, 'rho_MLP_norms_0': 'batch', 'rho_MLP_norms_1': None, 'rho_MLP_norms_2': 'batch', 'rho_MLP_norms_3': 'batch'}. 
Test Accuracy: 0.6545
Accuracy:  0.654529119631315 , Inference time:  0.08164644241333008 , Validation Loss:  0.9061076312649007 , Param Count:  12791
Conv bp:  tensor(1707424.5000)
DeepSetsArchitecture(
  (phi): ConvPhi(
    (layers): Sequential(
      (0): Conv1d(3, 8, kernel_size=(1,), stride=(1,))
      (1): BatchNorm1d(8, eps=1e-05, momentum=0.1, affine=True, track_running_stats=True)
      (2): LeakyReLU(negative_slope=0.0078125)
      (3): Conv1d(8, 64, kernel_size=(1,), stride=(1,))
    )
  )
  (rho): Rho(
    (layers): Sequential(
      (0): Linear(in_features=64, out_features=32, bias=True)
      (1): BatchNorm1d(32, eps=1e-05, momentum=0.1, affine=True, track_running_stats=True)
      (2): ReLU()
      (3): Linear(in_features=32, out_features=128, bias=True)
      (4): BatchNorm1d(128, eps=1e-05, momentum=0.1, affine=True, track_running_stats=True)
      (5): ReLU()
      (6): Linear(in_features=128, out_features=5, bias=True)
    )
  )
)
BOPs: tensor(2875552.5000)
Trial  304  begins evaluation...
[I 2024-09-17 15:44:56,509] Trial 304 finished with values: [0.6513047890792024, 2875552.5] and parameters: {'bottleneck_dim': 6, 'aggregator_type': 1, 'phi_len': 2, 'phi_MLP_width_0': 0, 'phi_MLP_acts_0': 1, 'phi_MLP_norms_0': 'batch', 'phi_MLP_norms_1': None, 'rho_len': 3, 'rho_MLP_width_0': 2, 'rho_MLP_width_1': 4, 'rho_MLP_acts_0': 0, 'rho_MLP_acts_1': 0, 'rho_MLP_norms_0': 'batch', 'rho_MLP_norms_1': 'batch', 'rho_MLP_norms_2': None}. 
Test Accuracy: 0.6513
Accuracy:  0.6513047890792024 , Inference time:  0.06265974044799805 , Validation Loss:  0.9145851127144431 , Param Count:  7893
Conv bp:  tensor(259845.)
DeepSetsArchitecture(
  (phi): ConvPhi(
    (layers): Sequential(
      (0): Conv1d(3, 16, kernel_size=(1,), stride=(1,))
    )
  )
  (rho): Rho(
    (layers): Sequential(
      (0): Linear(in_features=16, out_features=16, bias=True)
      (1): BatchNorm1d(16, eps=1e-05, momentum=0.1, affine=True, track_running_stats=True)
      (2): ReLU()
      (3): Linear(in_features=16, out_features=5, bias=True)
    )
  )
)
BOPs: tensor(318085.)
Trial  305  begins evaluation...
[I 2024-09-17 15:51:09,147] Trial 305 finished with values: [0.5715150859738294, 318085.0] and parameters: {'bottleneck_dim': 4, 'aggregator_type': 1, 'phi_len': 1, 'phi_MLP_norms_0': None, 'rho_len': 2, 'rho_MLP_width_0': 1, 'rho_MLP_acts_0': 0, 'rho_MLP_norms_0': 'batch', 'rho_MLP_norms_1': 'layer'}. 
Test Accuracy: 0.5715
Accuracy:  0.5715150859738294 , Inference time:  0.02548956871032715 , Validation Loss:  1.098578653368009 , Param Count:  453
Conv bp:  tensor(2134056.)
DeepSetsArchitecture(
  (phi): ConvPhi(
    (layers): Sequential(
      (0): Conv1d(3, 32, kernel_size=(1,), stride=(1,))
      (1): LeakyReLU(negative_slope=0.0078125)
      (2): Conv1d(32, 16, kernel_size=(1,), stride=(1,))
    )
  )
  (rho): Rho(
    (layers): Sequential(
      (0): Linear(in_features=16, out_features=16, bias=True)
      (1): BatchNorm1d(16, eps=1e-05, momentum=0.1, affine=True, track_running_stats=True)
      (2): ReLU()
      (3): Linear(in_features=16, out_features=16, bias=True)
      (4): ReLU()
      (5): Linear(in_features=16, out_features=128, bias=True)
      (6): LeakyReLU(negative_slope=0.0078125)
      (7): Linear(in_features=128, out_features=5, bias=True)
    )
  )
)
BOPs: tensor(2677544.)
Trial  306  begins evaluation...
[I 2024-09-17 15:57:30,571] Trial 306 finished with values: [0.641164286130221, 2677544.0] and parameters: {'bottleneck_dim': 4, 'aggregator_type': 0, 'phi_len': 2, 'phi_MLP_width_0': 2, 'phi_MLP_acts_0': 1, 'phi_MLP_norms_0': 'layer', 'phi_MLP_norms_1': 'layer', 'rho_len': 4, 'rho_MLP_width_0': 1, 'rho_MLP_width_1': 1, 'rho_MLP_width_2': 4, 'rho_MLP_acts_0': 0, 'rho_MLP_acts_1': 0, 'rho_MLP_acts_2': 1, 'rho_MLP_norms_0': 'batch', 'rho_MLP_norms_1': 'layer', 'rho_MLP_norms_2': None, 'rho_MLP_norms_3': None}. 
Test Accuracy: 0.6412
Accuracy:  0.641164286130221 , Inference time:  0.04236960411071777 , Validation Loss:  0.946482429699022 , Param Count:  4053
Conv bp:  tensor(16240.3125)
DeepSetsArchitecture(
  (phi): ConvPhi(
    (layers): Sequential(
      (0): Conv1d(3, 1, kernel_size=(1,), stride=(1,))
    )
  )
  (rho): Rho(
    (layers): Sequential(
      (0): Linear(in_features=1, out_features=32, bias=True)
      (1): ReLU()
      (2): Linear(in_features=32, out_features=5, bias=True)
    )
  )
)
BOPs: tensor(48640.3125)
Trial  307  begins evaluation...
