KUBERNETES_SERVICE_PORT_HTTPS=443
NVIDIA_VISIBLE_DEVICES=GPU-17033bcf-6ebd-45df-b529-141462a446f1
GGEXPOSE_SERVICE_HOST=10.103.93.169
SPATOPEXPOSE_SERVICE_HOST=10.98.174.135
SSL_JET_V2_EXPOSE_PORT=tcp://10.98.170.207:80
KUBERNETES_SERVICE_PORT=443
SSL_JET_V3_EXPOSE_PORT_80_TCP_ADDR=10.99.91.182
HOSTNAME=dd-global-c-par-1
PFEXPOSEEAST_PORT_80_TCP_ADDR=10.106.41.90
XILINXD_SERVICE_HOST=10.111.109.177
ABCDNNEXPOSE_PORT_80_TCP_PROTO=tcp
PFEXPOSE_PORT_80_TCP_PROTO=tcp
L1ANOMALYEXPOSE_PORT_80_TCP_PORT=80
HHBBVVEXPOSE_PORT_80_TCP_PROTO=tcp
SSL_JET_V3_EXPOSE_PORT=tcp://10.99.91.182:80
SPATOPEXPOSE_PORT_8800_TCP_ADDR=10.98.174.135
J_JEPA_VOL_EXPOSE_PORT=tcp://10.98.255.12:80
BUMPHUNTEXPOSE_SERVICE_PORT=80
HHBBVVEXPOSE_PORT_80_TCP_PORT=80
J_JEPA_VOL_EXPOSE_SERVICE_HOST=10.98.255.12
PFEXPOSE_PORT_80_TCP=tcp://10.97.167.151:80
BUMPHUNTEXPOSE_SERVICE_HOST=10.96.169.13
PFEXPOSE_SERVICE_PORT=80
PWD=/morph-nas-central/Morph
PFEXPOSE_PORT_80_TCP_ADDR=10.97.167.151
PFEXPOSEEAST_SERVICE_PORT=80
JOB_COMPLETION_INDEX=1
PFEXPOSEEAST_SERVICE_HOST=10.106.41.90
J_JEPA_VOL_EXPOSE_PORT_80_TCP_ADDR=10.98.255.12
NVIDIA_DRIVER_CAPABILITIES=compute,utility
PFEXPOSECENTRAL_SERVICE_HOST=10.101.81.212
BUMPHUNTEXPOSE_PORT_80_TCP_PROTO=tcp
SSL_JET_V3_EXPOSE_SERVICE_HOST=10.99.91.182
ABCDNNEXPOSE_SERVICE_PORT=80
SPATOPEXPOSE_PORT_8800_TCP_PROTO=tcp
SSL_JET_V3_EXPOSE_SERVICE_PORT=80
XILINXD_SERVICE_PORT_XILINXD=2100
ABCDNNEXPOSE_PORT_80_TCP_ADDR=10.108.83.250
MODEL_INDEX=1
PFEXPOSECENTRAL_PORT_80_TCP=tcp://10.101.81.212:80
HOME=/root
KUBERNETES_PORT_443_TCP=tcp://10.96.0.1:443
PFEXPOSECENTRAL_PORT_80_TCP_ADDR=10.101.81.212
J_JEPA_VOL_EXPOSE_PORT_80_TCP=tcp://10.98.255.12:80
XILINXD_PORT_2100_TCP_PORT=2100
SPATOPEXPOSE_PORT=tcp://10.98.174.135:8800
L1ANOMALYEXPOSE_PORT_80_TCP_PROTO=tcp
PYTORCH_VERSION=2.2.1
L1ANOMALYEXPOSE_SERVICE_PORT=80
XILINXD_SERVICE_PORT=2100
HHBBVVEXPOSE_PORT_80_TCP_ADDR=10.102.7.121
PFEXPOSEEAST_PORT_80_TCP_PORT=80
SPATOPEXPOSE_PORT_8800_TCP_PORT=8800
PFEXPOSE_SERVICE_HOST=10.97.167.151
PFEXPOSECENTRAL_PORT=tcp://10.101.81.212:80
PFEXPOSE_PORT=tcp://10.97.167.151:80
SPATOPEXPOSE_PORT_8800_TCP=tcp://10.98.174.135:8800
HHBBVVEXPOSE_PORT=tcp://10.102.7.121:80
ABCDNNEXPOSE_PORT_80_TCP_PORT=80
PFEXPOSEEAST_PORT=tcp://10.106.41.90:80
PFEXPOSECENTRAL_SERVICE_PORT=80
XILINXD_PORT_2100_TCP=tcp://10.111.109.177:2100
PFEXPOSEEAST_PORT_80_TCP=tcp://10.106.41.90:80
BUMPHUNTEXPOSE_PORT=tcp://10.96.169.13:80
SSL_JET_V3_EXPOSE_PORT_80_TCP_PROTO=tcp
PFEXPOSEEAST_PORT_80_TCP_PROTO=tcp
GGEXPOSE_SERVICE_PORT=80
PFEXPOSE_PORT_80_TCP_PORT=80
J_JEPA_VOL_EXPOSE_PORT_80_TCP_PORT=80
GGEXPOSE_PORT_80_TCP_PROTO=tcp
L1ANOMALYEXPOSE_PORT=tcp://10.101.29.4:80
SPATOPEXPOSE_SERVICE_PORT=8800
SSL_JET_V3_EXPOSE_PORT_80_TCP_PORT=80
HHBBVVEXPOSE_SERVICE_HOST=10.102.7.121
L1ANOMALYEXPOSE_SERVICE_HOST=10.101.29.4
XILINXD_PORT=tcp://10.111.109.177:2100
SSL_JET_V2_EXPOSE_PORT_80_TCP_ADDR=10.98.170.207
SHLVL=1
BUMPHUNTEXPOSE_PORT_80_TCP_ADDR=10.96.169.13
GGEXPOSE_PORT_80_TCP_ADDR=10.103.93.169
GGEXPOSE_PORT=tcp://10.103.93.169:80
PFEXPOSECENTRAL_PORT_80_TCP_PROTO=tcp
KUBERNETES_PORT_443_TCP_PROTO=tcp
SSL_JET_V2_EXPOSE_SERVICE_PORT=80
KUBERNETES_PORT_443_TCP_ADDR=10.96.0.1
SSL_JET_V3_EXPOSE_PORT_80_TCP=tcp://10.99.91.182:80
L1ANOMALYEXPOSE_PORT_80_TCP_ADDR=10.101.29.4
LD_LIBRARY_PATH=/usr/local/nvidia/lib:/usr/local/nvidia/lib64
SSL_JET_V2_EXPOSE_PORT_80_TCP_PORT=80
BUMPHUNTEXPOSE_PORT_80_TCP_PORT=80
XILINXD_PORT_2100_TCP_ADDR=10.111.109.177
GGEXPOSE_PORT_80_TCP_PORT=80
SSL_JET_V2_EXPOSE_PORT_80_TCP_PROTO=tcp
XILINXD_PORT_2100_TCP_PROTO=tcp
SSL_JET_V2_EXPOSE_SERVICE_HOST=10.98.170.207
KUBERNETES_SERVICE_HOST=10.96.0.1
ABCDNNEXPOSE_PORT_80_TCP=tcp://10.108.83.250:80
KUBERNETES_PORT=tcp://10.96.0.1:443
KUBERNETES_PORT_443_TCP_PORT=443
PATH=/opt/conda/bin:/usr/local/sbin:/usr/local/bin:/usr/sbin:/usr/bin:/sbin:/bin
HHBBVVEXPOSE_PORT_80_TCP=tcp://10.102.7.121:80
HHBBVVEXPOSE_SERVICE_PORT=80
BUMPHUNTEXPOSE_PORT_80_TCP=tcp://10.96.169.13:80
L1ANOMALYEXPOSE_PORT_80_TCP=tcp://10.101.29.4:80
GGEXPOSE_PORT_80_TCP=tcp://10.103.93.169:80
ABCDNNEXPOSE_SERVICE_HOST=10.108.83.250
ABCDNNEXPOSE_PORT=tcp://10.108.83.250:80
J_JEPA_VOL_EXPOSE_PORT_80_TCP_PROTO=tcp
J_JEPA_VOL_EXPOSE_SERVICE_PORT=80
SSL_JET_V2_EXPOSE_PORT_80_TCP=tcp://10.98.170.207:80
PFEXPOSECENTRAL_PORT_80_TCP_PORT=80
OLDPWD=/app
_=/usr/bin/env
MODEL_INDEX from terminal: 1
All command-line arguments: ['global_search_parallel2.py', '1']
model index:  1
Processing large model with index 1
Loaded 1 files for train set
Loaded 1 files for validation set
Loaded 2 files for test set
Loaded Dataset...
[I 2024-09-16 04:56:58,952] A new study created in memory with name: no-name-ffce258e-dc59-49fc-a438-c00055211433
input shape:  torch.Size([4096, 3, 8])
Conv bp:  tensor(7570572.)
DeepSetsArchitecture(
  (phi): ConvPhi(
    (layers): Sequential(
      (0): Conv1d(3, 64, kernel_size=(1,), stride=(1,))
      (1): BatchNorm1d(64, eps=1e-05, momentum=0.1, affine=True, track_running_stats=True)
      (2): ReLU()
      (3): Conv1d(64, 32, kernel_size=(1,), stride=(1,))
      (4): BatchNorm1d(32, eps=1e-05, momentum=0.1, affine=True, track_running_stats=True)
    )
  )
  (rho): Rho(
    (layers): Sequential(
      (0): Linear(in_features=32, out_features=64, bias=True)
      (1): BatchNorm1d(64, eps=1e-05, momentum=0.1, affine=True, track_running_stats=True)
      (2): ReLU()
      (3): Linear(in_features=64, out_features=128, bias=True)
      (4): ReLU()
      (5): Linear(in_features=128, out_features=5, bias=True)
      (6): BatchNorm1d(5, eps=1e-05, momentum=0.1, affine=True, track_running_stats=True)
    )
  )
)
BOPs: tensor(9443340.)
Trial  0  begins evaluation...
[I 2024-09-16 05:03:10,784] Trial 0 finished with values: [0.6645797805525284, 9443340.0] and parameters: {'bottleneck_dim': 5, 'aggregator_type': 0, 'phi_len': 2, 'phi_MLP_width_0': 3, 'phi_MLP_acts_0': 0, 'phi_MLP_norms_0': 'batch', 'phi_MLP_norms_1': 'batch', 'rho_len': 3, 'rho_MLP_width_0': 3, 'rho_MLP_width_1': 4, 'rho_MLP_acts_0': 0, 'rho_MLP_acts_1': 0, 'rho_MLP_norms_0': 'batch', 'rho_MLP_norms_1': None, 'rho_MLP_norms_2': 'batch'}. 
Test Accuracy: 0.6646
Accuracy:  0.6645797805525284 , Inference time:  0.06774139404296875 , Validation Loss:  0.8812147338374131 , Param Count:  13743
Conv bp:  tensor(2486312.)
DeepSetsArchitecture(
  (phi): ConvPhi(
    (layers): Sequential(
      (0): Conv1d(3, 32, kernel_size=(1,), stride=(1,))
      (1): ReLU()
      (2): Conv1d(32, 16, kernel_size=(1,), stride=(1,))
      (3): ReLU()
      (4): Conv1d(16, 16, kernel_size=(1,), stride=(1,))
      (5): BatchNorm1d(16, eps=1e-05, momentum=0.1, affine=True, track_running_stats=True)
    )
  )
  (rho): Rho(
    (layers): Sequential(
      (0): Linear(in_features=16, out_features=8, bias=True)
      (1): ReLU()
      (2): Linear(in_features=8, out_features=8, bias=True)
      (3): BatchNorm1d(8, eps=1e-05, momentum=0.1, affine=True, track_running_stats=True)
      (4): LeakyReLU(negative_slope=0.0078125)
      (5): Linear(in_features=8, out_features=5, bias=True)
      (6): BatchNorm1d(5, eps=1e-05, momentum=0.1, affine=True, track_running_stats=True)
    )
  )
)
BOPs: tensor(2526872.)
Trial  1  begins evaluation...
[I 2024-09-16 05:09:20,690] Trial 1 finished with values: [0.6261523487867167, 2526872.0] and parameters: {'bottleneck_dim': 4, 'aggregator_type': 1, 'phi_len': 3, 'phi_MLP_width_0': 2, 'phi_MLP_width_1': 1, 'phi_MLP_acts_0': 0, 'phi_MLP_acts_1': 0, 'phi_MLP_norms_0': None, 'phi_MLP_norms_1': None, 'phi_MLP_norms_2': 'batch', 'rho_len': 3, 'rho_MLP_width_0': 0, 'rho_MLP_width_1': 0, 'rho_MLP_acts_0': 0, 'rho_MLP_acts_1': 1, 'rho_MLP_norms_0': 'layer', 'rho_MLP_norms_1': 'batch', 'rho_MLP_norms_2': 'batch'}. 
Test Accuracy: 0.6262
Accuracy:  0.6261523487867167 , Inference time:  0.05853772163391113 , Validation Loss:  0.9821434345375113 , Param Count:  1239
Conv bp:  tensor(259845.)
DeepSetsArchitecture(
  (phi): ConvPhi(
    (layers): Sequential(
      (0): Conv1d(3, 16, kernel_size=(1,), stride=(1,))
      (1): BatchNorm1d(16, eps=1e-05, momentum=0.1, affine=True, track_running_stats=True)
    )
  )
  (rho): Rho(
    (layers): Sequential(
      (0): Linear(in_features=16, out_features=64, bias=True)
      (1): LeakyReLU(negative_slope=0.0078125)
      (2): Linear(in_features=64, out_features=32, bias=True)
      (3): ReLU()
      (4): Linear(in_features=32, out_features=32, bias=True)
      (5): LeakyReLU(negative_slope=0.0078125)
      (6): Linear(in_features=32, out_features=5, bias=True)
    )
  )
)
BOPs: tensor(987461.)
Trial  2  begins evaluation...
[I 2024-09-16 05:15:24,224] Trial 2 finished with values: [0.40037600552362096, 987461.0] and parameters: {'bottleneck_dim': 4, 'aggregator_type': 0, 'phi_len': 1, 'phi_MLP_norms_0': 'batch', 'rho_len': 4, 'rho_MLP_width_0': 3, 'rho_MLP_width_1': 2, 'rho_MLP_width_2': 2, 'rho_MLP_acts_0': 1, 'rho_MLP_acts_1': 0, 'rho_MLP_acts_2': 1, 'rho_MLP_norms_0': 'layer', 'rho_MLP_norms_1': None, 'rho_MLP_norms_2': None, 'rho_MLP_norms_3': 'layer'}. 
Test Accuracy: 0.4004
Accuracy:  0.40037600552362096 , Inference time:  0.04040408134460449 , Validation Loss:  1.377686874396136 , Param Count:  4485
Conv bp:  tensor(16240.3125)
DeepSetsArchitecture(
  (phi): ConvPhi(
    (layers): Sequential(
      (0): Conv1d(3, 1, kernel_size=(1,), stride=(1,))
      (1): BatchNorm1d(1, eps=1e-05, momentum=0.1, affine=True, track_running_stats=True)
    )
  )
  (rho): Rho(
    (layers): Sequential(
      (0): Linear(in_features=1, out_features=64, bias=True)
      (1): BatchNorm1d(64, eps=1e-05, momentum=0.1, affine=True, track_running_stats=True)
      (2): LeakyReLU(negative_slope=0.0078125)
      (3): Linear(in_features=64, out_features=8, bias=True)
      (4): LeakyReLU(negative_slope=0.0078125)
      (5): Linear(in_features=8, out_features=5, bias=True)
    )
  )
)
BOPs: tensor(121400.3125)
Trial  3  begins evaluation...
[I 2024-09-16 05:21:30,692] Trial 3 finished with values: [0.29364201279417024, 121400.3125] and parameters: {'bottleneck_dim': 0, 'aggregator_type': 0, 'phi_len': 1, 'phi_MLP_norms_0': 'batch', 'rho_len': 3, 'rho_MLP_width_0': 3, 'rho_MLP_width_1': 0, 'rho_MLP_acts_0': 1, 'rho_MLP_acts_1': 1, 'rho_MLP_norms_0': 'batch', 'rho_MLP_norms_1': None, 'rho_MLP_norms_2': 'layer'}. 
Test Accuracy: 0.2936
Accuracy:  0.29364201279417024 , Inference time:  0.03323793411254883 , Validation Loss:  1.549568357921782 , Param Count:  827
Conv bp:  tensor(309717.9375)
DeepSetsArchitecture(
  (phi): ConvPhi(
    (layers): Sequential(
      (0): Conv1d(3, 16, kernel_size=(1,), stride=(1,))
      (1): BatchNorm1d(16, eps=1e-05, momentum=0.1, affine=True, track_running_stats=True)
      (2): LeakyReLU(negative_slope=0.0078125)
      (3): Conv1d(16, 1, kernel_size=(1,), stride=(1,))
    )
  )
  (rho): Rho(
    (layers): Sequential(
      (0): Linear(in_features=1, out_features=5, bias=True)
    )
  )
)
BOPs: tensor(310733.9375)
Trial  4  begins evaluation...
[I 2024-09-16 05:27:31,704] Trial 4 finished with values: [0.45913601916629926, 310733.9375] and parameters: {'bottleneck_dim': 0, 'aggregator_type': 0, 'phi_len': 2, 'phi_MLP_width_0': 1, 'phi_MLP_acts_0': 1, 'phi_MLP_norms_0': 'batch', 'phi_MLP_norms_1': 'layer', 'rho_len': 1, 'rho_MLP_norms_0': 'layer'}. 
Test Accuracy: 0.4591
Accuracy:  0.45913601916629926 , Inference time:  0.029527902603149414 , Validation Loss:  1.3205324597910149 , Param Count:  123
Conv bp:  tensor(29983752.)
DeepSetsArchitecture(
  (phi): ConvPhi(
    (layers): Sequential(
      (0): Conv1d(3, 128, kernel_size=(1,), stride=(1,))
      (1): LeakyReLU(negative_slope=0.0078125)
      (2): Conv1d(128, 64, kernel_size=(1,), stride=(1,))
      (3): BatchNorm1d(64, eps=1e-05, momentum=0.1, affine=True, track_running_stats=True)
      (4): LeakyReLU(negative_slope=0.0078125)
      (5): Conv1d(64, 16, kernel_size=(1,), stride=(1,))
      (6): BatchNorm1d(16, eps=1e-05, momentum=0.1, affine=True, track_running_stats=True)
      (7): LeakyReLU(negative_slope=0.0078125)
      (8): Conv1d(16, 8, kernel_size=(1,), stride=(1,))
      (9): BatchNorm1d(8, eps=1e-05, momentum=0.1, affine=True, track_running_stats=True)
    )
  )
  (rho): Rho(
    (layers): Sequential(
      (0): Linear(in_features=8, out_features=5, bias=True)
    )
  )
)
BOPs: tensor(29991416.)
Trial  5  begins evaluation...
[I 2024-09-16 05:33:39,845] Trial 5 finished with values: [0.5560140087013667, 29991416.0] and parameters: {'bottleneck_dim': 3, 'aggregator_type': 0, 'phi_len': 4, 'phi_MLP_width_0': 4, 'phi_MLP_width_1': 3, 'phi_MLP_width_2': 1, 'phi_MLP_acts_0': 1, 'phi_MLP_acts_1': 1, 'phi_MLP_acts_2': 1, 'phi_MLP_norms_0': 'layer', 'phi_MLP_norms_1': 'batch', 'phi_MLP_norms_2': 'batch', 'phi_MLP_norms_3': 'batch', 'rho_len': 1, 'rho_MLP_norms_0': None}. 
Test Accuracy: 0.5560
Accuracy:  0.5560140087013667 , Inference time:  0.059743642807006836 , Validation Loss:  1.149106093409921 , Param Count:  10165
Conv bp:  tensor(1855779.)
DeepSetsArchitecture(
  (phi): ConvPhi(
    (layers): Sequential(
      (0): Conv1d(3, 64, kernel_size=(1,), stride=(1,))
      (1): LeakyReLU(negative_slope=0.0078125)
      (2): Conv1d(64, 4, kernel_size=(1,), stride=(1,))
    )
  )
  (rho): Rho(
    (layers): Sequential(
      (0): Linear(in_features=4, out_features=16, bias=True)
      (1): ReLU()
      (2): Linear(in_features=16, out_features=8, bias=True)
      (3): LeakyReLU(negative_slope=0.0078125)
      (4): Linear(in_features=8, out_features=5, bias=True)
    )
  )
)
BOPs: tensor(1894963.)
Trial  6  begins evaluation...
[I 2024-09-16 05:39:53,128] Trial 6 finished with values: [0.6243738093851644, 1894963.0] and parameters: {'bottleneck_dim': 2, 'aggregator_type': 0, 'phi_len': 2, 'phi_MLP_width_0': 3, 'phi_MLP_acts_0': 1, 'phi_MLP_norms_0': None, 'phi_MLP_norms_1': None, 'rho_len': 3, 'rho_MLP_width_0': 1, 'rho_MLP_width_1': 0, 'rho_MLP_acts_0': 0, 'rho_MLP_acts_1': 1, 'rho_MLP_norms_0': None, 'rho_MLP_norms_1': 'layer', 'rho_MLP_norms_2': 'layer'}. 
Test Accuracy: 0.6244
Accuracy:  0.6243738093851644 , Inference time:  0.0328519344329834 , Validation Loss:  0.9846878213947322 , Param Count:  777
Conv bp:  tensor(64961.2500)
DeepSetsArchitecture(
  (phi): ConvPhi(
    (layers): Sequential(
      (0): Conv1d(3, 4, kernel_size=(1,), stride=(1,))
    )
  )
  (rho): Rho(
    (layers): Sequential(
      (0): Linear(in_features=4, out_features=64, bias=True)
      (1): ReLU()
      (2): Linear(in_features=64, out_features=32, bias=True)
      (3): LeakyReLU(negative_slope=0.0078125)
      (4): Linear(in_features=32, out_features=16, bias=True)
      (5): BatchNorm1d(16, eps=1e-05, momentum=0.1, affine=True, track_running_stats=True)
      (6): ReLU()
      (7): Linear(in_features=16, out_features=5, bias=True)
    )
  )
)
BOPs: tensor(560225.2500)
Trial  7  begins evaluation...
[I 2024-09-16 05:46:04,390] Trial 7 finished with values: [0.39944930164460823, 560225.25] and parameters: {'bottleneck_dim': 2, 'aggregator_type': 0, 'phi_len': 1, 'phi_MLP_norms_0': 'layer', 'rho_len': 4, 'rho_MLP_width_0': 3, 'rho_MLP_width_1': 2, 'rho_MLP_width_2': 1, 'rho_MLP_acts_0': 0, 'rho_MLP_acts_1': 1, 'rho_MLP_acts_2': 0, 'rho_MLP_norms_0': None, 'rho_MLP_norms_1': 'layer', 'rho_MLP_norms_2': 'batch', 'rho_MLP_norms_3': None}. 
Test Accuracy: 0.3994
Accuracy:  0.39944930164460823 , Inference time:  0.04257011413574219 , Validation Loss:  1.3796961039912945 , Param Count:  3061
Conv bp:  tensor(13993100.)
DeepSetsArchitecture(
  (phi): ConvPhi(
    (layers): Sequential(
      (0): Conv1d(3, 64, kernel_size=(1,), stride=(1,))
      (1): LeakyReLU(negative_slope=0.0078125)
      (2): Conv1d(64, 32, kernel_size=(1,), stride=(1,))
      (3): ReLU()
      (4): Conv1d(32, 128, kernel_size=(1,), stride=(1,))
      (5): ReLU()
      (6): Conv1d(128, 16, kernel_size=(1,), stride=(1,))
    )
  )
  (rho): Rho(
    (layers): Sequential(
      (0): Linear(in_features=16, out_features=128, bias=True)
      (1): LeakyReLU(negative_slope=0.0078125)
      (2): Linear(in_features=128, out_features=8, bias=True)
      (3): LeakyReLU(negative_slope=0.0078125)
      (4): Linear(in_features=8, out_features=16, bias=True)
      (5): ReLU()
      (6): Linear(in_features=16, out_features=5, bias=True)
    )
  )
)
BOPs: tensor(14552076.)
Trial  8  begins evaluation...
[I 2024-09-16 05:52:14,426] Trial 8 finished with values: [0.6399480912728452, 14552076.0] and parameters: {'bottleneck_dim': 4, 'aggregator_type': 0, 'phi_len': 4, 'phi_MLP_width_0': 3, 'phi_MLP_width_1': 2, 'phi_MLP_width_2': 4, 'phi_MLP_acts_0': 1, 'phi_MLP_acts_1': 0, 'phi_MLP_acts_2': 0, 'phi_MLP_norms_0': None, 'phi_MLP_norms_1': None, 'phi_MLP_norms_2': 'layer', 'phi_MLP_norms_3': 'layer', 'rho_len': 4, 'rho_MLP_width_0': 4, 'rho_MLP_width_1': 0, 'rho_MLP_width_2': 1, 'rho_MLP_acts_0': 1, 'rho_MLP_acts_1': 1, 'rho_MLP_acts_2': 0, 'rho_MLP_norms_0': None, 'rho_MLP_norms_1': 'layer', 'rho_MLP_norms_2': 'layer', 'rho_MLP_norms_3': None}. 
Test Accuracy: 0.6399
Accuracy:  0.6399480912728452 , Inference time:  0.05448460578918457 , Validation Loss:  0.9481028586017842 , Param Count:  12061
Conv bp:  tensor(2355089.5000)
DeepSetsArchitecture(
  (phi): ConvPhi(
    (layers): Sequential(
      (0): Conv1d(3, 8, kernel_size=(1,), stride=(1,))
      (1): LeakyReLU(negative_slope=0.0078125)
      (2): Conv1d(8, 32, kernel_size=(1,), stride=(1,))
      (3): ReLU()
      (4): Conv1d(32, 32, kernel_size=(1,), stride=(1,))
      (5): BatchNorm1d(32, eps=1e-05, momentum=0.1, affine=True, track_running_stats=True)
      (6): ReLU()
      (7): Conv1d(32, 1, kernel_size=(1,), stride=(1,))
    )
  )
  (rho): Rho(
    (layers): Sequential(
      (0): Linear(in_features=1, out_features=64, bias=True)
      (1): ReLU()
      (2): Linear(in_features=64, out_features=8, bias=True)
      (3): LeakyReLU(negative_slope=0.0078125)
      (4): Linear(in_features=8, out_features=5, bias=True)
      (5): BatchNorm1d(5, eps=1e-05, momentum=0.1, affine=True, track_running_stats=True)
    )
  )
)
BOPs: tensor(2460249.5000)
Trial  9  begins evaluation...
[I 2024-09-16 05:58:26,808] Trial 9 finished with values: [0.5634243122509587, 2460249.5] and parameters: {'bottleneck_dim': 0, 'aggregator_type': 0, 'phi_len': 4, 'phi_MLP_width_0': 0, 'phi_MLP_width_1': 2, 'phi_MLP_width_2': 2, 'phi_MLP_acts_0': 1, 'phi_MLP_acts_1': 0, 'phi_MLP_acts_2': 0, 'phi_MLP_norms_0': 'layer', 'phi_MLP_norms_1': None, 'phi_MLP_norms_2': 'batch', 'phi_MLP_norms_3': None, 'rho_len': 3, 'rho_MLP_width_0': 3, 'rho_MLP_width_1': 0, 'rho_MLP_acts_0': 0, 'rho_MLP_acts_1': 1, 'rho_MLP_norms_0': 'layer', 'rho_MLP_norms_1': 'layer', 'rho_MLP_norms_2': 'batch'}. 
Test Accuracy: 0.5634
Accuracy:  0.5634243122509587 , Inference time:  0.06396842002868652 , Validation Loss:  1.1233083017829324 , Param Count:  2176
Conv bp:  tensor(259845.)
DeepSetsArchitecture(
  (phi): ConvPhi(
    (layers): Sequential(
      (0): Conv1d(3, 16, kernel_size=(1,), stride=(1,))
    )
  )
  (rho): Rho(
    (layers): Sequential(
      (0): Linear(in_features=16, out_features=5, bias=True)
    )
  )
)
BOPs: tensor(275333.)
Trial  10  begins evaluation...
[I 2024-09-16 06:04:33,082] Trial 10 finished with values: [0.3212285065426625, 275333.0] and parameters: {'bottleneck_dim': 4, 'aggregator_type': 0, 'phi_len': 1, 'phi_MLP_norms_0': 'layer', 'rho_len': 1, 'rho_MLP_norms_0': 'layer'}. 
Test Accuracy: 0.3212
Accuracy:  0.3212285065426625 , Inference time:  0.01631307601928711 , Validation Loss:  1.5010173474850297 , Param Count:  149
Conv bp:  tensor(28858888.)
DeepSetsArchitecture(
  (phi): ConvPhi(
    (layers): Sequential(
      (0): Conv1d(3, 128, kernel_size=(1,), stride=(1,))
      (1): BatchNorm1d(128, eps=1e-05, momentum=0.1, affine=True, track_running_stats=True)
      (2): LeakyReLU(negative_slope=0.0078125)
      (3): Conv1d(128, 64, kernel_size=(1,), stride=(1,))
      (4): BatchNorm1d(64, eps=1e-05, momentum=0.1, affine=True, track_running_stats=True)
      (5): ReLU()
      (6): Conv1d(64, 4, kernel_size=(1,), stride=(1,))
    )
  )
  (rho): Rho(
    (layers): Sequential(
      (0): Linear(in_features=4, out_features=32, bias=True)
      (1): BatchNorm1d(32, eps=1e-05, momentum=0.1, affine=True, track_running_stats=True)
      (2): LeakyReLU(negative_slope=0.0078125)
      (3): Linear(in_features=32, out_features=16, bias=True)
      (4): ReLU()
      (5): Linear(in_features=16, out_features=5, bias=True)
    )
  )
)
BOPs: tensor(28980744.)
Trial  11  begins evaluation...
