[I 2024-09-16 05:58:00,153] Trial 11 finished with values: [0.6506043540108642, 22684440.0] and parameters: {'bottleneck_dim': 5, 'aggregator_type': 1, 'phi_len': 4, 'phi_MLP_width_0': 4, 'phi_MLP_width_1': 2, 'phi_MLP_width_2': 4, 'phi_MLP_acts_0': 1, 'phi_MLP_acts_1': 0, 'phi_MLP_acts_2': 0, 'phi_MLP_norms_0': None, 'phi_MLP_norms_1': 'layer', 'phi_MLP_norms_2': 'layer', 'phi_MLP_norms_3': 'batch', 'rho_len': 4, 'rho_MLP_width_0': 1, 'rho_MLP_width_1': 0, 'rho_MLP_width_2': 3, 'rho_MLP_acts_0': 1, 'rho_MLP_acts_1': 1, 'rho_MLP_acts_2': 1, 'rho_MLP_norms_0': 'batch', 'rho_MLP_norms_1': 'batch', 'rho_MLP_norms_2': None, 'rho_MLP_norms_3': 'batch'}. 
Test Accuracy: 0.6506
Accuracy:  0.6506043540108642 , Inference time:  0.07313275337219238 , Validation Loss:  0.9161047412424671 , Param Count:  14679
Conv bp:  tensor(1855779.)
DeepSetsArchitecture(
  (phi): ConvPhi(
    (layers): Sequential(
      (0): Conv1d(3, 64, kernel_size=(1,), stride=(1,))
      (1): ReLU()
      (2): Conv1d(64, 4, kernel_size=(1,), stride=(1,))
      (3): BatchNorm1d(4, eps=1e-05, momentum=0.1, affine=True, track_running_stats=True)
    )
  )
  (rho): Rho(
    (layers): Sequential(
      (0): Linear(in_features=4, out_features=32, bias=True)
      (1): BatchNorm1d(32, eps=1e-05, momentum=0.1, affine=True, track_running_stats=True)
      (2): ReLU()
      (3): Linear(in_features=32, out_features=32, bias=True)
      (4): ReLU()
      (5): Linear(in_features=32, out_features=128, bias=True)
      (6): LeakyReLU(negative_slope=0.0078125)
      (7): Linear(in_features=128, out_features=5, bias=True)
      (8): BatchNorm1d(5, eps=1e-05, momentum=0.1, affine=True, track_running_stats=True)
    )
  )
)
BOPs: tensor(2858915.)
Trial  12  begins evaluation...
[I 2024-09-16 06:03:17,221] Trial 12 finished with values: [0.6073570638294332, 2858915.0] and parameters: {'bottleneck_dim': 2, 'aggregator_type': 1, 'phi_len': 2, 'phi_MLP_width_0': 3, 'phi_MLP_acts_0': 0, 'phi_MLP_norms_0': None, 'phi_MLP_norms_1': 'batch', 'rho_len': 4, 'rho_MLP_width_0': 2, 'rho_MLP_width_1': 2, 'rho_MLP_width_2': 4, 'rho_MLP_acts_0': 0, 'rho_MLP_acts_1': 0, 'rho_MLP_acts_2': 1, 'rho_MLP_norms_0': 'batch', 'rho_MLP_norms_1': 'layer', 'rho_MLP_norms_2': None, 'rho_MLP_norms_3': 'batch'}. 
Test Accuracy: 0.6074
Accuracy:  0.6073570638294332 , Inference time:  0.04783487319946289 , Validation Loss:  1.023107787784265 , Param Count:  6683
Conv bp:  tensor(519690.)
DeepSetsArchitecture(
  (phi): ConvPhi(
    (layers): Sequential(
      (0): Conv1d(3, 32, kernel_size=(1,), stride=(1,))
    )
  )
  (rho): Rho(
    (layers): Sequential(
      (0): Linear(in_features=32, out_features=8, bias=True)
      (1): ReLU()
      (2): Linear(in_features=8, out_features=128, bias=True)
      (3): LeakyReLU(negative_slope=0.0078125)
      (4): Linear(in_features=128, out_features=128, bias=True)
      (5): LeakyReLU(negative_slope=0.0078125)
      (6): Linear(in_features=128, out_features=5, bias=True)
    )
  )
)
BOPs: tensor(3699594.)
Trial  13  begins evaluation...
[I 2024-09-16 06:08:34,835] Trial 13 finished with values: [0.40047582999891856, 3699594.0] and parameters: {'bottleneck_dim': 5, 'aggregator_type': 0, 'phi_len': 1, 'phi_MLP_norms_0': 'layer', 'rho_len': 4, 'rho_MLP_width_0': 0, 'rho_MLP_width_1': 4, 'rho_MLP_width_2': 4, 'rho_MLP_acts_0': 0, 'rho_MLP_acts_1': 1, 'rho_MLP_acts_2': 1, 'rho_MLP_norms_0': None, 'rho_MLP_norms_1': None, 'rho_MLP_norms_2': 'layer', 'rho_MLP_norms_3': 'layer'}. 
Test Accuracy: 0.4005
Accuracy:  0.40047582999891856 , Inference time:  0.027560949325561523 , Validation Loss:  1.3774353363076035 , Param Count:  18701
Conv bp:  tensor(64961.2500)
DeepSetsArchitecture(
  (phi): ConvPhi(
    (layers): Sequential(
      (0): Conv1d(3, 4, kernel_size=(1,), stride=(1,))
    )
  )
  (rho): Rho(
    (layers): Sequential(
      (0): Linear(in_features=4, out_features=5, bias=True)
    )
  )
)
BOPs: tensor(68785.2500)
Trial  14  begins evaluation...
[I 2024-09-16 06:13:56,105] Trial 14 finished with values: [0.32143813794078746, 68785.25] and parameters: {'bottleneck_dim': 2, 'aggregator_type': 0, 'phi_len': 1, 'phi_MLP_norms_0': None, 'rho_len': 1, 'rho_MLP_norms_0': 'layer'}. 
Test Accuracy: 0.3214
Accuracy:  0.32143813794078746 , Inference time:  0.015881776809692383 , Validation Loss:  1.501023037903974 , Param Count:  41
Conv bp:  tensor(1039380.)
DeepSetsArchitecture(
  (phi): ConvPhi(
    (layers): Sequential(
      (0): Conv1d(3, 64, kernel_size=(1,), stride=(1,))
    )
  )
  (rho): Rho(
    (layers): Sequential(
      (0): Linear(in_features=64, out_features=128, bias=True)
      (1): LeakyReLU(negative_slope=0.0078125)
      (2): Linear(in_features=128, out_features=16, bias=True)
      (3): ReLU()
      (4): Linear(in_features=16, out_features=5, bias=True)
    )
  )
)
BOPs: tensor(2826388.)
Trial  15  begins evaluation...
[I 2024-09-16 06:19:24,233] Trial 15 finished with values: [0.6285231800750347, 2826388.0] and parameters: {'bottleneck_dim': 6, 'aggregator_type': 1, 'phi_len': 1, 'phi_MLP_norms_0': None, 'rho_len': 3, 'rho_MLP_width_0': 4, 'rho_MLP_width_1': 1, 'rho_MLP_acts_0': 1, 'rho_MLP_acts_1': 0, 'rho_MLP_norms_0': 'layer', 'rho_MLP_norms_1': 'layer', 'rho_MLP_norms_2': 'layer'}. 
Test Accuracy: 0.6285
Accuracy:  0.6285231800750347 , Inference time:  0.02326369285583496 , Validation Loss:  0.9707058270772299 , Param Count:  10725
Conv bp:  tensor(923281.5000)
DeepSetsArchitecture(
  (phi): ConvPhi(
    (layers): Sequential(
      (0): Conv1d(3, 32, kernel_size=(1,), stride=(1,))
      (1): LeakyReLU(negative_slope=0.0078125)
      (2): Conv1d(32, 4, kernel_size=(1,), stride=(1,))
    )
  )
  (rho): Rho(
    (layers): Sequential(
      (0): Linear(in_features=4, out_features=64, bias=True)
      (1): LeakyReLU(negative_slope=0.0078125)
      (2): Linear(in_features=64, out_features=5, bias=True)
      (3): BatchNorm1d(5, eps=1e-05, momentum=0.1, affine=True, track_running_stats=True)
    )
  )
)
BOPs: tensor(1020849.5000)
Trial  16  begins evaluation...
[I 2024-09-16 06:24:50,446] Trial 16 finished with values: [0.5923484539684388, 1020849.5] and parameters: {'bottleneck_dim': 2, 'aggregator_type': 0, 'phi_len': 2, 'phi_MLP_width_0': 2, 'phi_MLP_acts_0': 1, 'phi_MLP_norms_0': None, 'phi_MLP_norms_1': None, 'rho_len': 2, 'rho_MLP_width_0': 3, 'rho_MLP_acts_0': 1, 'rho_MLP_norms_0': None, 'rho_MLP_norms_1': 'batch'}. 
Test Accuracy: 0.5923
Accuracy:  0.5923484539684388 , Inference time:  0.032224416732788086 , Validation Loss:  1.0580291841305842 , Param Count:  915
Conv bp:  tensor(1855779.)
DeepSetsArchitecture(
  (phi): ConvPhi(
    (layers): Sequential(
      (0): Conv1d(3, 64, kernel_size=(1,), stride=(1,))
      (1): LeakyReLU(negative_slope=0.0078125)
      (2): Conv1d(64, 4, kernel_size=(1,), stride=(1,))
    )
  )
  (rho): Rho(
    (layers): Sequential(
      (0): Linear(in_features=4, out_features=32, bias=True)
      (1): ReLU()
      (2): Linear(in_features=32, out_features=128, bias=True)
      (3): LeakyReLU(negative_slope=0.0078125)
      (4): Linear(in_features=128, out_features=16, bias=True)
      (5): LeakyReLU(negative_slope=0.0078125)
      (6): Linear(in_features=16, out_features=5, bias=True)
      (7): BatchNorm1d(5, eps=1e-05, momentum=0.1, affine=True, track_running_stats=True)
    )
  )
)
BOPs: tensor(2943427.)
Trial  17  begins evaluation...
[I 2024-09-16 06:30:07,803] Trial 17 finished with values: [0.6148089609103992, 2943427.0] and parameters: {'bottleneck_dim': 2, 'aggregator_type': 0, 'phi_len': 2, 'phi_MLP_width_0': 3, 'phi_MLP_acts_0': 1, 'phi_MLP_norms_0': None, 'phi_MLP_norms_1': None, 'rho_len': 4, 'rho_MLP_width_0': 2, 'rho_MLP_width_1': 4, 'rho_MLP_width_2': 1, 'rho_MLP_acts_0': 0, 'rho_MLP_acts_1': 1, 'rho_MLP_acts_2': 1, 'rho_MLP_norms_0': None, 'rho_MLP_norms_1': None, 'rho_MLP_norms_2': None, 'rho_MLP_norms_3': 'batch'}. 
Test Accuracy: 0.6148
Accuracy:  0.6148089609103992 , Inference time:  0.041204214096069336 , Validation Loss:  0.9953499521527972 , Param Count:  7059
Conv bp:  tensor(129922.5000)
DeepSetsArchitecture(
  (phi): ConvPhi(
    (layers): Sequential(
      (0): Conv1d(3, 8, kernel_size=(1,), stride=(1,))
    )
  )
  (rho): Rho(
    (layers): Sequential(
      (0): Linear(in_features=8, out_features=5, bias=True)
    )
  )
)
BOPs: tensor(137394.5000)
Trial  18  begins evaluation...
[I 2024-09-16 06:34:59,604] Trial 18 finished with values: [0.4771027609786126, 137394.5] and parameters: {'bottleneck_dim': 3, 'aggregator_type': 1, 'phi_len': 1, 'phi_MLP_norms_0': 'layer', 'rho_len': 1, 'rho_MLP_norms_0': None}. 
Test Accuracy: 0.4771
Accuracy:  0.4771027609786126 , Inference time:  0.015631437301635742 , Validation Loss:  1.3349871971980245 , Param Count:  77
Conv bp:  tensor(30695292.)
DeepSetsArchitecture(
  (phi): ConvPhi(
    (layers): Sequential(
      (0): Conv1d(3, 16, kernel_size=(1,), stride=(1,))
      (1): LeakyReLU(negative_slope=0.0078125)
      (2): Conv1d(16, 128, kernel_size=(1,), stride=(1,))
      (3): LeakyReLU(negative_slope=0.0078125)
      (4): Conv1d(128, 128, kernel_size=(1,), stride=(1,))
      (5): LeakyReLU(negative_slope=0.0078125)
      (6): Conv1d(128, 16, kernel_size=(1,), stride=(1,))
    )
  )
  (rho): Rho(
    (layers): Sequential(
      (0): Linear(in_features=16, out_features=5, bias=True)
      (1): BatchNorm1d(5, eps=1e-05, momentum=0.1, affine=True, track_running_stats=True)
    )
  )
)
BOPs: tensor(30710524.)
Trial  19  begins evaluation...
[I 2024-09-16 06:39:57,793] Trial 19 finished with values: [0.619853424395438, 30710524.0] and parameters: {'bottleneck_dim': 4, 'aggregator_type': 1, 'phi_len': 4, 'phi_MLP_width_0': 1, 'phi_MLP_width_1': 4, 'phi_MLP_width_2': 4, 'phi_MLP_acts_0': 1, 'phi_MLP_acts_1': 1, 'phi_MLP_acts_2': 1, 'phi_MLP_norms_0': None, 'phi_MLP_norms_1': 'layer', 'phi_MLP_norms_2': None, 'phi_MLP_norms_3': None, 'rho_len': 1, 'rho_MLP_norms_0': 'batch'}. 
Test Accuracy: 0.6199
Accuracy:  0.619853424395438 , Inference time:  0.05488276481628418 , Validation Loss:  0.9893646114537505 , Param Count:  20911
Conv bp:  tensor(568330.)
DeepSetsArchitecture(
  (phi): ConvPhi(
    (layers): Sequential(
      (0): Conv1d(3, 8, kernel_size=(1,), stride=(1,))
      (1): LeakyReLU(negative_slope=0.0078125)
      (2): Conv1d(8, 16, kernel_size=(1,), stride=(1,))
      (3): BatchNorm1d(16, eps=1e-05, momentum=0.1, affine=True, track_running_stats=True)
      (4): LeakyReLU(negative_slope=0.0078125)
      (5): Conv1d(16, 2, kernel_size=(1,), stride=(1,))
    )
  )
  (rho): Rho(
    (layers): Sequential(
      (0): Linear(in_features=2, out_features=32, bias=True)
      (1): LeakyReLU(negative_slope=0.0078125)
      (2): Linear(in_features=32, out_features=8, bias=True)
      (3): ReLU()
      (4): Linear(in_features=8, out_features=128, bias=True)
      (5): BatchNorm1d(128, eps=1e-05, momentum=0.1, affine=True, track_running_stats=True)
      (6): LeakyReLU(negative_slope=0.0078125)
      (7): Linear(in_features=128, out_features=5, bias=True)
    )
  )
)
BOPs: tensor(903882.)
Trial  20  begins evaluation...
[I 2024-09-16 06:44:59,302] Trial 20 finished with values: [0.5830647777657618, 903882.0] and parameters: {'bottleneck_dim': 1, 'aggregator_type': 0, 'phi_len': 3, 'phi_MLP_width_0': 0, 'phi_MLP_width_1': 1, 'phi_MLP_acts_0': 1, 'phi_MLP_acts_1': 1, 'phi_MLP_norms_0': 'layer', 'phi_MLP_norms_1': 'batch', 'phi_MLP_norms_2': 'layer', 'rho_len': 4, 'rho_MLP_width_0': 2, 'rho_MLP_width_1': 0, 'rho_MLP_width_2': 4, 'rho_MLP_acts_0': 1, 'rho_MLP_acts_1': 0, 'rho_MLP_acts_2': 1, 'rho_MLP_norms_0': None, 'rho_MLP_norms_1': None, 'rho_MLP_norms_2': 'batch', 'rho_MLP_norms_3': None}. 
Test Accuracy: 0.5831
Accuracy:  0.5830647777657618 , Inference time:  0.05090188980102539 , Validation Loss:  1.0603080128325897 , Param Count:  2655
Conv bp:  tensor(19868932.)
DeepSetsArchitecture(
  (phi): ConvPhi(
    (layers): Sequential(
      (0): Conv1d(3, 64, kernel_size=(1,), stride=(1,))
      (1): ReLU()
      (2): Conv1d(64, 64, kernel_size=(1,), stride=(1,))
      (3): LeakyReLU(negative_slope=0.0078125)
      (4): Conv1d(64, 64, kernel_size=(1,), stride=(1,))
    )
  )
  (rho): Rho(
    (layers): Sequential(
      (0): Linear(in_features=64, out_features=16, bias=True)
      (1): LeakyReLU(negative_slope=0.0078125)
      (2): Linear(in_features=16, out_features=16, bias=True)
      (3): LeakyReLU(negative_slope=0.0078125)
      (4): Linear(in_features=16, out_features=5, bias=True)
    )
  )
)
BOPs: tensor(20110340.)
Trial  21  begins evaluation...
[I 2024-09-16 06:50:02,441] Trial 21 finished with values: [0.6355674605485355, 20110340.0] and parameters: {'bottleneck_dim': 6, 'aggregator_type': 0, 'phi_len': 3, 'phi_MLP_width_0': 3, 'phi_MLP_width_1': 3, 'phi_MLP_acts_0': 0, 'phi_MLP_acts_1': 1, 'phi_MLP_norms_0': None, 'phi_MLP_norms_1': None, 'phi_MLP_norms_2': None, 'rho_len': 3, 'rho_MLP_width_0': 1, 'rho_MLP_width_1': 1, 'rho_MLP_acts_0': 1, 'rho_MLP_acts_1': 1, 'rho_MLP_norms_0': None, 'rho_MLP_norms_1': 'layer', 'rho_MLP_norms_2': None}. 
Test Accuracy: 0.6356
Accuracy:  0.6355674605485355 , Inference time:  0.040819644927978516 , Validation Loss:  0.9599927177234572 , Param Count:  9973
Conv bp:  tensor(28498440.)
DeepSetsArchitecture(
  (phi): ConvPhi(
    (layers): Sequential(
      (0): Conv1d(3, 128, kernel_size=(1,), stride=(1,))
      (1): BatchNorm1d(128, eps=1e-05, momentum=0.1, affine=True, track_running_stats=True)
      (2): LeakyReLU(negative_slope=0.0078125)
      (3): Conv1d(128, 64, kernel_size=(1,), stride=(1,))
      (4): BatchNorm1d(64, eps=1e-05, momentum=0.1, affine=True, track_running_stats=True)
    )
  )
  (rho): Rho(
    (layers): Sequential(
      (0): Linear(in_features=64, out_features=16, bias=True)
      (1): BatchNorm1d(16, eps=1e-05, momentum=0.1, affine=True, track_running_stats=True)
      (2): LeakyReLU(negative_slope=0.0078125)
      (3): Linear(in_features=16, out_features=8, bias=True)
      (4): LeakyReLU(negative_slope=0.0078125)
      (5): Linear(in_features=8, out_features=5, bias=True)
    )
  )
)
BOPs: tensor(28710904.)
Trial  22  begins evaluation...
[I 2024-09-16 06:55:06,694] Trial 22 finished with values: [0.6497425360407949, 28710904.0] and parameters: {'bottleneck_dim': 6, 'aggregator_type': 1, 'phi_len': 2, 'phi_MLP_width_0': 4, 'phi_MLP_acts_0': 1, 'phi_MLP_norms_0': 'batch', 'phi_MLP_norms_1': 'batch', 'rho_len': 3, 'rho_MLP_width_0': 1, 'rho_MLP_width_1': 0, 'rho_MLP_acts_0': 1, 'rho_MLP_acts_1': 1, 'rho_MLP_norms_0': 'batch', 'rho_MLP_norms_1': None, 'rho_MLP_norms_2': None}. 
Test Accuracy: 0.6497
Accuracy:  0.6497425360407949 , Inference time:  0.04299807548522949 , Validation Loss:  0.9211127944544059 , Param Count:  10405
Conv bp:  tensor(64961.2500)
DeepSetsArchitecture(
  (phi): ConvPhi(
    (layers): Sequential(
      (0): Conv1d(3, 4, kernel_size=(1,), stride=(1,))
    )
  )
  (rho): Rho(
    (layers): Sequential(
      (0): Linear(in_features=4, out_features=16, bias=True)
      (1): LeakyReLU(negative_slope=0.0078125)
      (2): Linear(in_features=16, out_features=32, bias=True)
      (3): LeakyReLU(negative_slope=0.0078125)
      (4): Linear(in_features=32, out_features=5, bias=True)
      (5): BatchNorm1d(5, eps=1e-05, momentum=0.1, affine=True, track_running_stats=True)
    )
  )
)
BOPs: tensor(189057.2500)
Trial  23  begins evaluation...
[I 2024-09-16 07:00:09,166] Trial 23 finished with values: [0.5646504895558643, 189057.25] and parameters: {'bottleneck_dim': 2, 'aggregator_type': 1, 'phi_len': 1, 'phi_MLP_norms_0': None, 'rho_len': 3, 'rho_MLP_width_0': 1, 'rho_MLP_width_1': 2, 'rho_MLP_acts_0': 1, 'rho_MLP_acts_1': 1, 'rho_MLP_norms_0': 'layer', 'rho_MLP_norms_1': 'layer', 'rho_MLP_norms_2': 'batch'}. 
Test Accuracy: 0.5647
Accuracy:  0.5646504895558643 , Inference time:  0.026641368865966797 , Validation Loss:  1.1148124689958534 , Param Count:  815
Conv bp:  tensor(6977154.)
DeepSetsArchitecture(
  (phi): ConvPhi(
    (layers): Sequential(
      (0): Conv1d(3, 32, kernel_size=(1,), stride=(1,))
      (1): LeakyReLU(negative_slope=0.0078125)
      (2): Conv1d(32, 64, kernel_size=(1,), stride=(1,))
    )
  )
  (rho): Rho(
    (layers): Sequential(
      (0): Linear(in_features=64, out_features=8, bias=True)
      (1): BatchNorm1d(8, eps=1e-05, momentum=0.1, affine=True, track_running_stats=True)
      (2): LeakyReLU(negative_slope=0.0078125)
      (3): Linear(in_features=8, out_features=32, bias=True)
      (4): ReLU()
      (5): Linear(in_features=32, out_features=5, bias=True)
    )
  )
)
BOPs: tensor(7143106.)
Trial  24  begins evaluation...
[I 2024-09-16 07:05:13,386] Trial 24 finished with values: [0.6433454509154736, 7143106.0] and parameters: {'bottleneck_dim': 6, 'aggregator_type': 1, 'phi_len': 2, 'phi_MLP_width_0': 2, 'phi_MLP_acts_0': 1, 'phi_MLP_norms_0': 'layer', 'phi_MLP_norms_1': 'layer', 'rho_len': 3, 'rho_MLP_width_0': 0, 'rho_MLP_width_1': 2, 'rho_MLP_acts_0': 1, 'rho_MLP_acts_1': 0, 'rho_MLP_norms_0': 'batch', 'rho_MLP_norms_1': None, 'rho_MLP_norms_2': None}. 
Test Accuracy: 0.6433
Accuracy:  0.6433454509154736 , Inference time:  0.03734397888183594 , Validation Loss:  0.9362616413304595 , Param Count:  3229
Conv bp:  tensor(459336.7500)
DeepSetsArchitecture(
  (phi): ConvPhi(
    (layers): Sequential(
      (0): Conv1d(3, 16, kernel_size=(1,), stride=(1,))
      (1): ReLU()
      (2): Conv1d(16, 4, kernel_size=(1,), stride=(1,))
    )
  )
  (rho): Rho(
    (layers): Sequential(
      (0): Linear(in_features=4, out_features=16, bias=True)
      (1): BatchNorm1d(16, eps=1e-05, momentum=0.1, affine=True, track_running_stats=True)
      (2): ReLU()
      (3): Linear(in_features=16, out_features=8, bias=True)
      (4): LeakyReLU(negative_slope=0.0078125)
      (5): Linear(in_features=8, out_features=64, bias=True)
      (6): ReLU()
      (7): Linear(in_features=64, out_features=5, bias=True)
    )
  )
)
BOPs: tensor(631912.7500)
Trial  25  begins evaluation...
[I 2024-09-16 07:10:13,700] Trial 25 finished with values: [0.6152881183918277, 631912.75] and parameters: {'bottleneck_dim': 2, 'aggregator_type': 0, 'phi_len': 2, 'phi_MLP_width_0': 1, 'phi_MLP_acts_0': 0, 'phi_MLP_norms_0': None, 'phi_MLP_norms_1': None, 'rho_len': 4, 'rho_MLP_width_0': 1, 'rho_MLP_width_1': 0, 'rho_MLP_width_2': 3, 'rho_MLP_acts_0': 0, 'rho_MLP_acts_1': 1, 'rho_MLP_acts_2': 0, 'rho_MLP_norms_0': 'batch', 'rho_MLP_norms_1': 'layer', 'rho_MLP_norms_2': 'layer', 'rho_MLP_norms_3': None}. 
Test Accuracy: 0.6153
Accuracy:  0.6152881183918277 , Inference time:  0.0396881103515625 , Validation Loss:  1.0005430648116027 , Param Count:  1281
Conv bp:  tensor(1855779.)
DeepSetsArchitecture(
  (phi): ConvPhi(
    (layers): Sequential(
      (0): Conv1d(3, 16, kernel_size=(1,), stride=(1,))
      (1): LeakyReLU(negative_slope=0.0078125)
      (2): Conv1d(16, 32, kernel_size=(1,), stride=(1,))
    )
  )
  (rho): Rho(
    (layers): Sequential(
      (0): Linear(in_features=32, out_features=8, bias=True)
      (1): BatchNorm1d(8, eps=1e-05, momentum=0.1, affine=True, track_running_stats=True)
      (2): LeakyReLU(negative_slope=0.0078125)
      (3): Linear(in_features=8, out_features=5, bias=True)
    )
  )
)
BOPs: tensor(1909779.)
Trial  26  begins evaluation...
[I 2024-09-16 07:15:12,933] Trial 26 finished with values: [0.6217750455449168, 1909779.0] and parameters: {'bottleneck_dim': 5, 'aggregator_type': 1, 'phi_len': 2, 'phi_MLP_width_0': 1, 'phi_MLP_acts_0': 1, 'phi_MLP_norms_0': None, 'phi_MLP_norms_1': None, 'rho_len': 2, 'rho_MLP_width_0': 0, 'rho_MLP_acts_0': 1, 'rho_MLP_norms_0': 'batch', 'rho_MLP_norms_1': None}. 
Test Accuracy: 0.6218
Accuracy:  0.6217750455449168 , Inference time:  0.03240966796875 , Validation Loss:  0.989512254186228 , Param Count:  933
Conv bp:  tensor(30102260.)
DeepSetsArchitecture(
  (phi): ConvPhi(
    (layers): Sequential(
      (0): Conv1d(3, 64, kernel_size=(1,), stride=(1,))
      (1): LeakyReLU(negative_slope=0.0078125)
      (2): Conv1d(64, 128, kernel_size=(1,), stride=(1,))
      (3): ReLU()
      (4): Conv1d(128, 16, kernel_size=(1,), stride=(1,))
      (5): LeakyReLU(negative_slope=0.0078125)
      (6): Conv1d(16, 4, kernel_size=(1,), stride=(1,))
      (7): BatchNorm1d(4, eps=1e-05, momentum=0.1, affine=True, track_running_stats=True)
    )
  )
  (rho): Rho(
    (layers): Sequential(
      (0): Linear(in_features=4, out_features=128, bias=True)
      (1): LeakyReLU(negative_slope=0.0078125)
      (2): Linear(in_features=128, out_features=64, bias=True)
      (3): ReLU()
      (4): Linear(in_features=64, out_features=8, bias=True)
      (5): BatchNorm1d(8, eps=1e-05, momentum=0.1, affine=True, track_running_stats=True)
      (6): ReLU()
      (7): Linear(in_features=8, out_features=5, bias=True)
    )
  )
)
BOPs: tensor(31706724.)
Trial  27  begins evaluation...
