[I 2024-09-17 02:26:53,589] Trial 254 finished with values: [0.6401527314472053, 4886083.0] and parameters: {'bottleneck_dim': 2, 'aggregator_type': 0, 'phi_len': 2, 'phi_MLP_width_0': 3, 'phi_MLP_acts_0': 1, 'phi_MLP_norms_0': None, 'phi_MLP_norms_1': 'layer', 'rho_len': 4, 'rho_MLP_width_0': 4, 'rho_MLP_width_1': 3, 'rho_MLP_width_2': 4, 'rho_MLP_acts_0': 0, 'rho_MLP_acts_1': 0, 'rho_MLP_acts_2': 1, 'rho_MLP_norms_0': 'batch', 'rho_MLP_norms_1': 'batch', 'rho_MLP_norms_2': None, 'rho_MLP_norms_3': None}. 
Test Accuracy: 0.6402
Accuracy:  0.6401527314472053 , Inference time:  0.04508471488952637 , Validation Loss:  0.9463310594461403 , Param Count:  18761
Conv bp:  tensor(81132520.)
DeepSetsArchitecture(
  (phi): ConvPhi(
    (layers): Sequential(
      (0): Conv1d(3, 128, kernel_size=(1,), stride=(1,))
      (1): LeakyReLU(negative_slope=0.0078125)
      (2): Conv1d(128, 128, kernel_size=(1,), stride=(1,))
      (3): ReLU()
      (4): Conv1d(128, 128, kernel_size=(1,), stride=(1,))
      (5): BatchNorm1d(128, eps=1e-05, momentum=0.1, affine=True, track_running_stats=True)
      (6): ReLU()
      (7): Conv1d(128, 64, kernel_size=(1,), stride=(1,))
    )
  )
  (rho): Rho(
    (layers): Sequential(
      (0): Linear(in_features=64, out_features=8, bias=True)
      (1): BatchNorm1d(8, eps=1e-05, momentum=0.1, affine=True, track_running_stats=True)
      (2): LeakyReLU(negative_slope=0.0078125)
      (3): Linear(in_features=8, out_features=128, bias=True)
      (4): BatchNorm1d(128, eps=1e-05, momentum=0.1, affine=True, track_running_stats=True)
      (5): LeakyReLU(negative_slope=0.0078125)
      (6): Linear(in_features=128, out_features=8, bias=True)
      (7): LeakyReLU(negative_slope=0.0078125)
      (8): Linear(in_features=8, out_features=5, bias=True)
    )
  )
)
BOPs: tensor(81584216.)
Trial  255  begins evaluation...
[I 2024-09-17 02:32:32,602] Trial 255 finished with values: [0.652276413972099, 81584216.0] and parameters: {'bottleneck_dim': 6, 'aggregator_type': 0, 'phi_len': 4, 'phi_MLP_width_0': 4, 'phi_MLP_width_1': 4, 'phi_MLP_width_2': 4, 'phi_MLP_acts_0': 1, 'phi_MLP_acts_1': 0, 'phi_MLP_acts_2': 0, 'phi_MLP_norms_0': None, 'phi_MLP_norms_1': None, 'phi_MLP_norms_2': 'batch', 'phi_MLP_norms_3': None, 'rho_len': 4, 'rho_MLP_width_0': 0, 'rho_MLP_width_1': 4, 'rho_MLP_width_2': 0, 'rho_MLP_acts_0': 1, 'rho_MLP_acts_1': 1, 'rho_MLP_acts_2': 1, 'rho_MLP_norms_0': 'batch', 'rho_MLP_norms_1': 'batch', 'rho_MLP_norms_2': None, 'rho_MLP_norms_3': None}. 
Test Accuracy: 0.6523
Accuracy:  0.652276413972099 , Inference time:  0.06926202774047852 , Validation Loss:  0.9203875729826843 , Param Count:  45069
Conv bp:  tensor(1275025.5000)
DeepSetsArchitecture(
  (phi): ConvPhi(
    (layers): Sequential(
      (0): Conv1d(3, 8, kernel_size=(1,), stride=(1,))
      (1): LeakyReLU(negative_slope=0.0078125)
      (2): Conv1d(8, 32, kernel_size=(1,), stride=(1,))
      (3): LeakyReLU(negative_slope=0.0078125)
      (4): Conv1d(32, 8, kernel_size=(1,), stride=(1,))
    )
  )
  (rho): Rho(
    (layers): Sequential(
      (0): Linear(in_features=8, out_features=64, bias=True)
      (1): ReLU()
      (2): Linear(in_features=64, out_features=128, bias=True)
      (3): ReLU()
      (4): Linear(in_features=128, out_features=128, bias=True)
      (5): LeakyReLU(negative_slope=0.0078125)
      (6): Linear(in_features=128, out_features=5, bias=True)
    )
  )
)
BOPs: tensor(5732241.5000)
Trial  256  begins evaluation...
[I 2024-09-17 02:37:57,851] Trial 256 finished with values: [0.6478608446814351, 5732241.5] and parameters: {'bottleneck_dim': 3, 'aggregator_type': 0, 'phi_len': 3, 'phi_MLP_width_0': 0, 'phi_MLP_width_1': 2, 'phi_MLP_acts_0': 1, 'phi_MLP_acts_1': 1, 'phi_MLP_norms_0': None, 'phi_MLP_norms_1': None, 'phi_MLP_norms_2': None, 'rho_len': 4, 'rho_MLP_width_0': 3, 'rho_MLP_width_1': 4, 'rho_MLP_width_2': 4, 'rho_MLP_acts_0': 0, 'rho_MLP_acts_1': 0, 'rho_MLP_acts_2': 1, 'rho_MLP_norms_0': 'layer', 'rho_MLP_norms_1': None, 'rho_MLP_norms_2': None, 'rho_MLP_norms_3': None}. 
Test Accuracy: 0.6479
Accuracy:  0.6478608446814351 , Inference time:  0.04287290573120117 , Validation Loss:  0.9219050030319058 , Param Count:  26637
Conv bp:  tensor(129922.5000)
DeepSetsArchitecture(
  (phi): ConvPhi(
    (layers): Sequential(
      (0): Conv1d(3, 8, kernel_size=(1,), stride=(1,))
      (1): BatchNorm1d(8, eps=1e-05, momentum=0.1, affine=True, track_running_stats=True)
    )
  )
  (rho): Rho(
    (layers): Sequential(
      (0): Linear(in_features=8, out_features=64, bias=True)
      (1): BatchNorm1d(64, eps=1e-05, momentum=0.1, affine=True, track_running_stats=True)
      (2): LeakyReLU(negative_slope=0.0078125)
      (3): Linear(in_features=64, out_features=5, bias=True)
      (4): BatchNorm1d(5, eps=1e-05, momentum=0.1, affine=True, track_running_stats=True)
    )
  )
)
BOPs: tensor(270786.5000)
Trial  257  begins evaluation...
[I 2024-09-17 02:43:04,511] Trial 257 finished with values: [0.5970102569648368, 270786.5] and parameters: {'bottleneck_dim': 3, 'aggregator_type': 1, 'phi_len': 1, 'phi_MLP_norms_0': 'batch', 'rho_len': 2, 'rho_MLP_width_0': 3, 'rho_MLP_acts_0': 1, 'rho_MLP_norms_0': 'batch', 'rho_MLP_norms_1': 'batch'}. 
Test Accuracy: 0.5970
Accuracy:  0.5970102569648368 , Inference time:  0.03033733367919922 , Validation Loss:  1.047254285439342 , Param Count:  1087
Conv bp:  tensor(129922.5000)
DeepSetsArchitecture(
  (phi): ConvPhi(
    (layers): Sequential(
      (0): Conv1d(3, 8, kernel_size=(1,), stride=(1,))
    )
  )
  (rho): Rho(
    (layers): Sequential(
      (0): Linear(in_features=8, out_features=64, bias=True)
      (1): ReLU()
      (2): Linear(in_features=64, out_features=128, bias=True)
      (3): BatchNorm1d(128, eps=1e-05, momentum=0.1, affine=True, track_running_stats=True)
      (4): ReLU()
      (5): Linear(in_features=128, out_features=5, bias=True)
    )
  )
)
BOPs: tensor(1736130.5000)
Trial  258  begins evaluation...
[I 2024-09-17 02:47:57,066] Trial 258 finished with values: [0.601665404996215, 1736130.5] and parameters: {'bottleneck_dim': 3, 'aggregator_type': 1, 'phi_len': 1, 'phi_MLP_norms_0': None, 'rho_len': 3, 'rho_MLP_width_0': 3, 'rho_MLP_width_1': 4, 'rho_MLP_acts_0': 0, 'rho_MLP_acts_1': 0, 'rho_MLP_norms_0': 'layer', 'rho_MLP_norms_1': 'batch', 'rho_MLP_norms_2': 'layer'}. 
Test Accuracy: 0.6017
Accuracy:  0.601665404996215 , Inference time:  0.0279538631439209 , Validation Loss:  1.0304380849916108 , Param Count:  9829
Conv bp:  tensor(64961.2500)
DeepSetsArchitecture(
  (phi): ConvPhi(
    (layers): Sequential(
      (0): Conv1d(3, 4, kernel_size=(1,), stride=(1,))
    )
  )
  (rho): Rho(
    (layers): Sequential(
      (0): Linear(in_features=4, out_features=5, bias=True)
    )
  )
)
BOPs: tensor(68625.2500)
Trial  259  begins evaluation...
[I 2024-09-17 02:50:38,070] Trial 259 finished with values: [0.46294765038141267, 68625.25] and parameters: {'bottleneck_dim': 2, 'aggregator_type': 1, 'phi_len': 1, 'phi_MLP_norms_0': None, 'rho_len': 1, 'rho_MLP_norms_0': 'layer'}. 
Test Accuracy: 0.4629
Accuracy:  0.46294765038141267 , Inference time:  0.015000581741333008 , Validation Loss:  1.3953508414378784 , Param Count:  41
Conv bp:  tensor(3729990.)
DeepSetsArchitecture(
  (phi): ConvPhi(
    (layers): Sequential(
      (0): Conv1d(3, 128, kernel_size=(1,), stride=(1,))
      (1): LeakyReLU(negative_slope=0.0078125)
      (2): Conv1d(128, 4, kernel_size=(1,), stride=(1,))
    )
  )
  (rho): Rho(
    (layers): Sequential(
      (0): Linear(in_features=4, out_features=32, bias=True)
      (1): BatchNorm1d(32, eps=1e-05, momentum=0.1, affine=True, track_running_stats=True)
      (2): ReLU()
      (3): Linear(in_features=32, out_features=32, bias=True)
      (4): BatchNorm1d(32, eps=1e-05, momentum=0.1, affine=True, track_running_stats=True)
      (5): ReLU()
      (6): Linear(in_features=32, out_features=64, bias=True)
      (7): LeakyReLU(negative_slope=0.0078125)
      (8): Linear(in_features=64, out_features=5, bias=True)
    )
  )
)
BOPs: tensor(4328806.)
Trial  260  begins evaluation...
[I 2024-09-17 02:55:35,486] Trial 260 finished with values: [0.6434436116495162, 4328806.0] and parameters: {'bottleneck_dim': 2, 'aggregator_type': 0, 'phi_len': 2, 'phi_MLP_width_0': 4, 'phi_MLP_acts_0': 1, 'phi_MLP_norms_0': None, 'phi_MLP_norms_1': 'layer', 'rho_len': 4, 'rho_MLP_width_0': 2, 'rho_MLP_width_1': 2, 'rho_MLP_width_2': 3, 'rho_MLP_acts_0': 0, 'rho_MLP_acts_1': 0, 'rho_MLP_acts_2': 1, 'rho_MLP_norms_0': 'batch', 'rho_MLP_norms_1': 'batch', 'rho_MLP_norms_2': 'layer', 'rho_MLP_norms_3': None}. 
Test Accuracy: 0.6434
Accuracy:  0.6434436116495162 , Inference time:  0.04204916954040527 , Validation Loss:  0.941065323596098 , Param Count:  4809
Conv bp:  tensor(11846796.)
DeepSetsArchitecture(
  (phi): ConvPhi(
    (layers): Sequential(
      (0): Conv1d(3, 64, kernel_size=(1,), stride=(1,))
      (1): LeakyReLU(negative_slope=0.0078125)
      (2): Conv1d(64, 32, kernel_size=(1,), stride=(1,))
      (3): ReLU()
      (4): Conv1d(32, 64, kernel_size=(1,), stride=(1,))
      (5): BatchNorm1d(64, eps=1e-05, momentum=0.1, affine=True, track_running_stats=True)
      (6): LeakyReLU(negative_slope=0.0078125)
      (7): Conv1d(64, 64, kernel_size=(1,), stride=(1,))
    )
  )
  (rho): Rho(
    (layers): Sequential(
      (0): Linear(in_features=64, out_features=128, bias=True)
      (1): ReLU()
      (2): Linear(in_features=128, out_features=8, bias=True)
      (3): LeakyReLU(negative_slope=0.0078125)
      (4): Linear(in_features=8, out_features=5, bias=True)
    )
  )
)
BOPs: tensor(13449468.)
Trial  261  begins evaluation...
[I 2024-09-17 03:00:54,636] Trial 261 finished with values: [0.6591426741313191, 13449468.0] and parameters: {'bottleneck_dim': 6, 'aggregator_type': 0, 'phi_len': 4, 'phi_MLP_width_0': 3, 'phi_MLP_width_1': 2, 'phi_MLP_width_2': 3, 'phi_MLP_acts_0': 1, 'phi_MLP_acts_1': 0, 'phi_MLP_acts_2': 1, 'phi_MLP_norms_0': None, 'phi_MLP_norms_1': None, 'phi_MLP_norms_2': 'batch', 'phi_MLP_norms_3': 'layer', 'rho_len': 3, 'rho_MLP_width_0': 4, 'rho_MLP_width_1': 0, 'rho_MLP_acts_0': 0, 'rho_MLP_acts_1': 1, 'rho_MLP_norms_0': 'layer', 'rho_MLP_norms_1': 'layer', 'rho_MLP_norms_2': None}. 
Test Accuracy: 0.6591
Accuracy:  0.6591426741313191 , Inference time:  0.05507636070251465 , Validation Loss:  0.8982976026275531 , Param Count:  18133
Conv bp:  tensor(129922.5000)
DeepSetsArchitecture(
  (phi): ConvPhi(
    (layers): Sequential(
      (0): Conv1d(3, 8, kernel_size=(1,), stride=(1,))
    )
  )
  (rho): Rho(
    (layers): Sequential(
      (0): Linear(in_features=8, out_features=64, bias=True)
      (1): ReLU()
      (2): Linear(in_features=64, out_features=128, bias=True)
      (3): LeakyReLU(negative_slope=0.0078125)
      (4): Linear(in_features=128, out_features=5, bias=True)
    )
  )
)
BOPs: tensor(1736130.5000)
Trial  262  begins evaluation...
[I 2024-09-17 03:06:02,594] Trial 262 finished with values: [0.6011629551372171, 1736130.5] and parameters: {'bottleneck_dim': 3, 'aggregator_type': 1, 'phi_len': 1, 'phi_MLP_norms_0': None, 'rho_len': 3, 'rho_MLP_width_0': 3, 'rho_MLP_width_1': 4, 'rho_MLP_acts_0': 0, 'rho_MLP_acts_1': 1, 'rho_MLP_norms_0': 'layer', 'rho_MLP_norms_1': None, 'rho_MLP_norms_2': 'layer'}. 
Test Accuracy: 0.6012
Accuracy:  0.6011629551372171 , Inference time:  0.02410101890563965 , Validation Loss:  1.0299688658746733 , Param Count:  9573
Conv bp:  tensor(64961.2500)
DeepSetsArchitecture(
  (phi): ConvPhi(
    (layers): Sequential(
      (0): Conv1d(3, 4, kernel_size=(1,), stride=(1,))
      (1): BatchNorm1d(4, eps=1e-05, momentum=0.1, affine=True, track_running_stats=True)
    )
  )
  (rho): Rho(
    (layers): Sequential(
      (0): Linear(in_features=4, out_features=64, bias=True)
      (1): LeakyReLU(negative_slope=0.0078125)
      (2): Linear(in_features=64, out_features=128, bias=True)
      (3): BatchNorm1d(128, eps=1e-05, momentum=0.1, affine=True, track_running_stats=True)
      (4): ReLU()
      (5): Linear(in_features=128, out_features=5, bias=True)
    )
  )
)
BOPs: tensor(1627713.2500)
Trial  263  begins evaluation...
[I 2024-09-17 03:11:15,269] Trial 263 finished with values: [0.5755895883072265, 1627713.25] and parameters: {'bottleneck_dim': 2, 'aggregator_type': 1, 'phi_len': 1, 'phi_MLP_norms_0': 'batch', 'rho_len': 3, 'rho_MLP_width_0': 3, 'rho_MLP_width_1': 4, 'rho_MLP_acts_0': 1, 'rho_MLP_acts_1': 0, 'rho_MLP_norms_0': 'layer', 'rho_MLP_norms_1': 'batch', 'rho_MLP_norms_2': 'layer'}. 
Test Accuracy: 0.5756
Accuracy:  0.5755895883072265 , Inference time:  0.03139352798461914 , Validation Loss:  1.0893827096945574 , Param Count:  9565
Conv bp:  tensor(327110.2500)
DeepSetsArchitecture(
  (phi): ConvPhi(
    (layers): Sequential(
      (0): Conv1d(3, 8, kernel_size=(1,), stride=(1,))
      (1): LeakyReLU(negative_slope=0.0078125)
      (2): Conv1d(8, 8, kernel_size=(1,), stride=(1,))
      (3): BatchNorm1d(8, eps=1e-05, momentum=0.1, affine=True, track_running_stats=True)
    )
  )
  (rho): Rho(
    (layers): Sequential(
      (0): Linear(in_features=8, out_features=16, bias=True)
      (1): BatchNorm1d(16, eps=1e-05, momentum=0.1, affine=True, track_running_stats=True)
      (2): ReLU()
      (3): Linear(in_features=16, out_features=64, bias=True)
      (4): BatchNorm1d(64, eps=1e-05, momentum=0.1, affine=True, track_running_stats=True)
      (5): LeakyReLU(negative_slope=0.0078125)
      (6): Linear(in_features=64, out_features=64, bias=True)
      (7): LeakyReLU(negative_slope=0.0078125)
      (8): Linear(in_features=64, out_features=5, bias=True)
      (9): BatchNorm1d(5, eps=1e-05, momentum=0.1, affine=True, track_running_stats=True)
    )
  )
)
BOPs: tensor(1280966.2500)
Trial  264  begins evaluation...
[I 2024-09-17 03:16:14,447] Trial 264 finished with values: [0.629095507066741, 1280966.25] and parameters: {'bottleneck_dim': 3, 'aggregator_type': 0, 'phi_len': 2, 'phi_MLP_width_0': 0, 'phi_MLP_acts_0': 1, 'phi_MLP_norms_0': None, 'phi_MLP_norms_1': 'batch', 'rho_len': 4, 'rho_MLP_width_0': 1, 'rho_MLP_width_1': 3, 'rho_MLP_width_2': 3, 'rho_MLP_acts_0': 0, 'rho_MLP_acts_1': 1, 'rho_MLP_acts_2': 1, 'rho_MLP_norms_0': 'batch', 'rho_MLP_norms_1': 'batch', 'rho_MLP_norms_2': None, 'rho_MLP_norms_3': 'batch'}. 
Test Accuracy: 0.6291
Accuracy:  0.629095507066741 , Inference time:  0.0498661994934082 , Validation Loss:  0.963888887645436 , Param Count:  6007
Conv bp:  tensor(1039380.)
DeepSetsArchitecture(
  (phi): ConvPhi(
    (layers): Sequential(
      (0): Conv1d(3, 64, kernel_size=(1,), stride=(1,))
      (1): BatchNorm1d(64, eps=1e-05, momentum=0.1, affine=True, track_running_stats=True)
    )
  )
  (rho): Rho(
    (layers): Sequential(
      (0): Linear(in_features=64, out_features=32, bias=True)
      (1): BatchNorm1d(32, eps=1e-05, momentum=0.1, affine=True, track_running_stats=True)
      (2): ReLU()
      (3): Linear(in_features=32, out_features=5, bias=True)
    )
  )
)
BOPs: tensor(1427668.)
Trial  265  begins evaluation...
[I 2024-09-17 03:21:20,652] Trial 265 finished with values: [0.39783380888604203, 1427668.0] and parameters: {'bottleneck_dim': 6, 'aggregator_type': 0, 'phi_len': 1, 'phi_MLP_norms_0': 'batch', 'rho_len': 2, 'rho_MLP_width_0': 2, 'rho_MLP_acts_0': 0, 'rho_MLP_norms_0': 'batch', 'rho_MLP_norms_1': None}. 
Test Accuracy: 0.3978
Accuracy:  0.39783380888604203 , Inference time:  0.028405189514160156 , Validation Loss:  1.3853475406867306 , Param Count:  2693
Conv bp:  tensor(64961.2500)
DeepSetsArchitecture(
  (phi): ConvPhi(
    (layers): Sequential(
      (0): Conv1d(3, 4, kernel_size=(1,), stride=(1,))
    )
  )
  (rho): Rho(
    (layers): Sequential(
      (0): Linear(in_features=4, out_features=8, bias=True)
      (1): ReLU()
      (2): Linear(in_features=8, out_features=5, bias=True)
    )
  )
)
BOPs: tensor(77233.2500)
Trial  266  begins evaluation...
[I 2024-09-17 03:26:20,411] Trial 266 finished with values: [0.4746271139912321, 77233.25] and parameters: {'bottleneck_dim': 2, 'aggregator_type': 1, 'phi_len': 1, 'phi_MLP_norms_0': 'layer', 'rho_len': 2, 'rho_MLP_width_0': 0, 'rho_MLP_acts_0': 0, 'rho_MLP_norms_0': 'layer', 'rho_MLP_norms_1': None}. 
Test Accuracy: 0.4746
Accuracy:  0.4746271139912321 , Inference time:  0.018884897232055664 , Validation Loss:  1.2676918474184413 , Param Count:  101
Conv bp:  tensor(1855779.)
DeepSetsArchitecture(
  (phi): ConvPhi(
    (layers): Sequential(
      (0): Conv1d(3, 64, kernel_size=(1,), stride=(1,))
      (1): BatchNorm1d(64, eps=1e-05, momentum=0.1, affine=True, track_running_stats=True)
      (2): ReLU()
      (3): Conv1d(64, 4, kernel_size=(1,), stride=(1,))
    )
  )
  (rho): Rho(
    (layers): Sequential(
      (0): Linear(in_features=4, out_features=128, bias=True)
      (1): ReLU()
      (2): Linear(in_features=128, out_features=64, bias=True)
      (3): BatchNorm1d(64, eps=1e-05, momentum=0.1, affine=True, track_running_stats=True)
      (4): LeakyReLU(negative_slope=0.0078125)
      (5): Linear(in_features=64, out_features=5, bias=True)
    )
  )
)
BOPs: tensor(3420579.)
Trial  267  begins evaluation...
[I 2024-09-17 03:31:22,095] Trial 267 finished with values: [0.6124547670346308, 3420579.0] and parameters: {'bottleneck_dim': 2, 'aggregator_type': 1, 'phi_len': 2, 'phi_MLP_width_0': 3, 'phi_MLP_acts_0': 0, 'phi_MLP_norms_0': 'batch', 'phi_MLP_norms_1': None, 'rho_len': 3, 'rho_MLP_width_0': 4, 'rho_MLP_width_1': 3, 'rho_MLP_acts_0': 0, 'rho_MLP_acts_1': 1, 'rho_MLP_norms_0': 'layer', 'rho_MLP_norms_1': 'batch', 'rho_MLP_norms_2': 'layer'}. 
Test Accuracy: 0.6125
Accuracy:  0.6124547670346308 , Inference time:  0.04016542434692383 , Validation Loss:  1.0104862901629235 , Param Count:  9993
Conv bp:  tensor(129922.5000)
DeepSetsArchitecture(
  (phi): ConvPhi(
    (layers): Sequential(
      (0): Conv1d(3, 8, kernel_size=(1,), stride=(1,))
      (1): BatchNorm1d(8, eps=1e-05, momentum=0.1, affine=True, track_running_stats=True)
    )
  )
  (rho): Rho(
    (layers): Sequential(
      (0): Linear(in_features=8, out_features=8, bias=True)
      (1): BatchNorm1d(8, eps=1e-05, momentum=0.1, affine=True, track_running_stats=True)
      (2): LeakyReLU(negative_slope=0.0078125)
      (3): Linear(in_features=8, out_features=32, bias=True)
      (4): LeakyReLU(negative_slope=0.0078125)
      (5): Linear(in_features=32, out_features=32, bias=True)
      (6): ReLU()
      (7): Linear(in_features=32, out_features=5, bias=True)
    )
  )
)
BOPs: tensor(385154.5000)
Trial  268  begins evaluation...
[I 2024-09-17 03:36:22,342] Trial 268 finished with values: [0.5919158812421492, 385154.5] and parameters: {'bottleneck_dim': 3, 'aggregator_type': 1, 'phi_len': 1, 'phi_MLP_norms_0': 'batch', 'rho_len': 4, 'rho_MLP_width_0': 0, 'rho_MLP_width_1': 2, 'rho_MLP_width_2': 2, 'rho_MLP_acts_0': 1, 'rho_MLP_acts_1': 1, 'rho_MLP_acts_2': 0, 'rho_MLP_norms_0': 'batch', 'rho_MLP_norms_1': 'layer', 'rho_MLP_norms_2': None, 'rho_MLP_norms_3': 'layer'}. 
Test Accuracy: 0.5919
Accuracy:  0.5919158812421492 , Inference time:  0.03365182876586914 , Validation Loss:  1.0527423948657757 , Param Count:  1645
Conv bp:  tensor(1224714.)
DeepSetsArchitecture(
  (phi): ConvPhi(
    (layers): Sequential(
      (0): Conv1d(3, 8, kernel_size=(1,), stride=(1,))
      (1): BatchNorm1d(8, eps=1e-05, momentum=0.1, affine=True, track_running_stats=True)
      (2): ReLU()
      (3): Conv1d(8, 16, kernel_size=(1,), stride=(1,))
      (4): ReLU()
      (5): Conv1d(16, 16, kernel_size=(1,), stride=(1,))
      (6): BatchNorm1d(16, eps=1e-05, momentum=0.1, affine=True, track_running_stats=True)
      (7): ReLU()
      (8): Conv1d(16, 64, kernel_size=(1,), stride=(1,))
    )
  )
  (rho): Rho(
    (layers): Sequential(
      (0): Linear(in_features=64, out_features=16, bias=True)
      (1): BatchNorm1d(16, eps=1e-05, momentum=0.1, affine=True, track_running_stats=True)
      (2): ReLU()
      (3): Linear(in_features=16, out_features=64, bias=True)
      (4): BatchNorm1d(64, eps=1e-05, momentum=0.1, affine=True, track_running_stats=True)
      (5): ReLU()
      (6): Linear(in_features=64, out_features=128, bias=True)
      (7): LeakyReLU(negative_slope=0.0078125)
      (8): Linear(in_features=128, out_features=5, bias=True)
    )
  )
)
BOPs: tensor(3102090.)
Trial  269  begins evaluation...
