[I 2024-09-16 11:58:49,319] Trial 81 finished with values: [0.603828268627663, 972017.5] and parameters: {'bottleneck_dim': 2, 'aggregator_type': 0, 'phi_len': 2, 'phi_MLP_width_0': 2, 'phi_MLP_acts_0': 1, 'phi_MLP_norms_0': 'layer', 'phi_MLP_norms_1': None, 'rho_len': 2, 'rho_MLP_width_0': 2, 'rho_MLP_acts_0': 1, 'rho_MLP_norms_0': 'batch', 'rho_MLP_norms_1': 'layer'}. 
Test Accuracy: 0.6038
Accuracy:  0.603828268627663 , Inference time:  0.03293752670288086 , Validation Loss:  1.028049138127541 , Param Count:  649
Conv bp:  tensor(129922.5000)
DeepSetsArchitecture(
  (phi): ConvPhi(
    (layers): Sequential(
      (0): Conv1d(3, 8, kernel_size=(1,), stride=(1,))
      (1): BatchNorm1d(8, eps=1e-05, momentum=0.1, affine=True, track_running_stats=True)
    )
  )
  (rho): Rho(
    (layers): Sequential(
      (0): Linear(in_features=8, out_features=16, bias=True)
      (1): BatchNorm1d(16, eps=1e-05, momentum=0.1, affine=True, track_running_stats=True)
      (2): LeakyReLU(negative_slope=0.0078125)
      (3): Linear(in_features=16, out_features=16, bias=True)
      (4): BatchNorm1d(16, eps=1e-05, momentum=0.1, affine=True, track_running_stats=True)
      (5): ReLU()
      (6): Linear(in_features=16, out_features=128, bias=True)
      (7): BatchNorm1d(128, eps=1e-05, momentum=0.1, affine=True, track_running_stats=True)
      (8): LeakyReLU(negative_slope=0.0078125)
      (9): Linear(in_features=128, out_features=5, bias=True)
      (10): BatchNorm1d(5, eps=1e-05, momentum=0.1, affine=True, track_running_stats=True)
    )
  )
)
BOPs: tensor(650434.5000)
Trial  82  begins evaluation...
[I 2024-09-16 12:03:59,467] Trial 82 finished with values: [0.6098210646280291, 650434.5] and parameters: {'bottleneck_dim': 3, 'aggregator_type': 1, 'phi_len': 1, 'phi_MLP_norms_0': 'batch', 'rho_len': 4, 'rho_MLP_width_0': 1, 'rho_MLP_width_1': 1, 'rho_MLP_width_2': 4, 'rho_MLP_acts_0': 1, 'rho_MLP_acts_1': 0, 'rho_MLP_acts_2': 1, 'rho_MLP_norms_0': 'batch', 'rho_MLP_norms_1': 'batch', 'rho_MLP_norms_2': 'batch', 'rho_MLP_norms_3': 'batch'}. 
Test Accuracy: 0.6098
Accuracy:  0.6098210646280291 , Inference time:  0.04628562927246094 , Validation Loss:  1.0132314096502706 , Param Count:  3615
Conv bp:  tensor(129922.5000)
DeepSetsArchitecture(
  (phi): ConvPhi(
    (layers): Sequential(
      (0): Conv1d(3, 8, kernel_size=(1,), stride=(1,))
    )
  )
  (rho): Rho(
    (layers): Sequential(
      (0): Linear(in_features=8, out_features=128, bias=True)
      (1): ReLU()
      (2): Linear(in_features=128, out_features=5, bias=True)
    )
  )
)
BOPs: tensor(412098.5000)
Trial  83  begins evaluation...
[I 2024-09-16 12:09:19,062] Trial 83 finished with values: [0.5971416925239786, 412098.5] and parameters: {'bottleneck_dim': 3, 'aggregator_type': 1, 'phi_len': 1, 'phi_MLP_norms_0': None, 'rho_len': 2, 'rho_MLP_width_0': 4, 'rho_MLP_acts_0': 0, 'rho_MLP_norms_0': None, 'rho_MLP_norms_1': 'layer'}. 
Test Accuracy: 0.5971
Accuracy:  0.5971416925239786 , Inference time:  0.020832061767578125 , Validation Loss:  1.0432085317819297 , Param Count:  1829
Conv bp:  tensor(1228810.)
DeepSetsArchitecture(
  (phi): ConvPhi(
    (layers): Sequential(
      (0): Conv1d(3, 8, kernel_size=(1,), stride=(1,))
      (1): BatchNorm1d(8, eps=1e-05, momentum=0.1, affine=True, track_running_stats=True)
      (2): LeakyReLU(negative_slope=0.0078125)
      (3): Conv1d(8, 16, kernel_size=(1,), stride=(1,))
      (4): BatchNorm1d(16, eps=1e-05, momentum=0.1, affine=True, track_running_stats=True)
      (5): LeakyReLU(negative_slope=0.0078125)
      (6): Conv1d(16, 32, kernel_size=(1,), stride=(1,))
    )
  )
  (rho): Rho(
    (layers): Sequential(
      (0): Linear(in_features=32, out_features=8, bias=True)
      (1): LeakyReLU(negative_slope=0.0078125)
      (2): Linear(in_features=8, out_features=32, bias=True)
      (3): LeakyReLU(negative_slope=0.0078125)
      (4): Linear(in_features=32, out_features=5, bias=True)
    )
  )
)
BOPs: tensor(1345866.)
Trial  84  begins evaluation...
[I 2024-09-16 12:14:55,866] Trial 84 finished with values: [0.630301719476587, 1345866.0] and parameters: {'bottleneck_dim': 5, 'aggregator_type': 1, 'phi_len': 3, 'phi_MLP_width_0': 0, 'phi_MLP_width_1': 1, 'phi_MLP_acts_0': 1, 'phi_MLP_acts_1': 1, 'phi_MLP_norms_0': 'batch', 'phi_MLP_norms_1': 'batch', 'phi_MLP_norms_2': 'layer', 'rho_len': 3, 'rho_MLP_width_0': 0, 'rho_MLP_width_1': 2, 'rho_MLP_acts_0': 1, 'rho_MLP_acts_1': 1, 'rho_MLP_norms_0': None, 'rho_MLP_norms_1': 'layer', 'rho_MLP_norms_2': None}. 
Test Accuracy: 0.6303
Accuracy:  0.630301719476587 , Inference time:  0.04596233367919922 , Validation Loss:  0.9674792966875089 , Param Count:  1485
Conv bp:  tensor(64961.2500)
DeepSetsArchitecture(
  (phi): ConvPhi(
    (layers): Sequential(
      (0): Conv1d(3, 4, kernel_size=(1,), stride=(1,))
      (1): BatchNorm1d(4, eps=1e-05, momentum=0.1, affine=True, track_running_stats=True)
    )
  )
  (rho): Rho(
    (layers): Sequential(
      (0): Linear(in_features=4, out_features=8, bias=True)
      (1): LeakyReLU(negative_slope=0.0078125)
      (2): Linear(in_features=8, out_features=16, bias=True)
      (3): ReLU()
      (4): Linear(in_features=16, out_features=128, bias=True)
      (5): ReLU()
      (6): Linear(in_features=128, out_features=5, bias=True)
      (7): BatchNorm1d(5, eps=1e-05, momentum=0.1, affine=True, track_running_stats=True)
    )
  )
)
BOPs: tensor(547265.2500)
Trial  85  begins evaluation...
[I 2024-09-16 12:20:25,514] Trial 85 finished with values: [0.5710625483524803, 547265.25] and parameters: {'bottleneck_dim': 2, 'aggregator_type': 1, 'phi_len': 1, 'phi_MLP_norms_0': 'batch', 'rho_len': 4, 'rho_MLP_width_0': 0, 'rho_MLP_width_1': 1, 'rho_MLP_width_2': 4, 'rho_MLP_acts_0': 1, 'rho_MLP_acts_1': 0, 'rho_MLP_acts_2': 0, 'rho_MLP_norms_0': None, 'rho_MLP_norms_1': 'layer', 'rho_MLP_norms_2': None, 'rho_MLP_norms_3': 'batch'}. 
Test Accuracy: 0.5711
Accuracy:  0.5710625483524803 , Inference time:  0.03453540802001953 , Validation Loss:  1.099165019534883 , Param Count:  3039
Conv bp:  tensor(586182.2500)
DeepSetsArchitecture(
  (phi): ConvPhi(
    (layers): Sequential(
      (0): Conv1d(3, 8, kernel_size=(1,), stride=(1,))
      (1): LeakyReLU(negative_slope=0.0078125)
      (2): Conv1d(8, 8, kernel_size=(1,), stride=(1,))
      (3): LeakyReLU(negative_slope=0.0078125)
      (4): Conv1d(8, 8, kernel_size=(1,), stride=(1,))
      (5): ReLU()
      (6): Conv1d(8, 64, kernel_size=(1,), stride=(1,))
      (7): BatchNorm1d(64, eps=1e-05, momentum=0.1, affine=True, track_running_stats=True)
    )
  )
  (rho): Rho(
    (layers): Sequential(
      (0): Linear(in_features=64, out_features=5, bias=True)
    )
  )
)
BOPs: tensor(649414.2500)
Trial  86  begins evaluation...
[I 2024-09-16 12:25:50,851] Trial 86 finished with values: [0.6015256507307983, 649414.25] and parameters: {'bottleneck_dim': 6, 'aggregator_type': 1, 'phi_len': 4, 'phi_MLP_width_0': 0, 'phi_MLP_width_1': 0, 'phi_MLP_width_2': 0, 'phi_MLP_acts_0': 1, 'phi_MLP_acts_1': 1, 'phi_MLP_acts_2': 0, 'phi_MLP_norms_0': None, 'phi_MLP_norms_1': None, 'phi_MLP_norms_2': None, 'phi_MLP_norms_3': 'batch', 'rho_len': 1, 'rho_MLP_norms_0': 'layer'}. 
Test Accuracy: 0.6015
Accuracy:  0.6015256507307983 , Inference time:  0.04319000244140625 , Validation Loss:  1.0360871675063152 , Param Count:  1205
Conv bp:  tensor(228516.3750)
DeepSetsArchitecture(
  (phi): ConvPhi(
    (layers): Sequential(
      (0): Conv1d(3, 8, kernel_size=(1,), stride=(1,))
      (1): ReLU()
      (2): Conv1d(8, 4, kernel_size=(1,), stride=(1,))
      (3): BatchNorm1d(4, eps=1e-05, momentum=0.1, affine=True, track_running_stats=True)
    )
  )
  (rho): Rho(
    (layers): Sequential(
      (0): Linear(in_features=4, out_features=128, bias=True)
      (1): BatchNorm1d(128, eps=1e-05, momentum=0.1, affine=True, track_running_stats=True)
      (2): LeakyReLU(negative_slope=0.0078125)
      (3): Linear(in_features=128, out_features=32, bias=True)
      (4): ReLU()
      (5): Linear(in_features=32, out_features=64, bias=True)
      (6): LeakyReLU(negative_slope=0.0078125)
      (7): Linear(in_features=64, out_features=5, bias=True)
      (8): BatchNorm1d(5, eps=1e-05, momentum=0.1, affine=True, track_running_stats=True)
    )
  )
)
BOPs: tensor(1428932.3750)
Trial  87  begins evaluation...
[I 2024-09-16 12:31:17,035] Trial 87 finished with values: [0.6006471953481795, 1428932.375] and parameters: {'bottleneck_dim': 2, 'aggregator_type': 0, 'phi_len': 2, 'phi_MLP_width_0': 0, 'phi_MLP_acts_0': 0, 'phi_MLP_norms_0': None, 'phi_MLP_norms_1': 'batch', 'rho_len': 4, 'rho_MLP_width_0': 4, 'rho_MLP_width_1': 2, 'rho_MLP_width_2': 3, 'rho_MLP_acts_0': 1, 'rho_MLP_acts_1': 0, 'rho_MLP_acts_2': 1, 'rho_MLP_norms_0': 'batch', 'rho_MLP_norms_1': 'layer', 'rho_MLP_norms_2': 'layer', 'rho_MLP_norms_3': 'batch'}. 
Test Accuracy: 0.6006
Accuracy:  0.6006471953481795 , Inference time:  0.04766082763671875 , Validation Loss:  1.0215576615463309 , Param Count:  7547
Conv bp:  tensor(259845.)
DeepSetsArchitecture(
  (phi): ConvPhi(
    (layers): Sequential(
      (0): Conv1d(3, 16, kernel_size=(1,), stride=(1,))
    )
  )
  (rho): Rho(
    (layers): Sequential(
      (0): Linear(in_features=16, out_features=128, bias=True)
      (1): BatchNorm1d(128, eps=1e-05, momentum=0.1, affine=True, track_running_stats=True)
      (2): ReLU()
      (3): Linear(in_features=128, out_features=32, bias=True)
      (4): BatchNorm1d(32, eps=1e-05, momentum=0.1, affine=True, track_running_stats=True)
      (5): LeakyReLU(negative_slope=0.0078125)
      (6): Linear(in_features=32, out_features=128, bias=True)
      (7): BatchNorm1d(128, eps=1e-05, momentum=0.1, affine=True, track_running_stats=True)
      (8): ReLU()
      (9): Linear(in_features=128, out_features=5, bias=True)
      (10): BatchNorm1d(5, eps=1e-05, momentum=0.1, affine=True, track_running_stats=True)
    )
  )
)
BOPs: tensor(2126085.)
Trial  88  begins evaluation...
[I 2024-09-16 12:36:15,664] Trial 88 finished with values: [0.6339303391536548, 2126085.0] and parameters: {'bottleneck_dim': 4, 'aggregator_type': 1, 'phi_len': 1, 'phi_MLP_norms_0': None, 'rho_len': 4, 'rho_MLP_width_0': 4, 'rho_MLP_width_1': 2, 'rho_MLP_width_2': 4, 'rho_MLP_acts_0': 0, 'rho_MLP_acts_1': 1, 'rho_MLP_acts_2': 0, 'rho_MLP_norms_0': 'batch', 'rho_MLP_norms_1': 'batch', 'rho_MLP_norms_2': 'batch', 'rho_MLP_norms_3': 'batch'}. 
Test Accuracy: 0.6339
Accuracy:  0.6339303391536548 , Inference time:  0.04392671585083008 , Validation Loss:  0.9545678520689205 , Param Count:  11823
Conv bp:  tensor(64961.2500)
DeepSetsArchitecture(
  (phi): ConvPhi(
    (layers): Sequential(
      (0): Conv1d(3, 4, kernel_size=(1,), stride=(1,))
    )
  )
  (rho): Rho(
    (layers): Sequential(
      (0): Linear(in_features=4, out_features=16, bias=True)
      (1): LeakyReLU(negative_slope=0.0078125)
      (2): Linear(in_features=16, out_features=16, bias=True)
      (3): ReLU()
      (4): Linear(in_features=16, out_features=64, bias=True)
      (5): ReLU()
      (6): Linear(in_features=64, out_features=5, bias=True)
      (7): BatchNorm1d(5, eps=1e-05, momentum=0.1, affine=True, track_running_stats=True)
    )
  )
)
BOPs: tensor(345921.2500)
Trial  89  begins evaluation...
[I 2024-09-16 12:41:12,705] Trial 89 finished with values: [0.5550523662559999, 345921.25] and parameters: {'bottleneck_dim': 2, 'aggregator_type': 1, 'phi_len': 1, 'phi_MLP_norms_0': 'layer', 'rho_len': 4, 'rho_MLP_width_0': 1, 'rho_MLP_width_1': 1, 'rho_MLP_width_2': 3, 'rho_MLP_acts_0': 1, 'rho_MLP_acts_1': 0, 'rho_MLP_acts_2': 0, 'rho_MLP_norms_0': None, 'rho_MLP_norms_1': None, 'rho_MLP_norms_2': None, 'rho_MLP_norms_3': 'batch'}. 
Test Accuracy: 0.5551
Accuracy:  0.5550523662559999 , Inference time:  0.030167818069458008 , Validation Loss:  1.128484192348662 , Param Count:  1791
Conv bp:  tensor(38207224.)
DeepSetsArchitecture(
  (phi): ConvPhi(
    (layers): Sequential(
      (0): Conv1d(3, 32, kernel_size=(1,), stride=(1,))
      (1): BatchNorm1d(32, eps=1e-05, momentum=0.1, affine=True, track_running_stats=True)
      (2): LeakyReLU(negative_slope=0.0078125)
      (3): Conv1d(32, 128, kernel_size=(1,), stride=(1,))
      (4): BatchNorm1d(128, eps=1e-05, momentum=0.1, affine=True, track_running_stats=True)
      (5): ReLU()
      (6): Conv1d(128, 128, kernel_size=(1,), stride=(1,))
      (7): BatchNorm1d(128, eps=1e-05, momentum=0.1, affine=True, track_running_stats=True)
      (8): LeakyReLU(negative_slope=0.0078125)
      (9): Conv1d(128, 32, kernel_size=(1,), stride=(1,))
    )
  )
  (rho): Rho(
    (layers): Sequential(
      (0): Linear(in_features=32, out_features=16, bias=True)
      (1): ReLU()
      (2): Linear(in_features=16, out_features=64, bias=True)
      (3): BatchNorm1d(64, eps=1e-05, momentum=0.1, affine=True, track_running_stats=True)
      (4): LeakyReLU(negative_slope=0.0078125)
      (5): Linear(in_features=64, out_features=16, bias=True)
      (6): BatchNorm1d(16, eps=1e-05, momentum=0.1, affine=True, track_running_stats=True)
      (7): LeakyReLU(negative_slope=0.0078125)
      (8): Linear(in_features=16, out_features=5, bias=True)
      (9): BatchNorm1d(5, eps=1e-05, momentum=0.1, affine=True, track_running_stats=True)
    )
  )
)
BOPs: tensor(38659704.)
Trial  90  begins evaluation...
[I 2024-09-16 12:46:24,564] Trial 90 finished with values: [0.6560414604320736, 38659704.0] and parameters: {'bottleneck_dim': 5, 'aggregator_type': 1, 'phi_len': 4, 'phi_MLP_width_0': 2, 'phi_MLP_width_1': 4, 'phi_MLP_width_2': 4, 'phi_MLP_acts_0': 1, 'phi_MLP_acts_1': 0, 'phi_MLP_acts_2': 1, 'phi_MLP_norms_0': 'batch', 'phi_MLP_norms_1': 'batch', 'phi_MLP_norms_2': 'batch', 'phi_MLP_norms_3': 'layer', 'rho_len': 4, 'rho_MLP_width_0': 1, 'rho_MLP_width_1': 3, 'rho_MLP_width_2': 1, 'rho_MLP_acts_0': 0, 'rho_MLP_acts_1': 1, 'rho_MLP_acts_2': 1, 'rho_MLP_norms_0': None, 'rho_MLP_norms_1': 'batch', 'rho_MLP_norms_2': 'batch', 'rho_MLP_norms_3': 'batch'}. 
Test Accuracy: 0.6560
Accuracy:  0.6560414604320736 , Inference time:  0.07928133010864258 , Validation Loss:  0.9031035040511566 , Param Count:  28479
Conv bp:  tensor(4161305.)
DeepSetsArchitecture(
  (phi): ConvPhi(
    (layers): Sequential(
      (0): Conv1d(3, 32, kernel_size=(1,), stride=(1,))
      (1): BatchNorm1d(32, eps=1e-05, momentum=0.1, affine=True, track_running_stats=True)
      (2): ReLU()
      (3): Conv1d(32, 8, kernel_size=(1,), stride=(1,))
      (4): ReLU()
      (5): Conv1d(8, 128, kernel_size=(1,), stride=(1,))
      (6): LeakyReLU(negative_slope=0.0078125)
      (7): Conv1d(128, 32, kernel_size=(1,), stride=(1,))
    )
  )
  (rho): Rho(
    (layers): Sequential(
      (0): Linear(in_features=32, out_features=16, bias=True)
      (1): ReLU()
      (2): Linear(in_features=16, out_features=64, bias=True)
      (3): LeakyReLU(negative_slope=0.0078125)
      (4): Linear(in_features=64, out_features=128, bias=True)
      (5): ReLU()
      (6): Linear(in_features=128, out_features=5, bias=True)
    )
  )
)
BOPs: tensor(5944601.)
Trial  91  begins evaluation...
[I 2024-09-16 12:51:36,347] Trial 91 finished with values: [0.644413572801158, 5944601.0] and parameters: {'bottleneck_dim': 5, 'aggregator_type': 1, 'phi_len': 4, 'phi_MLP_width_0': 2, 'phi_MLP_width_1': 0, 'phi_MLP_width_2': 4, 'phi_MLP_acts_0': 0, 'phi_MLP_acts_1': 0, 'phi_MLP_acts_2': 1, 'phi_MLP_norms_0': 'batch', 'phi_MLP_norms_1': None, 'phi_MLP_norms_2': None, 'phi_MLP_norms_3': None, 'rho_len': 4, 'rho_MLP_width_0': 1, 'rho_MLP_width_1': 3, 'rho_MLP_width_2': 4, 'rho_MLP_acts_0': 0, 'rho_MLP_acts_1': 1, 'rho_MLP_acts_2': 0, 'rho_MLP_norms_0': None, 'rho_MLP_norms_1': 'layer', 'rho_MLP_norms_2': 'layer', 'rho_MLP_norms_3': None}. 
Test Accuracy: 0.6444
Accuracy:  0.644413572801158 , Inference time:  0.06353473663330078 , Validation Loss:  0.9290740080431205 , Param Count:  16317
Conv bp:  tensor(3748422.)
DeepSetsArchitecture(
  (phi): ConvPhi(
    (layers): Sequential(
      (0): Conv1d(3, 32, kernel_size=(1,), stride=(1,))
      (1): BatchNorm1d(32, eps=1e-05, momentum=0.1, affine=True, track_running_stats=True)
      (2): LeakyReLU(negative_slope=0.0078125)
      (3): Conv1d(32, 32, kernel_size=(1,), stride=(1,))
      (4): BatchNorm1d(32, eps=1e-05, momentum=0.1, affine=True, track_running_stats=True)
    )
  )
  (rho): Rho(
    (layers): Sequential(
      (0): Linear(in_features=32, out_features=32, bias=True)
      (1): ReLU()
      (2): Linear(in_features=32, out_features=8, bias=True)
      (3): ReLU()
      (4): Linear(in_features=8, out_features=8, bias=True)
      (5): BatchNorm1d(8, eps=1e-05, momentum=0.1, affine=True, track_running_stats=True)
      (6): ReLU()
      (7): Linear(in_features=8, out_features=5, bias=True)
    )
  )
)
BOPs: tensor(3987126.)
Trial  92  begins evaluation...
[I 2024-09-16 12:56:46,527] Trial 92 finished with values: [0.6475547162905225, 3987126.0] and parameters: {'bottleneck_dim': 5, 'aggregator_type': 1, 'phi_len': 2, 'phi_MLP_width_0': 2, 'phi_MLP_acts_0': 1, 'phi_MLP_norms_0': 'batch', 'phi_MLP_norms_1': 'batch', 'rho_len': 4, 'rho_MLP_width_0': 2, 'rho_MLP_width_1': 0, 'rho_MLP_width_2': 0, 'rho_MLP_acts_0': 0, 'rho_MLP_acts_1': 0, 'rho_MLP_acts_2': 0, 'rho_MLP_norms_0': None, 'rho_MLP_norms_1': 'layer', 'rho_MLP_norms_2': 'batch', 'rho_MLP_norms_3': None}. 
Test Accuracy: 0.6476
Accuracy:  0.6475547162905225 , Inference time:  0.048195600509643555 , Validation Loss:  0.9240725887875979 , Param Count:  2765
Conv bp:  tensor(1855779.)
DeepSetsArchitecture(
  (phi): ConvPhi(
    (layers): Sequential(
      (0): Conv1d(3, 64, kernel_size=(1,), stride=(1,))
      (1): LeakyReLU(negative_slope=0.0078125)
      (2): Conv1d(64, 4, kernel_size=(1,), stride=(1,))
    )
  )
  (rho): Rho(
    (layers): Sequential(
      (0): Linear(in_features=4, out_features=8, bias=True)
      (1): LeakyReLU(negative_slope=0.0078125)
      (2): Linear(in_features=8, out_features=5, bias=True)
    )
  )
)
BOPs: tensor(1868051.)
Trial  93  begins evaluation...
[I 2024-09-16 13:01:50,419] Trial 93 finished with values: [0.5887963663890992, 1868051.0] and parameters: {'bottleneck_dim': 2, 'aggregator_type': 1, 'phi_len': 2, 'phi_MLP_width_0': 3, 'phi_MLP_acts_0': 1, 'phi_MLP_norms_0': None, 'phi_MLP_norms_1': 'layer', 'rho_len': 2, 'rho_MLP_width_0': 0, 'rho_MLP_acts_0': 1, 'rho_MLP_norms_0': None, 'rho_MLP_norms_1': None}. 
Test Accuracy: 0.5888
Accuracy:  0.5887963663890992 , Inference time:  0.027974843978881836 , Validation Loss:  1.069115970815931 , Param Count:  601
Conv bp:  tensor(129922.5000)
DeepSetsArchitecture(
  (phi): ConvPhi(
    (layers): Sequential(
      (0): Conv1d(3, 8, kernel_size=(1,), stride=(1,))
    )
  )
  (rho): Rho(
    (layers): Sequential(
      (0): Linear(in_features=8, out_features=32, bias=True)
      (1): BatchNorm1d(32, eps=1e-05, momentum=0.1, affine=True, track_running_stats=True)
      (2): LeakyReLU(negative_slope=0.0078125)
      (3): Linear(in_features=32, out_features=5, bias=True)
    )
  )
)
BOPs: tensor(200450.5000)
Trial  94  begins evaluation...
[I 2024-09-16 13:06:49,542] Trial 94 finished with values: [0.5635690577401402, 200450.5] and parameters: {'bottleneck_dim': 3, 'aggregator_type': 1, 'phi_len': 1, 'phi_MLP_norms_0': None, 'rho_len': 2, 'rho_MLP_width_0': 2, 'rho_MLP_acts_0': 1, 'rho_MLP_norms_0': 'batch', 'rho_MLP_norms_1': 'layer'}. 
Test Accuracy: 0.5636
Accuracy:  0.5635690577401402 , Inference time:  0.024072885513305664 , Validation Loss:  1.1171165489826074 , Param Count:  549
Conv bp:  tensor(64961.2500)
DeepSetsArchitecture(
  (phi): ConvPhi(
    (layers): Sequential(
      (0): Conv1d(3, 4, kernel_size=(1,), stride=(1,))
    )
  )
  (rho): Rho(
    (layers): Sequential(
      (0): Linear(in_features=4, out_features=5, bias=True)
    )
  )
)
BOPs: tensor(68625.2500)
Trial  95  begins evaluation...
[I 2024-09-16 13:11:48,565] Trial 95 finished with values: [0.463183901639617, 68625.25] and parameters: {'bottleneck_dim': 2, 'aggregator_type': 1, 'phi_len': 1, 'phi_MLP_norms_0': 'layer', 'rho_len': 1, 'rho_MLP_norms_0': None}. 
Test Accuracy: 0.4632
Accuracy:  0.463183901639617 , Inference time:  0.01505136489868164 , Validation Loss:  1.395246501682567 , Param Count:  41
Conv bp:  tensor(129922.5000)
DeepSetsArchitecture(
  (phi): ConvPhi(
    (layers): Sequential(
      (0): Conv1d(3, 8, kernel_size=(1,), stride=(1,))
      (1): BatchNorm1d(8, eps=1e-05, momentum=0.1, affine=True, track_running_stats=True)
    )
  )
  (rho): Rho(
    (layers): Sequential(
      (0): Linear(in_features=8, out_features=32, bias=True)
      (1): LeakyReLU(negative_slope=0.0078125)
      (2): Linear(in_features=32, out_features=16, bias=True)
      (3): ReLU()
      (4): Linear(in_features=16, out_features=5, bias=True)
      (5): BatchNorm1d(5, eps=1e-05, momentum=0.1, affine=True, track_running_stats=True)
    )
  )
)
BOPs: tensor(273730.5000)
Trial  96  begins evaluation...
[I 2024-09-16 13:16:48,342] Trial 96 finished with values: [0.6045736247098851, 273730.5] and parameters: {'bottleneck_dim': 3, 'aggregator_type': 1, 'phi_len': 1, 'phi_MLP_norms_0': 'batch', 'rho_len': 3, 'rho_MLP_width_0': 2, 'rho_MLP_width_1': 1, 'rho_MLP_acts_0': 1, 'rho_MLP_acts_1': 0, 'rho_MLP_norms_0': 'layer', 'rho_MLP_norms_1': None, 'rho_MLP_norms_2': 'batch'}. 
Test Accuracy: 0.6046
Accuracy:  0.6045736247098851 , Inference time:  0.030215024948120117 , Validation Loss:  1.0283048351605732 , Param Count:  959
Conv bp:  tensor(64961.2500)
DeepSetsArchitecture(
  (phi): ConvPhi(
    (layers): Sequential(
      (0): Conv1d(3, 4, kernel_size=(1,), stride=(1,))
    )
  )
  (rho): Rho(
    (layers): Sequential(
      (0): Linear(in_features=4, out_features=128, bias=True)
      (1): LeakyReLU(negative_slope=0.0078125)
      (2): Linear(in_features=128, out_features=5, bias=True)
    )
  )
)
BOPs: tensor(260673.2500)
Trial  97  begins evaluation...
