KUBERNETES_SERVICE_PORT_HTTPS=443
NVIDIA_VISIBLE_DEVICES=GPU-d121650f-4d5f-98ef-35b6-a0c6e6c4ba59
GGEXPOSE_SERVICE_HOST=10.103.93.169
SPATOPEXPOSE_SERVICE_HOST=10.98.174.135
SSL_JET_V2_EXPOSE_PORT=tcp://10.98.170.207:80
KUBERNETES_SERVICE_PORT=443
SSL_JET_V3_EXPOSE_PORT_80_TCP_ADDR=10.99.91.182
HOSTNAME=dd-global-c-par-3
PFEXPOSEEAST_PORT_80_TCP_ADDR=10.106.41.90
XILINXD_SERVICE_HOST=10.111.109.177
ABCDNNEXPOSE_PORT_80_TCP_PROTO=tcp
PFEXPOSE_PORT_80_TCP_PROTO=tcp
L1ANOMALYEXPOSE_PORT_80_TCP_PORT=80
HHBBVVEXPOSE_PORT_80_TCP_PROTO=tcp
SSL_JET_V3_EXPOSE_PORT=tcp://10.99.91.182:80
SPATOPEXPOSE_PORT_8800_TCP_ADDR=10.98.174.135
J_JEPA_VOL_EXPOSE_PORT=tcp://10.98.255.12:80
BUMPHUNTEXPOSE_SERVICE_PORT=80
HHBBVVEXPOSE_PORT_80_TCP_PORT=80
J_JEPA_VOL_EXPOSE_SERVICE_HOST=10.98.255.12
PFEXPOSE_PORT_80_TCP=tcp://10.97.167.151:80
BUMPHUNTEXPOSE_SERVICE_HOST=10.96.169.13
PFEXPOSE_SERVICE_PORT=80
PWD=/morph-nas-central/Morph
PFEXPOSE_PORT_80_TCP_ADDR=10.97.167.151
PFEXPOSEEAST_SERVICE_PORT=80
JOB_COMPLETION_INDEX=3
PFEXPOSEEAST_SERVICE_HOST=10.106.41.90
J_JEPA_VOL_EXPOSE_PORT_80_TCP_ADDR=10.98.255.12
NVIDIA_DRIVER_CAPABILITIES=compute,utility
PFEXPOSECENTRAL_SERVICE_HOST=10.101.81.212
BUMPHUNTEXPOSE_PORT_80_TCP_PROTO=tcp
SSL_JET_V3_EXPOSE_SERVICE_HOST=10.99.91.182
ABCDNNEXPOSE_SERVICE_PORT=80
SPATOPEXPOSE_PORT_8800_TCP_PROTO=tcp
SSL_JET_V3_EXPOSE_SERVICE_PORT=80
ABCDNNEXPOSE_PORT_80_TCP_ADDR=10.108.83.250
XILINXD_SERVICE_PORT_XILINXD=2100
MODEL_INDEX=3
PFEXPOSECENTRAL_PORT_80_TCP=tcp://10.101.81.212:80
HOME=/root
KUBERNETES_PORT_443_TCP=tcp://10.96.0.1:443
PFEXPOSECENTRAL_PORT_80_TCP_ADDR=10.101.81.212
J_JEPA_VOL_EXPOSE_PORT_80_TCP=tcp://10.98.255.12:80
XILINXD_PORT_2100_TCP_PORT=2100
SPATOPEXPOSE_PORT=tcp://10.98.174.135:8800
L1ANOMALYEXPOSE_PORT_80_TCP_PROTO=tcp
PYTORCH_VERSION=2.2.1
L1ANOMALYEXPOSE_SERVICE_PORT=80
XILINXD_SERVICE_PORT=2100
HHBBVVEXPOSE_PORT_80_TCP_ADDR=10.102.7.121
PFEXPOSEEAST_PORT_80_TCP_PORT=80
SPATOPEXPOSE_PORT_8800_TCP_PORT=8800
PFEXPOSE_SERVICE_HOST=10.97.167.151
PFEXPOSECENTRAL_PORT=tcp://10.101.81.212:80
SPATOPEXPOSE_PORT_8800_TCP=tcp://10.98.174.135:8800
PFEXPOSE_PORT=tcp://10.97.167.151:80
HHBBVVEXPOSE_PORT=tcp://10.102.7.121:80
ABCDNNEXPOSE_PORT_80_TCP_PORT=80
PFEXPOSEEAST_PORT=tcp://10.106.41.90:80
PFEXPOSECENTRAL_SERVICE_PORT=80
XILINXD_PORT_2100_TCP=tcp://10.111.109.177:2100
PFEXPOSEEAST_PORT_80_TCP=tcp://10.106.41.90:80
BUMPHUNTEXPOSE_PORT=tcp://10.96.169.13:80
SSL_JET_V3_EXPOSE_PORT_80_TCP_PROTO=tcp
PFEXPOSEEAST_PORT_80_TCP_PROTO=tcp
GGEXPOSE_SERVICE_PORT=80
PFEXPOSE_PORT_80_TCP_PORT=80
J_JEPA_VOL_EXPOSE_PORT_80_TCP_PORT=80
GGEXPOSE_PORT_80_TCP_PROTO=tcp
L1ANOMALYEXPOSE_PORT=tcp://10.101.29.4:80
SPATOPEXPOSE_SERVICE_PORT=8800
SSL_JET_V3_EXPOSE_PORT_80_TCP_PORT=80
HHBBVVEXPOSE_SERVICE_HOST=10.102.7.121
L1ANOMALYEXPOSE_SERVICE_HOST=10.101.29.4
XILINXD_PORT=tcp://10.111.109.177:2100
SSL_JET_V2_EXPOSE_PORT_80_TCP_ADDR=10.98.170.207
SHLVL=1
BUMPHUNTEXPOSE_PORT_80_TCP_ADDR=10.96.169.13
GGEXPOSE_PORT_80_TCP_ADDR=10.103.93.169
GGEXPOSE_PORT=tcp://10.103.93.169:80
PFEXPOSECENTRAL_PORT_80_TCP_PROTO=tcp
KUBERNETES_PORT_443_TCP_PROTO=tcp
SSL_JET_V2_EXPOSE_SERVICE_PORT=80
KUBERNETES_PORT_443_TCP_ADDR=10.96.0.1
SSL_JET_V3_EXPOSE_PORT_80_TCP=tcp://10.99.91.182:80
L1ANOMALYEXPOSE_PORT_80_TCP_ADDR=10.101.29.4
LD_LIBRARY_PATH=/usr/local/nvidia/lib:/usr/local/nvidia/lib64
SSL_JET_V2_EXPOSE_PORT_80_TCP_PORT=80
BUMPHUNTEXPOSE_PORT_80_TCP_PORT=80
XILINXD_PORT_2100_TCP_ADDR=10.111.109.177
GGEXPOSE_PORT_80_TCP_PORT=80
SSL_JET_V2_EXPOSE_PORT_80_TCP_PROTO=tcp
SSL_JET_V2_EXPOSE_SERVICE_HOST=10.98.170.207
XILINXD_PORT_2100_TCP_PROTO=tcp
KUBERNETES_SERVICE_HOST=10.96.0.1
ABCDNNEXPOSE_PORT_80_TCP=tcp://10.108.83.250:80
KUBERNETES_PORT=tcp://10.96.0.1:443
KUBERNETES_PORT_443_TCP_PORT=443
PATH=/opt/conda/bin:/usr/local/sbin:/usr/local/bin:/usr/sbin:/usr/bin:/sbin:/bin
HHBBVVEXPOSE_PORT_80_TCP=tcp://10.102.7.121:80
HHBBVVEXPOSE_SERVICE_PORT=80
BUMPHUNTEXPOSE_PORT_80_TCP=tcp://10.96.169.13:80
L1ANOMALYEXPOSE_PORT_80_TCP=tcp://10.101.29.4:80
GGEXPOSE_PORT_80_TCP=tcp://10.103.93.169:80
ABCDNNEXPOSE_SERVICE_HOST=10.108.83.250
ABCDNNEXPOSE_PORT=tcp://10.108.83.250:80
J_JEPA_VOL_EXPOSE_PORT_80_TCP_PROTO=tcp
J_JEPA_VOL_EXPOSE_SERVICE_PORT=80
SSL_JET_V2_EXPOSE_PORT_80_TCP=tcp://10.98.170.207:80
PFEXPOSECENTRAL_PORT_80_TCP_PORT=80
OLDPWD=/app
_=/usr/bin/env
MODEL_INDEX from terminal: 3
All command-line arguments: ['global_search_parallel2.py', '3']
model index:  3
Processing small model with index 3
Loaded 1 files for train set
Loaded 1 files for validation set
Loaded 2 files for test set
Loaded Dataset...
[I 2024-09-16 04:56:55,225] A new study created in memory with name: no-name-315bc53f-28af-43e5-8ebd-3941e87bbd1f
input shape:  torch.Size([4096, 3, 8])
Conv bp:  tensor(658828.5000)
DeepSetsArchitecture(
  (phi): ConvPhi(
    (layers): Sequential(
      (0): Conv1d(3, 16, kernel_size=(1,), stride=(1,))
      (1): BatchNorm1d(16, eps=1e-05, momentum=0.1, affine=True, track_running_stats=True)
      (2): LeakyReLU(negative_slope=0.0078125)
      (3): Conv1d(16, 8, kernel_size=(1,), stride=(1,))
    )
  )
  (rho): Rho(
    (layers): Sequential(
      (0): Linear(in_features=8, out_features=32, bias=True)
      (1): BatchNorm1d(32, eps=1e-05, momentum=0.1, affine=True, track_running_stats=True)
      (2): LeakyReLU(negative_slope=0.0078125)
      (3): Linear(in_features=32, out_features=32, bias=True)
      (4): BatchNorm1d(32, eps=1e-05, momentum=0.1, affine=True, track_running_stats=True)
      (5): ReLU()
      (6): Linear(in_features=32, out_features=5, bias=True)
    )
  )
)
BOPs: tensor(903628.5000)
Trial  0  begins evaluation...
[I 2024-09-16 05:02:34,161] Trial 0 finished with values: [0.6394705975326718, 903628.5] and parameters: {'bottleneck_dim': 3, 'aggregator_type': 0, 'phi_len': 2, 'phi_MLP_width_0': 1, 'phi_MLP_acts_0': 1, 'phi_MLP_norms_0': 'batch', 'phi_MLP_norms_1': None, 'rho_len': 3, 'rho_MLP_width_0': 2, 'rho_MLP_width_1': 2, 'rho_MLP_acts_0': 1, 'rho_MLP_acts_1': 0, 'rho_MLP_norms_0': 'batch', 'rho_MLP_norms_1': 'batch', 'rho_MLP_norms_2': None}. 
Test Accuracy: 0.6395
Accuracy:  0.6394705975326718 , Inference time:  0.04283308982849121 , Validation Loss:  0.9473867039291226 , Param Count:  1869
Conv bp:  tensor(1039380.)
DeepSetsArchitecture(
  (phi): ConvPhi(
    (layers): Sequential(
      (0): Conv1d(3, 64, kernel_size=(1,), stride=(1,))
    )
  )
  (rho): Rho(
    (layers): Sequential(
      (0): Linear(in_features=64, out_features=16, bias=True)
      (1): LeakyReLU(negative_slope=0.0078125)
      (2): Linear(in_features=16, out_features=5, bias=True)
      (3): BatchNorm1d(5, eps=1e-05, momentum=0.1, affine=True, track_running_stats=True)
    )
  )
)
BOPs: tensor(1237140.)
Trial  1  begins evaluation...
[I 2024-09-16 05:08:01,295] Trial 1 finished with values: [0.5535583266090458, 1237140.0] and parameters: {'bottleneck_dim': 6, 'aggregator_type': 1, 'phi_len': 1, 'phi_MLP_norms_0': None, 'rho_len': 2, 'rho_MLP_width_0': 1, 'rho_MLP_acts_0': 1, 'rho_MLP_norms_0': 'layer', 'rho_MLP_norms_1': 'batch'}. 
Test Accuracy: 0.5536
Accuracy:  0.5535583266090458 , Inference time:  0.02377152442932129 , Validation Loss:  1.1471011667024522 , Param Count:  1391
Conv bp:  tensor(16240.3125)
DeepSetsArchitecture(
  (phi): ConvPhi(
    (layers): Sequential(
      (0): Conv1d(3, 1, kernel_size=(1,), stride=(1,))
      (1): BatchNorm1d(1, eps=1e-05, momentum=0.1, affine=True, track_running_stats=True)
    )
  )
  (rho): Rho(
    (layers): Sequential(
      (0): Linear(in_features=1, out_features=64, bias=True)
      (1): ReLU()
      (2): Linear(in_features=64, out_features=5, bias=True)
    )
  )
)
BOPs: tensor(81736.3125)
Trial  2  begins evaluation...
[I 2024-09-16 05:13:17,380] Trial 2 finished with values: [0.3397409554866027, 81736.3125] and parameters: {'bottleneck_dim': 0, 'aggregator_type': 0, 'phi_len': 1, 'phi_MLP_norms_0': 'batch', 'rho_len': 2, 'rho_MLP_width_0': 3, 'rho_MLP_acts_0': 0, 'rho_MLP_norms_0': None, 'rho_MLP_norms_1': None}. 
Test Accuracy: 0.3397
Accuracy:  0.3397409554866027 , Inference time:  0.02065873146057129 , Validation Loss:  1.4663520305335116 , Param Count:  459
Conv bp:  tensor(3020338.)
DeepSetsArchitecture(
  (phi): ConvPhi(
    (layers): Sequential(
      (0): Conv1d(3, 64, kernel_size=(1,), stride=(1,))
      (1): ReLU()
      (2): Conv1d(64, 8, kernel_size=(1,), stride=(1,))
      (3): LeakyReLU(negative_slope=0.0078125)
      (4): Conv1d(8, 32, kernel_size=(1,), stride=(1,))
    )
  )
  (rho): Rho(
    (layers): Sequential(
      (0): Linear(in_features=32, out_features=5, bias=True)
    )
  )
)
BOPs: tensor(3051762.)
Trial  3  begins evaluation...
[I 2024-09-16 05:18:13,249] Trial 3 finished with values: [0.5419986523695834, 3051762.0] and parameters: {'bottleneck_dim': 5, 'aggregator_type': 0, 'phi_len': 3, 'phi_MLP_width_0': 3, 'phi_MLP_width_1': 0, 'phi_MLP_acts_0': 0, 'phi_MLP_acts_1': 1, 'phi_MLP_norms_0': 'layer', 'phi_MLP_norms_1': 'layer', 'phi_MLP_norms_2': None, 'rho_len': 1, 'rho_MLP_norms_0': None}. 
Test Accuracy: 0.5420
Accuracy:  0.5419986523695834 , Inference time:  0.031893014907836914 , Validation Loss:  1.1743818310653271 , Param Count:  1229
Conv bp:  tensor(14101764.)
DeepSetsArchitecture(
  (phi): ConvPhi(
    (layers): Sequential(
      (0): Conv1d(3, 64, kernel_size=(1,), stride=(1,))
      (1): BatchNorm1d(64, eps=1e-05, momentum=0.1, affine=True, track_running_stats=True)
      (2): LeakyReLU(negative_slope=0.0078125)
      (3): Conv1d(64, 64, kernel_size=(1,), stride=(1,))
      (4): BatchNorm1d(64, eps=1e-05, momentum=0.1, affine=True, track_running_stats=True)
    )
  )
  (rho): Rho(
    (layers): Sequential(
      (0): Linear(in_features=64, out_features=5, bias=True)
    )
  )
)
BOPs: tensor(14164996.)
Trial  4  begins evaluation...
[I 2024-09-16 05:23:06,740] Trial 4 finished with values: [0.6301519827636406, 14164996.0] and parameters: {'bottleneck_dim': 6, 'aggregator_type': 1, 'phi_len': 2, 'phi_MLP_width_0': 3, 'phi_MLP_acts_0': 1, 'phi_MLP_norms_0': 'batch', 'phi_MLP_norms_1': 'batch', 'rho_len': 1, 'rho_MLP_norms_0': None}. 
Test Accuracy: 0.6302
Accuracy:  0.6301519827636406 , Inference time:  0.034372806549072266 , Validation Loss:  0.9757006066997035 , Param Count:  4997
Conv bp:  tensor(5468260.)
DeepSetsArchitecture(
  (phi): ConvPhi(
    (layers): Sequential(
      (0): Conv1d(3, 128, kernel_size=(1,), stride=(1,))
      (1): BatchNorm1d(128, eps=1e-05, momentum=0.1, affine=True, track_running_stats=True)
      (2): LeakyReLU(negative_slope=0.0078125)
      (3): Conv1d(128, 8, kernel_size=(1,), stride=(1,))
      (4): ReLU()
      (5): Conv1d(8, 8, kernel_size=(1,), stride=(1,))
      (6): BatchNorm1d(8, eps=1e-05, momentum=0.1, affine=True, track_running_stats=True)
    )
  )
  (rho): Rho(
    (layers): Sequential(
      (0): Linear(in_features=8, out_features=64, bias=True)
      (1): BatchNorm1d(64, eps=1e-05, momentum=0.1, affine=True, track_running_stats=True)
      (2): ReLU()
      (3): Linear(in_features=64, out_features=32, bias=True)
      (4): ReLU()
      (5): Linear(in_features=32, out_features=5, bias=True)
    )
  )
)
BOPs: tensor(5933540.)
Trial  5  begins evaluation...
[I 2024-09-16 05:28:02,985] Trial 5 finished with values: [0.6332498689803762, 5933540.0] and parameters: {'bottleneck_dim': 3, 'aggregator_type': 1, 'phi_len': 3, 'phi_MLP_width_0': 4, 'phi_MLP_width_1': 0, 'phi_MLP_acts_0': 1, 'phi_MLP_acts_1': 0, 'phi_MLP_norms_0': 'batch', 'phi_MLP_norms_1': None, 'phi_MLP_norms_2': 'batch', 'rho_len': 3, 'rho_MLP_width_0': 3, 'rho_MLP_width_1': 2, 'rho_MLP_acts_0': 0, 'rho_MLP_acts_1': 0, 'rho_MLP_norms_0': 'batch', 'rho_MLP_norms_1': None, 'rho_MLP_norms_2': 'layer'}. 
Test Accuracy: 0.6332
Accuracy:  0.6332498689803762 , Inference time:  0.05458474159240723 , Validation Loss:  0.9609221905267158 , Param Count:  4837
Conv bp:  tensor(6393896.)
DeepSetsArchitecture(
  (phi): ConvPhi(
    (layers): Sequential(
      (0): Conv1d(3, 32, kernel_size=(1,), stride=(1,))
      (1): ReLU()
      (2): Conv1d(32, 16, kernel_size=(1,), stride=(1,))
      (3): ReLU()
      (4): Conv1d(16, 128, kernel_size=(1,), stride=(1,))
      (5): LeakyReLU(negative_slope=0.0078125)
      (6): Conv1d(128, 32, kernel_size=(1,), stride=(1,))
    )
  )
  (rho): Rho(
    (layers): Sequential(
      (0): Linear(in_features=32, out_features=128, bias=True)
      (1): BatchNorm1d(128, eps=1e-05, momentum=0.1, affine=True, track_running_stats=True)
      (2): ReLU()
      (3): Linear(in_features=128, out_features=16, bias=True)
      (4): ReLU()
      (5): Linear(in_features=16, out_features=32, bias=True)
      (6): LeakyReLU(negative_slope=0.0078125)
      (7): Linear(in_features=32, out_features=5, bias=True)
    )
  )
)
BOPs: tensor(7564008.)
Trial  6  begins evaluation...
[I 2024-09-16 05:33:00,379] Trial 6 finished with values: [0.6605102694428963, 7564008.0] and parameters: {'bottleneck_dim': 5, 'aggregator_type': 0, 'phi_len': 4, 'phi_MLP_width_0': 2, 'phi_MLP_width_1': 1, 'phi_MLP_width_2': 4, 'phi_MLP_acts_0': 0, 'phi_MLP_acts_1': 0, 'phi_MLP_acts_2': 1, 'phi_MLP_norms_0': 'layer', 'phi_MLP_norms_1': None, 'phi_MLP_norms_2': 'layer', 'phi_MLP_norms_3': 'layer', 'rho_len': 4, 'rho_MLP_width_0': 4, 'rho_MLP_width_1': 1, 'rho_MLP_width_2': 2, 'rho_MLP_acts_0': 0, 'rho_MLP_acts_1': 0, 'rho_MLP_acts_2': 1, 'rho_MLP_norms_0': 'batch', 'rho_MLP_norms_1': None, 'rho_MLP_norms_2': None, 'rho_MLP_norms_3': 'layer'}. 
Test Accuracy: 0.6605
Accuracy:  0.6605102694428963 , Inference time:  0.06084728240966797 , Validation Loss:  0.8955335377835903 , Param Count:  14213
Conv bp:  tensor(6070352.)
DeepSetsArchitecture(
  (phi): ConvPhi(
    (layers): Sequential(
      (0): Conv1d(3, 64, kernel_size=(1,), stride=(1,))
      (1): ReLU()
      (2): Conv1d(64, 16, kernel_size=(1,), stride=(1,))
      (3): ReLU()
      (4): Conv1d(16, 64, kernel_size=(1,), stride=(1,))
      (5): ReLU()
      (6): Conv1d(64, 16, kernel_size=(1,), stride=(1,))
    )
  )
  (rho): Rho(
    (layers): Sequential(
      (0): Linear(in_features=16, out_features=5, bias=True)
    )
  )
)
BOPs: tensor(6085840.)
Trial  7  begins evaluation...
[I 2024-09-16 05:37:55,837] Trial 7 finished with values: [0.5544916854530784, 6085840.0] and parameters: {'bottleneck_dim': 4, 'aggregator_type': 0, 'phi_len': 4, 'phi_MLP_width_0': 3, 'phi_MLP_width_1': 1, 'phi_MLP_width_2': 3, 'phi_MLP_acts_0': 0, 'phi_MLP_acts_1': 0, 'phi_MLP_acts_2': 0, 'phi_MLP_norms_0': None, 'phi_MLP_norms_1': 'layer', 'phi_MLP_norms_2': 'layer', 'phi_MLP_norms_3': None, 'rho_len': 1, 'rho_MLP_norms_0': None}. 
Test Accuracy: 0.5545
Accuracy:  0.5544916854530784 , Inference time:  0.04148221015930176 , Validation Loss:  1.1500513946928945 , Param Count:  3509
Conv bp:  tensor(28519684.)
DeepSetsArchitecture(
  (phi): ConvPhi(
    (layers): Sequential(
      (0): Conv1d(3, 64, kernel_size=(1,), stride=(1,))
      (1): BatchNorm1d(64, eps=1e-05, momentum=0.1, affine=True, track_running_stats=True)
      (2): ReLU()
      (3): Conv1d(64, 64, kernel_size=(1,), stride=(1,))
      (4): LeakyReLU(negative_slope=0.0078125)
      (5): Conv1d(64, 128, kernel_size=(1,), stride=(1,))
      (6): BatchNorm1d(128, eps=1e-05, momentum=0.1, affine=True, track_running_stats=True)
      (7): ReLU()
      (8): Conv1d(128, 64, kernel_size=(1,), stride=(1,))
    )
  )
  (rho): Rho(
    (layers): Sequential(
      (0): Linear(in_features=64, out_features=8, bias=True)
      (1): LeakyReLU(negative_slope=0.0078125)
      (2): Linear(in_features=8, out_features=64, bias=True)
      (3): BatchNorm1d(64, eps=1e-05, momentum=0.1, affine=True, track_running_stats=True)
      (4): ReLU()
      (5): Linear(in_features=64, out_features=64, bias=True)
      (6): LeakyReLU(negative_slope=0.0078125)
      (7): Linear(in_features=64, out_features=5, bias=True)
    )
  )
)
BOPs: tensor(29460484.)
Trial  8  begins evaluation...
[I 2024-09-16 05:42:55,076] Trial 8 finished with values: [0.6577650963722121, 29460484.0] and parameters: {'bottleneck_dim': 6, 'aggregator_type': 1, 'phi_len': 4, 'phi_MLP_width_0': 3, 'phi_MLP_width_1': 3, 'phi_MLP_width_2': 4, 'phi_MLP_acts_0': 0, 'phi_MLP_acts_1': 1, 'phi_MLP_acts_2': 0, 'phi_MLP_norms_0': 'batch', 'phi_MLP_norms_1': None, 'phi_MLP_norms_2': 'batch', 'phi_MLP_norms_3': 'layer', 'rho_len': 4, 'rho_MLP_width_0': 0, 'rho_MLP_width_1': 3, 'rho_MLP_width_2': 3, 'rho_MLP_acts_0': 1, 'rho_MLP_acts_1': 0, 'rho_MLP_acts_2': 1, 'rho_MLP_norms_0': None, 'rho_MLP_norms_1': 'batch', 'rho_MLP_norms_2': None, 'rho_MLP_norms_3': 'layer'}. 
Test Accuracy: 0.6578
Accuracy:  0.6577650963722121 , Inference time:  0.06946372985839844 , Validation Loss:  0.899035614769475 , Param Count:  27085
Conv bp:  tensor(1707424.5000)
DeepSetsArchitecture(
  (phi): ConvPhi(
    (layers): Sequential(
      (0): Conv1d(3, 8, kernel_size=(1,), stride=(1,))
      (1): LeakyReLU(negative_slope=0.0078125)
      (2): Conv1d(8, 64, kernel_size=(1,), stride=(1,))
      (3): BatchNorm1d(64, eps=1e-05, momentum=0.1, affine=True, track_running_stats=True)
    )
  )
  (rho): Rho(
    (layers): Sequential(
      (0): Linear(in_features=64, out_features=8, bias=True)
      (1): ReLU()
      (2): Linear(in_features=8, out_features=32, bias=True)
      (3): ReLU()
      (4): Linear(in_features=32, out_features=5, bias=True)
    )
  )
)
BOPs: tensor(1873376.5000)
Trial  9  begins evaluation...
[I 2024-09-16 05:47:49,968] Trial 9 finished with values: [0.6351332240809909, 1873376.5] and parameters: {'bottleneck_dim': 6, 'aggregator_type': 1, 'phi_len': 2, 'phi_MLP_width_0': 0, 'phi_MLP_acts_0': 1, 'phi_MLP_norms_0': None, 'phi_MLP_norms_1': 'batch', 'rho_len': 3, 'rho_MLP_width_0': 0, 'rho_MLP_width_1': 2, 'rho_MLP_acts_0': 0, 'rho_MLP_acts_1': 0, 'rho_MLP_norms_0': None, 'rho_MLP_norms_1': None, 'rho_MLP_norms_2': 'layer'}. 
Test Accuracy: 0.6351
Accuracy:  0.6351332240809909 , Inference time:  0.03530526161193848 , Validation Loss:  0.9566735029220581 , Param Count:  1709
Conv bp:  tensor(9017996.)
DeepSetsArchitecture(
  (phi): ConvPhi(
    (layers): Sequential(
      (0): Conv1d(3, 64, kernel_size=(1,), stride=(1,))
      (1): LeakyReLU(negative_slope=0.0078125)
      (2): Conv1d(64, 32, kernel_size=(1,), stride=(1,))
      (3): BatchNorm1d(32, eps=1e-05, momentum=0.1, affine=True, track_running_stats=True)
      (4): ReLU()
      (5): Conv1d(32, 32, kernel_size=(1,), stride=(1,))
      (6): LeakyReLU(negative_slope=0.0078125)
      (7): Conv1d(32, 2, kernel_size=(1,), stride=(1,))
    )
  )
  (rho): Rho(
    (layers): Sequential(
      (0): Linear(in_features=2, out_features=16, bias=True)
      (1): LeakyReLU(negative_slope=0.0078125)
      (2): Linear(in_features=16, out_features=128, bias=True)
      (3): LeakyReLU(negative_slope=0.0078125)
      (4): Linear(in_features=128, out_features=8, bias=True)
      (5): BatchNorm1d(8, eps=1e-05, momentum=0.1, affine=True, track_running_stats=True)
      (6): ReLU()
      (7): Linear(in_features=8, out_features=5, bias=True)
      (8): BatchNorm1d(5, eps=1e-05, momentum=0.1, affine=True, track_running_stats=True)
    )
  )
)
BOPs: tensor(9552236.)
Trial  10  begins evaluation...
[I 2024-09-16 05:52:53,516] Trial 10 finished with values: [0.5861310528986532, 9552236.0] and parameters: {'bottleneck_dim': 1, 'aggregator_type': 1, 'phi_len': 4, 'phi_MLP_width_0': 3, 'phi_MLP_width_1': 2, 'phi_MLP_width_2': 2, 'phi_MLP_acts_0': 1, 'phi_MLP_acts_1': 0, 'phi_MLP_acts_2': 1, 'phi_MLP_norms_0': 'layer', 'phi_MLP_norms_1': 'batch', 'phi_MLP_norms_2': None, 'phi_MLP_norms_3': None, 'rho_len': 4, 'rho_MLP_width_0': 1, 'rho_MLP_width_1': 4, 'rho_MLP_width_2': 0, 'rho_MLP_acts_0': 1, 'rho_MLP_acts_1': 1, 'rho_MLP_acts_2': 0, 'rho_MLP_norms_0': None, 'rho_MLP_norms_1': None, 'rho_MLP_norms_2': 'batch', 'rho_MLP_norms_3': 'batch'}. 
Test Accuracy: 0.5861
Accuracy:  0.5861310528986532 , Inference time:  0.06508731842041016 , Validation Loss:  1.0814462713643807 , Param Count:  6849
Conv bp:  tensor(22432024.)
DeepSetsArchitecture(
  (phi): ConvPhi(
    (layers): Sequential(
      (0): Conv1d(3, 128, kernel_size=(1,), stride=(1,))
      (1): LeakyReLU(negative_slope=0.0078125)
      (2): Conv1d(128, 32, kernel_size=(1,), stride=(1,))
      (3): ReLU()
      (4): Conv1d(32, 128, kernel_size=(1,), stride=(1,))
      (5): ReLU()
      (6): Conv1d(128, 32, kernel_size=(1,), stride=(1,))
      (7): BatchNorm1d(32, eps=1e-05, momentum=0.1, affine=True, track_running_stats=True)
    )
  )
  (rho): Rho(
    (layers): Sequential(
      (0): Linear(in_features=32, out_features=16, bias=True)
      (1): BatchNorm1d(16, eps=1e-05, momentum=0.1, affine=True, track_running_stats=True)
      (2): LeakyReLU(negative_slope=0.0078125)
      (3): Linear(in_features=16, out_features=8, bias=True)
      (4): BatchNorm1d(8, eps=1e-05, momentum=0.1, affine=True, track_running_stats=True)
      (5): LeakyReLU(negative_slope=0.0078125)
      (6): Linear(in_features=8, out_features=64, bias=True)
      (7): LeakyReLU(negative_slope=0.0078125)
      (8): Linear(in_features=64, out_features=5, bias=True)
      (9): BatchNorm1d(5, eps=1e-05, momentum=0.1, affine=True, track_running_stats=True)
    )
  )
)
BOPs: tensor(22684440.)
Trial  11  begins evaluation...
