[I 2024-09-16 15:14:00,968] Trial 122 finished with values: [0.39901839265957356, 211266.5] and parameters: {'bottleneck_dim': 3, 'aggregator_type': 0, 'phi_len': 1, 'phi_MLP_norms_0': 'batch', 'rho_len': 3, 'rho_MLP_width_0': 0, 'rho_MLP_width_1': 2, 'rho_MLP_acts_0': 1, 'rho_MLP_acts_1': 0, 'rho_MLP_norms_0': 'batch', 'rho_MLP_norms_1': 'layer', 'rho_MLP_norms_2': 'layer'}. 
Test Accuracy: 0.3990
Accuracy:  0.39901839265957356 , Inference time:  0.030257701873779297 , Validation Loss:  1.3795221387123575 , Param Count:  589
Conv bp:  tensor(5173830.)
DeepSetsArchitecture(
  (phi): ConvPhi(
    (layers): Sequential(
      (0): Conv1d(3, 32, kernel_size=(1,), stride=(1,))
      (1): BatchNorm1d(32, eps=1e-05, momentum=0.1, affine=True, track_running_stats=True)
      (2): ReLU()
      (3): Conv1d(32, 32, kernel_size=(1,), stride=(1,))
      (4): BatchNorm1d(32, eps=1e-05, momentum=0.1, affine=True, track_running_stats=True)
      (5): LeakyReLU(negative_slope=0.0078125)
      (6): Conv1d(32, 32, kernel_size=(1,), stride=(1,))
      (7): BatchNorm1d(32, eps=1e-05, momentum=0.1, affine=True, track_running_stats=True)
    )
  )
  (rho): Rho(
    (layers): Sequential(
      (0): Linear(in_features=32, out_features=32, bias=True)
      (1): ReLU()
      (2): Linear(in_features=32, out_features=5, bias=True)
    )
  )
)
BOPs: tensor(5378950.)
Trial  123  begins evaluation...
[I 2024-09-16 15:18:49,838] Trial 123 finished with values: [0.6458610276929732, 5378950.0] and parameters: {'bottleneck_dim': 5, 'aggregator_type': 1, 'phi_len': 3, 'phi_MLP_width_0': 2, 'phi_MLP_width_1': 2, 'phi_MLP_acts_0': 0, 'phi_MLP_acts_1': 1, 'phi_MLP_norms_0': 'batch', 'phi_MLP_norms_1': 'batch', 'phi_MLP_norms_2': 'batch', 'rho_len': 2, 'rho_MLP_width_0': 2, 'rho_MLP_acts_0': 0, 'rho_MLP_norms_0': 'layer', 'rho_MLP_norms_1': None}. 
Test Accuracy: 0.6459
Accuracy:  0.6458610276929732 , Inference time:  0.047060251235961914 , Validation Loss:  0.9300502031838813 , Param Count:  3653
Conv bp:  tensor(658828.5000)
DeepSetsArchitecture(
  (phi): ConvPhi(
    (layers): Sequential(
      (0): Conv1d(3, 16, kernel_size=(1,), stride=(1,))
      (1): BatchNorm1d(16, eps=1e-05, momentum=0.1, affine=True, track_running_stats=True)
      (2): LeakyReLU(negative_slope=0.0078125)
      (3): Conv1d(16, 8, kernel_size=(1,), stride=(1,))
      (4): BatchNorm1d(8, eps=1e-05, momentum=0.1, affine=True, track_running_stats=True)
    )
  )
  (rho): Rho(
    (layers): Sequential(
      (0): Linear(in_features=8, out_features=128, bias=True)
      (1): BatchNorm1d(128, eps=1e-05, momentum=0.1, affine=True, track_running_stats=True)
      (2): ReLU()
      (3): Linear(in_features=128, out_features=128, bias=True)
      (4): ReLU()
      (5): Linear(in_features=128, out_features=5, bias=True)
      (6): BatchNorm1d(5, eps=1e-05, momentum=0.1, affine=True, track_running_stats=True)
    )
  )
)
BOPs: tensor(3792012.5000)
Trial  124  begins evaluation...
[I 2024-09-16 15:23:32,919] Trial 124 finished with values: [0.6507873655489098, 3792012.5] and parameters: {'bottleneck_dim': 3, 'aggregator_type': 0, 'phi_len': 2, 'phi_MLP_width_0': 1, 'phi_MLP_acts_0': 1, 'phi_MLP_norms_0': 'batch', 'phi_MLP_norms_1': 'batch', 'rho_len': 3, 'rho_MLP_width_0': 4, 'rho_MLP_width_1': 4, 'rho_MLP_acts_0': 0, 'rho_MLP_acts_1': 0, 'rho_MLP_norms_0': 'batch', 'rho_MLP_norms_1': 'layer', 'rho_MLP_norms_2': 'batch'}. 
Test Accuracy: 0.6508
Accuracy:  0.6507873655489098 , Inference time:  0.04507732391357422 , Validation Loss:  0.9169109938096027 , Param Count:  18823
Conv bp:  tensor(3702794.)
DeepSetsArchitecture(
  (phi): ConvPhi(
    (layers): Sequential(
      (0): Conv1d(3, 8, kernel_size=(1,), stride=(1,))
      (1): LeakyReLU(negative_slope=0.0078125)
      (2): Conv1d(8, 16, kernel_size=(1,), stride=(1,))
      (3): ReLU()
      (4): Conv1d(16, 128, kernel_size=(1,), stride=(1,))
      (5): LeakyReLU(negative_slope=0.0078125)
      (6): Conv1d(128, 8, kernel_size=(1,), stride=(1,))
    )
  )
  (rho): Rho(
    (layers): Sequential(
      (0): Linear(in_features=8, out_features=5, bias=True)
      (1): BatchNorm1d(5, eps=1e-05, momentum=0.1, affine=True, track_running_stats=True)
    )
  )
)
BOPs: tensor(3710458.)
Trial  125  begins evaluation...
[I 2024-09-16 15:28:19,247] Trial 125 finished with values: [0.5484639508863581, 3710458.0] and parameters: {'bottleneck_dim': 3, 'aggregator_type': 0, 'phi_len': 4, 'phi_MLP_width_0': 0, 'phi_MLP_width_1': 1, 'phi_MLP_width_2': 4, 'phi_MLP_acts_0': 1, 'phi_MLP_acts_1': 0, 'phi_MLP_acts_2': 1, 'phi_MLP_norms_0': None, 'phi_MLP_norms_1': 'layer', 'phi_MLP_norms_2': 'layer', 'phi_MLP_norms_3': 'layer', 'rho_len': 1, 'rho_MLP_norms_0': 'batch'}. 
Test Accuracy: 0.5485
Accuracy:  0.5484639508863581 , Inference time:  0.046163082122802734 , Validation Loss:  1.1627619935541738 , Param Count:  3439
Conv bp:  tensor(3702794.)
DeepSetsArchitecture(
  (phi): ConvPhi(
    (layers): Sequential(
      (0): Conv1d(3, 8, kernel_size=(1,), stride=(1,))
      (1): LeakyReLU(negative_slope=0.0078125)
      (2): Conv1d(8, 16, kernel_size=(1,), stride=(1,))
      (3): LeakyReLU(negative_slope=0.0078125)
      (4): Conv1d(16, 128, kernel_size=(1,), stride=(1,))
      (5): LeakyReLU(negative_slope=0.0078125)
      (6): Conv1d(128, 8, kernel_size=(1,), stride=(1,))
    )
  )
  (rho): Rho(
    (layers): Sequential(
      (0): Linear(in_features=8, out_features=16, bias=True)
      (1): BatchNorm1d(16, eps=1e-05, momentum=0.1, affine=True, track_running_stats=True)
      (2): ReLU()
      (3): Linear(in_features=16, out_features=5, bias=True)
    )
  )
)
BOPs: tensor(3738506.)
Trial  126  begins evaluation...
[I 2024-09-16 15:33:00,157] Trial 126 finished with values: [0.6228631323256607, 3738506.0] and parameters: {'bottleneck_dim': 3, 'aggregator_type': 0, 'phi_len': 4, 'phi_MLP_width_0': 0, 'phi_MLP_width_1': 1, 'phi_MLP_width_2': 4, 'phi_MLP_acts_0': 1, 'phi_MLP_acts_1': 1, 'phi_MLP_acts_2': 1, 'phi_MLP_norms_0': 'layer', 'phi_MLP_norms_1': None, 'phi_MLP_norms_2': 'layer', 'phi_MLP_norms_3': None, 'rho_len': 2, 'rho_MLP_width_0': 1, 'rho_MLP_acts_0': 0, 'rho_MLP_norms_0': 'batch', 'rho_MLP_norms_1': 'layer'}. 
Test Accuracy: 0.6229
Accuracy:  0.6228631323256607 , Inference time:  0.047322988510131836 , Validation Loss:  0.9951545210922657 , Param Count:  3645
Conv bp:  tensor(8859808.)
DeepSetsArchitecture(
  (phi): ConvPhi(
    (layers): Sequential(
      (0): Conv1d(3, 128, kernel_size=(1,), stride=(1,))
      (1): BatchNorm1d(128, eps=1e-05, momentum=0.1, affine=True, track_running_stats=True)
      (2): LeakyReLU(negative_slope=0.0078125)
      (3): Conv1d(128, 16, kernel_size=(1,), stride=(1,))
      (4): ReLU()
      (5): Conv1d(16, 8, kernel_size=(1,), stride=(1,))
      (6): BatchNorm1d(8, eps=1e-05, momentum=0.1, affine=True, track_running_stats=True)
    )
  )
  (rho): Rho(
    (layers): Sequential(
      (0): Linear(in_features=8, out_features=8, bias=True)
      (1): ReLU()
      (2): Linear(in_features=8, out_features=128, bias=True)
      (3): BatchNorm1d(128, eps=1e-05, momentum=0.1, affine=True, track_running_stats=True)
      (4): ReLU()
      (5): Linear(in_features=128, out_features=5, bias=True)
    )
  )
)
BOPs: tensor(9152800.)
Trial  127  begins evaluation...
[I 2024-09-16 15:38:22,266] Trial 127 finished with values: [0.6436449243413664, 9152800.0] and parameters: {'bottleneck_dim': 3, 'aggregator_type': 0, 'phi_len': 3, 'phi_MLP_width_0': 4, 'phi_MLP_width_1': 1, 'phi_MLP_acts_0': 1, 'phi_MLP_acts_1': 0, 'phi_MLP_norms_0': 'batch', 'phi_MLP_norms_1': None, 'phi_MLP_norms_2': 'batch', 'rho_len': 3, 'rho_MLP_width_0': 0, 'rho_MLP_width_1': 4, 'rho_MLP_acts_0': 0, 'rho_MLP_acts_1': 0, 'rho_MLP_norms_0': None, 'rho_MLP_norms_1': 'batch', 'rho_MLP_norms_2': None}. 
Test Accuracy: 0.6436
Accuracy:  0.6436449243413664 , Inference time:  0.04877281188964844 , Validation Loss:  0.9389640842976213 , Param Count:  5109
Conv bp:  tensor(3729990.)
DeepSetsArchitecture(
  (phi): ConvPhi(
    (layers): Sequential(
      (0): Conv1d(3, 128, kernel_size=(1,), stride=(1,))
      (1): ReLU()
      (2): Conv1d(128, 4, kernel_size=(1,), stride=(1,))
    )
  )
  (rho): Rho(
    (layers): Sequential(
      (0): Linear(in_features=4, out_features=8, bias=True)
      (1): ReLU()
      (2): Linear(in_features=8, out_features=5, bias=True)
    )
  )
)
BOPs: tensor(3742422.)
Trial  128  begins evaluation...
[I 2024-09-16 15:43:21,795] Trial 128 finished with values: [0.602788430343313, 3742422.0] and parameters: {'bottleneck_dim': 2, 'aggregator_type': 0, 'phi_len': 2, 'phi_MLP_width_0': 4, 'phi_MLP_acts_0': 0, 'phi_MLP_norms_0': None, 'phi_MLP_norms_1': None, 'rho_len': 2, 'rho_MLP_width_0': 0, 'rho_MLP_acts_0': 0, 'rho_MLP_norms_0': 'layer', 'rho_MLP_norms_1': None}. 
Test Accuracy: 0.6028
Accuracy:  0.602788430343313 , Inference time:  0.026076078414916992 , Validation Loss:  1.0306589721011468 , Param Count:  1113
Conv bp:  tensor(10092704.)
DeepSetsArchitecture(
  (phi): ConvPhi(
    (layers): Sequential(
      (0): Conv1d(3, 128, kernel_size=(1,), stride=(1,))
      (1): LeakyReLU(negative_slope=0.0078125)
      (2): Conv1d(128, 16, kernel_size=(1,), stride=(1,))
      (3): ReLU()
      (4): Conv1d(16, 64, kernel_size=(1,), stride=(1,))
      (5): BatchNorm1d(64, eps=1e-05, momentum=0.1, affine=True, track_running_stats=True)
    )
  )
  (rho): Rho(
    (layers): Sequential(
      (0): Linear(in_features=64, out_features=32, bias=True)
      (1): ReLU()
      (2): Linear(in_features=32, out_features=64, bias=True)
      (3): BatchNorm1d(64, eps=1e-05, momentum=0.1, affine=True, track_running_stats=True)
      (4): LeakyReLU(negative_slope=0.0078125)
      (5): Linear(in_features=64, out_features=16, bias=True)
      (6): LeakyReLU(negative_slope=0.0078125)
      (7): Linear(in_features=16, out_features=5, bias=True)
    )
  )
)
BOPs: tensor(10991520.)
Trial  129  begins evaluation...
[I 2024-09-16 15:48:32,001] Trial 129 finished with values: [0.6588714843067606, 10991520.0] and parameters: {'bottleneck_dim': 6, 'aggregator_type': 0, 'phi_len': 3, 'phi_MLP_width_0': 4, 'phi_MLP_width_1': 1, 'phi_MLP_acts_0': 1, 'phi_MLP_acts_1': 0, 'phi_MLP_norms_0': None, 'phi_MLP_norms_1': None, 'phi_MLP_norms_2': 'batch', 'rho_len': 4, 'rho_MLP_width_0': 2, 'rho_MLP_width_1': 3, 'rho_MLP_width_2': 1, 'rho_MLP_acts_0': 0, 'rho_MLP_acts_1': 1, 'rho_MLP_acts_2': 1, 'rho_MLP_norms_0': 'layer', 'rho_MLP_norms_1': 'batch', 'rho_MLP_norms_2': None, 'rho_MLP_norms_3': None}. 
Test Accuracy: 0.6589
Accuracy:  0.6588714843067606 , Inference time:  0.05225729942321777 , Validation Loss:  0.9026948168975155 , Param Count:  9237
Conv bp:  tensor(129922.5000)
DeepSetsArchitecture(
  (phi): ConvPhi(
    (layers): Sequential(
      (0): Conv1d(3, 8, kernel_size=(1,), stride=(1,))
    )
  )
  (rho): Rho(
    (layers): Sequential(
      (0): Linear(in_features=8, out_features=128, bias=True)
      (1): LeakyReLU(negative_slope=0.0078125)
      (2): Linear(in_features=128, out_features=32, bias=True)
      (3): ReLU()
      (4): Linear(in_features=32, out_features=5, bias=True)
      (5): BatchNorm1d(5, eps=1e-05, momentum=0.1, affine=True, track_running_stats=True)
    )
  )
)
BOPs: tensor(1040834.5000)
Trial  130  begins evaluation...
[I 2024-09-16 15:53:23,764] Trial 130 finished with values: [0.3996206669938691, 1040834.5] and parameters: {'bottleneck_dim': 3, 'aggregator_type': 0, 'phi_len': 1, 'phi_MLP_norms_0': 'layer', 'rho_len': 3, 'rho_MLP_width_0': 4, 'rho_MLP_width_1': 2, 'rho_MLP_acts_0': 1, 'rho_MLP_acts_1': 0, 'rho_MLP_norms_0': None, 'rho_MLP_norms_1': 'layer', 'rho_MLP_norms_2': 'batch'}. 
Test Accuracy: 0.3996
Accuracy:  0.3996206669938691 , Inference time:  0.02616572380065918 , Validation Loss:  1.3797177960272549 , Param Count:  5487
Conv bp:  tensor(6201278.5000)
DeepSetsArchitecture(
  (phi): ConvPhi(
    (layers): Sequential(
      (0): Conv1d(3, 8, kernel_size=(1,), stride=(1,))
      (1): LeakyReLU(negative_slope=0.0078125)
      (2): Conv1d(8, 128, kernel_size=(1,), stride=(1,))
      (3): ReLU()
      (4): Conv1d(128, 16, kernel_size=(1,), stride=(1,))
    )
  )
  (rho): Rho(
    (layers): Sequential(
      (0): Linear(in_features=16, out_features=16, bias=True)
      (1): ReLU()
      (2): Linear(in_features=16, out_features=16, bias=True)
      (3): ReLU()
      (4): Linear(in_features=16, out_features=16, bias=True)
      (5): ReLU()
      (6): Linear(in_features=16, out_features=5, bias=True)
    )
  )
)
BOPs: tensor(6345790.5000)
Trial  131  begins evaluation...
[I 2024-09-16 15:58:18,416] Trial 131 finished with values: [0.6325960186671769, 6345790.5] and parameters: {'bottleneck_dim': 4, 'aggregator_type': 0, 'phi_len': 3, 'phi_MLP_width_0': 0, 'phi_MLP_width_1': 4, 'phi_MLP_acts_0': 1, 'phi_MLP_acts_1': 0, 'phi_MLP_norms_0': None, 'phi_MLP_norms_1': 'layer', 'phi_MLP_norms_2': 'layer', 'rho_len': 4, 'rho_MLP_width_0': 1, 'rho_MLP_width_1': 1, 'rho_MLP_width_2': 1, 'rho_MLP_acts_0': 0, 'rho_MLP_acts_1': 0, 'rho_MLP_acts_2': 0, 'rho_MLP_norms_0': 'layer', 'rho_MLP_norms_1': 'layer', 'rho_MLP_norms_2': 'layer', 'rho_MLP_norms_3': None}. 
Test Accuracy: 0.6326
Accuracy:  0.6325960186671769 , Inference time:  0.04255795478820801 , Validation Loss:  0.9629685951738941 , Param Count:  4149
Conv bp:  tensor(680588.5000)
DeepSetsArchitecture(
  (phi): ConvPhi(
    (layers): Sequential(
      (0): Conv1d(3, 16, kernel_size=(1,), stride=(1,))
      (1): ReLU()
      (2): Conv1d(16, 8, kernel_size=(1,), stride=(1,))
      (3): BatchNorm1d(8, eps=1e-05, momentum=0.1, affine=True, track_running_stats=True)
      (4): ReLU()
      (5): Conv1d(8, 2, kernel_size=(1,), stride=(1,))
    )
  )
  (rho): Rho(
    (layers): Sequential(
      (0): Linear(in_features=2, out_features=128, bias=True)
      (1): BatchNorm1d(128, eps=1e-05, momentum=0.1, affine=True, track_running_stats=True)
      (2): ReLU()
      (3): Linear(in_features=128, out_features=8, bias=True)
      (4): LeakyReLU(negative_slope=0.0078125)
      (5): Linear(in_features=8, out_features=8, bias=True)
      (6): BatchNorm1d(8, eps=1e-05, momentum=0.1, affine=True, track_running_stats=True)
      (7): ReLU()
      (8): Linear(in_features=8, out_features=5, bias=True)
    )
  )
)
BOPs: tensor(917676.5000)
Trial  132  begins evaluation...
[I 2024-09-16 16:03:17,614] Trial 132 finished with values: [0.5808503381554101, 917676.5] and parameters: {'bottleneck_dim': 1, 'aggregator_type': 1, 'phi_len': 3, 'phi_MLP_width_0': 1, 'phi_MLP_width_1': 0, 'phi_MLP_acts_0': 0, 'phi_MLP_acts_1': 0, 'phi_MLP_norms_0': 'layer', 'phi_MLP_norms_1': 'batch', 'phi_MLP_norms_2': None, 'rho_len': 4, 'rho_MLP_width_0': 4, 'rho_MLP_width_1': 0, 'rho_MLP_width_2': 0, 'rho_MLP_acts_0': 0, 'rho_MLP_acts_1': 1, 'rho_MLP_acts_2': 0, 'rho_MLP_norms_0': 'batch', 'rho_MLP_norms_1': 'layer', 'rho_MLP_norms_2': 'batch', 'rho_MLP_norms_3': 'layer'}. 
Test Accuracy: 0.5809
Accuracy:  0.5808503381554101 , Inference time:  0.055533409118652344 , Validation Loss:  1.0927560937647918 , Param Count:  2039
Conv bp:  tensor(10270880.)
DeepSetsArchitecture(
  (phi): ConvPhi(
    (layers): Sequential(
      (0): Conv1d(3, 128, kernel_size=(1,), stride=(1,))
      (1): LeakyReLU(negative_slope=0.0078125)
      (2): Conv1d(128, 16, kernel_size=(1,), stride=(1,))
      (3): ReLU()
      (4): Conv1d(16, 64, kernel_size=(1,), stride=(1,))
      (5): ReLU()
      (6): Conv1d(64, 8, kernel_size=(1,), stride=(1,))
    )
  )
  (rho): Rho(
    (layers): Sequential(
      (0): Linear(in_features=8, out_features=64, bias=True)
      (1): BatchNorm1d(64, eps=1e-05, momentum=0.1, affine=True, track_running_stats=True)
      (2): LeakyReLU(negative_slope=0.0078125)
      (3): Linear(in_features=64, out_features=128, bias=True)
      (4): BatchNorm1d(128, eps=1e-05, momentum=0.1, affine=True, track_running_stats=True)
      (5): ReLU()
      (6): Linear(in_features=128, out_features=5, bias=True)
    )
  )
)
BOPs: tensor(11877280.)
Trial  133  begins evaluation...
[I 2024-09-16 16:08:29,770] Trial 133 finished with values: [0.6599329512274251, 11877280.0] and parameters: {'bottleneck_dim': 3, 'aggregator_type': 0, 'phi_len': 4, 'phi_MLP_width_0': 4, 'phi_MLP_width_1': 1, 'phi_MLP_width_2': 3, 'phi_MLP_acts_0': 1, 'phi_MLP_acts_1': 0, 'phi_MLP_acts_2': 0, 'phi_MLP_norms_0': None, 'phi_MLP_norms_1': None, 'phi_MLP_norms_2': None, 'phi_MLP_norms_3': None, 'rho_len': 3, 'rho_MLP_width_0': 3, 'rho_MLP_width_1': 4, 'rho_MLP_acts_0': 1, 'rho_MLP_acts_1': 0, 'rho_MLP_norms_0': 'batch', 'rho_MLP_norms_1': 'batch', 'rho_MLP_norms_2': 'layer'}. 
Test Accuracy: 0.6599
Accuracy:  0.6599329512274251 , Inference time:  0.056752681732177734 , Validation Loss:  0.8981066244800074 , Param Count:  14109
Conv bp:  tensor(4524112.)
DeepSetsArchitecture(
  (phi): ConvPhi(
    (layers): Sequential(
      (0): Conv1d(3, 64, kernel_size=(1,), stride=(1,))
      (1): LeakyReLU(negative_slope=0.0078125)
      (2): Conv1d(64, 16, kernel_size=(1,), stride=(1,))
      (3): LeakyReLU(negative_slope=0.0078125)
      (4): Conv1d(16, 8, kernel_size=(1,), stride=(1,))
      (5): ReLU()
      (6): Conv1d(8, 16, kernel_size=(1,), stride=(1,))
    )
  )
  (rho): Rho(
    (layers): Sequential(
      (0): Linear(in_features=16, out_features=64, bias=True)
      (1): ReLU()
      (2): Linear(in_features=64, out_features=16, bias=True)
      (3): ReLU()
      (4): Linear(in_features=16, out_features=16, bias=True)
      (5): LeakyReLU(negative_slope=0.0078125)
      (6): Linear(in_features=16, out_features=5, bias=True)
    )
  )
)
BOPs: tensor(4930512.)
Trial  134  begins evaluation...
[I 2024-09-16 16:13:27,925] Trial 134 finished with values: [0.6322349868148506, 4930512.0] and parameters: {'bottleneck_dim': 4, 'aggregator_type': 1, 'phi_len': 4, 'phi_MLP_width_0': 3, 'phi_MLP_width_1': 1, 'phi_MLP_width_2': 0, 'phi_MLP_acts_0': 1, 'phi_MLP_acts_1': 1, 'phi_MLP_acts_2': 0, 'phi_MLP_norms_0': None, 'phi_MLP_norms_1': 'layer', 'phi_MLP_norms_2': 'layer', 'phi_MLP_norms_3': None, 'rho_len': 4, 'rho_MLP_width_0': 3, 'rho_MLP_width_1': 1, 'rho_MLP_width_2': 1, 'rho_MLP_acts_0': 0, 'rho_MLP_acts_1': 0, 'rho_MLP_acts_2': 1, 'rho_MLP_norms_0': None, 'rho_MLP_norms_1': None, 'rho_MLP_norms_2': 'layer', 'rho_MLP_norms_3': None}. 
Test Accuracy: 0.6322
Accuracy:  0.6322349868148506 , Inference time:  0.05269813537597656 , Validation Loss:  0.9618032777390513 , Param Count:  4061
Conv bp:  tensor(228516.3750)
DeepSetsArchitecture(
  (phi): ConvPhi(
    (layers): Sequential(
      (0): Conv1d(3, 8, kernel_size=(1,), stride=(1,))
      (1): ReLU()
      (2): Conv1d(8, 4, kernel_size=(1,), stride=(1,))
      (3): BatchNorm1d(4, eps=1e-05, momentum=0.1, affine=True, track_running_stats=True)
    )
  )
  (rho): Rho(
    (layers): Sequential(
      (0): Linear(in_features=4, out_features=32, bias=True)
      (1): ReLU()
      (2): Linear(in_features=32, out_features=5, bias=True)
    )
  )
)
BOPs: tensor(277252.3750)
Trial  135  begins evaluation...
[I 2024-09-16 16:18:22,774] Trial 135 finished with values: [0.5707181539127035, 277252.375] and parameters: {'bottleneck_dim': 2, 'aggregator_type': 0, 'phi_len': 2, 'phi_MLP_width_0': 0, 'phi_MLP_acts_0': 0, 'phi_MLP_norms_0': None, 'phi_MLP_norms_1': 'batch', 'rho_len': 2, 'rho_MLP_width_0': 2, 'rho_MLP_acts_0': 0, 'rho_MLP_norms_0': 'layer', 'rho_MLP_norms_1': None}. 
Test Accuracy: 0.5707
Accuracy:  0.5707181539127035 , Inference time:  0.030103206634521484 , Validation Loss:  1.0790991304683037 , Param Count:  401
Conv bp:  tensor(4893505.)
DeepSetsArchitecture(
  (phi): ConvPhi(
    (layers): Sequential(
      (0): Conv1d(3, 16, kernel_size=(1,), stride=(1,))
      (1): LeakyReLU(negative_slope=0.0078125)
      (2): Conv1d(16, 64, kernel_size=(1,), stride=(1,))
      (3): BatchNorm1d(64, eps=1e-05, momentum=0.1, affine=True, track_running_stats=True)
      (4): LeakyReLU(negative_slope=0.0078125)
      (5): Conv1d(64, 16, kernel_size=(1,), stride=(1,))
    )
  )
  (rho): Rho(
    (layers): Sequential(
      (0): Linear(in_features=16, out_features=32, bias=True)
      (1): BatchNorm1d(32, eps=1e-05, momentum=0.1, affine=True, track_running_stats=True)
      (2): ReLU()
      (3): Linear(in_features=32, out_features=128, bias=True)
      (4): LeakyReLU(negative_slope=0.0078125)
      (5): Linear(in_features=128, out_features=32, bias=True)
      (6): BatchNorm1d(32, eps=1e-05, momentum=0.1, affine=True, track_running_stats=True)
      (7): ReLU()
      (8): Linear(in_features=32, out_features=5, bias=True)
    )
  )
)
BOPs: tensor(6417793.)
Trial  136  begins evaluation...
[I 2024-09-16 16:23:47,776] Trial 136 finished with values: [0.6647012336641406, 6417793.0] and parameters: {'bottleneck_dim': 4, 'aggregator_type': 0, 'phi_len': 3, 'phi_MLP_width_0': 1, 'phi_MLP_width_1': 3, 'phi_MLP_acts_0': 1, 'phi_MLP_acts_1': 1, 'phi_MLP_norms_0': None, 'phi_MLP_norms_1': 'batch', 'phi_MLP_norms_2': 'layer', 'rho_len': 4, 'rho_MLP_width_0': 2, 'rho_MLP_width_1': 4, 'rho_MLP_width_2': 2, 'rho_MLP_acts_0': 0, 'rho_MLP_acts_1': 1, 'rho_MLP_acts_2': 0, 'rho_MLP_norms_0': 'batch', 'rho_MLP_norms_1': 'layer', 'rho_MLP_norms_2': 'batch', 'rho_MLP_norms_3': 'layer'}. 
Test Accuracy: 0.6647
Accuracy:  0.6647012336641406 , Inference time:  0.05325961112976074 , Validation Loss:  0.8808969490382136 , Param Count:  11509
Conv bp:  tensor(918673.5000)
DeepSetsArchitecture(
  (phi): ConvPhi(
    (layers): Sequential(
      (0): Conv1d(3, 8, kernel_size=(1,), stride=(1,))
      (1): LeakyReLU(negative_slope=0.0078125)
      (2): Conv1d(8, 32, kernel_size=(1,), stride=(1,))
    )
  )
  (rho): Rho(
    (layers): Sequential(
      (0): Linear(in_features=32, out_features=128, bias=True)
      (1): BatchNorm1d(128, eps=1e-05, momentum=0.1, affine=True, track_running_stats=True)
      (2): ReLU()
      (3): Linear(in_features=128, out_features=5, bias=True)
    )
  )
)
BOPs: tensor(1730193.5000)
Trial  137  begins evaluation...
