[I 2024-09-16 09:44:14,286] Trial 57 finished with values: [0.6072971691442547, 1385236.0] and parameters: {'bottleneck_dim': 6, 'aggregator_type': 1, 'phi_len': 1, 'phi_MLP_norms_0': 'layer', 'rho_len': 4, 'rho_MLP_width_0': 1, 'rho_MLP_width_1': 0, 'rho_MLP_width_2': 3, 'rho_MLP_acts_0': 1, 'rho_MLP_acts_1': 0, 'rho_MLP_acts_2': 1, 'rho_MLP_norms_0': 'layer', 'rho_MLP_norms_1': 'batch', 'rho_MLP_norms_2': None, 'rho_MLP_norms_3': None}. 
Test Accuracy: 0.6073
Accuracy:  0.6072971691442547 , Inference time:  0.030269861221313477 , Validation Loss:  1.0160294507636505 , Param Count:  2349
Conv bp:  tensor(1039380.)
DeepSetsArchitecture(
  (phi): ConvPhi(
    (layers): Sequential(
      (0): Conv1d(3, 64, kernel_size=(1,), stride=(1,))
    )
  )
  (rho): Rho(
    (layers): Sequential(
      (0): Linear(in_features=64, out_features=64, bias=True)
      (1): LeakyReLU(negative_slope=0.0078125)
      (2): Linear(in_features=64, out_features=64, bias=True)
      (3): LeakyReLU(negative_slope=0.0078125)
      (4): Linear(in_features=64, out_features=8, bias=True)
      (5): LeakyReLU(negative_slope=0.0078125)
      (6): Linear(in_features=8, out_features=5, bias=True)
    )
  )
)
BOPs: tensor(2551300.)
Trial  58  begins evaluation...
[I 2024-09-16 09:49:04,518] Trial 58 finished with values: [0.624684928999842, 2551300.0] and parameters: {'bottleneck_dim': 6, 'aggregator_type': 1, 'phi_len': 1, 'phi_MLP_norms_0': None, 'rho_len': 4, 'rho_MLP_width_0': 3, 'rho_MLP_width_1': 3, 'rho_MLP_width_2': 0, 'rho_MLP_acts_0': 1, 'rho_MLP_acts_1': 1, 'rho_MLP_acts_2': 1, 'rho_MLP_norms_0': 'layer', 'rho_MLP_norms_1': None, 'rho_MLP_norms_2': 'layer', 'rho_MLP_norms_3': None}. 
Test Accuracy: 0.6247
Accuracy:  0.624684928999842 , Inference time:  0.026781082153320312 , Validation Loss:  0.9763489012815514 , Param Count:  9141
Conv bp:  tensor(78429160.)
DeepSetsArchitecture(
  (phi): ConvPhi(
    (layers): Sequential(
      (0): Conv1d(3, 128, kernel_size=(1,), stride=(1,))
      (1): BatchNorm1d(128, eps=1e-05, momentum=0.1, affine=True, track_running_stats=True)
      (2): LeakyReLU(negative_slope=0.0078125)
      (3): Conv1d(128, 128, kernel_size=(1,), stride=(1,))
      (4): ReLU()
      (5): Conv1d(128, 128, kernel_size=(1,), stride=(1,))
      (6): ReLU()
      (7): Conv1d(128, 4, kernel_size=(1,), stride=(1,))
    )
  )
  (rho): Rho(
    (layers): Sequential(
      (0): Linear(in_features=4, out_features=128, bias=True)
      (1): LeakyReLU(negative_slope=0.0078125)
      (2): Linear(in_features=128, out_features=32, bias=True)
      (3): LeakyReLU(negative_slope=0.0078125)
      (4): Linear(in_features=32, out_features=5, bias=True)
      (5): BatchNorm1d(5, eps=1e-05, momentum=0.1, affine=True, track_running_stats=True)
    )
  )
)
BOPs: tensor(79253576.)
Trial  59  begins evaluation...
[I 2024-09-16 09:53:58,097] Trial 59 finished with values: [0.6370698189017644, 79253576.0] and parameters: {'bottleneck_dim': 2, 'aggregator_type': 0, 'phi_len': 4, 'phi_MLP_width_0': 4, 'phi_MLP_width_1': 4, 'phi_MLP_width_2': 4, 'phi_MLP_acts_0': 1, 'phi_MLP_acts_1': 0, 'phi_MLP_acts_2': 0, 'phi_MLP_norms_0': 'batch', 'phi_MLP_norms_1': 'layer', 'phi_MLP_norms_2': None, 'phi_MLP_norms_3': None, 'rho_len': 3, 'rho_MLP_width_0': 4, 'rho_MLP_width_1': 2, 'rho_MLP_acts_0': 1, 'rho_MLP_acts_1': 1, 'rho_MLP_norms_0': None, 'rho_MLP_norms_1': 'layer', 'rho_MLP_norms_2': 'batch'}. 
Test Accuracy: 0.6371
Accuracy:  0.6370698189017644 , Inference time:  0.05867767333984375 , Validation Loss:  0.9570123764122425 , Param Count:  39251
Conv bp:  tensor(55282664.)
DeepSetsArchitecture(
  (phi): ConvPhi(
    (layers): Sequential(
      (0): Conv1d(3, 128, kernel_size=(1,), stride=(1,))
      (1): ReLU()
      (2): Conv1d(128, 128, kernel_size=(1,), stride=(1,))
      (3): BatchNorm1d(128, eps=1e-05, momentum=0.1, affine=True, track_running_stats=True)
      (4): ReLU()
      (5): Conv1d(128, 2, kernel_size=(1,), stride=(1,))
    )
  )
  (rho): Rho(
    (layers): Sequential(
      (0): Linear(in_features=2, out_features=128, bias=True)
      (1): BatchNorm1d(128, eps=1e-05, momentum=0.1, affine=True, track_running_stats=True)
      (2): ReLU()
      (3): Linear(in_features=128, out_features=16, bias=True)
      (4): ReLU()
      (5): Linear(in_features=16, out_features=5, bias=True)
    )
  )
)
BOPs: tensor(55694248.)
Trial  60  begins evaluation...
[I 2024-09-16 09:58:53,662] Trial 60 finished with values: [0.6038515610052325, 55694248.0] and parameters: {'bottleneck_dim': 1, 'aggregator_type': 0, 'phi_len': 3, 'phi_MLP_width_0': 4, 'phi_MLP_width_1': 4, 'phi_MLP_acts_0': 0, 'phi_MLP_acts_1': 0, 'phi_MLP_norms_0': 'layer', 'phi_MLP_norms_1': 'batch', 'phi_MLP_norms_2': None, 'rho_len': 3, 'rho_MLP_width_0': 4, 'rho_MLP_width_1': 1, 'rho_MLP_acts_0': 0, 'rho_MLP_acts_1': 0, 'rho_MLP_norms_0': 'batch', 'rho_MLP_norms_1': None, 'rho_MLP_norms_2': None}. 
Test Accuracy: 0.6039
Accuracy:  0.6038515610052325 , Inference time:  0.049405574798583984 , Validation Loss:  1.0223386875626181 , Param Count:  20327
Conv bp:  tensor(1447579.5000)
DeepSetsArchitecture(
  (phi): ConvPhi(
    (layers): Sequential(
      (0): Conv1d(3, 64, kernel_size=(1,), stride=(1,))
      (1): LeakyReLU(negative_slope=0.0078125)
      (2): Conv1d(64, 2, kernel_size=(1,), stride=(1,))
    )
  )
  (rho): Rho(
    (layers): Sequential(
      (0): Linear(in_features=2, out_features=32, bias=True)
      (1): BatchNorm1d(32, eps=1e-05, momentum=0.1, affine=True, track_running_stats=True)
      (2): LeakyReLU(negative_slope=0.0078125)
      (3): Linear(in_features=32, out_features=32, bias=True)
      (4): BatchNorm1d(32, eps=1e-05, momentum=0.1, affine=True, track_running_stats=True)
      (5): ReLU()
      (6): Linear(in_features=32, out_features=5, bias=True)
    )
  )
)
BOPs: tensor(1659547.5000)
Trial  61  begins evaluation...
[I 2024-09-16 10:03:43,526] Trial 61 finished with values: [0.5940138589646539, 1659547.5] and parameters: {'bottleneck_dim': 1, 'aggregator_type': 0, 'phi_len': 2, 'phi_MLP_width_0': 3, 'phi_MLP_acts_0': 1, 'phi_MLP_norms_0': None, 'phi_MLP_norms_1': None, 'rho_len': 3, 'rho_MLP_width_0': 2, 'rho_MLP_width_1': 2, 'rho_MLP_acts_0': 1, 'rho_MLP_acts_1': 0, 'rho_MLP_norms_0': 'batch', 'rho_MLP_norms_1': 'batch', 'rho_MLP_norms_2': 'layer'}. 
Test Accuracy: 0.5940
Accuracy:  0.5940138589646539 , Inference time:  0.03874850273132324 , Validation Loss:  1.037059186267204 , Param Count:  1831
Conv bp:  tensor(9559933.)
DeepSetsArchitecture(
  (phi): ConvPhi(
    (layers): Sequential(
      (0): Conv1d(3, 16, kernel_size=(1,), stride=(1,))
      (1): LeakyReLU(negative_slope=0.0078125)
      (2): Conv1d(16, 128, kernel_size=(1,), stride=(1,))
      (3): BatchNorm1d(128, eps=1e-05, momentum=0.1, affine=True, track_running_stats=True)
      (4): ReLU()
      (5): Conv1d(128, 16, kernel_size=(1,), stride=(1,))
      (6): BatchNorm1d(16, eps=1e-05, momentum=0.1, affine=True, track_running_stats=True)
    )
  )
  (rho): Rho(
    (layers): Sequential(
      (0): Linear(in_features=16, out_features=128, bias=True)
      (1): BatchNorm1d(128, eps=1e-05, momentum=0.1, affine=True, track_running_stats=True)
      (2): LeakyReLU(negative_slope=0.0078125)
      (3): Linear(in_features=128, out_features=16, bias=True)
      (4): BatchNorm1d(16, eps=1e-05, momentum=0.1, affine=True, track_running_stats=True)
      (5): LeakyReLU(negative_slope=0.0078125)
      (6): Linear(in_features=16, out_features=64, bias=True)
      (7): LeakyReLU(negative_slope=0.0078125)
      (8): Linear(in_features=64, out_features=5, bias=True)
      (9): BatchNorm1d(5, eps=1e-05, momentum=0.1, affine=True, track_running_stats=True)
    )
  )
)
BOPs: tensor(10489469.)
Trial  62  begins evaluation...
[I 2024-09-16 10:08:42,610] Trial 62 finished with values: [0.6637445824425385, 10489469.0] and parameters: {'bottleneck_dim': 4, 'aggregator_type': 0, 'phi_len': 3, 'phi_MLP_width_0': 1, 'phi_MLP_width_1': 4, 'phi_MLP_acts_0': 1, 'phi_MLP_acts_1': 0, 'phi_MLP_norms_0': 'layer', 'phi_MLP_norms_1': 'batch', 'phi_MLP_norms_2': 'batch', 'rho_len': 4, 'rho_MLP_width_0': 4, 'rho_MLP_width_1': 1, 'rho_MLP_width_2': 3, 'rho_MLP_acts_0': 1, 'rho_MLP_acts_1': 1, 'rho_MLP_acts_2': 1, 'rho_MLP_norms_0': 'batch', 'rho_MLP_norms_1': 'batch', 'rho_MLP_norms_2': 'layer', 'rho_MLP_norms_3': 'batch'}. 
Test Accuracy: 0.6637
Accuracy:  0.6637445824425385 , Inference time:  0.06328964233398438 , Validation Loss:  0.8847130297803555 , Param Count:  10543
Conv bp:  tensor(1007761.5000)
DeepSetsArchitecture(
  (phi): ConvPhi(
    (layers): Sequential(
      (0): Conv1d(3, 8, kernel_size=(1,), stride=(1,))
      (1): LeakyReLU(negative_slope=0.0078125)
      (2): Conv1d(8, 32, kernel_size=(1,), stride=(1,))
      (3): ReLU()
      (4): Conv1d(32, 2, kernel_size=(1,), stride=(1,))
      (5): BatchNorm1d(2, eps=1e-05, momentum=0.1, affine=True, track_running_stats=True)
    )
  )
  (rho): Rho(
    (layers): Sequential(
      (0): Linear(in_features=2, out_features=8, bias=True)
      (1): ReLU()
      (2): Linear(in_features=8, out_features=128, bias=True)
      (3): LeakyReLU(negative_slope=0.0078125)
      (4): Linear(in_features=128, out_features=8, bias=True)
      (5): LeakyReLU(negative_slope=0.0078125)
      (6): Linear(in_features=8, out_features=5, bias=True)
      (7): BatchNorm1d(5, eps=1e-05, momentum=0.1, affine=True, track_running_stats=True)
    )
  )
)
BOPs: tensor(1365329.5000)
Trial  63  begins evaluation...
[I 2024-09-16 10:13:42,231] Trial 63 finished with values: [0.5634209847684488, 1365329.5] and parameters: {'bottleneck_dim': 1, 'aggregator_type': 1, 'phi_len': 3, 'phi_MLP_width_0': 0, 'phi_MLP_width_1': 2, 'phi_MLP_acts_0': 1, 'phi_MLP_acts_1': 0, 'phi_MLP_norms_0': None, 'phi_MLP_norms_1': 'layer', 'phi_MLP_norms_2': 'batch', 'rho_len': 4, 'rho_MLP_width_0': 0, 'rho_MLP_width_1': 4, 'rho_MLP_width_2': 0, 'rho_MLP_acts_0': 0, 'rho_MLP_acts_1': 1, 'rho_MLP_acts_2': 1, 'rho_MLP_norms_0': 'layer', 'rho_MLP_norms_1': None, 'rho_MLP_norms_2': 'layer', 'rho_MLP_norms_3': 'batch'}. 
Test Accuracy: 0.5634
Accuracy:  0.5634209847684488 , Inference time:  0.049292802810668945 , Validation Loss:  1.1251612986837114 , Param Count:  2653
Conv bp:  tensor(519690.)
DeepSetsArchitecture(
  (phi): ConvPhi(
    (layers): Sequential(
      (0): Conv1d(3, 32, kernel_size=(1,), stride=(1,))
      (1): BatchNorm1d(32, eps=1e-05, momentum=0.1, affine=True, track_running_stats=True)
    )
  )
  (rho): Rho(
    (layers): Sequential(
      (0): Linear(in_features=32, out_features=128, bias=True)
      (1): ReLU()
      (2): Linear(in_features=128, out_features=8, bias=True)
      (3): LeakyReLU(negative_slope=0.0078125)
      (4): Linear(in_features=8, out_features=5, bias=True)
      (5): BatchNorm1d(5, eps=1e-05, momentum=0.1, affine=True, track_running_stats=True)
    )
  )
)
BOPs: tensor(1404666.)
Trial  64  begins evaluation...
[I 2024-09-16 10:18:48,875] Trial 64 finished with values: [0.6227533254028333, 1404666.0] and parameters: {'bottleneck_dim': 5, 'aggregator_type': 1, 'phi_len': 1, 'phi_MLP_norms_0': 'batch', 'rho_len': 3, 'rho_MLP_width_0': 4, 'rho_MLP_width_1': 0, 'rho_MLP_acts_0': 0, 'rho_MLP_acts_1': 1, 'rho_MLP_norms_0': 'layer', 'rho_MLP_norms_1': None, 'rho_MLP_norms_2': 'batch'}. 
Test Accuracy: 0.6228
Accuracy:  0.6227533254028333 , Inference time:  0.031080007553100586 , Validation Loss:  0.9893572910302351 , Param Count:  5503
Conv bp:  tensor(8727712.)
DeepSetsArchitecture(
  (phi): ConvPhi(
    (layers): Sequential(
      (0): Conv1d(3, 128, kernel_size=(1,), stride=(1,))
      (1): LeakyReLU(negative_slope=0.0078125)
      (2): Conv1d(128, 16, kernel_size=(1,), stride=(1,))
      (3): ReLU()
      (4): Conv1d(16, 2, kernel_size=(1,), stride=(1,))
      (5): BatchNorm1d(2, eps=1e-05, momentum=0.1, affine=True, track_running_stats=True)
    )
  )
  (rho): Rho(
    (layers): Sequential(
      (0): Linear(in_features=2, out_features=64, bias=True)
      (1): ReLU()
      (2): Linear(in_features=64, out_features=5, bias=True)
      (3): BatchNorm1d(5, eps=1e-05, momentum=0.1, affine=True, track_running_stats=True)
    )
  )
)
BOPs: tensor(8803808.)
Trial  65  begins evaluation...
[I 2024-09-16 10:23:55,373] Trial 65 finished with values: [0.5976474698654866, 8803808.0] and parameters: {'bottleneck_dim': 1, 'aggregator_type': 0, 'phi_len': 3, 'phi_MLP_width_0': 4, 'phi_MLP_width_1': 1, 'phi_MLP_acts_0': 1, 'phi_MLP_acts_1': 0, 'phi_MLP_norms_0': 'layer', 'phi_MLP_norms_1': None, 'phi_MLP_norms_2': 'batch', 'rho_len': 2, 'rho_MLP_width_0': 3, 'rho_MLP_acts_0': 0, 'rho_MLP_norms_0': 'layer', 'rho_MLP_norms_1': 'batch'}. 
Test Accuracy: 0.5976
Accuracy:  0.5976474698654866 , Inference time:  0.04404759407043457 , Validation Loss:  1.0265608940805708 , Param Count:  3141
Conv bp:  tensor(32480.6250)
DeepSetsArchitecture(
  (phi): ConvPhi(
    (layers): Sequential(
      (0): Conv1d(3, 2, kernel_size=(1,), stride=(1,))
      (1): BatchNorm1d(2, eps=1e-05, momentum=0.1, affine=True, track_running_stats=True)
    )
  )
  (rho): Rho(
    (layers): Sequential(
      (0): Linear(in_features=2, out_features=128, bias=True)
      (1): LeakyReLU(negative_slope=0.0078125)
      (2): Linear(in_features=128, out_features=64, bias=True)
      (3): LeakyReLU(negative_slope=0.0078125)
      (4): Linear(in_features=64, out_features=8, bias=True)
      (5): BatchNorm1d(8, eps=1e-05, momentum=0.1, affine=True, track_running_stats=True)
      (6): LeakyReLU(negative_slope=0.0078125)
      (7): Linear(in_features=8, out_features=5, bias=True)
    )
  )
)
BOPs: tensor(1594240.6250)
Trial  66  begins evaluation...
[I 2024-09-16 10:29:16,411] Trial 66 finished with values: [0.4309039938108825, 1594240.625] and parameters: {'bottleneck_dim': 1, 'aggregator_type': 1, 'phi_len': 1, 'phi_MLP_norms_0': 'batch', 'rho_len': 4, 'rho_MLP_width_0': 4, 'rho_MLP_width_1': 3, 'rho_MLP_width_2': 0, 'rho_MLP_acts_0': 1, 'rho_MLP_acts_1': 1, 'rho_MLP_acts_2': 1, 'rho_MLP_norms_0': 'layer', 'rho_MLP_norms_1': None, 'rho_MLP_norms_2': 'batch', 'rho_MLP_norms_3': None}. 
Test Accuracy: 0.4309
Accuracy:  0.4309039938108825 , Inference time:  0.033179521560668945 , Validation Loss:  1.3236434159635686 , Param Count:  9233
Conv bp:  tensor(15288600.)
DeepSetsArchitecture(
  (phi): ConvPhi(
    (layers): Sequential(
      (0): Conv1d(3, 128, kernel_size=(1,), stride=(1,))
      (1): ReLU()
      (2): Conv1d(128, 32, kernel_size=(1,), stride=(1,))
    )
  )
  (rho): Rho(
    (layers): Sequential(
      (0): Linear(in_features=32, out_features=8, bias=True)
      (1): LeakyReLU(negative_slope=0.0078125)
      (2): Linear(in_features=8, out_features=5, bias=True)
      (3): BatchNorm1d(5, eps=1e-05, momentum=0.1, affine=True, track_running_stats=True)
    )
  )
)
BOPs: tensor(15342600.)
Trial  67  begins evaluation...
[I 2024-09-16 10:34:37,397] Trial 67 finished with values: [0.6238730232674214, 15342600.0] and parameters: {'bottleneck_dim': 5, 'aggregator_type': 1, 'phi_len': 2, 'phi_MLP_width_0': 4, 'phi_MLP_acts_0': 0, 'phi_MLP_norms_0': None, 'phi_MLP_norms_1': None, 'rho_len': 2, 'rho_MLP_width_0': 0, 'rho_MLP_acts_0': 1, 'rho_MLP_norms_0': None, 'rho_MLP_norms_1': 'batch'}. 
Test Accuracy: 0.6239
Accuracy:  0.6238730232674214 , Inference time:  0.0333707332611084 , Validation Loss:  0.9840408085154838 , Param Count:  4959
Conv bp:  tensor(3729990.)
DeepSetsArchitecture(
  (phi): ConvPhi(
    (layers): Sequential(
      (0): Conv1d(3, 128, kernel_size=(1,), stride=(1,))
      (1): BatchNorm1d(128, eps=1e-05, momentum=0.1, affine=True, track_running_stats=True)
      (2): LeakyReLU(negative_slope=0.0078125)
      (3): Conv1d(128, 4, kernel_size=(1,), stride=(1,))
      (4): BatchNorm1d(4, eps=1e-05, momentum=0.1, affine=True, track_running_stats=True)
    )
  )
  (rho): Rho(
    (layers): Sequential(
      (0): Linear(in_features=4, out_features=128, bias=True)
      (1): ReLU()
      (2): Linear(in_features=128, out_features=128, bias=True)
      (3): ReLU()
      (4): Linear(in_features=128, out_features=5, bias=True)
    )
  )
)
BOPs: tensor(6776518.)
Trial  68  begins evaluation...
[I 2024-09-16 10:40:07,312] Trial 68 finished with values: [0.6097794710966551, 6776518.0] and parameters: {'bottleneck_dim': 2, 'aggregator_type': 1, 'phi_len': 2, 'phi_MLP_width_0': 4, 'phi_MLP_acts_0': 1, 'phi_MLP_norms_0': 'batch', 'phi_MLP_norms_1': 'batch', 'rho_len': 3, 'rho_MLP_width_0': 4, 'rho_MLP_width_1': 4, 'rho_MLP_acts_0': 0, 'rho_MLP_acts_1': 0, 'rho_MLP_norms_0': 'layer', 'rho_MLP_norms_1': 'layer', 'rho_MLP_norms_2': None}. 
Test Accuracy: 0.6098
Accuracy:  0.6097794710966551 , Inference time:  0.03953361511230469 , Validation Loss:  1.0189230742097712 , Param Count:  19089
Conv bp:  tensor(3748422.)
DeepSetsArchitecture(
  (phi): ConvPhi(
    (layers): Sequential(
      (0): Conv1d(3, 32, kernel_size=(1,), stride=(1,))
      (1): LeakyReLU(negative_slope=0.0078125)
      (2): Conv1d(32, 32, kernel_size=(1,), stride=(1,))
    )
  )
  (rho): Rho(
    (layers): Sequential(
      (0): Linear(in_features=32, out_features=64, bias=True)
      (1): BatchNorm1d(64, eps=1e-05, momentum=0.1, affine=True, track_running_stats=True)
      (2): LeakyReLU(negative_slope=0.0078125)
      (3): Linear(in_features=64, out_features=5, bias=True)
      (4): BatchNorm1d(5, eps=1e-05, momentum=0.1, affine=True, track_running_stats=True)
    )
  )
)
BOPs: tensor(4155462.)
Trial  69  begins evaluation...
[I 2024-09-16 10:45:33,949] Trial 69 finished with values: [0.6482667975476454, 4155462.0] and parameters: {'bottleneck_dim': 5, 'aggregator_type': 1, 'phi_len': 2, 'phi_MLP_width_0': 2, 'phi_MLP_acts_0': 1, 'phi_MLP_norms_0': None, 'phi_MLP_norms_1': None, 'rho_len': 2, 'rho_MLP_width_0': 3, 'rho_MLP_acts_0': 1, 'rho_MLP_norms_0': 'batch', 'rho_MLP_norms_1': 'batch'}. 
Test Accuracy: 0.6483
Accuracy:  0.6482667975476454 , Inference time:  0.037305355072021484 , Validation Loss:  0.9213951781493466 , Param Count:  3759
Conv bp:  tensor(3368498.)
DeepSetsArchitecture(
  (phi): ConvPhi(
    (layers): Sequential(
      (0): Conv1d(3, 64, kernel_size=(1,), stride=(1,))
      (1): LeakyReLU(negative_slope=0.0078125)
      (2): Conv1d(64, 8, kernel_size=(1,), stride=(1,))
      (3): BatchNorm1d(8, eps=1e-05, momentum=0.1, affine=True, track_running_stats=True)
      (4): LeakyReLU(negative_slope=0.0078125)
      (5): Conv1d(8, 64, kernel_size=(1,), stride=(1,))
      (6): BatchNorm1d(64, eps=1e-05, momentum=0.1, affine=True, track_running_stats=True)
    )
  )
  (rho): Rho(
    (layers): Sequential(
      (0): Linear(in_features=64, out_features=64, bias=True)
      (1): ReLU()
      (2): Linear(in_features=64, out_features=8, bias=True)
      (3): BatchNorm1d(8, eps=1e-05, momentum=0.1, affine=True, track_running_stats=True)
      (4): LeakyReLU(negative_slope=0.0078125)
      (5): Linear(in_features=8, out_features=64, bias=True)
      (6): LeakyReLU(negative_slope=0.0078125)
      (7): Linear(in_features=64, out_features=5, bias=True)
    )
  )
)
BOPs: tensor(4309298.)
Trial  70  begins evaluation...
[I 2024-09-16 10:50:39,790] Trial 70 finished with values: [0.6531814892147974, 4309298.0] and parameters: {'bottleneck_dim': 6, 'aggregator_type': 1, 'phi_len': 3, 'phi_MLP_width_0': 3, 'phi_MLP_width_1': 0, 'phi_MLP_acts_0': 1, 'phi_MLP_acts_1': 1, 'phi_MLP_norms_0': None, 'phi_MLP_norms_1': 'batch', 'phi_MLP_norms_2': 'batch', 'rho_len': 4, 'rho_MLP_width_0': 3, 'rho_MLP_width_1': 0, 'rho_MLP_width_2': 3, 'rho_MLP_acts_0': 0, 'rho_MLP_acts_1': 1, 'rho_MLP_acts_2': 1, 'rho_MLP_norms_0': 'layer', 'rho_MLP_norms_1': 'batch', 'rho_MLP_norms_2': None, 'rho_MLP_norms_3': None}. 
Test Accuracy: 0.6532
Accuracy:  0.6531814892147974 , Inference time:  0.0539250373840332 , Validation Loss:  0.9087964807237897 , Param Count:  7093
Conv bp:  tensor(7659660.)
DeepSetsArchitecture(
  (phi): ConvPhi(
    (layers): Sequential(
      (0): Conv1d(3, 64, kernel_size=(1,), stride=(1,))
      (1): BatchNorm1d(64, eps=1e-05, momentum=0.1, affine=True, track_running_stats=True)
      (2): LeakyReLU(negative_slope=0.0078125)
      (3): Conv1d(64, 32, kernel_size=(1,), stride=(1,))
      (4): ReLU()
      (5): Conv1d(32, 2, kernel_size=(1,), stride=(1,))
      (6): BatchNorm1d(2, eps=1e-05, momentum=0.1, affine=True, track_running_stats=True)
    )
  )
  (rho): Rho(
    (layers): Sequential(
      (0): Linear(in_features=2, out_features=128, bias=True)
      (1): ReLU()
      (2): Linear(in_features=128, out_features=5, bias=True)
    )
  )
)
BOPs: tensor(7812812.)
Trial  71  begins evaluation...
[I 2024-09-16 10:55:38,006] Trial 71 finished with values: [0.6013393117102428, 7812812.0] and parameters: {'bottleneck_dim': 1, 'aggregator_type': 0, 'phi_len': 3, 'phi_MLP_width_0': 3, 'phi_MLP_width_1': 2, 'phi_MLP_acts_0': 1, 'phi_MLP_acts_1': 0, 'phi_MLP_norms_0': 'batch', 'phi_MLP_norms_1': None, 'phi_MLP_norms_2': 'batch', 'rho_len': 2, 'rho_MLP_width_0': 4, 'rho_MLP_acts_0': 0, 'rho_MLP_norms_0': 'layer', 'rho_MLP_norms_1': None}. 
Test Accuracy: 0.6013
Accuracy:  0.6013393117102428 , Inference time:  0.044327735900878906 , Validation Loss:  1.0246207710026072 , Param Count:  3563
Conv bp:  tensor(7570572.)
DeepSetsArchitecture(
  (phi): ConvPhi(
    (layers): Sequential(
      (0): Conv1d(3, 64, kernel_size=(1,), stride=(1,))
      (1): ReLU()
      (2): Conv1d(64, 32, kernel_size=(1,), stride=(1,))
    )
  )
  (rho): Rho(
    (layers): Sequential(
      (0): Linear(in_features=32, out_features=32, bias=True)
      (1): BatchNorm1d(32, eps=1e-05, momentum=0.1, affine=True, track_running_stats=True)
      (2): LeakyReLU(negative_slope=0.0078125)
      (3): Linear(in_features=32, out_features=5, bias=True)
    )
  )
)
BOPs: tensor(7775692.)
Trial  72  begins evaluation...
