[I 2024-09-16 12:21:33,693] Trial 88 finished with values: [0.6667975476453902, 5502115.0] and parameters: {'bottleneck_dim': 5, 'aggregator_type': 0, 'phi_len': 3, 'phi_MLP_width_0': 1, 'phi_MLP_width_1': 2, 'phi_MLP_acts_0': 0, 'phi_MLP_acts_1': 1, 'phi_MLP_norms_0': None, 'phi_MLP_norms_1': 'layer', 'phi_MLP_norms_2': 'layer', 'rho_len': 4, 'rho_MLP_width_0': 4, 'rho_MLP_width_1': 2, 'rho_MLP_width_2': 4, 'rho_MLP_acts_0': 1, 'rho_MLP_acts_1': 0, 'rho_MLP_acts_2': 1, 'rho_MLP_norms_0': 'batch', 'rho_MLP_norms_1': None, 'rho_MLP_norms_2': 'batch', 'rho_MLP_norms_3': 'batch'}. 
Test Accuracy: 0.6668
Accuracy:  0.6667975476453902 , Inference time:  0.05874371528625488 , Validation Loss:  0.8756306126815121 , Param Count:  15407
Conv bp:  tensor(32480.6250)
DeepSetsArchitecture(
  (phi): ConvPhi(
    (layers): Sequential(
      (0): Conv1d(3, 2, kernel_size=(1,), stride=(1,))
      (1): BatchNorm1d(2, eps=1e-05, momentum=0.1, affine=True, track_running_stats=True)
    )
  )
  (rho): Rho(
    (layers): Sequential(
      (0): Linear(in_features=2, out_features=128, bias=True)
      (1): BatchNorm1d(128, eps=1e-05, momentum=0.1, affine=True, track_running_stats=True)
      (2): ReLU()
      (3): Linear(in_features=128, out_features=5, bias=True)
    )
  )
)
BOPs: tensor(185488.6250)
Trial  89  begins evaluation...
[I 2024-09-16 12:26:29,191] Trial 89 finished with values: [0.42179168295746644, 185488.625] and parameters: {'bottleneck_dim': 1, 'aggregator_type': 1, 'phi_len': 1, 'phi_MLP_norms_0': 'batch', 'rho_len': 2, 'rho_MLP_width_0': 4, 'rho_MLP_acts_0': 0, 'rho_MLP_norms_0': 'batch', 'rho_MLP_norms_1': 'layer'}. 
Test Accuracy: 0.4218
Accuracy:  0.42179168295746644 , Inference time:  0.029415607452392578 , Validation Loss:  1.3630072040622736 , Param Count:  1297
Conv bp:  tensor(259845.)
DeepSetsArchitecture(
  (phi): ConvPhi(
    (layers): Sequential(
      (0): Conv1d(3, 16, kernel_size=(1,), stride=(1,))
      (1): BatchNorm1d(16, eps=1e-05, momentum=0.1, affine=True, track_running_stats=True)
    )
  )
  (rho): Rho(
    (layers): Sequential(
      (0): Linear(in_features=16, out_features=8, bias=True)
      (1): BatchNorm1d(8, eps=1e-05, momentum=0.1, affine=True, track_running_stats=True)
      (2): ReLU()
      (3): Linear(in_features=8, out_features=32, bias=True)
      (4): BatchNorm1d(32, eps=1e-05, momentum=0.1, affine=True, track_running_stats=True)
      (5): ReLU()
      (6): Linear(in_features=32, out_features=5, bias=True)
      (7): BatchNorm1d(5, eps=1e-05, momentum=0.1, affine=True, track_running_stats=True)
    )
  )
)
BOPs: tensor(353093.)
Trial  90  begins evaluation...
[I 2024-09-16 12:31:24,021] Trial 90 finished with values: [0.39941436307825406, 353093.0] and parameters: {'bottleneck_dim': 4, 'aggregator_type': 0, 'phi_len': 1, 'phi_MLP_norms_0': 'batch', 'rho_len': 3, 'rho_MLP_width_0': 0, 'rho_MLP_width_1': 2, 'rho_MLP_acts_0': 0, 'rho_MLP_acts_1': 0, 'rho_MLP_norms_0': 'batch', 'rho_MLP_norms_1': 'batch', 'rho_MLP_norms_2': 'batch'}. 
Test Accuracy: 0.3994
Accuracy:  0.39941436307825406 , Inference time:  0.03823661804199219 , Validation Loss:  1.379247517001872 , Param Count:  775
Conv bp:  tensor(3748422.)
DeepSetsArchitecture(
  (phi): ConvPhi(
    (layers): Sequential(
      (0): Conv1d(3, 32, kernel_size=(1,), stride=(1,))
      (1): LeakyReLU(negative_slope=0.0078125)
      (2): Conv1d(32, 32, kernel_size=(1,), stride=(1,))
    )
  )
  (rho): Rho(
    (layers): Sequential(
      (0): Linear(in_features=32, out_features=64, bias=True)
      (1): BatchNorm1d(64, eps=1e-05, momentum=0.1, affine=True, track_running_stats=True)
      (2): LeakyReLU(negative_slope=0.0078125)
      (3): Linear(in_features=64, out_features=64, bias=True)
      (4): BatchNorm1d(64, eps=1e-05, momentum=0.1, affine=True, track_running_stats=True)
      (5): LeakyReLU(negative_slope=0.0078125)
      (6): Linear(in_features=64, out_features=5, bias=True)
    )
  )
)
BOPs: tensor(4860358.)
Trial  91  begins evaluation...
[I 2024-09-16 12:36:13,478] Trial 91 finished with values: [0.6596318140602774, 4860358.0] and parameters: {'bottleneck_dim': 5, 'aggregator_type': 0, 'phi_len': 2, 'phi_MLP_width_0': 2, 'phi_MLP_acts_0': 1, 'phi_MLP_norms_0': None, 'phi_MLP_norms_1': None, 'rho_len': 3, 'rho_MLP_width_0': 3, 'rho_MLP_width_1': 3, 'rho_MLP_acts_0': 1, 'rho_MLP_acts_1': 1, 'rho_MLP_norms_0': 'batch', 'rho_MLP_norms_1': 'batch', 'rho_MLP_norms_2': 'layer'}. 
Test Accuracy: 0.6596
Accuracy:  0.6596318140602774 , Inference time:  0.04063677787780762 , Validation Loss:  0.8950759573858611 , Param Count:  8037
Conv bp:  tensor(32480.6250)
DeepSetsArchitecture(
  (phi): ConvPhi(
    (layers): Sequential(
      (0): Conv1d(3, 2, kernel_size=(1,), stride=(1,))
      (1): BatchNorm1d(2, eps=1e-05, momentum=0.1, affine=True, track_running_stats=True)
    )
  )
  (rho): Rho(
    (layers): Sequential(
      (0): Linear(in_features=2, out_features=16, bias=True)
      (1): BatchNorm1d(16, eps=1e-05, momentum=0.1, affine=True, track_running_stats=True)
      (2): ReLU()
      (3): Linear(in_features=16, out_features=64, bias=True)
      (4): LeakyReLU(negative_slope=0.0078125)
      (5): Linear(in_features=64, out_features=5, bias=True)
    )
  )
)
BOPs: tensor(265056.6250)
Trial  92  begins evaluation...
[I 2024-09-16 12:41:06,590] Trial 92 finished with values: [0.3754215504404755, 265056.625] and parameters: {'bottleneck_dim': 1, 'aggregator_type': 0, 'phi_len': 1, 'phi_MLP_norms_0': 'batch', 'rho_len': 3, 'rho_MLP_width_0': 1, 'rho_MLP_width_1': 3, 'rho_MLP_acts_0': 0, 'rho_MLP_acts_1': 1, 'rho_MLP_norms_0': 'batch', 'rho_MLP_norms_1': None, 'rho_MLP_norms_2': None}. 
Test Accuracy: 0.3754
Accuracy:  0.3754215504404755 , Inference time:  0.03012371063232422 , Validation Loss:  1.4126102308026787 , Param Count:  1505
Conv bp:  tensor(519690.)
DeepSetsArchitecture(
  (phi): ConvPhi(
    (layers): Sequential(
      (0): Conv1d(3, 32, kernel_size=(1,), stride=(1,))
    )
  )
  (rho): Rho(
    (layers): Sequential(
      (0): Linear(in_features=32, out_features=32, bias=True)
      (1): BatchNorm1d(32, eps=1e-05, momentum=0.1, affine=True, track_running_stats=True)
      (2): ReLU()
      (3): Linear(in_features=32, out_features=5, bias=True)
    )
  )
)
BOPs: tensor(724810.)
Trial  93  begins evaluation...
[I 2024-09-16 12:45:59,265] Trial 93 finished with values: [0.5925730590378584, 724810.0] and parameters: {'bottleneck_dim': 5, 'aggregator_type': 1, 'phi_len': 1, 'phi_MLP_norms_0': None, 'rho_len': 2, 'rho_MLP_width_0': 2, 'rho_MLP_acts_0': 0, 'rho_MLP_norms_0': 'batch', 'rho_MLP_norms_1': None}. 
Test Accuracy: 0.5926
Accuracy:  0.5925730590378584 , Inference time:  0.0238189697265625 , Validation Loss:  1.058755715282596 , Param Count:  1413
Conv bp:  tensor(2134056.)
DeepSetsArchitecture(
  (phi): ConvPhi(
    (layers): Sequential(
      (0): Conv1d(3, 32, kernel_size=(1,), stride=(1,))
      (1): ReLU()
      (2): Conv1d(32, 16, kernel_size=(1,), stride=(1,))
      (3): BatchNorm1d(16, eps=1e-05, momentum=0.1, affine=True, track_running_stats=True)
    )
  )
  (rho): Rho(
    (layers): Sequential(
      (0): Linear(in_features=16, out_features=64, bias=True)
      (1): BatchNorm1d(64, eps=1e-05, momentum=0.1, affine=True, track_running_stats=True)
      (2): LeakyReLU(negative_slope=0.0078125)
      (3): Linear(in_features=64, out_features=64, bias=True)
      (4): ReLU()
      (5): Linear(in_features=64, out_features=8, bias=True)
      (6): ReLU()
      (7): Linear(in_features=8, out_features=5, bias=True)
    )
  )
)
BOPs: tensor(3107352.)
Trial  94  begins evaluation...
[I 2024-09-16 12:50:51,942] Trial 94 finished with values: [0.6534759714169253, 3107352.0] and parameters: {'bottleneck_dim': 4, 'aggregator_type': 0, 'phi_len': 2, 'phi_MLP_width_0': 2, 'phi_MLP_acts_0': 0, 'phi_MLP_norms_0': None, 'phi_MLP_norms_1': 'batch', 'rho_len': 4, 'rho_MLP_width_0': 3, 'rho_MLP_width_1': 3, 'rho_MLP_width_2': 0, 'rho_MLP_acts_0': 1, 'rho_MLP_acts_1': 0, 'rho_MLP_acts_2': 0, 'rho_MLP_norms_0': 'batch', 'rho_MLP_norms_1': 'layer', 'rho_MLP_norms_2': 'layer', 'rho_MLP_norms_3': 'layer'}. 
Test Accuracy: 0.6535
Accuracy:  0.6534759714169253 , Inference time:  0.04248404502868652 , Validation Loss:  0.909945725178232 , Param Count:  6629
Conv bp:  tensor(15288600.)
DeepSetsArchitecture(
  (phi): ConvPhi(
    (layers): Sequential(
      (0): Conv1d(3, 128, kernel_size=(1,), stride=(1,))
      (1): ReLU()
      (2): Conv1d(128, 32, kernel_size=(1,), stride=(1,))
    )
  )
  (rho): Rho(
    (layers): Sequential(
      (0): Linear(in_features=32, out_features=64, bias=True)
      (1): BatchNorm1d(64, eps=1e-05, momentum=0.1, affine=True, track_running_stats=True)
      (2): LeakyReLU(negative_slope=0.0078125)
      (3): Linear(in_features=64, out_features=5, bias=True)
    )
  )
)
BOPs: tensor(15695640.)
Trial  95  begins evaluation...
[I 2024-09-16 12:55:39,998] Trial 95 finished with values: [0.6520667825739741, 15695640.0] and parameters: {'bottleneck_dim': 5, 'aggregator_type': 1, 'phi_len': 2, 'phi_MLP_width_0': 4, 'phi_MLP_acts_0': 0, 'phi_MLP_norms_0': None, 'phi_MLP_norms_1': None, 'rho_len': 2, 'rho_MLP_width_0': 3, 'rho_MLP_acts_0': 1, 'rho_MLP_norms_0': 'batch', 'rho_MLP_norms_1': None}. 
Test Accuracy: 0.6521
Accuracy:  0.6520667825739741 , Inference time:  0.034638404846191406 , Validation Loss:  0.9169574955693719 , Param Count:  7205
Conv bp:  tensor(259845.)
DeepSetsArchitecture(
  (phi): ConvPhi(
    (layers): Sequential(
      (0): Conv1d(3, 16, kernel_size=(1,), stride=(1,))
    )
  )
  (rho): Rho(
    (layers): Sequential(
      (0): Linear(in_features=16, out_features=64, bias=True)
      (1): BatchNorm1d(64, eps=1e-05, momentum=0.1, affine=True, track_running_stats=True)
      (2): LeakyReLU(negative_slope=0.0078125)
      (3): Linear(in_features=64, out_features=32, bias=True)
      (4): BatchNorm1d(32, eps=1e-05, momentum=0.1, affine=True, track_running_stats=True)
      (5): ReLU()
      (6): Linear(in_features=32, out_features=5, bias=True)
    )
  )
)
BOPs: tensor(813125.)
Trial  96  begins evaluation...
[I 2024-09-16 13:00:30,363] Trial 96 finished with values: [0.6245102361680711, 813125.0] and parameters: {'bottleneck_dim': 4, 'aggregator_type': 1, 'phi_len': 1, 'phi_MLP_norms_0': 'layer', 'rho_len': 3, 'rho_MLP_width_0': 3, 'rho_MLP_width_1': 2, 'rho_MLP_acts_0': 1, 'rho_MLP_acts_1': 0, 'rho_MLP_norms_0': 'batch', 'rho_MLP_norms_1': 'batch', 'rho_MLP_norms_2': None}. 
Test Accuracy: 0.6245
Accuracy:  0.6245102361680711 , Inference time:  0.03127312660217285 , Validation Loss:  0.9792256841854173 , Param Count:  3589
Conv bp:  tensor(56419304.)
DeepSetsArchitecture(
  (phi): ConvPhi(
    (layers): Sequential(
      (0): Conv1d(3, 128, kernel_size=(1,), stride=(1,))
      (1): ReLU()
      (2): Conv1d(128, 128, kernel_size=(1,), stride=(1,))
      (3): BatchNorm1d(128, eps=1e-05, momentum=0.1, affine=True, track_running_stats=True)
      (4): LeakyReLU(negative_slope=0.0078125)
      (5): Conv1d(128, 8, kernel_size=(1,), stride=(1,))
      (6): LeakyReLU(negative_slope=0.0078125)
      (7): Conv1d(8, 16, kernel_size=(1,), stride=(1,))
    )
  )
  (rho): Rho(
    (layers): Sequential(
      (0): Linear(in_features=16, out_features=16, bias=True)
      (1): LeakyReLU(negative_slope=0.0078125)
      (2): Linear(in_features=16, out_features=32, bias=True)
      (3): ReLU()
      (4): Linear(in_features=32, out_features=5, bias=True)
      (5): BatchNorm1d(5, eps=1e-05, momentum=0.1, affine=True, track_running_stats=True)
    )
  )
)
BOPs: tensor(56577576.)
Trial  97  begins evaluation...
[I 2024-09-16 13:05:23,884] Trial 97 finished with values: [0.6266647810932444, 56577576.0] and parameters: {'bottleneck_dim': 4, 'aggregator_type': 0, 'phi_len': 4, 'phi_MLP_width_0': 4, 'phi_MLP_width_1': 4, 'phi_MLP_width_2': 0, 'phi_MLP_acts_0': 0, 'phi_MLP_acts_1': 1, 'phi_MLP_acts_2': 1, 'phi_MLP_norms_0': 'layer', 'phi_MLP_norms_1': 'batch', 'phi_MLP_norms_2': None, 'phi_MLP_norms_3': 'layer', 'rho_len': 3, 'rho_MLP_width_0': 1, 'rho_MLP_width_1': 2, 'rho_MLP_acts_0': 1, 'rho_MLP_acts_1': 0, 'rho_MLP_norms_0': 'layer', 'rho_MLP_norms_1': 'layer', 'rho_MLP_norms_2': 'batch'}. 
Test Accuracy: 0.6267
Accuracy:  0.6266647810932444 , Inference time:  0.05683088302612305 , Validation Loss:  0.9782153530185725 , Param Count:  19447
Conv bp:  tensor(15288600.)
DeepSetsArchitecture(
  (phi): ConvPhi(
    (layers): Sequential(
      (0): Conv1d(3, 128, kernel_size=(1,), stride=(1,))
      (1): ReLU()
      (2): Conv1d(128, 32, kernel_size=(1,), stride=(1,))
      (3): BatchNorm1d(32, eps=1e-05, momentum=0.1, affine=True, track_running_stats=True)
    )
  )
  (rho): Rho(
    (layers): Sequential(
      (0): Linear(in_features=32, out_features=128, bias=True)
      (1): LeakyReLU(negative_slope=0.0078125)
      (2): Linear(in_features=128, out_features=16, bias=True)
      (3): LeakyReLU(negative_slope=0.0078125)
      (4): Linear(in_features=16, out_features=5, bias=True)
    )
  )
)
BOPs: tensor(16358552.)
Trial  98  begins evaluation...
[I 2024-09-16 13:10:13,573] Trial 98 finished with values: [0.6558235103276738, 16358552.0] and parameters: {'bottleneck_dim': 5, 'aggregator_type': 1, 'phi_len': 2, 'phi_MLP_width_0': 4, 'phi_MLP_acts_0': 0, 'phi_MLP_norms_0': 'layer', 'phi_MLP_norms_1': 'batch', 'rho_len': 3, 'rho_MLP_width_0': 4, 'rho_MLP_width_1': 1, 'rho_MLP_acts_0': 1, 'rho_MLP_acts_1': 1, 'rho_MLP_norms_0': None, 'rho_MLP_norms_1': 'layer', 'rho_MLP_norms_2': 'layer'}. 
Test Accuracy: 0.6558
Accuracy:  0.6558235103276738 , Inference time:  0.035927534103393555 , Validation Loss:  0.9046628722528212 , Param Count:  11077
Conv bp:  tensor(1447579.5000)
DeepSetsArchitecture(
  (phi): ConvPhi(
    (layers): Sequential(
      (0): Conv1d(3, 64, kernel_size=(1,), stride=(1,))
      (1): BatchNorm1d(64, eps=1e-05, momentum=0.1, affine=True, track_running_stats=True)
      (2): LeakyReLU(negative_slope=0.0078125)
      (3): Conv1d(64, 2, kernel_size=(1,), stride=(1,))
      (4): BatchNorm1d(2, eps=1e-05, momentum=0.1, affine=True, track_running_stats=True)
    )
  )
  (rho): Rho(
    (layers): Sequential(
      (0): Linear(in_features=2, out_features=16, bias=True)
      (1): LeakyReLU(negative_slope=0.0078125)
      (2): Linear(in_features=16, out_features=128, bias=True)
      (3): BatchNorm1d(128, eps=1e-05, momentum=0.1, affine=True, track_running_stats=True)
      (4): LeakyReLU(negative_slope=0.0078125)
      (5): Linear(in_features=128, out_features=5, bias=True)
    )
  )
)
BOPs: tensor(1908363.5000)
Trial  99  begins evaluation...
[I 2024-09-16 13:15:30,497] Trial 99 finished with values: [0.581728793538029, 1908363.5] and parameters: {'bottleneck_dim': 1, 'aggregator_type': 1, 'phi_len': 2, 'phi_MLP_width_0': 3, 'phi_MLP_acts_0': 1, 'phi_MLP_norms_0': 'batch', 'phi_MLP_norms_1': 'batch', 'rho_len': 3, 'rho_MLP_width_0': 1, 'rho_MLP_width_1': 4, 'rho_MLP_acts_0': 1, 'rho_MLP_acts_1': 1, 'rho_MLP_norms_0': 'layer', 'rho_MLP_norms_1': 'batch', 'rho_MLP_norms_2': None}. 
Test Accuracy: 0.5817
Accuracy:  0.581728793538029 , Inference time:  0.042490482330322266 , Validation Loss:  1.0877835555952422 , Param Count:  3643
Conv bp:  tensor(7570572.)
DeepSetsArchitecture(
  (phi): ConvPhi(
    (layers): Sequential(
      (0): Conv1d(3, 64, kernel_size=(1,), stride=(1,))
      (1): LeakyReLU(negative_slope=0.0078125)
      (2): Conv1d(64, 32, kernel_size=(1,), stride=(1,))
    )
  )
  (rho): Rho(
    (layers): Sequential(
      (0): Linear(in_features=32, out_features=5, bias=True)
    )
  )
)
BOPs: tensor(7601996.)
Trial  100  begins evaluation...
[I 2024-09-16 13:21:08,948] Trial 100 finished with values: [0.5483890825298849, 7601996.0] and parameters: {'bottleneck_dim': 5, 'aggregator_type': 0, 'phi_len': 2, 'phi_MLP_width_0': 3, 'phi_MLP_acts_0': 1, 'phi_MLP_norms_0': None, 'phi_MLP_norms_1': 'layer', 'rho_len': 1, 'rho_MLP_norms_0': 'layer'}. 
Test Accuracy: 0.5484
Accuracy:  0.5483890825298849 , Inference time:  0.024300336837768555 , Validation Loss:  1.1783863585822436 , Param Count:  2501
Conv bp:  tensor(8283276.)
DeepSetsArchitecture(
  (phi): ConvPhi(
    (layers): Sequential(
      (0): Conv1d(3, 64, kernel_size=(1,), stride=(1,))
      (1): LeakyReLU(negative_slope=0.0078125)
      (2): Conv1d(64, 32, kernel_size=(1,), stride=(1,))
      (3): ReLU()
      (4): Conv1d(32, 16, kernel_size=(1,), stride=(1,))
      (5): BatchNorm1d(16, eps=1e-05, momentum=0.1, affine=True, track_running_stats=True)
    )
  )
  (rho): Rho(
    (layers): Sequential(
      (0): Linear(in_features=16, out_features=16, bias=True)
      (1): BatchNorm1d(16, eps=1e-05, momentum=0.1, affine=True, track_running_stats=True)
      (2): LeakyReLU(negative_slope=0.0078125)
      (3): Linear(in_features=16, out_features=128, bias=True)
      (4): LeakyReLU(negative_slope=0.0078125)
      (5): Linear(in_features=128, out_features=5, bias=True)
      (6): BatchNorm1d(5, eps=1e-05, momentum=0.1, affine=True, track_running_stats=True)
    )
  )
)
BOPs: tensor(8783500.)
Trial  101  begins evaluation...
[I 2024-09-16 13:26:46,336] Trial 101 finished with values: [0.6405769854672201, 8783500.0] and parameters: {'bottleneck_dim': 4, 'aggregator_type': 1, 'phi_len': 3, 'phi_MLP_width_0': 3, 'phi_MLP_width_1': 2, 'phi_MLP_acts_0': 1, 'phi_MLP_acts_1': 0, 'phi_MLP_norms_0': 'layer', 'phi_MLP_norms_1': None, 'phi_MLP_norms_2': 'batch', 'rho_len': 3, 'rho_MLP_width_0': 1, 'rho_MLP_width_1': 4, 'rho_MLP_acts_0': 1, 'rho_MLP_acts_1': 1, 'rho_MLP_norms_0': 'batch', 'rho_MLP_norms_1': 'layer', 'rho_MLP_norms_2': 'batch'}. 
Test Accuracy: 0.6406
Accuracy:  0.6405769854672201 , Inference time:  0.05157637596130371 , Validation Loss:  0.9379855447074994 , Param Count:  6031
Conv bp:  tensor(2201369.)
DeepSetsArchitecture(
  (phi): ConvPhi(
    (layers): Sequential(
      (0): Conv1d(3, 32, kernel_size=(1,), stride=(1,))
      (1): BatchNorm1d(32, eps=1e-05, momentum=0.1, affine=True, track_running_stats=True)
      (2): LeakyReLU(negative_slope=0.0078125)
      (3): Conv1d(32, 8, kernel_size=(1,), stride=(1,))
      (4): ReLU()
      (5): Conv1d(8, 64, kernel_size=(1,), stride=(1,))
      (6): LeakyReLU(negative_slope=0.0078125)
      (7): Conv1d(64, 8, kernel_size=(1,), stride=(1,))
      (8): BatchNorm1d(8, eps=1e-05, momentum=0.1, affine=True, track_running_stats=True)
    )
  )
  (rho): Rho(
    (layers): Sequential(
      (0): Linear(in_features=8, out_features=8, bias=True)
      (1): BatchNorm1d(8, eps=1e-05, momentum=0.1, affine=True, track_running_stats=True)
      (2): LeakyReLU(negative_slope=0.0078125)
      (3): Linear(in_features=8, out_features=64, bias=True)
      (4): ReLU()
      (5): Linear(in_features=64, out_features=5, bias=True)
    )
  )
)
BOPs: tensor(2353049.)
Trial  102  begins evaluation...
[I 2024-09-16 13:32:34,780] Trial 102 finished with values: [0.6422207618271206, 2353049.0] and parameters: {'bottleneck_dim': 3, 'aggregator_type': 0, 'phi_len': 4, 'phi_MLP_width_0': 2, 'phi_MLP_width_1': 0, 'phi_MLP_width_2': 3, 'phi_MLP_acts_0': 1, 'phi_MLP_acts_1': 0, 'phi_MLP_acts_2': 1, 'phi_MLP_norms_0': 'batch', 'phi_MLP_norms_1': 'layer', 'phi_MLP_norms_2': None, 'phi_MLP_norms_3': 'batch', 'rho_len': 3, 'rho_MLP_width_0': 0, 'rho_MLP_width_1': 3, 'rho_MLP_acts_0': 1, 'rho_MLP_acts_1': 0, 'rho_MLP_norms_0': 'batch', 'rho_MLP_norms_1': None, 'rho_MLP_norms_2': None}. 
Test Accuracy: 0.6422
Accuracy:  0.6422207618271206 , Inference time:  0.05748867988586426 , Validation Loss:  0.943104253334253 , Param Count:  2557
Conv bp:  tensor(259845.)
DeepSetsArchitecture(
  (phi): ConvPhi(
    (layers): Sequential(
      (0): Conv1d(3, 16, kernel_size=(1,), stride=(1,))
      (1): BatchNorm1d(16, eps=1e-05, momentum=0.1, affine=True, track_running_stats=True)
    )
  )
  (rho): Rho(
    (layers): Sequential(
      (0): Linear(in_features=16, out_features=8, bias=True)
      (1): BatchNorm1d(8, eps=1e-05, momentum=0.1, affine=True, track_running_stats=True)
      (2): LeakyReLU(negative_slope=0.0078125)
      (3): Linear(in_features=8, out_features=64, bias=True)
      (4): ReLU()
      (5): Linear(in_features=64, out_features=5, bias=True)
    )
  )
)
BOPs: tensor(423429.)
Trial  103  begins evaluation...
[I 2024-09-16 13:37:52,926] Trial 103 finished with values: [0.39945096538586317, 423429.0] and parameters: {'bottleneck_dim': 4, 'aggregator_type': 0, 'phi_len': 1, 'phi_MLP_norms_0': 'batch', 'rho_len': 3, 'rho_MLP_width_0': 0, 'rho_MLP_width_1': 3, 'rho_MLP_acts_0': 1, 'rho_MLP_acts_1': 0, 'rho_MLP_norms_0': 'batch', 'rho_MLP_norms_1': 'layer', 'rho_MLP_norms_2': None}. 
Test Accuracy: 0.3995
Accuracy:  0.39945096538586317 , Inference time:  0.029429197311401367 , Validation Loss:  1.3794012337314838 , Param Count:  1149
Conv bp:  tensor(32480.6250)
DeepSetsArchitecture(
  (phi): ConvPhi(
    (layers): Sequential(
      (0): Conv1d(3, 2, kernel_size=(1,), stride=(1,))
    )
  )
  (rho): Rho(
    (layers): Sequential(
      (0): Linear(in_features=2, out_features=128, bias=True)
      (1): ReLU()
      (2): Linear(in_features=128, out_features=5, bias=True)
      (3): BatchNorm1d(5, eps=1e-05, momentum=0.1, affine=True, track_running_stats=True)
    )
  )
)
BOPs: tensor(185488.6250)
Trial  104  begins evaluation...
