[I 2024-09-16 08:28:24,216] Trial 42 finished with values: [0.5627172222176007, 1116308.0] and parameters: {'bottleneck_dim': 4, 'aggregator_type': 0, 'phi_len': 2, 'phi_MLP_width_0': 1, 'phi_MLP_acts_0': 1, 'phi_MLP_norms_0': 'layer', 'phi_MLP_norms_1': 'layer', 'rho_len': 2, 'rho_MLP_width_0': 1, 'rho_MLP_acts_0': 1, 'rho_MLP_norms_0': 'layer', 'rho_MLP_norms_1': 'batch'}. 
Test Accuracy: 0.5627
Accuracy:  0.5627172222176007 , Inference time:  0.03133749961853027 , Validation Loss:  1.1039692467572737 , Param Count:  703
Conv bp:  tensor(4014014.5000)
DeepSetsArchitecture(
  (phi): ConvPhi(
    (layers): Sequential(
      (0): Conv1d(3, 8, kernel_size=(1,), stride=(1,))
      (1): BatchNorm1d(8, eps=1e-05, momentum=0.1, affine=True, track_running_stats=True)
      (2): LeakyReLU(negative_slope=0.0078125)
      (3): Conv1d(8, 128, kernel_size=(1,), stride=(1,))
      (4): LeakyReLU(negative_slope=0.0078125)
      (5): Conv1d(128, 4, kernel_size=(1,), stride=(1,))
    )
  )
  (rho): Rho(
    (layers): Sequential(
      (0): Linear(in_features=4, out_features=32, bias=True)
      (1): BatchNorm1d(32, eps=1e-05, momentum=0.1, affine=True, track_running_stats=True)
      (2): LeakyReLU(negative_slope=0.0078125)
      (3): Linear(in_features=32, out_features=128, bias=True)
      (4): ReLU()
      (5): Linear(in_features=128, out_features=5, bias=True)
    )
  )
)
BOPs: tensor(4843070.5000)
Trial  43  begins evaluation...
[I 2024-09-16 08:33:17,252] Trial 43 finished with values: [0.6111104641006231, 4843070.5] and parameters: {'bottleneck_dim': 2, 'aggregator_type': 1, 'phi_len': 3, 'phi_MLP_width_0': 0, 'phi_MLP_width_1': 4, 'phi_MLP_acts_0': 1, 'phi_MLP_acts_1': 1, 'phi_MLP_norms_0': 'batch', 'phi_MLP_norms_1': None, 'phi_MLP_norms_2': 'layer', 'rho_len': 3, 'rho_MLP_width_0': 2, 'rho_MLP_width_1': 4, 'rho_MLP_acts_0': 1, 'rho_MLP_acts_1': 0, 'rho_MLP_norms_0': 'batch', 'rho_MLP_norms_1': None, 'rho_MLP_norms_2': None}. 
Test Accuracy: 0.6111
Accuracy:  0.6111104641006231 , Inference time:  0.04934120178222656 , Validation Loss:  1.0179503041059792 , Param Count:  6809
Conv bp:  tensor(1447579.5000)
DeepSetsArchitecture(
  (phi): ConvPhi(
    (layers): Sequential(
      (0): Conv1d(3, 64, kernel_size=(1,), stride=(1,))
      (1): ReLU()
      (2): Conv1d(64, 2, kernel_size=(1,), stride=(1,))
    )
  )
  (rho): Rho(
    (layers): Sequential(
      (0): Linear(in_features=2, out_features=5, bias=True)
      (1): BatchNorm1d(5, eps=1e-05, momentum=0.1, affine=True, track_running_stats=True)
    )
  )
)
BOPs: tensor(1449519.5000)
Trial  44  begins evaluation...
[I 2024-09-16 08:38:05,232] Trial 44 finished with values: [0.5216444418564025, 1449519.5] and parameters: {'bottleneck_dim': 1, 'aggregator_type': 0, 'phi_len': 2, 'phi_MLP_width_0': 3, 'phi_MLP_acts_0': 0, 'phi_MLP_norms_0': 'layer', 'phi_MLP_norms_1': 'layer', 'rho_len': 1, 'rho_MLP_norms_0': 'batch'}. 
Test Accuracy: 0.5216
Accuracy:  0.5216444418564025 , Inference time:  0.027361392974853516 , Validation Loss:  1.1872544734656405 , Param Count:  411
Conv bp:  tensor(8104445.)
DeepSetsArchitecture(
  (phi): ConvPhi(
    (layers): Sequential(
      (0): Conv1d(3, 16, kernel_size=(1,), stride=(1,))
      (1): BatchNorm1d(16, eps=1e-05, momentum=0.1, affine=True, track_running_stats=True)
      (2): ReLU()
      (3): Conv1d(16, 128, kernel_size=(1,), stride=(1,))
      (4): LeakyReLU(negative_slope=0.0078125)
      (5): Conv1d(128, 8, kernel_size=(1,), stride=(1,))
      (6): LeakyReLU(negative_slope=0.0078125)
      (7): Conv1d(8, 1, kernel_size=(1,), stride=(1,))
    )
  )
  (rho): Rho(
    (layers): Sequential(
      (0): Linear(in_features=1, out_features=64, bias=True)
      (1): ReLU()
      (2): Linear(in_features=64, out_features=32, bias=True)
      (3): BatchNorm1d(32, eps=1e-05, momentum=0.1, affine=True, track_running_stats=True)
      (4): ReLU()
      (5): Linear(in_features=32, out_features=5, bias=True)
    )
  )
)
BOPs: tensor(8494221.)
Trial  45  begins evaluation...
[I 2024-09-16 08:43:00,698] Trial 45 finished with values: [0.44322067032135165, 8494221.0] and parameters: {'bottleneck_dim': 0, 'aggregator_type': 1, 'phi_len': 4, 'phi_MLP_width_0': 1, 'phi_MLP_width_1': 4, 'phi_MLP_width_2': 0, 'phi_MLP_acts_0': 0, 'phi_MLP_acts_1': 1, 'phi_MLP_acts_2': 1, 'phi_MLP_norms_0': 'batch', 'phi_MLP_norms_1': 'layer', 'phi_MLP_norms_2': None, 'phi_MLP_norms_3': 'layer', 'rho_len': 3, 'rho_MLP_width_0': 3, 'rho_MLP_width_1': 2, 'rho_MLP_acts_0': 0, 'rho_MLP_acts_1': 0, 'rho_MLP_norms_0': None, 'rho_MLP_norms_1': 'batch', 'rho_MLP_norms_2': 'layer'}. 
Test Accuracy: 0.4432
Accuracy:  0.44322067032135165 , Inference time:  0.05825090408325195 , Validation Loss:  1.286600726802333 , Param Count:  5750
Conv bp:  tensor(1145876.)
DeepSetsArchitecture(
  (phi): ConvPhi(
    (layers): Sequential(
      (0): Conv1d(3, 16, kernel_size=(1,), stride=(1,))
      (1): ReLU()
      (2): Conv1d(16, 16, kernel_size=(1,), stride=(1,))
      (3): BatchNorm1d(16, eps=1e-05, momentum=0.1, affine=True, track_running_stats=True)
      (4): ReLU()
      (5): Conv1d(16, 4, kernel_size=(1,), stride=(1,))
      (6): BatchNorm1d(4, eps=1e-05, momentum=0.1, affine=True, track_running_stats=True)
    )
  )
  (rho): Rho(
    (layers): Sequential(
      (0): Linear(in_features=4, out_features=32, bias=True)
      (1): LeakyReLU(negative_slope=0.0078125)
      (2): Linear(in_features=32, out_features=5, bias=True)
    )
  )
)
BOPs: tensor(1194452.)
Trial  46  begins evaluation...
[I 2024-09-16 08:47:50,790] Trial 46 finished with values: [0.5979935280465182, 1194452.0] and parameters: {'bottleneck_dim': 2, 'aggregator_type': 1, 'phi_len': 3, 'phi_MLP_width_0': 1, 'phi_MLP_width_1': 1, 'phi_MLP_acts_0': 0, 'phi_MLP_acts_1': 0, 'phi_MLP_norms_0': None, 'phi_MLP_norms_1': 'batch', 'phi_MLP_norms_2': 'batch', 'rho_len': 2, 'rho_MLP_width_0': 2, 'rho_MLP_acts_0': 1, 'rho_MLP_norms_0': None, 'rho_MLP_norms_1': 'layer'}. 
Test Accuracy: 0.5980
Accuracy:  0.5979935280465182 , Inference time:  0.04235053062438965 , Validation Loss:  1.0430686250835859 , Param Count:  769
Conv bp:  tensor(1887648.5000)
DeepSetsArchitecture(
  (phi): ConvPhi(
    (layers): Sequential(
      (0): Conv1d(3, 8, kernel_size=(1,), stride=(1,))
      (1): LeakyReLU(negative_slope=0.0078125)
      (2): Conv1d(8, 64, kernel_size=(1,), stride=(1,))
      (3): ReLU()
      (4): Conv1d(64, 2, kernel_size=(1,), stride=(1,))
      (5): BatchNorm1d(2, eps=1e-05, momentum=0.1, affine=True, track_running_stats=True)
    )
  )
  (rho): Rho(
    (layers): Sequential(
      (0): Linear(in_features=2, out_features=32, bias=True)
      (1): BatchNorm1d(32, eps=1e-05, momentum=0.1, affine=True, track_running_stats=True)
      (2): ReLU()
      (3): Linear(in_features=32, out_features=64, bias=True)
      (4): BatchNorm1d(64, eps=1e-05, momentum=0.1, affine=True, track_running_stats=True)
      (5): LeakyReLU(negative_slope=0.0078125)
      (6): Linear(in_features=64, out_features=32, bias=True)
      (7): LeakyReLU(negative_slope=0.0078125)
      (8): Linear(in_features=32, out_features=5, bias=True)
      (9): BatchNorm1d(5, eps=1e-05, momentum=0.1, affine=True, track_running_stats=True)
    )
  )
)
BOPs: tensor(2625952.5000)
Trial  47  begins evaluation...
[I 2024-09-16 08:53:00,656] Trial 47 finished with values: [0.5947908261307201, 2625952.5] and parameters: {'bottleneck_dim': 1, 'aggregator_type': 0, 'phi_len': 3, 'phi_MLP_width_0': 0, 'phi_MLP_width_1': 3, 'phi_MLP_acts_0': 1, 'phi_MLP_acts_1': 0, 'phi_MLP_norms_0': 'layer', 'phi_MLP_norms_1': None, 'phi_MLP_norms_2': 'batch', 'rho_len': 4, 'rho_MLP_width_0': 2, 'rho_MLP_width_1': 3, 'rho_MLP_width_2': 2, 'rho_MLP_acts_0': 0, 'rho_MLP_acts_1': 1, 'rho_MLP_acts_2': 1, 'rho_MLP_norms_0': 'batch', 'rho_MLP_norms_1': 'batch', 'rho_MLP_norms_2': None, 'rho_MLP_norms_3': 'batch'}. 
Test Accuracy: 0.5948
Accuracy:  0.5947908261307201 , Inference time:  0.05772733688354492 , Validation Loss:  1.0384009399381624 , Param Count:  5397
Conv bp:  tensor(31470088.)
DeepSetsArchitecture(
  (phi): ConvPhi(
    (layers): Sequential(
      (0): Conv1d(3, 128, kernel_size=(1,), stride=(1,))
      (1): BatchNorm1d(128, eps=1e-05, momentum=0.1, affine=True, track_running_stats=True)
      (2): ReLU()
      (3): Conv1d(128, 64, kernel_size=(1,), stride=(1,))
      (4): ReLU()
      (5): Conv1d(64, 32, kernel_size=(1,), stride=(1,))
      (6): LeakyReLU(negative_slope=0.0078125)
      (7): Conv1d(32, 8, kernel_size=(1,), stride=(1,))
      (8): BatchNorm1d(8, eps=1e-05, momentum=0.1, affine=True, track_running_stats=True)
    )
  )
  (rho): Rho(
    (layers): Sequential(
      (0): Linear(in_features=8, out_features=32, bias=True)
      (1): LeakyReLU(negative_slope=0.0078125)
      (2): Linear(in_features=32, out_features=8, bias=True)
      (3): LeakyReLU(negative_slope=0.0078125)
      (4): Linear(in_features=8, out_features=5, bias=True)
      (5): BatchNorm1d(5, eps=1e-05, momentum=0.1, affine=True, track_running_stats=True)
    )
  )
)
BOPs: tensor(31563768.)
Trial  48  begins evaluation...
[I 2024-09-16 08:58:23,080] Trial 48 finished with values: [0.6430592874196205, 31563768.0] and parameters: {'bottleneck_dim': 3, 'aggregator_type': 0, 'phi_len': 4, 'phi_MLP_width_0': 4, 'phi_MLP_width_1': 3, 'phi_MLP_width_2': 2, 'phi_MLP_acts_0': 0, 'phi_MLP_acts_1': 0, 'phi_MLP_acts_2': 1, 'phi_MLP_norms_0': 'batch', 'phi_MLP_norms_1': 'layer', 'phi_MLP_norms_2': None, 'phi_MLP_norms_3': 'batch', 'rho_len': 3, 'rho_MLP_width_0': 2, 'rho_MLP_width_1': 0, 'rho_MLP_acts_0': 1, 'rho_MLP_acts_1': 1, 'rho_MLP_norms_0': 'layer', 'rho_MLP_norms_1': 'layer', 'rho_MLP_norms_2': 'batch'}. 
Test Accuracy: 0.6431
Accuracy:  0.6430592874196205 , Inference time:  0.05982089042663574 , Validation Loss:  0.9429739928569923 , Param Count:  11991
Conv bp:  tensor(309717.9375)
DeepSetsArchitecture(
  (phi): ConvPhi(
    (layers): Sequential(
      (0): Conv1d(3, 16, kernel_size=(1,), stride=(1,))
      (1): ReLU()
      (2): Conv1d(16, 1, kernel_size=(1,), stride=(1,))
    )
  )
  (rho): Rho(
    (layers): Sequential(
      (0): Linear(in_features=1, out_features=32, bias=True)
      (1): ReLU()
      (2): Linear(in_features=32, out_features=128, bias=True)
      (3): ReLU()
      (4): Linear(in_features=128, out_features=8, bias=True)
      (5): ReLU()
      (6): Linear(in_features=8, out_features=5, bias=True)
    )
  )
)
BOPs: tensor(1196190.)
Trial  49  begins evaluation...
[I 2024-09-16 09:03:50,637] Trial 49 finished with values: [0.5403715134222326, 1196190.0] and parameters: {'bottleneck_dim': 0, 'aggregator_type': 0, 'phi_len': 2, 'phi_MLP_width_0': 1, 'phi_MLP_acts_0': 0, 'phi_MLP_norms_0': 'layer', 'phi_MLP_norms_1': 'layer', 'rho_len': 4, 'rho_MLP_width_0': 2, 'rho_MLP_width_1': 4, 'rho_MLP_width_2': 0, 'rho_MLP_acts_0': 0, 'rho_MLP_acts_1': 0, 'rho_MLP_acts_2': 0, 'rho_MLP_norms_0': 'layer', 'rho_MLP_norms_1': 'layer', 'rho_MLP_norms_2': 'layer', 'rho_MLP_norms_3': None}. 
Test Accuracy: 0.5404
Accuracy:  0.5403715134222326 , Inference time:  0.03642916679382324 , Validation Loss:  1.1583695955016986 , Param Count:  5446
Conv bp:  tensor(3543080.)
DeepSetsArchitecture(
  (phi): ConvPhi(
    (layers): Sequential(
      (0): Conv1d(3, 32, kernel_size=(1,), stride=(1,))
      (1): LeakyReLU(negative_slope=0.0078125)
      (2): Conv1d(32, 16, kernel_size=(1,), stride=(1,))
      (3): LeakyReLU(negative_slope=0.0078125)
      (4): Conv1d(16, 64, kernel_size=(1,), stride=(1,))
    )
  )
  (rho): Rho(
    (layers): Sequential(
      (0): Linear(in_features=64, out_features=128, bias=True)
      (1): LeakyReLU(negative_slope=0.0078125)
      (2): Linear(in_features=128, out_features=5, bias=True)
      (3): BatchNorm1d(5, eps=1e-05, momentum=0.1, affine=True, track_running_stats=True)
    )
  )
)
BOPs: tensor(5071656.)
Trial  50  begins evaluation...
[I 2024-09-16 09:09:10,027] Trial 50 finished with values: [0.6375523038657028, 5071656.0] and parameters: {'bottleneck_dim': 6, 'aggregator_type': 1, 'phi_len': 3, 'phi_MLP_width_0': 2, 'phi_MLP_width_1': 1, 'phi_MLP_acts_0': 1, 'phi_MLP_acts_1': 1, 'phi_MLP_norms_0': None, 'phi_MLP_norms_1': None, 'phi_MLP_norms_2': None, 'rho_len': 2, 'rho_MLP_width_0': 4, 'rho_MLP_acts_0': 1, 'rho_MLP_norms_0': 'layer', 'rho_MLP_norms_1': 'batch'}. 
Test Accuracy: 0.6376
Accuracy:  0.6375523038657028 , Inference time:  0.04010415077209473 , Validation Loss:  0.9458709744369092 , Param Count:  10719
Conv bp:  tensor(32480.6250)
DeepSetsArchitecture(
  (phi): ConvPhi(
    (layers): Sequential(
      (0): Conv1d(3, 2, kernel_size=(1,), stride=(1,))
    )
  )
  (rho): Rho(
    (layers): Sequential(
      (0): Linear(in_features=2, out_features=32, bias=True)
      (1): ReLU()
      (2): Linear(in_features=32, out_features=5, bias=True)
    )
  )
)
BOPs: tensor(70224.6250)
Trial  51  begins evaluation...
[I 2024-09-16 09:14:36,269] Trial 51 finished with values: [0.42250043673207943, 70224.625] and parameters: {'bottleneck_dim': 1, 'aggregator_type': 1, 'phi_len': 1, 'phi_MLP_norms_0': 'layer', 'rho_len': 2, 'rho_MLP_width_0': 2, 'rho_MLP_acts_0': 0, 'rho_MLP_norms_0': 'layer', 'rho_MLP_norms_1': 'layer'}. 
Test Accuracy: 0.4225
Accuracy:  0.42250043673207943 , Inference time:  0.01947474479675293 , Validation Loss:  1.3347055506544048 , Param Count:  269
Conv bp:  tensor(6255716.)
DeepSetsArchitecture(
  (phi): ConvPhi(
    (layers): Sequential(
      (0): Conv1d(3, 128, kernel_size=(1,), stride=(1,))
      (1): LeakyReLU(negative_slope=0.0078125)
      (2): Conv1d(128, 8, kernel_size=(1,), stride=(1,))
      (3): ReLU()
      (4): Conv1d(8, 64, kernel_size=(1,), stride=(1,))
      (5): ReLU()
      (6): Conv1d(64, 8, kernel_size=(1,), stride=(1,))
      (7): BatchNorm1d(8, eps=1e-05, momentum=0.1, affine=True, track_running_stats=True)
    )
  )
  (rho): Rho(
    (layers): Sequential(
      (0): Linear(in_features=8, out_features=8, bias=True)
      (1): ReLU()
      (2): Linear(in_features=8, out_features=128, bias=True)
      (3): ReLU()
      (4): Linear(in_features=128, out_features=5, bias=True)
      (5): BatchNorm1d(5, eps=1e-05, momentum=0.1, affine=True, track_running_stats=True)
    )
  )
)
BOPs: tensor(6548708.)
Trial  52  begins evaluation...
[I 2024-09-16 09:20:04,012] Trial 52 finished with values: [0.6460440392310188, 6548708.0] and parameters: {'bottleneck_dim': 3, 'aggregator_type': 0, 'phi_len': 4, 'phi_MLP_width_0': 4, 'phi_MLP_width_1': 0, 'phi_MLP_width_2': 3, 'phi_MLP_acts_0': 1, 'phi_MLP_acts_1': 0, 'phi_MLP_acts_2': 0, 'phi_MLP_norms_0': None, 'phi_MLP_norms_1': 'layer', 'phi_MLP_norms_2': 'layer', 'phi_MLP_norms_3': 'batch', 'rho_len': 3, 'rho_MLP_width_0': 0, 'rho_MLP_width_1': 4, 'rho_MLP_acts_0': 0, 'rho_MLP_acts_1': 0, 'rho_MLP_norms_0': 'layer', 'rho_MLP_norms_1': 'layer', 'rho_MLP_norms_2': 'batch'}. 
Test Accuracy: 0.6460
Accuracy:  0.6460440392310188 , Inference time:  0.05495095252990723 , Validation Loss:  0.935027710029057 , Param Count:  4535
Conv bp:  tensor(1275025.5000)
DeepSetsArchitecture(
  (phi): ConvPhi(
    (layers): Sequential(
      (0): Conv1d(3, 8, kernel_size=(1,), stride=(1,))
      (1): BatchNorm1d(8, eps=1e-05, momentum=0.1, affine=True, track_running_stats=True)
      (2): LeakyReLU(negative_slope=0.0078125)
      (3): Conv1d(8, 32, kernel_size=(1,), stride=(1,))
      (4): LeakyReLU(negative_slope=0.0078125)
      (5): Conv1d(32, 8, kernel_size=(1,), stride=(1,))
      (6): BatchNorm1d(8, eps=1e-05, momentum=0.1, affine=True, track_running_stats=True)
    )
  )
  (rho): Rho(
    (layers): Sequential(
      (0): Linear(in_features=8, out_features=128, bias=True)
      (1): ReLU()
      (2): Linear(in_features=128, out_features=64, bias=True)
      (3): ReLU()
      (4): Linear(in_features=64, out_features=5, bias=True)
      (5): BatchNorm1d(5, eps=1e-05, momentum=0.1, affine=True, track_running_stats=True)
    )
  )
)
BOPs: tensor(2926289.5000)
Trial  53  begins evaluation...
[I 2024-09-16 09:25:01,281] Trial 53 finished with values: [0.633336383525634, 2926289.5] and parameters: {'bottleneck_dim': 3, 'aggregator_type': 1, 'phi_len': 3, 'phi_MLP_width_0': 0, 'phi_MLP_width_1': 2, 'phi_MLP_acts_0': 1, 'phi_MLP_acts_1': 1, 'phi_MLP_norms_0': 'batch', 'phi_MLP_norms_1': None, 'phi_MLP_norms_2': 'batch', 'rho_len': 3, 'rho_MLP_width_0': 4, 'rho_MLP_width_1': 3, 'rho_MLP_acts_0': 0, 'rho_MLP_acts_1': 0, 'rho_MLP_norms_0': 'layer', 'rho_MLP_norms_1': 'layer', 'rho_MLP_norms_2': 'batch'}. 
Test Accuracy: 0.6333
Accuracy:  0.633336383525634 , Inference time:  0.05057954788208008 , Validation Loss:  0.9587806280778379 , Param Count:  10359
Conv bp:  tensor(64961.2500)
DeepSetsArchitecture(
  (phi): ConvPhi(
    (layers): Sequential(
      (0): Conv1d(3, 4, kernel_size=(1,), stride=(1,))
    )
  )
  (rho): Rho(
    (layers): Sequential(
      (0): Linear(in_features=4, out_features=128, bias=True)
      (1): BatchNorm1d(128, eps=1e-05, momentum=0.1, affine=True, track_running_stats=True)
      (2): LeakyReLU(negative_slope=0.0078125)
      (3): Linear(in_features=128, out_features=5, bias=True)
      (4): BatchNorm1d(5, eps=1e-05, momentum=0.1, affine=True, track_running_stats=True)
    )
  )
)
BOPs: tensor(260833.2500)
Trial  54  begins evaluation...
[I 2024-09-16 09:29:45,514] Trial 54 finished with values: [0.39827303657735147, 260833.25] and parameters: {'bottleneck_dim': 2, 'aggregator_type': 0, 'phi_len': 1, 'phi_MLP_norms_0': 'layer', 'rho_len': 2, 'rho_MLP_width_0': 4, 'rho_MLP_acts_0': 1, 'rho_MLP_norms_0': 'batch', 'rho_MLP_norms_1': 'batch'}. 
Test Accuracy: 0.3983
Accuracy:  0.39827303657735147 , Inference time:  0.027530193328857422 , Validation Loss:  1.3830940139536956 , Param Count:  1567
Conv bp:  tensor(4481104.)
DeepSetsArchitecture(
  (phi): ConvPhi(
    (layers): Sequential(
      (0): Conv1d(3, 64, kernel_size=(1,), stride=(1,))
      (1): BatchNorm1d(64, eps=1e-05, momentum=0.1, affine=True, track_running_stats=True)
      (2): ReLU()
      (3): Conv1d(64, 16, kernel_size=(1,), stride=(1,))
      (4): BatchNorm1d(16, eps=1e-05, momentum=0.1, affine=True, track_running_stats=True)
      (5): LeakyReLU(negative_slope=0.0078125)
      (6): Conv1d(16, 8, kernel_size=(1,), stride=(1,))
    )
  )
  (rho): Rho(
    (layers): Sequential(
      (0): Linear(in_features=8, out_features=32, bias=True)
      (1): LeakyReLU(negative_slope=0.0078125)
      (2): Linear(in_features=32, out_features=8, bias=True)
      (3): ReLU()
      (4): Linear(in_features=8, out_features=5, bias=True)
      (5): BatchNorm1d(5, eps=1e-05, momentum=0.1, affine=True, track_running_stats=True)
    )
  )
)
BOPs: tensor(4574784.)
Trial  55  begins evaluation...
[I 2024-09-16 09:34:34,347] Trial 55 finished with values: [0.6407333771451864, 4574784.0] and parameters: {'bottleneck_dim': 3, 'aggregator_type': 0, 'phi_len': 3, 'phi_MLP_width_0': 3, 'phi_MLP_width_1': 1, 'phi_MLP_acts_0': 0, 'phi_MLP_acts_1': 1, 'phi_MLP_norms_0': 'batch', 'phi_MLP_norms_1': 'batch', 'phi_MLP_norms_2': None, 'rho_len': 3, 'rho_MLP_width_0': 2, 'rho_MLP_width_1': 0, 'rho_MLP_acts_0': 1, 'rho_MLP_acts_1': 0, 'rho_MLP_norms_0': None, 'rho_MLP_norms_1': 'layer', 'rho_MLP_norms_2': 'batch'}. 
Test Accuracy: 0.6407
Accuracy:  0.6407333771451864 , Inference time:  0.051198482513427734 , Validation Loss:  0.9463292964461709 , Param Count:  2199
Conv bp:  tensor(1183116.5000)
DeepSetsArchitecture(
  (phi): ConvPhi(
    (layers): Sequential(
      (0): Conv1d(3, 16, kernel_size=(1,), stride=(1,))
      (1): BatchNorm1d(16, eps=1e-05, momentum=0.1, affine=True, track_running_stats=True)
      (2): ReLU()
      (3): Conv1d(16, 8, kernel_size=(1,), stride=(1,))
      (4): BatchNorm1d(8, eps=1e-05, momentum=0.1, affine=True, track_running_stats=True)
      (5): ReLU()
      (6): Conv1d(8, 32, kernel_size=(1,), stride=(1,))
      (7): LeakyReLU(negative_slope=0.0078125)
      (8): Conv1d(32, 16, kernel_size=(1,), stride=(1,))
      (9): BatchNorm1d(16, eps=1e-05, momentum=0.1, affine=True, track_running_stats=True)
    )
  )
  (rho): Rho(
    (layers): Sequential(
      (0): Linear(in_features=16, out_features=8, bias=True)
      (1): ReLU()
      (2): Linear(in_features=8, out_features=8, bias=True)
      (3): BatchNorm1d(8, eps=1e-05, momentum=0.1, affine=True, track_running_stats=True)
      (4): ReLU()
      (5): Linear(in_features=8, out_features=5, bias=True)
    )
  )
)
BOPs: tensor(1223932.5000)
Trial  56  begins evaluation...
[I 2024-09-16 09:39:28,620] Trial 56 finished with values: [0.6352330485562885, 1223932.5] and parameters: {'bottleneck_dim': 4, 'aggregator_type': 0, 'phi_len': 4, 'phi_MLP_width_0': 1, 'phi_MLP_width_1': 0, 'phi_MLP_width_2': 2, 'phi_MLP_acts_0': 0, 'phi_MLP_acts_1': 0, 'phi_MLP_acts_2': 1, 'phi_MLP_norms_0': 'batch', 'phi_MLP_norms_1': 'batch', 'phi_MLP_norms_2': None, 'phi_MLP_norms_3': 'batch', 'rho_len': 3, 'rho_MLP_width_0': 0, 'rho_MLP_width_1': 0, 'rho_MLP_acts_0': 0, 'rho_MLP_acts_1': 0, 'rho_MLP_norms_0': None, 'rho_MLP_norms_1': 'batch', 'rho_MLP_norms_2': None}. 
Test Accuracy: 0.6352
Accuracy:  0.6352330485562885 , Inference time:  0.060733795166015625 , Validation Loss:  0.9619054198265076 , Param Count:  1365
Conv bp:  tensor(1039380.)
DeepSetsArchitecture(
  (phi): ConvPhi(
    (layers): Sequential(
      (0): Conv1d(3, 64, kernel_size=(1,), stride=(1,))
    )
  )
  (rho): Rho(
    (layers): Sequential(
      (0): Linear(in_features=64, out_features=16, bias=True)
      (1): LeakyReLU(negative_slope=0.0078125)
      (2): Linear(in_features=16, out_features=8, bias=True)
      (3): BatchNorm1d(8, eps=1e-05, momentum=0.1, affine=True, track_running_stats=True)
      (4): ReLU()
      (5): Linear(in_features=8, out_features=64, bias=True)
      (6): LeakyReLU(negative_slope=0.0078125)
      (7): Linear(in_features=64, out_features=5, bias=True)
    )
  )
)
BOPs: tensor(1385236.)
Trial  57  begins evaluation...
