[I 2024-09-16 20:11:35,620] Trial 182 finished with values: [0.6308707189857833, 5190784.0] and parameters: {'bottleneck_dim': 3, 'aggregator_type': 1, 'phi_len': 4, 'phi_MLP_width_0': 3, 'phi_MLP_width_1': 1, 'phi_MLP_width_2': 2, 'phi_MLP_acts_0': 1, 'phi_MLP_acts_1': 1, 'phi_MLP_acts_2': 0, 'phi_MLP_norms_0': 'batch', 'phi_MLP_norms_1': None, 'phi_MLP_norms_2': None, 'phi_MLP_norms_3': 'layer', 'rho_len': 4, 'rho_MLP_width_0': 1, 'rho_MLP_width_1': 1, 'rho_MLP_width_2': 0, 'rho_MLP_acts_0': 1, 'rho_MLP_acts_1': 0, 'rho_MLP_acts_2': 1, 'rho_MLP_norms_0': None, 'rho_MLP_norms_1': 'batch', 'rho_MLP_norms_2': None, 'rho_MLP_norms_3': 'batch'}. 
Test Accuracy: 0.6309
Accuracy:  0.6308707189857833 , Inference time:  0.06331753730773926 , Validation Loss:  0.9687258885020301 , Param Count:  2871
Conv bp:  tensor(228516.3750)
DeepSetsArchitecture(
  (phi): ConvPhi(
    (layers): Sequential(
      (0): Conv1d(3, 8, kernel_size=(1,), stride=(1,))
      (1): ReLU()
      (2): Conv1d(8, 4, kernel_size=(1,), stride=(1,))
    )
  )
  (rho): Rho(
    (layers): Sequential(
      (0): Linear(in_features=4, out_features=64, bias=True)
      (1): BatchNorm1d(64, eps=1e-05, momentum=0.1, affine=True, track_running_stats=True)
      (2): LeakyReLU(negative_slope=0.0078125)
      (3): Linear(in_features=64, out_features=5, bias=True)
    )
  )
)
BOPs: tensor(326084.3750)
Trial  183  begins evaluation...
[I 2024-09-16 20:17:01,246] Trial 183 finished with values: [0.5857434011862476, 326084.375] and parameters: {'bottleneck_dim': 2, 'aggregator_type': 0, 'phi_len': 2, 'phi_MLP_width_0': 0, 'phi_MLP_acts_0': 0, 'phi_MLP_norms_0': None, 'phi_MLP_norms_1': None, 'rho_len': 2, 'rho_MLP_width_0': 3, 'rho_MLP_acts_0': 1, 'rho_MLP_norms_0': 'batch', 'rho_MLP_norms_1': None}. 
Test Accuracy: 0.5857
Accuracy:  0.5857434011862476 , Inference time:  0.031226634979248047 , Validation Loss:  1.0491613688923063 , Param Count:  841
Conv bp:  tensor(228516.3750)
DeepSetsArchitecture(
  (phi): ConvPhi(
    (layers): Sequential(
      (0): Conv1d(3, 8, kernel_size=(1,), stride=(1,))
      (1): LeakyReLU(negative_slope=0.0078125)
      (2): Conv1d(8, 4, kernel_size=(1,), stride=(1,))
    )
  )
  (rho): Rho(
    (layers): Sequential(
      (0): Linear(in_features=4, out_features=16, bias=True)
      (1): LeakyReLU(negative_slope=0.0078125)
      (2): Linear(in_features=16, out_features=5, bias=True)
    )
  )
)
BOPs: tensor(252996.3750)
Trial  184  begins evaluation...
[I 2024-09-16 20:22:26,218] Trial 184 finished with values: [0.5667700959146833, 252996.375] and parameters: {'bottleneck_dim': 2, 'aggregator_type': 0, 'phi_len': 2, 'phi_MLP_width_0': 0, 'phi_MLP_acts_0': 1, 'phi_MLP_norms_0': None, 'phi_MLP_norms_1': 'layer', 'rho_len': 2, 'rho_MLP_width_0': 1, 'rho_MLP_acts_0': 1, 'rho_MLP_norms_0': None, 'rho_MLP_norms_1': None}. 
Test Accuracy: 0.5668
Accuracy:  0.5667700959146833 , Inference time:  0.025330305099487305 , Validation Loss:  1.0778476376922763 , Param Count:  233
Conv bp:  tensor(5773412.)
DeepSetsArchitecture(
  (phi): ConvPhi(
    (layers): Sequential(
      (0): Conv1d(3, 128, kernel_size=(1,), stride=(1,))
      (1): BatchNorm1d(128, eps=1e-05, momentum=0.1, affine=True, track_running_stats=True)
      (2): ReLU()
      (3): Conv1d(128, 8, kernel_size=(1,), stride=(1,))
      (4): BatchNorm1d(8, eps=1e-05, momentum=0.1, affine=True, track_running_stats=True)
      (5): ReLU()
      (6): Conv1d(8, 32, kernel_size=(1,), stride=(1,))
      (7): LeakyReLU(negative_slope=0.0078125)
      (8): Conv1d(32, 4, kernel_size=(1,), stride=(1,))
    )
  )
  (rho): Rho(
    (layers): Sequential(
      (0): Linear(in_features=4, out_features=16, bias=True)
      (1): ReLU()
      (2): Linear(in_features=16, out_features=16, bias=True)
      (3): BatchNorm1d(16, eps=1e-05, momentum=0.1, affine=True, track_running_stats=True)
      (4): ReLU()
      (5): Linear(in_features=16, out_features=5, bias=True)
    )
  )
)
BOPs: tensor(5840900.)
Trial  185  begins evaluation...
[I 2024-09-16 20:27:31,177] Trial 185 finished with values: [0.627511625392019, 5840900.0] and parameters: {'bottleneck_dim': 2, 'aggregator_type': 0, 'phi_len': 4, 'phi_MLP_width_0': 4, 'phi_MLP_width_1': 0, 'phi_MLP_width_2': 2, 'phi_MLP_acts_0': 0, 'phi_MLP_acts_1': 0, 'phi_MLP_acts_2': 1, 'phi_MLP_norms_0': 'batch', 'phi_MLP_norms_1': 'batch', 'phi_MLP_norms_2': 'layer', 'phi_MLP_norms_3': 'layer', 'rho_len': 3, 'rho_MLP_width_0': 1, 'rho_MLP_width_1': 1, 'rho_MLP_acts_0': 0, 'rho_MLP_acts_1': 0, 'rho_MLP_norms_0': None, 'rho_MLP_norms_1': 'batch', 'rho_MLP_norms_2': 'layer'}. 
Test Accuracy: 0.6275
Accuracy:  0.627511625392019 , Inference time:  0.058039188385009766 , Validation Loss:  0.9778708178980821 , Param Count:  2705
Conv bp:  tensor(64961.2500)
DeepSetsArchitecture(
  (phi): ConvPhi(
    (layers): Sequential(
      (0): Conv1d(3, 4, kernel_size=(1,), stride=(1,))
    )
  )
  (rho): Rho(
    (layers): Sequential(
      (0): Linear(in_features=4, out_features=128, bias=True)
      (1): BatchNorm1d(128, eps=1e-05, momentum=0.1, affine=True, track_running_stats=True)
      (2): ReLU()
      (3): Linear(in_features=128, out_features=5, bias=True)
    )
  )
)
BOPs: tensor(260833.2500)
Trial  186  begins evaluation...
[I 2024-09-16 20:32:22,842] Trial 186 finished with values: [0.39937776077064496, 260833.25] and parameters: {'bottleneck_dim': 2, 'aggregator_type': 0, 'phi_len': 1, 'phi_MLP_norms_0': None, 'rho_len': 2, 'rho_MLP_width_0': 4, 'rho_MLP_acts_0': 0, 'rho_MLP_norms_0': 'batch', 'rho_MLP_norms_1': 'layer'}. 
Test Accuracy: 0.3994
Accuracy:  0.39937776077064496 , Inference time:  0.024472713470458984 , Validation Loss:  1.3800579455434059 , Param Count:  1557
Conv bp:  tensor(459336.7500)
DeepSetsArchitecture(
  (phi): ConvPhi(
    (layers): Sequential(
      (0): Conv1d(3, 16, kernel_size=(1,), stride=(1,))
      (1): LeakyReLU(negative_slope=0.0078125)
      (2): Conv1d(16, 4, kernel_size=(1,), stride=(1,))
    )
  )
  (rho): Rho(
    (layers): Sequential(
      (0): Linear(in_features=4, out_features=128, bias=True)
      (1): BatchNorm1d(128, eps=1e-05, momentum=0.1, affine=True, track_running_stats=True)
      (2): LeakyReLU(negative_slope=0.0078125)
      (3): Linear(in_features=128, out_features=64, bias=True)
      (4): LeakyReLU(negative_slope=0.0078125)
      (5): Linear(in_features=64, out_features=128, bias=True)
      (6): ReLU()
      (7): Linear(in_features=128, out_features=5, bias=True)
    )
  )
)
BOPs: tensor(3489640.7500)
Trial  187  begins evaluation...
[I 2024-09-16 20:37:20,162] Trial 187 finished with values: [0.6114215837153006, 3489640.75] and parameters: {'bottleneck_dim': 2, 'aggregator_type': 0, 'phi_len': 2, 'phi_MLP_width_0': 1, 'phi_MLP_acts_0': 1, 'phi_MLP_norms_0': None, 'phi_MLP_norms_1': 'layer', 'rho_len': 4, 'rho_MLP_width_0': 4, 'rho_MLP_width_1': 3, 'rho_MLP_width_2': 4, 'rho_MLP_acts_0': 1, 'rho_MLP_acts_1': 1, 'rho_MLP_acts_2': 0, 'rho_MLP_norms_0': 'batch', 'rho_MLP_norms_1': None, 'rho_MLP_norms_2': None, 'rho_MLP_norms_3': 'layer'}. 
Test Accuracy: 0.6114
Accuracy:  0.6114215837153006 , Inference time:  0.03805685043334961 , Validation Loss:  1.0016798648704477 , Param Count:  18249
Conv bp:  tensor(7337602.)
DeepSetsArchitecture(
  (phi): ConvPhi(
    (layers): Sequential(
      (0): Conv1d(3, 32, kernel_size=(1,), stride=(1,))
      (1): ReLU()
      (2): Conv1d(32, 64, kernel_size=(1,), stride=(1,))
      (3): LeakyReLU(negative_slope=0.0078125)
      (4): Conv1d(64, 4, kernel_size=(1,), stride=(1,))
      (5): BatchNorm1d(4, eps=1e-05, momentum=0.1, affine=True, track_running_stats=True)
    )
  )
  (rho): Rho(
    (layers): Sequential(
      (0): Linear(in_features=4, out_features=64, bias=True)
      (1): ReLU()
      (2): Linear(in_features=64, out_features=5, bias=True)
    )
  )
)
BOPs: tensor(7435170.)
Trial  188  begins evaluation...
[I 2024-09-16 20:42:14,989] Trial 188 finished with values: [0.6334495179309714, 7435170.0] and parameters: {'bottleneck_dim': 2, 'aggregator_type': 0, 'phi_len': 3, 'phi_MLP_width_0': 2, 'phi_MLP_width_1': 3, 'phi_MLP_acts_0': 0, 'phi_MLP_acts_1': 1, 'phi_MLP_norms_0': None, 'phi_MLP_norms_1': None, 'phi_MLP_norms_2': 'batch', 'rho_len': 2, 'rho_MLP_width_0': 3, 'rho_MLP_acts_0': 0, 'rho_MLP_norms_0': None, 'rho_MLP_norms_1': None}. 
Test Accuracy: 0.6334
Accuracy:  0.6334495179309714 , Inference time:  0.040261030197143555 , Validation Loss:  0.9674099245849921 , Param Count:  3153
Conv bp:  tensor(8683680.)
DeepSetsArchitecture(
  (phi): ConvPhi(
    (layers): Sequential(
      (0): Conv1d(3, 128, kernel_size=(1,), stride=(1,))
      (1): LeakyReLU(negative_slope=0.0078125)
      (2): Conv1d(128, 16, kernel_size=(1,), stride=(1,))
    )
  )
  (rho): Rho(
    (layers): Sequential(
      (0): Linear(in_features=16, out_features=5, bias=True)
      (1): BatchNorm1d(5, eps=1e-05, momentum=0.1, affine=True, track_running_stats=True)
    )
  )
)
BOPs: tensor(8699168.)
Trial  189  begins evaluation...
[I 2024-09-16 20:47:21,795] Trial 189 finished with values: [0.5505203350774888, 8699168.0] and parameters: {'bottleneck_dim': 4, 'aggregator_type': 0, 'phi_len': 2, 'phi_MLP_width_0': 4, 'phi_MLP_acts_0': 1, 'phi_MLP_norms_0': None, 'phi_MLP_norms_1': None, 'rho_len': 1, 'rho_MLP_norms_0': 'batch'}. 
Test Accuracy: 0.5505
Accuracy:  0.5505203350774888 , Inference time:  0.028272390365600586 , Validation Loss:  1.1586975426900954 , Param Count:  2671
Conv bp:  tensor(8683680.)
DeepSetsArchitecture(
  (phi): ConvPhi(
    (layers): Sequential(
      (0): Conv1d(3, 128, kernel_size=(1,), stride=(1,))
      (1): LeakyReLU(negative_slope=0.0078125)
      (2): Conv1d(128, 16, kernel_size=(1,), stride=(1,))
    )
  )
  (rho): Rho(
    (layers): Sequential(
      (0): Linear(in_features=16, out_features=32, bias=True)
      (1): BatchNorm1d(32, eps=1e-05, momentum=0.1, affine=True, track_running_stats=True)
      (2): ReLU()
      (3): Linear(in_features=32, out_features=64, bias=True)
      (4): LeakyReLU(negative_slope=0.0078125)
      (5): Linear(in_features=64, out_features=16, bias=True)
      (6): ReLU()
      (7): Linear(in_features=16, out_features=5, bias=True)
    )
  )
)
BOPs: tensor(9309472.)
Trial  190  begins evaluation...
[I 2024-09-16 20:52:12,230] Trial 190 finished with values: [0.6585137799369442, 9309472.0] and parameters: {'bottleneck_dim': 4, 'aggregator_type': 0, 'phi_len': 2, 'phi_MLP_width_0': 4, 'phi_MLP_acts_0': 1, 'phi_MLP_norms_0': None, 'phi_MLP_norms_1': None, 'rho_len': 4, 'rho_MLP_width_0': 2, 'rho_MLP_width_1': 3, 'rho_MLP_width_2': 1, 'rho_MLP_acts_0': 0, 'rho_MLP_acts_1': 1, 'rho_MLP_acts_2': 0, 'rho_MLP_norms_0': 'batch', 'rho_MLP_norms_1': 'layer', 'rho_MLP_norms_2': None, 'rho_MLP_norms_3': None}. 
Test Accuracy: 0.6585
Accuracy:  0.6585137799369442 , Inference time:  0.03968071937561035 , Validation Loss:  0.9015494475559312 , Param Count:  6421
Conv bp:  tensor(64961.2500)
DeepSetsArchitecture(
  (phi): ConvPhi(
    (layers): Sequential(
      (0): Conv1d(3, 4, kernel_size=(1,), stride=(1,))
    )
  )
  (rho): Rho(
    (layers): Sequential(
      (0): Linear(in_features=4, out_features=5, bias=True)
      (1): BatchNorm1d(5, eps=1e-05, momentum=0.1, affine=True, track_running_stats=True)
    )
  )
)
BOPs: tensor(68625.2500)
Trial  191  begins evaluation...
[I 2024-09-16 20:57:20,390] Trial 191 finished with values: [0.4247897446989044, 68625.25] and parameters: {'bottleneck_dim': 2, 'aggregator_type': 1, 'phi_len': 1, 'phi_MLP_norms_0': None, 'rho_len': 1, 'rho_MLP_norms_0': 'batch'}. 
Test Accuracy: 0.4248
Accuracy:  0.4247897446989044 , Inference time:  0.01929926872253418 , Validation Loss:  1.383935267422475 , Param Count:  51
Conv bp:  tensor(4304976.)
DeepSetsArchitecture(
  (phi): ConvPhi(
    (layers): Sequential(
      (0): Conv1d(3, 64, kernel_size=(1,), stride=(1,))
      (1): BatchNorm1d(64, eps=1e-05, momentum=0.1, affine=True, track_running_stats=True)
      (2): LeakyReLU(negative_slope=0.0078125)
      (3): Conv1d(64, 16, kernel_size=(1,), stride=(1,))
    )
  )
  (rho): Rho(
    (layers): Sequential(
      (0): Linear(in_features=16, out_features=5, bias=True)
      (1): BatchNorm1d(5, eps=1e-05, momentum=0.1, affine=True, track_running_stats=True)
    )
  )
)
BOPs: tensor(4320208.)
Trial  192  begins evaluation...
[I 2024-09-16 21:02:25,421] Trial 192 finished with values: [0.5975476453901889, 4320208.0] and parameters: {'bottleneck_dim': 4, 'aggregator_type': 1, 'phi_len': 2, 'phi_MLP_width_0': 3, 'phi_MLP_acts_0': 1, 'phi_MLP_norms_0': 'batch', 'phi_MLP_norms_1': None, 'rho_len': 1, 'rho_MLP_norms_0': 'batch'}. 
Test Accuracy: 0.5975
Accuracy:  0.5975476453901889 , Inference time:  0.030843734741210938 , Validation Loss:  1.0544247473178268 , Param Count:  1519
Conv bp:  tensor(64961.2500)
DeepSetsArchitecture(
  (phi): ConvPhi(
    (layers): Sequential(
      (0): Conv1d(3, 4, kernel_size=(1,), stride=(1,))
      (1): BatchNorm1d(4, eps=1e-05, momentum=0.1, affine=True, track_running_stats=True)
    )
  )
  (rho): Rho(
    (layers): Sequential(
      (0): Linear(in_features=4, out_features=32, bias=True)
      (1): ReLU()
      (2): Linear(in_features=32, out_features=8, bias=True)
      (3): BatchNorm1d(8, eps=1e-05, momentum=0.1, affine=True, track_running_stats=True)
      (4): LeakyReLU(negative_slope=0.0078125)
      (5): Linear(in_features=8, out_features=5, bias=True)
    )
  )
)
BOPs: tensor(136497.2500)
Trial  193  begins evaluation...
[I 2024-09-16 21:07:19,274] Trial 193 finished with values: [0.5689728893362505, 136497.25] and parameters: {'bottleneck_dim': 2, 'aggregator_type': 1, 'phi_len': 1, 'phi_MLP_norms_0': 'batch', 'rho_len': 3, 'rho_MLP_width_0': 2, 'rho_MLP_width_1': 0, 'rho_MLP_acts_0': 0, 'rho_MLP_acts_1': 1, 'rho_MLP_norms_0': None, 'rho_MLP_norms_1': 'batch', 'rho_MLP_norms_2': 'layer'}. 
Test Accuracy: 0.5690
Accuracy:  0.5689728893362505 , Inference time:  0.029916048049926758 , Validation Loss:  1.1071230363683635 , Param Count:  509
Conv bp:  tensor(64961.2500)
DeepSetsArchitecture(
  (phi): ConvPhi(
    (layers): Sequential(
      (0): Conv1d(3, 4, kernel_size=(1,), stride=(1,))
      (1): BatchNorm1d(4, eps=1e-05, momentum=0.1, affine=True, track_running_stats=True)
    )
  )
  (rho): Rho(
    (layers): Sequential(
      (0): Linear(in_features=4, out_features=32, bias=True)
      (1): LeakyReLU(negative_slope=0.0078125)
      (2): Linear(in_features=32, out_features=5, bias=True)
      (3): BatchNorm1d(5, eps=1e-05, momentum=0.1, affine=True, track_running_stats=True)
    )
  )
)
BOPs: tensor(113537.2500)
Trial  194  begins evaluation...
[I 2024-09-16 21:12:00,529] Trial 194 finished with values: [0.5517298749698447, 113537.25] and parameters: {'bottleneck_dim': 2, 'aggregator_type': 1, 'phi_len': 1, 'phi_MLP_norms_0': 'batch', 'rho_len': 2, 'rho_MLP_width_0': 2, 'rho_MLP_acts_0': 1, 'rho_MLP_norms_0': None, 'rho_MLP_norms_1': 'batch'}. 
Test Accuracy: 0.5517
Accuracy:  0.5517298749698447 , Inference time:  0.02637171745300293 , Validation Loss:  1.1341927075872615 , Param Count:  359
Conv bp:  tensor(16001304.)
DeepSetsArchitecture(
  (phi): ConvPhi(
    (layers): Sequential(
      (0): Conv1d(3, 128, kernel_size=(1,), stride=(1,))
      (1): LeakyReLU(negative_slope=0.0078125)
      (2): Conv1d(128, 32, kernel_size=(1,), stride=(1,))
      (3): BatchNorm1d(32, eps=1e-05, momentum=0.1, affine=True, track_running_stats=True)
      (4): ReLU()
      (5): Conv1d(32, 16, kernel_size=(1,), stride=(1,))
      (6): BatchNorm1d(16, eps=1e-05, momentum=0.1, affine=True, track_running_stats=True)
    )
  )
  (rho): Rho(
    (layers): Sequential(
      (0): Linear(in_features=16, out_features=64, bias=True)
      (1): BatchNorm1d(64, eps=1e-05, momentum=0.1, affine=True, track_running_stats=True)
      (2): ReLU()
      (3): Linear(in_features=64, out_features=32, bias=True)
      (4): BatchNorm1d(32, eps=1e-05, momentum=0.1, affine=True, track_running_stats=True)
      (5): LeakyReLU(negative_slope=0.0078125)
      (6): Linear(in_features=32, out_features=8, bias=True)
      (7): BatchNorm1d(8, eps=1e-05, momentum=0.1, affine=True, track_running_stats=True)
      (8): LeakyReLU(negative_slope=0.0078125)
      (9): Linear(in_features=8, out_features=5, bias=True)
    )
  )
)
BOPs: tensor(16577800.)
Trial  195  begins evaluation...
[I 2024-09-16 21:17:02,775] Trial 195 finished with values: [0.6637961584214424, 16577800.0] and parameters: {'bottleneck_dim': 4, 'aggregator_type': 0, 'phi_len': 3, 'phi_MLP_width_0': 4, 'phi_MLP_width_1': 2, 'phi_MLP_acts_0': 1, 'phi_MLP_acts_1': 0, 'phi_MLP_norms_0': None, 'phi_MLP_norms_1': 'batch', 'phi_MLP_norms_2': 'batch', 'rho_len': 4, 'rho_MLP_width_0': 3, 'rho_MLP_width_1': 2, 'rho_MLP_width_2': 0, 'rho_MLP_acts_0': 0, 'rho_MLP_acts_1': 1, 'rho_MLP_acts_2': 1, 'rho_MLP_norms_0': 'batch', 'rho_MLP_norms_1': 'batch', 'rho_MLP_norms_2': 'batch', 'rho_MLP_norms_3': None}. 
Test Accuracy: 0.6638
Accuracy:  0.6637961584214424 , Inference time:  0.06386256217956543 , Validation Loss:  0.8866685211253004 , Param Count:  8949
Conv bp:  tensor(923281.5000)
DeepSetsArchitecture(
  (phi): ConvPhi(
    (layers): Sequential(
      (0): Conv1d(3, 32, kernel_size=(1,), stride=(1,))
      (1): BatchNorm1d(32, eps=1e-05, momentum=0.1, affine=True, track_running_stats=True)
      (2): LeakyReLU(negative_slope=0.0078125)
      (3): Conv1d(32, 4, kernel_size=(1,), stride=(1,))
    )
  )
  (rho): Rho(
    (layers): Sequential(
      (0): Linear(in_features=4, out_features=64, bias=True)
      (1): ReLU()
      (2): Linear(in_features=64, out_features=5, bias=True)
    )
  )
)
BOPs: tensor(1020849.5000)
Trial  196  begins evaluation...
[I 2024-09-16 21:22:21,558] Trial 196 finished with values: [0.619271114956202, 1020849.5] and parameters: {'bottleneck_dim': 2, 'aggregator_type': 0, 'phi_len': 2, 'phi_MLP_width_0': 2, 'phi_MLP_acts_0': 1, 'phi_MLP_norms_0': 'batch', 'phi_MLP_norms_1': 'layer', 'rho_len': 2, 'rho_MLP_width_0': 3, 'rho_MLP_acts_0': 0, 'rho_MLP_norms_0': None, 'rho_MLP_norms_1': None}. 
Test Accuracy: 0.6193
Accuracy:  0.619271114956202 , Inference time:  0.029642343521118164 , Validation Loss:  0.9921841674110516 , Param Count:  969
Conv bp:  tensor(519690.)
DeepSetsArchitecture(
  (phi): ConvPhi(
    (layers): Sequential(
      (0): Conv1d(3, 32, kernel_size=(1,), stride=(1,))
      (1): BatchNorm1d(32, eps=1e-05, momentum=0.1, affine=True, track_running_stats=True)
    )
  )
  (rho): Rho(
    (layers): Sequential(
      (0): Linear(in_features=32, out_features=16, bias=True)
      (1): BatchNorm1d(16, eps=1e-05, momentum=0.1, affine=True, track_running_stats=True)
      (2): ReLU()
      (3): Linear(in_features=16, out_features=128, bias=True)
      (4): ReLU()
      (5): Linear(in_features=128, out_features=128, bias=True)
      (6): LeakyReLU(negative_slope=0.0078125)
      (7): Linear(in_features=128, out_features=5, bias=True)
    )
  )
)
BOPs: tensor(3917194.)
Trial  197  begins evaluation...
[I 2024-09-16 21:27:18,944] Trial 197 finished with values: [0.40055069835539175, 3917194.0] and parameters: {'bottleneck_dim': 5, 'aggregator_type': 0, 'phi_len': 1, 'phi_MLP_norms_0': 'batch', 'rho_len': 4, 'rho_MLP_width_0': 1, 'rho_MLP_width_1': 4, 'rho_MLP_width_2': 4, 'rho_MLP_acts_0': 0, 'rho_MLP_acts_1': 0, 'rho_MLP_acts_2': 1, 'rho_MLP_norms_0': 'batch', 'rho_MLP_norms_1': 'layer', 'rho_MLP_norms_2': 'layer', 'rho_MLP_norms_3': 'layer'}. 
Test Accuracy: 0.4006
Accuracy:  0.40055069835539175 , Inference time:  0.03415489196777344 , Validation Loss:  1.3772080731229717 , Param Count:  20085
Conv bp:  tensor(64961.2500)
DeepSetsArchitecture(
  (phi): ConvPhi(
    (layers): Sequential(
      (0): Conv1d(3, 4, kernel_size=(1,), stride=(1,))
    )
  )
  (rho): Rho(
    (layers): Sequential(
      (0): Linear(in_features=4, out_features=16, bias=True)
      (1): LeakyReLU(negative_slope=0.0078125)
      (2): Linear(in_features=16, out_features=8, bias=True)
      (3): LeakyReLU(negative_slope=0.0078125)
      (4): Linear(in_features=8, out_features=5, bias=True)
      (5): BatchNorm1d(5, eps=1e-05, momentum=0.1, affine=True, track_running_stats=True)
    )
  )
)
BOPs: tensor(103985.2500)
Trial  198  begins evaluation...
[I 2024-09-16 21:32:51,032] Trial 198 finished with values: [0.5384698571678133, 103985.25] and parameters: {'bottleneck_dim': 2, 'aggregator_type': 1, 'phi_len': 1, 'phi_MLP_norms_0': 'layer', 'rho_len': 3, 'rho_MLP_width_0': 1, 'rho_MLP_width_1': 0, 'rho_MLP_acts_0': 1, 'rho_MLP_acts_1': 1, 'rho_MLP_norms_0': None, 'rho_MLP_norms_1': None, 'rho_MLP_norms_2': 'batch'}. 
Test Accuracy: 0.5385
Accuracy:  0.5384698571678133 , Inference time:  0.025908231735229492 , Validation Loss:  1.17506954134727 , Param Count:  287
Conv bp:  tensor(1039380.)
DeepSetsArchitecture(
  (phi): ConvPhi(
    (layers): Sequential(
      (0): Conv1d(3, 64, kernel_size=(1,), stride=(1,))
      (1): BatchNorm1d(64, eps=1e-05, momentum=0.1, affine=True, track_running_stats=True)
    )
  )
  (rho): Rho(
    (layers): Sequential(
      (0): Linear(in_features=64, out_features=16, bias=True)
      (1): BatchNorm1d(16, eps=1e-05, momentum=0.1, affine=True, track_running_stats=True)
      (2): LeakyReLU(negative_slope=0.0078125)
      (3): Linear(in_features=16, out_features=8, bias=True)
      (4): ReLU()
      (5): Linear(in_features=8, out_features=5, bias=True)
      (6): BatchNorm1d(5, eps=1e-05, momentum=0.1, affine=True, track_running_stats=True)
    )
  )
)
BOPs: tensor(1251844.)
Trial  199  begins evaluation...
