[I 2024-09-17 16:20:53,273] Trial 414 finished with values: [0.652199881874371, 4041910.0] and parameters: {'bottleneck_dim': 5, 'aggregator_type': 0, 'phi_len': 2, 'phi_MLP_width_0': 2, 'phi_MLP_acts_0': 1, 'phi_MLP_norms_0': None, 'phi_MLP_norms_1': 'batch', 'rho_len': 4, 'rho_MLP_width_0': 2, 'rho_MLP_width_1': 1, 'rho_MLP_width_2': 0, 'rho_MLP_acts_0': 0, 'rho_MLP_acts_1': 0, 'rho_MLP_acts_2': 0, 'rho_MLP_norms_0': 'layer', 'rho_MLP_norms_1': 'batch', 'rho_MLP_norms_2': 'layer', 'rho_MLP_norms_3': 'layer'}. 
Test Accuracy: 0.6522
Accuracy:  0.652199881874371 , Inference time:  0.04170393943786621 , Validation Loss:  0.9163760855084374 , Param Count:  3045
Conv bp:  tensor(1855779.)
DeepSetsArchitecture(
  (phi): ConvPhi(
    (layers): Sequential(
      (0): Conv1d(3, 16, kernel_size=(1,), stride=(1,))
      (1): LeakyReLU(negative_slope=0.0078125)
      (2): Conv1d(16, 32, kernel_size=(1,), stride=(1,))
      (3): BatchNorm1d(32, eps=1e-05, momentum=0.1, affine=True, track_running_stats=True)
    )
  )
  (rho): Rho(
    (layers): Sequential(
      (0): Linear(in_features=32, out_features=16, bias=True)
      (1): BatchNorm1d(16, eps=1e-05, momentum=0.1, affine=True, track_running_stats=True)
      (2): LeakyReLU(negative_slope=0.0078125)
      (3): Linear(in_features=16, out_features=16, bias=True)
      (4): BatchNorm1d(16, eps=1e-05, momentum=0.1, affine=True, track_running_stats=True)
      (5): LeakyReLU(negative_slope=0.0078125)
      (6): Linear(in_features=16, out_features=32, bias=True)
      (7): LeakyReLU(negative_slope=0.0078125)
      (8): Linear(in_features=32, out_features=5, bias=True)
      (9): BatchNorm1d(5, eps=1e-05, momentum=0.1, affine=True, track_running_stats=True)
    )
  )
)
BOPs: tensor(2103267.)
Trial  415  begins evaluation...
[I 2024-09-17 16:26:34,382] Trial 415 finished with values: [0.6400312783355933, 2103267.0] and parameters: {'bottleneck_dim': 5, 'aggregator_type': 0, 'phi_len': 2, 'phi_MLP_width_0': 1, 'phi_MLP_acts_0': 1, 'phi_MLP_norms_0': None, 'phi_MLP_norms_1': 'batch', 'rho_len': 4, 'rho_MLP_width_0': 1, 'rho_MLP_width_1': 1, 'rho_MLP_width_2': 2, 'rho_MLP_acts_0': 1, 'rho_MLP_acts_1': 1, 'rho_MLP_acts_2': 1, 'rho_MLP_norms_0': 'batch', 'rho_MLP_norms_1': 'batch', 'rho_MLP_norms_2': 'layer', 'rho_MLP_norms_3': 'batch'}. 
Test Accuracy: 0.6400
Accuracy:  0.6400312783355933 , Inference time:  0.047734975814819336 , Validation Loss:  0.9442898164801046 , Param Count:  2255
Conv bp:  tensor(1039380.)
DeepSetsArchitecture(
  (phi): ConvPhi(
    (layers): Sequential(
      (0): Conv1d(3, 64, kernel_size=(1,), stride=(1,))
      (1): BatchNorm1d(64, eps=1e-05, momentum=0.1, affine=True, track_running_stats=True)
    )
  )
  (rho): Rho(
    (layers): Sequential(
      (0): Linear(in_features=64, out_features=8, bias=True)
      (1): BatchNorm1d(8, eps=1e-05, momentum=0.1, affine=True, track_running_stats=True)
      (2): ReLU()
      (3): Linear(in_features=8, out_features=8, bias=True)
      (4): ReLU()
      (5): Linear(in_features=8, out_features=5, bias=True)
      (6): BatchNorm1d(5, eps=1e-05, momentum=0.1, affine=True, track_running_stats=True)
    )
  )
)
BOPs: tensor(1152900.)
Trial  416  begins evaluation...
[I 2024-09-17 16:32:19,425] Trial 416 finished with values: [0.5844922677625176, 1152900.0] and parameters: {'bottleneck_dim': 6, 'aggregator_type': 1, 'phi_len': 1, 'phi_MLP_norms_0': 'batch', 'rho_len': 3, 'rho_MLP_width_0': 0, 'rho_MLP_width_1': 0, 'rho_MLP_acts_0': 0, 'rho_MLP_acts_1': 0, 'rho_MLP_norms_0': 'batch', 'rho_MLP_norms_1': 'layer', 'rho_MLP_norms_2': 'batch'}. 
Test Accuracy: 0.5845
Accuracy:  0.5844922677625176 , Inference time:  0.03342556953430176 , Validation Loss:  1.0769476529692306 , Param Count:  1047
Conv bp:  tensor(64961.2500)
DeepSetsArchitecture(
  (phi): ConvPhi(
    (layers): Sequential(
      (0): Conv1d(3, 4, kernel_size=(1,), stride=(1,))
      (1): BatchNorm1d(4, eps=1e-05, momentum=0.1, affine=True, track_running_stats=True)
    )
  )
  (rho): Rho(
    (layers): Sequential(
      (0): Linear(in_features=4, out_features=16, bias=True)
      (1): BatchNorm1d(16, eps=1e-05, momentum=0.1, affine=True, track_running_stats=True)
      (2): LeakyReLU(negative_slope=0.0078125)
      (3): Linear(in_features=16, out_features=128, bias=True)
      (4): BatchNorm1d(128, eps=1e-05, momentum=0.1, affine=True, track_running_stats=True)
      (5): LeakyReLU(negative_slope=0.0078125)
      (6): Linear(in_features=128, out_features=5, bias=True)
    )
  )
)
BOPs: tensor(531265.2500)
Trial  417  begins evaluation...
[I 2024-09-17 16:37:14,330] Trial 417 finished with values: [0.5745747061417008, 531265.25] and parameters: {'bottleneck_dim': 2, 'aggregator_type': 1, 'phi_len': 1, 'phi_MLP_norms_0': 'batch', 'rho_len': 3, 'rho_MLP_width_0': 1, 'rho_MLP_width_1': 4, 'rho_MLP_acts_0': 1, 'rho_MLP_acts_1': 1, 'rho_MLP_norms_0': 'batch', 'rho_MLP_norms_1': 'batch', 'rho_MLP_norms_2': 'layer'}. 
Test Accuracy: 0.5746
Accuracy:  0.5745747061417008 , Inference time:  0.03488898277282715 , Validation Loss:  1.0936124624849177 , Param Count:  3213
Conv bp:  tensor(1039380.)
DeepSetsArchitecture(
  (phi): ConvPhi(
    (layers): Sequential(
      (0): Conv1d(3, 64, kernel_size=(1,), stride=(1,))
    )
  )
  (rho): Rho(
    (layers): Sequential(
      (0): Linear(in_features=64, out_features=64, bias=True)
      (1): BatchNorm1d(64, eps=1e-05, momentum=0.1, affine=True, track_running_stats=True)
      (2): ReLU()
      (3): Linear(in_features=64, out_features=128, bias=True)
      (4): LeakyReLU(negative_slope=0.0078125)
      (5): Linear(in_features=128, out_features=32, bias=True)
      (6): ReLU()
      (7): Linear(in_features=32, out_features=5, bias=True)
    )
  )
)
BOPs: tensor(3901652.)
Trial  418  begins evaluation...
[I 2024-09-17 16:42:52,153] Trial 418 finished with values: [0.4006788064320237, 3901652.0] and parameters: {'bottleneck_dim': 6, 'aggregator_type': 0, 'phi_len': 1, 'phi_MLP_norms_0': None, 'rho_len': 4, 'rho_MLP_width_0': 3, 'rho_MLP_width_1': 4, 'rho_MLP_width_2': 2, 'rho_MLP_acts_0': 0, 'rho_MLP_acts_1': 1, 'rho_MLP_acts_2': 0, 'rho_MLP_norms_0': 'batch', 'rho_MLP_norms_1': 'layer', 'rho_MLP_norms_2': 'layer', 'rho_MLP_norms_3': 'layer'}. 
Test Accuracy: 0.4007
Accuracy:  0.4006788064320237 , Inference time:  0.02962517738342285 , Validation Loss:  1.3772526006309354 , Param Count:  17157
Conv bp:  tensor(27528692.)
DeepSetsArchitecture(
  (phi): ConvPhi(
    (layers): Sequential(
      (0): Conv1d(3, 64, kernel_size=(1,), stride=(1,))
      (1): BatchNorm1d(64, eps=1e-05, momentum=0.1, affine=True, track_running_stats=True)
      (2): LeakyReLU(negative_slope=0.0078125)
      (3): Conv1d(64, 128, kernel_size=(1,), stride=(1,))
      (4): BatchNorm1d(128, eps=1e-05, momentum=0.1, affine=True, track_running_stats=True)
      (5): ReLU()
      (6): Conv1d(128, 2, kernel_size=(1,), stride=(1,))
    )
  )
  (rho): Rho(
    (layers): Sequential(
      (0): Linear(in_features=2, out_features=128, bias=True)
      (1): BatchNorm1d(128, eps=1e-05, momentum=0.1, affine=True, track_running_stats=True)
      (2): LeakyReLU(negative_slope=0.0078125)
      (3): Linear(in_features=128, out_features=64, bias=True)
      (4): LeakyReLU(negative_slope=0.0078125)
      (5): Linear(in_features=64, out_features=5, bias=True)
      (6): BatchNorm1d(5, eps=1e-05, momentum=0.1, affine=True, track_running_stats=True)
    )
  )
)
BOPs: tensor(29050788.)
Trial  419  begins evaluation...
[I 2024-09-17 16:48:14,867] Trial 419 finished with values: [0.5816705625941053, 29050788.0] and parameters: {'bottleneck_dim': 1, 'aggregator_type': 1, 'phi_len': 3, 'phi_MLP_width_0': 3, 'phi_MLP_width_1': 4, 'phi_MLP_acts_0': 1, 'phi_MLP_acts_1': 0, 'phi_MLP_norms_0': 'batch', 'phi_MLP_norms_1': 'batch', 'phi_MLP_norms_2': 'layer', 'rho_len': 3, 'rho_MLP_width_0': 4, 'rho_MLP_width_1': 3, 'rho_MLP_acts_0': 1, 'rho_MLP_acts_1': 1, 'rho_MLP_norms_0': 'batch', 'rho_MLP_norms_1': None, 'rho_MLP_norms_2': 'batch'}. 
Test Accuracy: 0.5817
Accuracy:  0.5816705625941053 , Inference time:  0.0580141544342041 , Validation Loss:  1.0912971054615617 , Param Count:  18449
Conv bp:  tensor(16699130.)
DeepSetsArchitecture(
  (phi): ConvPhi(
    (layers): Sequential(
      (0): Conv1d(3, 32, kernel_size=(1,), stride=(1,))
      (1): BatchNorm1d(32, eps=1e-05, momentum=0.1, affine=True, track_running_stats=True)
      (2): ReLU()
      (3): Conv1d(32, 128, kernel_size=(1,), stride=(1,))
      (4): LeakyReLU(negative_slope=0.0078125)
      (5): Conv1d(128, 16, kernel_size=(1,), stride=(1,))
      (6): LeakyReLU(negative_slope=0.0078125)
      (7): Conv1d(16, 64, kernel_size=(1,), stride=(1,))
    )
  )
  (rho): Rho(
    (layers): Sequential(
      (0): Linear(in_features=64, out_features=16, bias=True)
      (1): ReLU()
      (2): Linear(in_features=16, out_features=32, bias=True)
      (3): LeakyReLU(negative_slope=0.0078125)
      (4): Linear(in_features=32, out_features=5, bias=True)
    )
  )
)
BOPs: tensor(16997306.)
Trial  420  begins evaluation...
[I 2024-09-17 16:53:51,894] Trial 420 finished with values: [0.6289158230112053, 16997306.0] and parameters: {'bottleneck_dim': 6, 'aggregator_type': 0, 'phi_len': 4, 'phi_MLP_width_0': 2, 'phi_MLP_width_1': 4, 'phi_MLP_width_2': 1, 'phi_MLP_acts_0': 0, 'phi_MLP_acts_1': 1, 'phi_MLP_acts_2': 1, 'phi_MLP_norms_0': 'batch', 'phi_MLP_norms_1': 'layer', 'phi_MLP_norms_2': 'layer', 'phi_MLP_norms_3': 'layer', 'rho_len': 3, 'rho_MLP_width_0': 1, 'rho_MLP_width_1': 2, 'rho_MLP_acts_0': 0, 'rho_MLP_acts_1': 1, 'rho_MLP_norms_0': None, 'rho_MLP_norms_1': 'layer', 'rho_MLP_norms_2': None}. 
Test Accuracy: 0.6289
Accuracy:  0.6289158230112053 , Inference time:  0.050093650817871094 , Validation Loss:  0.9730017537973366 , Param Count:  9317
Conv bp:  tensor(64961.2500)
DeepSetsArchitecture(
  (phi): ConvPhi(
    (layers): Sequential(
      (0): Conv1d(3, 4, kernel_size=(1,), stride=(1,))
      (1): BatchNorm1d(4, eps=1e-05, momentum=0.1, affine=True, track_running_stats=True)
    )
  )
  (rho): Rho(
    (layers): Sequential(
      (0): Linear(in_features=4, out_features=16, bias=True)
      (1): ReLU()
      (2): Linear(in_features=16, out_features=16, bias=True)
      (3): ReLU()
      (4): Linear(in_features=16, out_features=8, bias=True)
      (5): LeakyReLU(negative_slope=0.0078125)
      (6): Linear(in_features=8, out_features=5, bias=True)
    )
  )
)
BOPs: tensor(146993.2500)
Trial  421  begins evaluation...
[I 2024-09-17 16:59:26,715] Trial 421 finished with values: [0.5648384923176748, 146993.25] and parameters: {'bottleneck_dim': 2, 'aggregator_type': 1, 'phi_len': 1, 'phi_MLP_norms_0': 'batch', 'rho_len': 4, 'rho_MLP_width_0': 1, 'rho_MLP_width_1': 1, 'rho_MLP_width_2': 0, 'rho_MLP_acts_0': 0, 'rho_MLP_acts_1': 0, 'rho_MLP_acts_2': 1, 'rho_MLP_norms_0': None, 'rho_MLP_norms_1': None, 'rho_MLP_norms_2': 'layer', 'rho_MLP_norms_3': 'layer'}. 
Test Accuracy: 0.5648
Accuracy:  0.5648384923176748 , Inference time:  0.028745412826538086 , Validation Loss:  1.1140574715575393 , Param Count:  557
Conv bp:  tensor(5729380.)
DeepSetsArchitecture(
  (phi): ConvPhi(
    (layers): Sequential(
      (0): Conv1d(3, 128, kernel_size=(1,), stride=(1,))
      (1): BatchNorm1d(128, eps=1e-05, momentum=0.1, affine=True, track_running_stats=True)
      (2): ReLU()
      (3): Conv1d(128, 8, kernel_size=(1,), stride=(1,))
      (4): BatchNorm1d(8, eps=1e-05, momentum=0.1, affine=True, track_running_stats=True)
      (5): ReLU()
      (6): Conv1d(8, 32, kernel_size=(1,), stride=(1,))
    )
  )
  (rho): Rho(
    (layers): Sequential(
      (0): Linear(in_features=32, out_features=64, bias=True)
      (1): BatchNorm1d(64, eps=1e-05, momentum=0.1, affine=True, track_running_stats=True)
      (2): ReLU()
      (3): Linear(in_features=64, out_features=16, bias=True)
      (4): LeakyReLU(negative_slope=0.0078125)
      (5): Linear(in_features=16, out_features=5, bias=True)
      (6): BatchNorm1d(5, eps=1e-05, momentum=0.1, affine=True, track_running_stats=True)
    )
  )
)
BOPs: tensor(6270948.)
Trial  422  begins evaluation...
[I 2024-09-17 17:05:08,743] Trial 422 finished with values: [0.6499821147815091, 6270948.0] and parameters: {'bottleneck_dim': 5, 'aggregator_type': 1, 'phi_len': 3, 'phi_MLP_width_0': 4, 'phi_MLP_width_1': 0, 'phi_MLP_acts_0': 0, 'phi_MLP_acts_1': 0, 'phi_MLP_norms_0': 'batch', 'phi_MLP_norms_1': 'batch', 'phi_MLP_norms_2': None, 'rho_len': 3, 'rho_MLP_width_0': 3, 'rho_MLP_width_1': 1, 'rho_MLP_acts_0': 0, 'rho_MLP_acts_1': 1, 'rho_MLP_norms_0': 'batch', 'rho_MLP_norms_1': None, 'rho_MLP_norms_2': 'batch'}. 
Test Accuracy: 0.6500
Accuracy:  0.6499821147815091 , Inference time:  0.05413389205932617 , Validation Loss:  0.9187409034391649 , Param Count:  5479
Conv bp:  tensor(25100026.)
DeepSetsArchitecture(
  (phi): ConvPhi(
    (layers): Sequential(
      (0): Conv1d(3, 32, kernel_size=(1,), stride=(1,))
      (1): BatchNorm1d(32, eps=1e-05, momentum=0.1, affine=True, track_running_stats=True)
      (2): ReLU()
      (3): Conv1d(32, 128, kernel_size=(1,), stride=(1,))
      (4): LeakyReLU(negative_slope=0.0078125)
      (5): Conv1d(128, 64, kernel_size=(1,), stride=(1,))
    )
  )
  (rho): Rho(
    (layers): Sequential(
      (0): Linear(in_features=64, out_features=64, bias=True)
      (1): ReLU()
      (2): Linear(in_features=64, out_features=16, bias=True)
      (3): BatchNorm1d(16, eps=1e-05, momentum=0.1, affine=True, track_running_stats=True)
      (4): ReLU()
      (5): Linear(in_features=16, out_features=5, bias=True)
      (6): BatchNorm1d(5, eps=1e-05, momentum=0.1, affine=True, track_running_stats=True)
    )
  )
)
BOPs: tensor(26002938.)
Trial  423  begins evaluation...
[I 2024-09-17 17:10:26,667] Trial 423 finished with values: [0.6612822453851976, 26002938.0] and parameters: {'bottleneck_dim': 6, 'aggregator_type': 0, 'phi_len': 3, 'phi_MLP_width_0': 2, 'phi_MLP_width_1': 4, 'phi_MLP_acts_0': 0, 'phi_MLP_acts_1': 1, 'phi_MLP_norms_0': 'batch', 'phi_MLP_norms_1': None, 'phi_MLP_norms_2': None, 'rho_len': 3, 'rho_MLP_width_0': 3, 'rho_MLP_width_1': 1, 'rho_MLP_acts_0': 0, 'rho_MLP_acts_1': 0, 'rho_MLP_norms_0': None, 'rho_MLP_norms_1': 'batch', 'rho_MLP_norms_2': 'batch'}. 
Test Accuracy: 0.6613
Accuracy:  0.6612822453851976 , Inference time:  0.05346989631652832 , Validation Loss:  0.8934830167666584 , Param Count:  17999
Conv bp:  tensor(3192736.5000)
DeepSetsArchitecture(
  (phi): ConvPhi(
    (layers): Sequential(
      (0): Conv1d(3, 8, kernel_size=(1,), stride=(1,))
      (1): BatchNorm1d(8, eps=1e-05, momentum=0.1, affine=True, track_running_stats=True)
      (2): LeakyReLU(negative_slope=0.0078125)
      (3): Conv1d(8, 64, kernel_size=(1,), stride=(1,))
      (4): LeakyReLU(negative_slope=0.0078125)
      (5): Conv1d(64, 16, kernel_size=(1,), stride=(1,))
      (6): ReLU()
      (7): Conv1d(16, 8, kernel_size=(1,), stride=(1,))
    )
  )
  (rho): Rho(
    (layers): Sequential(
      (0): Linear(in_features=8, out_features=5, bias=True)
    )
  )
)
BOPs: tensor(3200208.5000)
Trial  424  begins evaluation...
[I 2024-09-17 17:15:54,015] Trial 424 finished with values: [0.5960486145194699, 3200208.5] and parameters: {'bottleneck_dim': 3, 'aggregator_type': 1, 'phi_len': 4, 'phi_MLP_width_0': 0, 'phi_MLP_width_1': 3, 'phi_MLP_width_2': 1, 'phi_MLP_acts_0': 1, 'phi_MLP_acts_1': 1, 'phi_MLP_acts_2': 0, 'phi_MLP_norms_0': 'batch', 'phi_MLP_norms_1': 'layer', 'phi_MLP_norms_2': None, 'phi_MLP_norms_3': 'layer', 'rho_len': 1, 'rho_MLP_norms_0': 'layer'}. 
Test Accuracy: 0.5960
Accuracy:  0.5960486145194699 , Inference time:  0.04221749305725098 , Validation Loss:  1.0607342655155934 , Param Count:  1845
Conv bp:  tensor(31382024.)
DeepSetsArchitecture(
  (phi): ConvPhi(
    (layers): Sequential(
      (0): Conv1d(3, 128, kernel_size=(1,), stride=(1,))
      (1): BatchNorm1d(128, eps=1e-05, momentum=0.1, affine=True, track_running_stats=True)
      (2): ReLU()
      (3): Conv1d(128, 64, kernel_size=(1,), stride=(1,))
      (4): ReLU()
      (5): Conv1d(64, 32, kernel_size=(1,), stride=(1,))
    )
  )
  (rho): Rho(
    (layers): Sequential(
      (0): Linear(in_features=32, out_features=128, bias=True)
      (1): ReLU()
      (2): Linear(in_features=128, out_features=8, bias=True)
      (3): LeakyReLU(negative_slope=0.0078125)
      (4): Linear(in_features=8, out_features=5, bias=True)
    )
  )
)
BOPs: tensor(32267000.)
Trial  425  begins evaluation...
[I 2024-09-17 17:21:15,072] Trial 425 finished with values: [0.6529568841453777, 32267000.0] and parameters: {'bottleneck_dim': 5, 'aggregator_type': 1, 'phi_len': 3, 'phi_MLP_width_0': 4, 'phi_MLP_width_1': 3, 'phi_MLP_acts_0': 0, 'phi_MLP_acts_1': 0, 'phi_MLP_norms_0': 'batch', 'phi_MLP_norms_1': 'layer', 'phi_MLP_norms_2': None, 'rho_len': 3, 'rho_MLP_width_0': 4, 'rho_MLP_width_1': 0, 'rho_MLP_acts_0': 0, 'rho_MLP_acts_1': 1, 'rho_MLP_norms_0': 'layer', 'rho_MLP_norms_1': 'layer', 'rho_MLP_norms_2': 'layer'}. 
Test Accuracy: 0.6530
Accuracy:  0.6529568841453777 , Inference time:  0.046465158462524414 , Validation Loss:  0.9120090883605334 , Param Count:  16405
Conv bp:  tensor(30080500.)
DeepSetsArchitecture(
  (phi): ConvPhi(
    (layers): Sequential(
      (0): Conv1d(3, 64, kernel_size=(1,), stride=(1,))
      (1): BatchNorm1d(64, eps=1e-05, momentum=0.1, affine=True, track_running_stats=True)
      (2): LeakyReLU(negative_slope=0.0078125)
      (3): Conv1d(64, 128, kernel_size=(1,), stride=(1,))
      (4): ReLU()
      (5): Conv1d(128, 16, kernel_size=(1,), stride=(1,))
      (6): BatchNorm1d(16, eps=1e-05, momentum=0.1, affine=True, track_running_stats=True)
    )
  )
  (rho): Rho(
    (layers): Sequential(
      (0): Linear(in_features=16, out_features=32, bias=True)
      (1): BatchNorm1d(32, eps=1e-05, momentum=0.1, affine=True, track_running_stats=True)
      (2): ReLU()
      (3): Linear(in_features=32, out_features=8, bias=True)
      (4): BatchNorm1d(8, eps=1e-05, momentum=0.1, affine=True, track_running_stats=True)
      (5): LeakyReLU(negative_slope=0.0078125)
      (6): Linear(in_features=8, out_features=128, bias=True)
      (7): BatchNorm1d(128, eps=1e-05, momentum=0.1, affine=True, track_running_stats=True)
      (8): ReLU()
      (9): Linear(in_features=128, out_features=5, bias=True)
    )
  )
)
BOPs: tensor(30493428.)
Trial  426  begins evaluation...
[I 2024-09-17 17:26:27,609] Trial 426 finished with values: [0.6624701566412392, 30493428.0] and parameters: {'bottleneck_dim': 4, 'aggregator_type': 0, 'phi_len': 3, 'phi_MLP_width_0': 3, 'phi_MLP_width_1': 4, 'phi_MLP_acts_0': 1, 'phi_MLP_acts_1': 0, 'phi_MLP_norms_0': 'batch', 'phi_MLP_norms_1': None, 'phi_MLP_norms_2': 'batch', 'rho_len': 4, 'rho_MLP_width_0': 2, 'rho_MLP_width_1': 0, 'rho_MLP_width_2': 4, 'rho_MLP_acts_0': 0, 'rho_MLP_acts_1': 1, 'rho_MLP_acts_2': 0, 'rho_MLP_norms_0': 'batch', 'rho_MLP_norms_1': 'batch', 'rho_MLP_norms_2': 'batch', 'rho_MLP_norms_3': None}. 
Test Accuracy: 0.6625
Accuracy:  0.6624701566412392 , Inference time:  0.06398272514343262 , Validation Loss:  0.8929380948851708 , Param Count:  13741
Conv bp:  tensor(64961.2500)
DeepSetsArchitecture(
  (phi): ConvPhi(
    (layers): Sequential(
      (0): Conv1d(3, 4, kernel_size=(1,), stride=(1,))
      (1): BatchNorm1d(4, eps=1e-05, momentum=0.1, affine=True, track_running_stats=True)
    )
  )
  (rho): Rho(
    (layers): Sequential(
      (0): Linear(in_features=4, out_features=16, bias=True)
      (1): LeakyReLU(negative_slope=0.0078125)
      (2): Linear(in_features=16, out_features=16, bias=True)
      (3): ReLU()
      (4): Linear(in_features=16, out_features=5, bias=True)
      (5): BatchNorm1d(5, eps=1e-05, momentum=0.1, affine=True, track_running_stats=True)
    )
  )
)
BOPs: tensor(132449.2500)
Trial  427  begins evaluation...
[I 2024-09-17 17:31:09,921] Trial 427 finished with values: [0.39957408223873025, 132449.25] and parameters: {'bottleneck_dim': 2, 'aggregator_type': 0, 'phi_len': 1, 'phi_MLP_norms_0': 'batch', 'rho_len': 3, 'rho_MLP_width_0': 1, 'rho_MLP_width_1': 1, 'rho_MLP_acts_0': 1, 'rho_MLP_acts_1': 0, 'rho_MLP_norms_0': None, 'rho_MLP_norms_1': None, 'rho_MLP_norms_2': 'batch'}. 
Test Accuracy: 0.3996
Accuracy:  0.39957408223873025 , Inference time:  0.02983570098876953 , Validation Loss:  1.379271774064927 , Param Count:  471
Conv bp:  tensor(259845.)
DeepSetsArchitecture(
  (phi): ConvPhi(
    (layers): Sequential(
      (0): Conv1d(3, 16, kernel_size=(1,), stride=(1,))
    )
  )
  (rho): Rho(
    (layers): Sequential(
      (0): Linear(in_features=16, out_features=16, bias=True)
      (1): BatchNorm1d(16, eps=1e-05, momentum=0.1, affine=True, track_running_stats=True)
      (2): LeakyReLU(negative_slope=0.0078125)
      (3): Linear(in_features=16, out_features=16, bias=True)
      (4): ReLU()
      (5): Linear(in_features=16, out_features=32, bias=True)
      (6): BatchNorm1d(32, eps=1e-05, momentum=0.1, affine=True, track_running_stats=True)
      (7): ReLU()
      (8): Linear(in_features=32, out_features=5, bias=True)
      (9): BatchNorm1d(5, eps=1e-05, momentum=0.1, affine=True, track_running_stats=True)
    )
  )
)
BOPs: tensor(460869.)
Trial  428  begins evaluation...
